Tanggal;year;month;day;T '07.00;T '13.00;T '18.00;TRata2;TMax;TMin;Curah Hujan (mm);SS (%);Cuaca;Tekanan Udara (mb);RH07.00;RH13.00;RH18.00;RHRata2;Kec Rata2;Arah Terbanyak;Kec,Max;Arah
01/01/2015;2015;1;1;20,4;24,2;21,6;21,65;25,4;19,6;10,8;0; RA  ;913,41875;96,23223326;83,28131187;96,34877172;93,02363753;0,6;CALM;2;90
02/01/2015;2015;1;2;20,2;24,6;21,4;21,6;25,1;15,4;9;0;TS RA  ;913,70625;94,33774194;78,90084981;92,71129115;90,07190621;5,03125;CALM;2;45
03/01/2015;2015;1;3;20,2;22,8;22,6;21,45;25;17,2;1,2;0; RA  ;914,16875;92,4764762;86,46470636;91,19421696;90,65296893;2,25;CALM;6;90
04/01/2015;2015;1;4;19;25;20,4;20,85;25,4;16,4;5,1;6,3; RA  ;913,5625;92,22442855;87,99849908;94,36802241;91,70384465;0,875;CALM;4;50
05/01/2015;2015;1;5;20,4;24;22,8;21,9;26;16;1;0; RA  ;913,5875;96,23223326;74,60466231;89,52275339;89,14797056;0;CALM;0;0
06/01/2015;2015;1;6;20,2;25,4;22,6;22,1;26,4;17,6;-;37,5;   ;913,44375;85,15901269;75,93974322;82,69573634;82,23837624;2,25;CALM;2;90
07/01/2015;2015;1;7;19,8;26,8;24,3;22,675;27,2;17,8;-;30;   ;913,0875;94,2760986;76,80336505;84,20279345;87,38958892;7,25;CALM;5;210
08/01/2015;2015;1;8;19,6;25,8;23,6;22,15;27;17,2;1;22,5; RA  ;914,03125;92,35270429;76,48832784;87,22640772;87,10503604;1,1;CALM;4;180
09/01/2015;2015;1;9;20;26,4;23,8;22,55;26,9;17,1;-;26,3;   ;913,475;85,07812468;73,29866298;84,8267666;82,07041973;2,75;CALM;5;40
10/01/2015;2015;1;10;20,5;25,9;23,2;22,525;28,2;18,2;10;0; RA  ;913,53125;86,17487207;64,97292864;87,93956874;81,31556038;1,125;CALM;2;180
11/01/2015;2015;1;11;20,4;24,4;23,4;22,15;28,2;18,6;1,3;35; RA  ;914,51875;94,36802241;63,8165611;86,33255909;84,72129125;4,46875;CALM;6;90
12/01/2015;2015;1;12;20,4;22,8;23,2;21,7;24;18;25,8;2,5;TS RA  ;914,19375;96,23223326;91,23795895;89,62573607;93,33204038;1,625;CALM;5;80
13/01/2015;2015;1;13;20,6;21,8;20,4;20,85;23;18,8;21,6;6,3; RA  ;915,25;96,25222619;96,34877172;97,1692343;96,5056146;1,5;CALM;5;60
14/01/2015;2015;1;14;20,8;23,2;21,6;21,6;24,5;17,8;1,8;13,8; RA  ;915,66875;96,27198665;86,39900394;92,748857;92,92295856;1,125;CALM;2;180
15/01/2015;2015;1;15;20,8;23,7;22,2;21,875;25,4;16;-;0;   ;915,14375;96,27198665;70,75764307;84,21271046;86,87858171;3,9375;CALM;4;90
16/01/2015;2015;1;16;20,2;23,4;20;20,95;26,2;16,6;99,3;34,4; RA  ;915,34375;92,4764762;87,99849908;96,19153602;92,28574688;1,6875;CALM;4;90
17/01/2015;2015;1;17;20,4;22;21,2;21;23;19,6;31;15; RA  ;914,8;98,10951906;94,42752755;91,77186298;95,60460716;1,125;CALM;3;180
18/01/2015;2015;1;18;20,6;22,4;20,4;21;23,4;19,2;60;0;TS RA  ;915,325;98,11953659;92,89487225;96,23223326;96,34154467;2,25;CALM;6;90
19/01/2015;2015;1;19;20,6;24;21,9;21,775;24,2;19;90,5;0;TS RA  ;916,40625;94,3979492;91,32397104;93,69272823;93,45314942;2,8125;CALM;6;90
20/01/2015;2015;1;20;19,9;23,8;21,2;21,2;24,8;18;14,6;0; RA  ;917,49375;96,1812109;96,38585608;94,48565941;95,80848432;0;CALM;0;0
21/01/2015;2015;1;21;20,6;23,8;22,4;21,85;24,4;18;2,7;10; RA  ;918,24375;94,3979492;92,96541688;96,42210202;94,54585432;1,6875;CALM;4;90
22/01/2015;2015;1;22;22;24,6;20,8;22,35;26,8;17,8;12,5;31,3;TS RA  ;917,41875;80,74012958;70,77110035;96,27198665;82,13083654;0,6;CALM;5;9
23/01/2015;2015;1;23;20;23,2;20,6;20,95;26;12,6;31,5;31,3;TS RA  ;916,69375;96,19153602;81,93474538;96,25222619;92,6425109;1,125;CALM;5;90
24/01/2015;2015;1;24;20;24,6;22,2;21,7;25,8;18,8;2,4;35;TS RA  ;916,2625;92,43570689;93,10181474;95,51308061;93,37157728;2,8125;CALM;6;90
25/01/2015;2015;1;25;21,7;23,3;20,8;21,875;25;17,6;6,6;0;TS RA  ;916,5125;95,4556947;91,28120792;92,59594236;93,69713492;0,5625;CALM;2;90
26/01/2015;2015;1;26;20,2;25,2;23,4;22,25;26,6;18;-;40;   ;915,975;98,09938348;80,54598856;91,36625533;92,02775271;2,5;CALM;4;90
27/01/2015;2015;1;27;21,6;25;22,4;22,65;26,2;17,2;1,5;31,3;TS RA  FG;914,83125;82,24783074;83,51850038;91,1499747;84,79103414;5,8125;CALM;4;210
28/01/2015;2015;1;28;19,6;24,8;22,4;21,6;26;17,6;0,5;0; RA  FG;914,2375;94,24472482;78,90084981;89,41740591;89,20192634;3,9375;CALM;6;90
29/01/2015;2015;1;29;19,8;24,6;19,6;20,95;26,4;17,8;88,5;37,5;TS RA  ;914,375;93,33364793;96,38585608;96,1498663;94,80075456;2,25;CALM;5;90
30/01/2015;2015;1;30;20,2;23,7;20,8;21,225;26,4;17,2;24,2;0;TS RA  ;915,11875;98,09938348;75,69257222;94,42752755;91,57971668;2,25;CALM;6;90
31/01/2015;2015;1;31;20,4;23,6;20;21,1;26,4;17,8;30,4;0;TS RA  ;915,4625;92,51676717;78,39036024;96,19153602;89,90385765;3,59375;CALM;5;130
01/02/2015;2015;2;1;19,4;23;20,8;20,65;25,2;18,4;33,8;16,25;TS RA FG;915,8;96,12865756;91,05995967;96,27198665;94,89731536;0,5625;CALM;4;45
02/02/2015;2015;2;2;20,8;22,4;20,8;21,2;25,1;16,4;60,4;15;TS RA  ;916,475;92,59594236;85,91767675;96,27198665;91,84538703;6,25;CALM;5;90
03/02/2015;2015;2;3;19;23,2;20,6;20,45;24,2;16,5;33;21,25;TS RA  ;916,9;98,03598928;91,32397104;94,3979492;95,4484747;2,25;CALM;4;90
04/02/2015;2015;2;4;19,8;23,5;19,6;20,675;25,4;16,8;106,4;12,5;TS   ;916,4125;98,07875101;80,45464606;98,06825048;93,67009964;1,6875;CALM;5;90
05/02/2015;2015;2;5;19,8;23,6;22,2;21,35;25,8;18;1,3;6,25;TS RA  ;916,09375;94,2760986;83,28131187;85,91767675;89,43779646;5,875;CALM;6;90
06/02/2015;2015;2;6;20;23,2;20,6;20,95;24;16;13,3;22,5; RA  ;916,1125;94,30710247;92,93034483;96,25222619;94,44919399;12,375;S;6;180
07/02/2015;2015;2;7;19,6;22,6;20,8;20,65;23,2;17,6;3,3;10;TS RA  ;915,825;92,35270429;94,65221046;94,42752755;93,44628665;3,375;CALM;6;90
08/02/2015;2015;2;8;20;25,8;22,3;22,025;26,5;17,7;0,2;50;   ;916,36875;96,19153602;76,48832784;93,75630956;90,65692736;2,3125;CALM;8;10
09/02/2015;2015;2;9;20,2;24,6;22,2;21,8;26;16,6;29;57,5;TS RA  ;916,7375;96,21200439;76,4348146;94,62524134;90,87101618;2,8125;CALM;4;90
10/02/2015;2015;2;10;18,6;24,4;22,4;21;28,2;17,2;2;50; RA  ;916,1;94,08210815;74,12805749;80,93563363;85,80697685;6,9375;CALM;8;180
11/02/2015;2015;2;11;20,4;24,8;21;21,65;26,2;18,2;5,3;31,25;TS RA  ;914,7625;94,36802241;77,67286517;92,63484041;89,7609376;11,8125;S;5;180
12/02/2015;2015;2;12;20,2;24;20,6;21,25;24;17;32;16,25;TS RA  ;914,39375;81,57520747;92,96541688;94,3979492;87,62844525;4,5;CALM;3;180
13/02/2015;2015;2;13;19;24;22,4;21,1;28,8;17,4;0,3;22,5; RA  ;914,46875;92,22442855;62,0127231;89,41740591;83,96974653;4,5625;CALM;12;80
14/02/2015;2015;2;14;19,6;22;21,4;20,65;26;17,8;-;17,5; RA  ;915,8625;98,06825048;92,84089945;96,32990733;96,32682694;7,375;CALM;4;90
15/02/2015;2015;2;15;19,6;25;22,8;21,75;26,4;17,6;2;25; RA  ;915,725;90,47368387;61,19653736;91,23795895;83,34546601;5,5;CALM;5;130
16/02/2015;2015;2;16;19,8;23,6;22;21,3;26,8;16,4;2;27,5; RA  ;914,989375;96,17082455;77,67286517;95,49032315;91,37620935;6,5625;CALM;5;210
17/02/2015;2015;2;17;24;23,4;20,8;23,05;26,8;16,6;29;16,25;TS   ;914,59375;60,329245;89,72642202;94,42752755;76,20310989;1,125;CALM;4;90
18/02/2015;2015;2;18;20,4;24,2;21;21,5;25,2;18,3;7,3;23,75;TS RA  ;914,23125;88,85265066;91,40806772;94,4567626;90,89253291;1,6875;CALM;4;90
19/02/2015;2015;2;19;19,8;23,2;21,2;21;26;17,4;9,4;6,25;TS RA FG;915,45;98,07875101;81,45301826;94,48565941;93,02404492;13,5;CALM;4;270
20/02/2015;2015;2;20;21,2;24,6;21,4;22,1;26;17,7;1;37,5;TS RA  ;916,05625;90,8735929;85,04312374;90,92099633;89,42782647;6,6875;CALM;5;90
21/02/2015;2015;2;21;20,4;26;22,6;22,35;27,6;17;-;52,5;TS   ;915,1875;88,85265066;83,89673693;92,93034483;88,63309577;4,5;CALM;6;90
22/02/2015;2015;2;22;19,8;24,8;23,8;22,05;27,6;17,2;-;38,75;   ;914,61875;92,39445203;76,48832784;83,20046603;86,11942448;1,96875;CALM;5;90
23/02/2015;2015;2;23;21,4;25,6;22,4;22,7;27,6;17,5;13,3;20; RA  ;915,1875;92,71129115;77,10835778;85,98881113;87,1299378;3,75;CALM;4;90
24/02/2015;2015;2;24;20,5;25,8;20,6;21,85;27;18,2;1,6;25;TS RA  ;915,38125;92,5367355;79,19378953;94,3979492;89,66630243;5,23125;CALM;6;270
25/02/2015;2015;2;25;20,4;25,4;23,4;22,4;27,2;18;3;30; RA  ;914,96875;94,36802241;85,18340451;84,67843514;89,64947111;4,15625;CALM;5;130
26/02/2015;2015;2;26;20,4;23,6;22;21,6;23,6;17,2;15,4;8,75; RA  ;914,54375;94,36802241;94,59796265;92,82270179;94,03917731;2,53125;CALM;2;45
27/02/2015;2015;2;27;19,4;23,4;22;21,05;24,8;17;5,3;20; RA  ;914,29375;96,12865756;91,40806772;93,70876028;94,34353578;0,5625;CALM;3;90
28/02/2015;2015;2;28;19,6;23,6;22,4;21,3;25,4;19;2,3;0;TS   ;914,6125;96,1498663;85,11365227;94,65221046;93,01639884;1,6875;CALM;8;70
01/03/2015;2015;3;1;21,2;23,4;20,2;21,5;24;18,2;70,1;0;TSRA;914,8;94;94;98;95;0;0;0;0
02/03/2015;2015;3;2;19,6;23,6;21;20,95;24,6;17,2;7,4;18,8;RA;914,9;96;89;94;93,75;2,2;0;4;90
03/03/2015;2015;3;3;19,8;23,8;20,6;21;25;18;25,5;15;RA;914,4;87;88;94;89;0;0;2;0
04/03/2015;2015;3;4;20;24,2;21,4;21,4;25,2;18;7,4;12,5;TSRA;914,3;98;80;91;91,75;0;0;0;0
05/03/2015;2015;3;5;19,2;23,8;22;21,05;24,2;17,6;6,7;0;RA;914,9;96;91;88;92,75;0,3;0;2;45
06/03/2015;2015;3;6;19,6;20,8;20,4;20,1;24,2;17,4;15,8;10;RA;915,5;94;89;86;90,75;0;0;0;0
07/03/2015;2015;3;7;20,4;24,2;23,6;22,15;26,4;17,8;43,7;31,3;RA;914,6;93;87;88;90,25;5,4;0;6;130
08/03/2015;2015;3;8;21,2;27;21,4;22,7;29,2;17,6;6,6;42,5;TSRA;915,2;82;75;91;82,5;4,7;0;10;120
09/03/2015;2015;3;9;19;25,2;22,6;21,45;25,6;19;8,2;27,5;RA;915,8;94;80;89;89,25;1,7;0;7;90
10/03/2015;2015;3;10;20,6;25,2;22;22,1;26,7;19,2;1,7;11,3;RA;915,6;94;78;84;87,5;5,6;90;10;90
11/03/2015;2015;3;11;20,8;23,5;21,8;21,725;24;19,4;10;0;RA;916,3;96;91;93;94;2,8;0;3;90
12/03/2015;2015;3;12;21;25,4;21,8;22,3;27,2;18,4;34,6;12,5;TSRA;916,5;96;80;95;91,75;0;0;0;0
13/03/2015;2015;3;13;20,9;22,6;22,8;21,8;24,6;18,8;ttu;3,8;RA;917,1;97;87;93;93,5;5,1;90;7;90
14/03/2015;2015;3;14;20;23,8;21,2;21,25;24,4;17,8;16;0;TSRA;916,8;95;91;98;94,75;0,6;0;3;90
15/03/2015;2015;3;15;19,8;23,6;21,7;21,225;24,5;17,4;15,6;13,8;RA;917,4;96;90;96;94,5;0;0;0;0
16/03/2015;2015;3;16;20,9;22,8;22,2;21,7;25,2;18,6;27;25;TSRA;917,3;86;92;93;89,25;1,1;0;4;90
17/03/2015;2015;3;17;20,6;24,2;21,6;21,75;26,2;19,2;32;26,3;RA;915,9;94;91;95;93,5;0;0;0;0
18/03/2015;2015;3;18;19,78;24,2;20,2;20,99;25;18,2;98,6;20;RA;915,3;96;90;96;94,5;0;0;0;0
19/03/2015;2015;3;19;19;24,4;22,6;21,25;26,2;16,4;7,2;12,5;RA;916,1;96;85;89;91,5;4,3;0;5;80
20/03/2015;2015;3;20;21;25,4;21,4;22,2;26,6;18,4;2,4;16,3;RA;916,9;98;88;91;93,75;2,3;0;6;90
21/03/2015;2015;3;21;20;25,8;21,8;21,9;27,4;18,6;15,2;58,8;RA;916,6;96;72;95;89,75;3,4;0;3;180
22/03/2015;2015;3;22;19,4;23;21;20,7;27,2;17,8;36,5;13,8;TSRA;916,3;96;84;96;93;1,3;0;4;210
23/03/2015;2015;3;23;20,2;24,8;24;22,3;26,2;18;-;16,3;0;916;92;82;85;87,75;0;0;0;0
24/03/2015;2015;3;24;20;25,4;22,6;22;26,4;17,8;-;50;0;916,2;96;78;89;89,75;1,1;0;5;90
25/03/2015;2015;3;25;21,2;26,8;21,2;22,6;27,8;17,6;2;80;RA;916,9;94;70;93;87,75;2,8;0;6;90
26/03/2015;2015;3;26;21,2;26,2;23;22,9;26,6;17,6;-;47,5;0;917,5;91;75;95;88;0,6;0;6;90
27/03/2015;2015;3;27;21,2;26,4;24,6;23,35;28;18;-;75;0;917,3;91;74;74;82,5;6,1;0;6;90
28/03/2015;2015;3;28;19,8;25,4;23,4;22,1;26;18;144,1;25;TSRA;915,8;96;84;85;90,25;2,6;0;2;210
29/03/2015;2015;3;29;20,4;27,5;22,2;22,625;28;16,8;-;87,5;0;915,8;93;73;89;87;0,6;0;4;90
30/03/2015;2015;3;30;20,8;26;21,6;22,3;27;17;-;58,8;0;916,4;91;81;91;88,5;3,9;0;6;90
31/03/2015;2015;3;31;22,8;25,7;23,6;23,725;26,6;18,8;2,4;0;RA;916;86;85;93;87,5;2,3;0;4;90
01/04/2015;2015;4;1;21,4;26;23,2;23;26,8;17,4;6,8;68,8;RA;915,7;91;73;86;85,25;1,2;0;5;180
02/04/2015;2015;4;2;21,8;27,4;22,8;23,45;27;19;2,2;85;RA;914;84;63;91;80,5;0,3;0;4;90
03/04/2015;2015;4;3;21,6;26;21,2;22,6;27,2;19,2;TTU;0;RA;914;93;79;94;89,75;0,6;0;5;120
04/04/2015;2015;4;4;20,2;26,8;23,2;22,6;27;18;-;6,3;0;914,1;94;74;87;87,25;0,7;0;3;180
05/04/2015;2015;4;5;21,8;28;23,6;23,8;28,8;17,6;-;95;0;913,9;92;66;83;83,25;1,4;0;5;90
06/04/2015;2015;4;6;21,6;27;21,2;22,85;28,8;18,2;37,6;40;RA;914,5;87;84;94;88;1,6;0;5;90
07/04/2015;2015;4;7;20;21,2;19,1;20,075;23,4;16,4;62,5;0;RA FG;915;98;96;96;97;0,1;0;2;180
08/04/2015;2015;4;8;19;24,1;22;21,025;26;17;-;38,8;0;915,4;90;85;91;89;2,6;90;5;80
09/04/2015;2015;4;9;20,8;26;23,6;22,8;28,4;16,7;-;65;0;915,6;93;71;88;86,25;0;0;0;0
10/04/2015;2015;4;10;19,6;26,3;23,6;22,275;27;17;-;37,5;0;915,8;92;78;88;87,5;1,1;0;3;90
11/04/2015;2015;4;11;20,4;26,6;23;22,6;28,2;18;0,2;63,8;RA;916,1;94;74;91;88,25;1,5;0;6;90
12/04/2015;2015;4;12;20,8;24,2;20,4;21,55;26,4;18;14;31,3;RA;916,2;94;93;96;94,25;0;0;0;0
13/04/2015;2015;4;13;20,4;24,6;22;21,85;26,4;16,6;-;60;0;916,4;93;82;88;89;2,8;90;5;90
14/04/2015;2015;4;14;21;25,8;21,2;22,25;26,3;18;0,9;50;RA;915,7;93;81;87;88,5;3,5;90;6;90
15/04/2015;2015;4;15;21,6;25,3;23,6;23,025;26,8;18,2;4;58,8;RA;916,5;85;70;85;81,25;2,3;90;4;90
16/04/2015;2015;4;16;20,8;25,6;21;22,05;26,8;18,2;-;28,8;0;917,2;94;75;87;87,5;1,4;0;5;130
17/04/2015;2015;4;17;19,6;22;20,4;20,4;24,4;17,4;14,5;2,5;RA;916,5;92;80;93;89,25;1;0;5;90
18/04/2015;2015;4;18;19,4;26,2;19,8;21,2;27;18,2;16,8;45;RA;915,4;96;79;92;90,75;1,6;0;6;90
19/04/2015;2015;4;19;20,2;24,8;20,7;21,475;27,4;17,5;8,9;28,8;RA;915,8;91;90;95;91,75;0;0;0;0
20/04/2015;2015;4;20;21,7;25;22,4;22,7;27,6;18;2,5;28,8;TSRA;915,2;86;70;91;83,25;1,3;0;4;90
21/04/2015;2015;4;21;20,4;24;21;21,45;28,6;18;1,8;25;TSRA;914,4;96;70;93;88,75;1,9;0;7;90
22/04/2015;2015;4;22;20,4;28;24,4;23,3;30,4;19;TTU;92,5;RA;914,4;94;61;85;83,5;1,3;0;4;180
23/04/2015;2015;4;23;20,2;23,4;21;21,2;25,2;18,6;52;12,5;TSRA;915;96;93;96;95,25;1,2;0;5;90
24/04/2015;2015;4;24;21;25,6;20,8;22,1;25;19;15,5;17,5;RA;914,5;91;85;96;90,75;0,5;0;4;90
25/04/2015;2015;4;25;21;22,8;22;21,7;25;19;-;0;0;914,5;97;85;93;93;1,4;0;6;270
26/04/2015;2015;4;26;20,4;24,2;21,8;21,7;25;18,4;0,4;2,5;TSRA;914,9;96;88;93;93,25;0,6;0;5;90
27/04/2015;2015;4;27;20,8;24;20,4;21,5;24,8;18,6;32,7;21,3;RA;914,9;96;91;94;94,25;0,4;0;3;90
28/04/2015;2015;4;28;20,4;21,8;20,6;20,8;22;17,6;3,1;0;RA;915;96;96;96;96;0;0;0;0
29/04/2015;2015;4;29;19,8;24,4;22,3;21,575;25,5;19,2;23;31,3;RA FG;915,6;98;84;95;93,75;0,4;0;2;180
30/04/2015;2015;4;30;21;23,9;21,4;21,825;24,6;19,2;97,4;22,5;TSRA;915,6;94;90;96;93,5;0,9;0;4;90
01/05/2015;2015;5;1;19,8;25,6;21;21,55;26;18,4;55,4;25; RA  FG;915,65625;98,07875101;83,67229545;94,4567626;93,57164002;0;0;0;0
02/05/2015;2015;5;2;21;23,8;20,4;21,55;26;17,6;49,5;10; RA  ;915,76875;96,29151809;94,57036981;97,1692343;96,08066007;0;0;0;0
03/05/2015;2015;5;3;19,6;22,6;22,4;21,05;24;18;0,5;0;   ;916,29375;96,1498663;94,67887453;96,42210202;95,85017729;0,25;0;2;90
04/05/2015;2015;5;4;20,2;22,6;21,5;21,125;24,4;16,8;7,2;6,25; RA  ;916,3625;98,09938348;96,4399182;90,05637041;95,67376389;0,6875;0;4;230
05/05/2015;2015;5;5;19,8;25;22;21,65;25,6;15,8;-;50;   ;915,275;92,39445203;78,59799192;92,82270179;89,05239944;0;0;0;0
06/05/2015;2015;5;6;20;25,4;22,2;21,9;26,4;16;-;67,5;   ;915,05625;88,73155197;73,66187748;94,62524134;86,43755569;0;0;0;0
07/05/2015;2015;5;7;24,8;24,6;22,1;24,075;25,4;15;-;52,5;   ;916,09375;82,01960357;88,05676978;85,02561972;84,28039916;1,25;0;7;230
08/05/2015;2015;5;8;21;25,4;22,8;22,55;26,2;15;-;92,5;   ;915,4625;73,40792349;63,55592257;81,1266891;72,87461466;2;0;6;90
09/05/2015;2015;5;9;20;26,6;23;22,4;26,7;16,7;3,6;87,5; RA  ;915,3;92,43570689;64,62728087;84,52671611;83,50635269;0;0;0;0
10/05/2015;2015;5;10;20,4;27,4;20,4;22,15;27,6;16,8;-;100;   ;915,7625;83,45071001;63,17914365;81,67473134;77,93882375;2,0625;0;8;100
11/05/2015;2015;5;11;23;26,8;23;23,95;27,2;18,2;ttu;100;   ;916,44375;74,74633411;66,66327642;86,19739839;75,58833576;2;0;8;270
12/05/2015;2015;5;12;22,4;27;23,5;23,825;27,2;18,8;-;95;   ;916,325;82,60820883;62,00849976;88,02771629;78,81315843;0,75;0;6;270
13/05/2015;2015;5;13;22,4;24,4;22,6;22,95;25,4;18,4;-;18,75;   ;916,41875;89,41740591;84,97180763;91,19421696;88,7502091;0,75;0;5;210
14/05/2015;2015;5;14;23;26;22;23,5;27;18;17,2;72,5;TS RA  ;917,025;82,8678151;80,54598856;96,38585608;85,66686871;0,6875;0;4;90
15/05/2015;2015;5;15;20,8;26,4;22,2;22,55;27;15,8;29,7;50; RA  ;917,50625;87,17726187;69,20125463;91,10522477;83,66525079;1,5;0;7;270
16/05/2015;2015;5;16;19,6;24;20,2;20,85;25,4;14,4;ttu;30;   ;916,70625;96,1498663;83,28131187;96,21200439;92,94826222;1,0625;0;4;230
17/05/2015;2015;5;17;19,8;24,6;20,4;21,15;26;14,6;-;63,75;   ;915,98125;94,2760986;68,47804453;88,85265066;86,4707231;0,6875;0;5;90
18/05/2015;2015;5;18;19,4;24,4;20,6;20,95;25,2;15;-;66,25;   ;916,6875;86,68066437;67,47679662;87,1088139;81,98673481;1,875;0;7;90
19/05/2015;2015;5;19;20;25;21,2;21,55;25,2;13,8;-;60;   ;917,075;81,47449239;76,92176471;87,31177312;81,79563065;1,625;0;7;90
20/05/2015;2015;5;20;18,6;25,4;18;20,15;25,2;14,4;-;100;   ;917,58125;88,28420336;66,86047513;80,39770823;80,95664752;3,8125;0;8;90
21/05/2015;2015;5;21;19,4;26;17,8;20,65;26,6;15;-;100;   ;917,6875;73,98293348;52,73231004;78,38242384;69,77015021;1,875;0;6;90
22/05/2015;2015;5;22;20,6;27,3;20,8;22,325;27,6;16,2;-;90;   ;917,3625;73,12087444;60,51129187;85,39600818;73,03726223;0,4375;0;7;90
23/05/2015;2015;5;23;19;25,6;23,2;21,7;26,4;16,6;2,5;72,5;   ;916,79375;86,53098912;65,11207538;84,60300527;80,69426472;1,375;0;4;90
24/05/2015;2015;5;24;20,2;26,2;22,2;22,2;26,2;18,4;-;97,5;   ;917,01875;90,62808814;74,54547905;87,63467775;85,85908327;0;0;0;0
25/05/2015;2015;5;25;21,6;25,6;20,6;22,35;26,4;18,8;80;71,25; RA  ;917,21875;82,24783074;77,464195;94,3979492;84,08945142;0,25;0;4;90
26/05/2015;2015;5;26;21,2;24,6;22,2;22,3;26;17,8;-;42,5;   ;917,7;98,14889814;80,54598856;91,10522477;91,9872524;0,75;0;6;90
27/05/2015;2015;5;27;21,6;26,6;23,4;23,3;27;18,2;0,5;87,5;   ;916,5875;98,16791345;76,80336505;89,67636196;90,70388848;3;0;7;270
28/05/2015;2015;5;28;20,2;25,2;21,8;21,85;26,6;16;-;80;   ;916,34375;94,33774194;69,20125463;67,46516635;81,33547621;2,375;0;7;270
29/05/2015;2015;5;29;19,6;27,4;24;22,65;28,4;16,2;-;95;   ;917,14375;92,35270429;58,79208393;86,52967706;82,50679239;0,625;0;4;90
30/05/2015;2015;5;30;22,2;26,8;23,6;23,7;28;18,2;-;57,5;   ;916,5125;84,21271046;80,98793454;88,05676978;84,36753131;1,1875;0;7;270
31/05/2015;2015;5;31;22,6;26,4;23,6;23,8;27,4;19;ttu;80; RA  ;915,14375;86,05913501;72,46019873;84,75301817;82,33287173;2,5;0;8;120
01/06/2015;2015;6;1;21,4;26,2;22,8;22,95;27,6;17,2;-;95;   ;915,2625;90,92099633;66,5117435;84,44955501;83,20082279;0,625;0;4;90
02/06/2015;2015;6;2;21,6;26,8;23,6;23,4;27,6;18,1;-;40;   ;915,725;83,96754266;73,66187748;88,05676978;82,41343314;1,25;0;7;270
03/06/2015;2015;6;3;20,4;26,8;23;22,65;27,8;18,4;ttu;63,75; RA  ;915,93125;96,23223326;77,30631337;89,57453602;89,83632898;0,5625;0;5;90
04/06/2015;2015;6;4;21,8;25,8;23,8;23,3;27,6;17,4;-;100;   ;915,7625;91,01417176;68,76803233;78,39036024;82,29668402;0;0;0;0
05/06/2015;2015;6;5;20,6;27,2;21;22,35;29,8;18,2;-;100;   ;915,06875;81,77308171;54,15426883;83,71367457;75,35352671;0;0;0;0
06/06/2015;2015;6;6;20;25,6;23,6;22,3;27;17,4;ttu;50; RA  ;915,0625;94,30710247;70,63788142;81,49596538;85,18701294;1,75;0;5;200
07/06/2015;2015;6;7;22;27,2;25;24,05;28;17,6;-;67,5;   ;915,675;85,84571988;56,96223642;75,93974322;76,14835485;0,6875;0;4;90
08/06/2015;2015;6;8;21,2;27,8;24,4;23,65;28,6;20;-;67,5;   ;915,36875;92,67328779;63,8165611;83,4403162;83,15086322;0;0;0;0
09/06/2015;2015;6;9;21,6;26,2;23,2;23,15;26,4;19,4;-;30;   ;915,51875;90,96785328;84,11395801;91,32397104;89,3434089;0,8125;0;4;90
10/06/2015;2015;6;10;20,2;24;22;21,6;26;16,2;-;12,5;   ;915,6;94,33774194;83,59582269;87,5715805;89,96072176;0;0;0;0
11/06/2015;2015;6;11;22,6;24,2;19,6;22,25;25,2;14,2;-;50;   ;915,35625;79,37932137;71,29582438;84,91342825;78,74197384;0;0;0;0
12/06/2015;2015;6;12;22,2;25,4;21,4;22,8;26;15;-;65;   ;915,4375;75,86460442;59,42563252;92,71129115;75,96653313;0;0;0;0
13/06/2015;2015;6;13;20,8;26,2;21,8;22,4;27;14,8;-;51,25;   ;915,29375;78,392828;55,99073181;82,33949598;73,77897095;2,0625;0;5;130
14/06/2015;2015;6;14;17,6;26;20,5;20,425;26;14,8;-;58,75;   ;915,3375;82;64,46206342;87,97681805;79,10972037;2;0;7;270
15/06/2015;2015;6;15;18,4;25;18,4;20,05;25,2;14,4;-;48,75;   ;915,3625;88,21715828;70,73971065;88,21715828;83,84779637;1,0625;0;7;60
16/06/2015;2015;6;16;18,2;24,4;18,2;19,75;27;13,8;-;97,5;   ;915,3625;86,22055278;58,06815009;84,3047346;78,70349756;1,375;0;8;90
17/06/2015;2015;6;17;19;26,4;19;20,85;27;14,4;-;96,25;   ;915,1125;98,03598928;52,51900106;77,2955851;81,47164118;2,1875;0;8;90
18/06/2015;2015;6;18;18,8;25,4;21,3;21,075;26;15;-;56,25;   ;915,05625;90,25901515;71,56467093;90,00458323;85,52182112;0,25;0;4;90
19/06/2015;2015;6;19;18,6;24,4;21,2;20,7;27;16,8;-;52,5;   ;916,3875;92,13630685;64,62728087;82,06126458;82,74028979;2,375;0;6;90
20/06/2015;2015;6;20;21,4;26,2;22,4;22,85;27;16,2;-;77,5;   ;915,83125;74,52187469;61,49884452;87,69705481;74,55991218;0;0;0;0
21/06/2015;2015;6;21;18,6;24,6;20,4;20,55;27;13,8;-;67,5;   ;916,35625;94,08210815;78,07670594;87,03955509;88,32011933;1,125;0;8;350
22/06/2015;2015;6;22;18,2;25;19;20,1;27;13,2;-;87,5;   ;916,6625;88,14929247;61,27523761;88,41588062;81,49742579;1,125;0;6;90
23/06/2015;2015;6;23;18,2;25,4;19,1;20,225;26,9;13,8;-;75;   ;917,075;90,09107603;50,80424403;82,84773345;78,45853238;1,125;0;6;90
24/06/2015;2015;6;24;16,8;25,6;19,5;19,675;26,4;15;-;68,75;   ;917,43125;91,71206704;64,62728087;85,79300428;83,46110481;2;0;8;10
25/06/2015;2015;6;25;20,2;26,4;19,2;21,5;27;17;-;100;   ;917,675;69,40973847;54,47339678;84,74473901;69,50940318;2,125;0;7;90
26/06/2015;2015;6;26;22;25,8;23;23,2;26,6;16,2;ttu;45; RA  ;917,50625;79,06190011;67,32528296;86,19739839;77,91162039;1,0625;0;7;90
27/06/2015;2015;6;27;19,8;26;22,7;22,075;27;15,4;1,6;62,5; RA  ;918,25625;94,2760986;76,27250697;92,08049944;89,2263009;1,3125;0;5;90
28/06/2015;2015;6;28;21;24,4;20,4;21,7;27;15,4;-;46,25;   ;918,35625;87,24491101;76,80958092;88,85265066;85,0380134;1,5;0;4;90
29/06/2015;2015;6;29;18,8;24,6;20,2;20,6;27;14,8;-;71,25;   ;919,1375;92,18063343;68,02435518;93,40549194;86,4477785;2,4375;0;8;70
30/06/2015;2015;6;30;19;24,6;22;21,15;26,8;14,8;-;68,75;   ;917,7875;86,53098912;57,11574187;80,74012958;77,72946243;2,75;0;8;90
01/07/2015;2015;7;1;18,2;23;19,8;19,8;23,6;17;-;65;0;918,2;92;76;89;87,25;0,4;0;2;90
02/07/2015;2015;7;2;18,8;23,8;20;20,35;24,6;14,2;-;50;0;917,6;90;67;85;83;1,1;0;6;90
03/07/2015;2015;7;3;18;23,6;19;19,65;25,2;13,2;-;50;0;916,7;80;69;81;77,5;2,4;0;6;90
04/07/2015;2015;7;4;15,4;24,6;20,2;18,9;25,4;13,6;-;55;0;916,9;79;57;80;73,75;1,3;0;4;90
05/07/2015;2015;7;5;17,8;24,4;20;20;25,2;14;-;91,3;0;915,6;75;76;76;75,5;3,6;320;7;360
06/07/2015;2015;7;6;17,6;24,6;21,4;20,3;28;14;-;12,5;0;915,2;84;61;82;77,75;1,5;0;7;360
07/07/2015;2015;7;7;16,8;23,4;21,4;19,6;24,8;15,4;-;42,5;0;915,3;92;79;86;87,25;0,9;0;5;180
08/07/2015;2015;7;8;18,4;23,4;21;20,3;25,4;17,6;-;37,5;0;915;88;79;89;86;1,7;0;7;90
09/07/2015;2015;7;9;19,6;21,8;20;20,25;22,6;15;-;60;0;915,4;94;86;91;91,25;0,6;0;6;360
10/07/2015;2015;7;10;16,6;24,2;21;19,6;25,2;16,8;-;51,3;0;916,2;90;64;80;81;2;0;6;90
11/07/2015;2015;7;11;19,6;23;20,4;20,65;25,2;15,8;TTU;6,3;RA;916,9;79;83;85;81,5;0;0;0;0
12/07/2015;2015;7;12;20,4;25,2;21,4;21,85;26,2;15,8;-;62,5;0;916,6;80;64;86;77,5;4;0;9;10
13/07/2015;2015;7;13;21,4;23,6;20;21,6;26;16;TTU;31,3;RA;915,9;80;83;81;81;3,6;0;8;270
14/07/2015;2015;7;14;20,2;25,6;20,2;21,55;26;16;-;30;0;915,7;80;69;73;75,5;3,7;0;10;360
15/07/2015;2015;7;15;20,2;25,8;22,4;22,15;26,2;15;-;85;0;915,7;80;75;95;82,5;5,4;50;8;180
16/07/2015;2015;7;16;19,4;24,8;21,4;21,25;25;15;-;80;0;916,2;83;66;84;79;4,9;0;9;45
17/07/2015;2015;7;17;19,6;26,2;19,7;21,275;26,6;15,2;-;65;0;917;78;59;86;75,25;1,5;0;6;45
18/07/2015;2015;7;18;19,8;26;21,4;21,75;26,6;15,4;-;100;0;916,8;85;54;80;76;5,4;0;8;90
19/07/2015;2015;7;19;20,3;26,2;22,3;22,275;27,2;16,2;-;97,5;0;916,2;75;55;86;72,75;0,8;0;4;360
20/07/2015;2015;7;20;19,4;23,5;20,1;20,6;25,2;16;-;12,5;0;917;85;71;87;82;0;0;0;0
21/07/2015;2015;7;21;18,8;24,7;19,6;20,475;25,5;15,8;TTU;80;RATS;917,7;87;69;85;82;2,5;0;7;360
22/07/2015;2015;7;22;19,2;23,8;21,8;21;25,5;15,4;-;42,5;0;918,5;87;71;88;83,25;0;0;0;0
23/07/2015;2015;7;23;20,2;24,8;21,6;21,7;25,5;15;-;85;0;918,4;83;63;77;76,5;1,5;0;8;360
24/07/2015;2015;7;24;20;25,2;20,6;21,45;25,6;15;-;75;0;917,8;80;68;84;78;1,9;0;7;90
25/07/2015;2015;7;25;19,8;24,8;20,4;21,2;25,8;14,8;-;42,5;0;917,8;87;66;83;80,75;1,1;0;7;45
26/07/2015;2015;7;26;19,8;26,6;21,6;21,95;27,8;15;-;95;0;918,5;91;51;82;78,75;2,7;0;9;320
27/07/2015;2015;7;27;21,2;27;23;23,1;27,6;15,2;-;100;0;918,3;75;54;75;69,75;3,6;0;12;20
28/07/2015;2015;7;28;20,4;26,8;21,4;22,25;27,4;15,4;-;100;0;918,8;74;55;82;71,25;4,9;0;8;270
29/07/2015;2015;7;29;19,4;26;22,8;21,9;26,6;17;-;62,5;0;917,5;87;65;88;81,75;4,9;0;8;45
30/07/2015;2015;7;30;19;25,4;22,8;21,55;26,8;16,4;-;100;0;917,8;94;66;83;84,25;2,9;0;8;45
31/07/2015;2015;7;31;20,2;26,4;22,8;22,4;26,8;15;-;60;0;916,8;83;71;86;80,75;3,9;0;8;45
01/08/2015;2015;8;1;17,4;25;19,4;19,8;26,6;12;-;52,5;   ;917,20625;81,98409044;66,70203351;84,82959028;78,87495117;1,1;0;5;50
02/08/2015;2015;8;2;15,4;24,6;18,4;18,45;25,2;13,8;-;60;   ;917,5375;64,72053692;58,26510664;73,23052709;65,23417689;2,8;0;6;30
03/08/2015;2015;8;3;18,2;25;22,2;20,9;26,8;14;-;72,5;   ;916,74375;76,76826187;52,73087573;77,51101975;70,9446048;2,8;0;8;20
04/08/2015;2015;8;4;17,1;24,8;20,9;19,975;25,6;16;ttu;37,5;RA;916,64375;84,77671347;63,23520224;84,55106689;79,33492402;1,2;0;4;45
05/08/2015;2015;8;5;18,4;24,6;20,4;20,45;25,2;15,2;-;50;   ;916,19375;86,29958292;63,25210302;81,67473134;79,38150005;1,1;0;5;90
06/08/2015;2015;8;6;19;23;20,2;20,3;23,4;17;4;33,8;RA;914,78125;92,22442855;77,15291078;98;89,90044197;1,9;0;6;50
07/08/2015;2015;8;7;18,4;23,4;21,5;20,425;28,6;15,4;ttu;12,5;RA FG;915,55625;96,01872126;89,41740591;92,73012836;93,5462442;1,4;0;6;45
08/08/2015;2015;8;8;16,8;23,4;20,6;19,4;24,6;16,2;9;26,3;RA;915,38125;91,71206704;81,03170929;94,3979492;89,71344814;1,6;0;6;90
09/08/2015;2015;8;9;18,6;24,2;20,6;20,5;24,6;16,2;28,6;32,5;RA;915,075;96,04124072;86,05913501;96,25222619;93,59846066;1,9;0;7;15
10/08/2015;2015;8;10;19,8;24;22,2;21,45;25;16;2,5;35;RA;915,85;88,66991698;72,53507237;87,63467775;84,37739602;1,5;0;5;90
11/08/2015;2015;8;11;18,4;25;21,6;20,85;25,6;16,4;1;50;RA;916,74375;96,01872126;78,06998378;90,96785328;90,2688199;0,9;0;4;90
12/08/2015;2015;8;12;19,6;27,2;22,4;22,2;28;15,4;-;60;FG;917,1;92,35270429;52,31590403;89,41740591;81,60967963;1,2;0;6;45
13/08/2015;2015;8;13;19,4;25,7;20,6;21,275;26,4;15,4;-;85;0;916,925;90,42097812;65,27013988;85,31794039;82,85750913;1,8;0;7;360
14/08/2015;2015;8;14;18,4;24,8;21,6;20,8;25,4;16;-;51,3;0;917,4875;84,39488882;68,32850956;87,44318247;81,14036742;1,9;90;5;90
15/08/2015;2015;8;15;19,4;23,4;21,4;20,9;25,4;14,6;ttu;47,5;RA;918,11875;92,31045621;79,88468951;92,71129115;89,30422327;1,2;0;7;20
16/08/2015;2015;8;16;18;23,4;20,8;20,05;24,4;14;-;45;0;917,925;95,97285541;83,11870692;92,59594236;91,91509002;1,9;0;5;20
17/08/2015;2015;8;17;17,8;24,2;21,4;20,3;25;15,4;-;85;   ;918,0375;93,94475986;70,73971065;87,37785981;86,50177254;1,1;0;5;90
18/08/2015;2015;8;18;18,6;25,2;21,4;20,95;25,6;14,4;-;52,5;   ;917,09375;90,20371292;63,95518188;75,35835725;79,93024124;2,4;0;6;90
19/08/2015;2015;8;19;18,2;24,8;22;20,8;25;13,4;-;25;   ;918,5;94,01426888;70,81060411;70,84319314;82,42058375;1,5;0;7;360
20/08/2015;2015;8;20;16,8;24;19,8;19,35;25,6;13,8;-;60;   ;917,0625;91,71206704;67,86968614;84,99626808;84,07252208;1,9;0;6;180
21/08/2015;2015;8;21;18,2;23;19,2;19,65;25;14,2;-;46,3;   ;916,7625;78,63359927;64,02346228;82,89580425;76,04661627;1,4;0;8;50
22/08/2015;2015;8;22;17,6;25;21;20,3;25,6;13,4;-;62,5;   ;917,13125;85,97757264;61,27523761;78,50763659;77,93450487;1,78;0;7;45
23/08/2015;2015;8;23;18;24,2;21,2;20,35;25,6;13,8;-;100;   ;917,7125;84,21347059;61,45810064;80,3352388;77,55507016;2,1;0;8;180
24/08/2015;2015;8;24;19,2;26;19,8;21,05;27;15,4;-;100;   ;917,64375;73,83609541;57,3102667;81,37256809;71,5887564;1,9;0;7;45
25/08/2015;2015;8;25;20;26,4;23;22,35;27,6;16,2;-;87,5;   ;917,1375;85,07812468;58,82529733;78,77140971;76,9382391;2,1;0;7;30
26/08/2015;2015;8;26;19,4;25,6;22,6;21,75;26,4;15,4;-;87,5;   ;916,9875;90,42097812;64,95226096;82,69573634;82,12248838;2,4;0;8;180
27/08/2015;2015;8;27;19,8;25,8;21;21,6;27,4;15,2;-;85;   ;917,19375;88,66991698;58,82529733;83,71367457;79,96970146;1,9;0;8;20
28/08/2015;2015;8;28;19,2;26,8;21;21,55;28,2;15,2;-;88,8;   ;917,45625;88,48053691;49,85859542;76,79606422;75,90393337;2,5;0;7;20
29/08/2015;2015;8;29;19,8;26,8;22,8;22,3;28;15;-;71,3;   ;917,4125;81,37256809;59,79552112;81,1266891;75,9168366;2,1;0;8;130
30/08/2015;2015;8;30;19,6;26,4;22,6;22,05;28,2;14,6;ttu;63,8; RA  ;917,8625;84,91342825;66,04699744;87,75872219;80,90814403;2,1;0;6;360
31/08/2015;2015;8;31;18,8;25,6;19,4;20,65;26,8;16,5;-;100;   ;917,975;73,53700996;50,50443939;79,35128723;69,23243664;3,6;0;7;45
01/09/2015;2015;9;1;19,2;26,8;22,2;21,85;27,4;14;-;96,25;0;917,2625;81,0593552;51,24810181;72,60584277;71,49316375;3;CALM;10;130
02/09/2015;2015;9;2;19;26,6;20,6;21,3;28,4;16,4;-;100;0;917,75;71,90137931;48,91416542;78,27665439;67,74839461;3,125;CALM;7;20
03/09/2015;2015;9;3;20,6;27,2;20,4;22,2;27,8;15,1;-;100;0;918,29375;61,49022597;45,27282215;78,15909521;61,60309233;4,125;CALM;7;45
04/09/2015;2015;9;4;20;25,4;22,4;21,95;26,4;14,6;-;75;0;918,54375;69,24077189;58,85513642;75,98752866;68,33105221;2,4375;CALM;8;45
05/09/2015;2015;9;5;21,4;26,8;20,4;22,5;27,6;17,4;-;93,75;0;918,90625;57,59822818;47,48830503;66,22410676;57,22721704;3,625;S;8;45
06/09/2015;2015;9;6;22;27,8;22,2;23,5;28,4;16,8;-;100;0;918,46875;50,74345864;39,38908372;69,39181344;52,56695361;3,0625;CALM;6;45
07/09/2015;2015;9;7;21,8;26,2;21,4;22,8;27,4;15,2;-;71,25;0;918,03125;82,33949598;62,51342147;82,15509228;77,33687643;2,5625;CALM;8;130
08/09/2015;2015;9;8;21,2;26,7;21,6;22,675;27,5;15;-;92,5;0;917,1625;96,31082388;47,00829615;75,48714497;78,77927222;2,6;CALM;8;100
09/09/2015;2015;9;9;19,6;26,2;22,4;21,95;27,6;15,8;-;91,25;0;917,64375;82,17577305;55,38158385;67,96646794;71,92489947;2,5;CALM;9;20
10/09/2015;2015;9;10;20,4;26,8;19,6;21,8;27,2;15,2;-;100;0;919,13125;67,89476357;46,51744438;72,37253304;63,66987614;5,5;CALM;15;190
11/09/2015;2015;9;11;19,8;25,8;21,8;21,8;27,6;16;-;86,25;0;917,65625;86,82679066;50,80424403;67,46516635;72,98074793;3,625;CALM;9;315
12/09/2015;2015;9;12;20;26,8;22,4;22,3;27,2;16;-;66,25;0;917,6375;79,69106169;68,77215117;84,29256536;78,11170998;3,5;CALM;8;180
13/09/2015;2015;9;13;19,4;26,2;21,6;21,65;28,1;14,8;-;60;0;916,95;86,68066437;61,67058513;75,48714497;77,62976471;2,625;CALM;8;45
14/09/2015;2015;9;14;18,7;26,2;21,4;21,25;27,4;14,8;-;91,25;0;916,8;81,71945974;52,51900106;80,43824001;74,09904014;3,9375;CALM;8;315
15/09/2015;2015;9;15;18,8;24,8;19,8;20,55;25,6;15,2;-;91,25;0;916,1375;84,57193469;55,69162767;76,02865616;75,2160383;2,75;CALM;9;30
16/09/2015;2015;9;16;19;26,4;22,6;21,75;27;15,4;-;100;0;915,96875;80,95240779;53,7988523;76,10904039;72,95317706;3,375;CALM;8;270
17/09/2015;2015;9;17;19,4;26,6;22,4;21,95;27;16,8;-;87,5;0;917,625;88,54442072;53,16605008;74,36101533;76,15397672;3;CALM;8;130
18/09/2015;2015;9;18;22;28,5;22,3;23,7;29,2;17,2;-;92,5;0;918,2;56,74116806;37,21035678;63,9656932;53,66459652;3,9375;CALM;8;30
19/09/2015;2015;9;19;23;26,8;22,8;23,9;28;16,8;-;87,5;0;916,75;52,00560959;59,4610381;69,85671706;58,33224359;1,75;CALM;6;30
20/09/2015;2015;9;20;20,8;27,8;23,8;23,3;28,8;16,4;-;72,5;0;916,15625;83,62705058;50,92463405;63,07127783;70,31250326;1,8125;CALM;8;10
21/09/2015;2015;9;21;21;27,4;21,4;22,7;29,4;16,2;-;100;0;916,675;73,40792349;40,36716332;44,00949646;57,79812669;4,5625;CALM;8;315
22/09/2015;2015;9;22;23,6;29,4;21,4;24,5;30,2;16,4;-;85;0;916,425;43,03972223;31,19209029;73,68826053;47,73994882;4,375;CALM;10;230
23/09/2015;2015;9;23;21;28,4;23,4;23,45;29;16,4;-;73,75;0;916,9125;66,76865125;57,33624067;71,08066516;65,48855209;3,1875;CALM;8;230
24/09/2015;2015;9;24;20;27,4;22,2;22,4;28;15,6;-;87,5;0;916,25;62,50422033;52,1069906;74,22958027;62,83625288;1,8125;CALM;6;20
25/09/2015;2015;9;25;19,6;25,6;21;21,45;27;16,6;-;92,5;0;916,48125;75,89531605;47,00829615;65,13675969;65,98392198;1,9375;CALM;7;20
26/09/2015;2015;9;26;19,8;27;23;22,4;27,4;17;-;56,25;0;915,9;76,02865616;62,16943084;76,34790855;72,64366293;2,8125;CALM;6;360
27/09/2015;2015;9;27;19,6;24,2;22;21,35;25,8;15,8;-;22,5;0;915,78125;94,24472482;65,06958539;80,74012958;83,57479115;1,8125;CALM;8;23
28/09/2015;2015;9;28;20;25;21,8;21,7;26;16,7;-;25;0;916,3125;81,47449239;67,82222061;78,95362004;77,43120636;1,125;CALM;5;45
29/09/2015;2015;9;29;21;26;22,2;22,55;27,2;16,2;-;42,5;0;916,825;61,90576027;62,69564744;82,51966965;67,25670941;1,6875;CALM;5;45
30/09/2015;2015;9;30;21,8;27,8;22,4;23,45;28;14;-;80;0;918,1375;64,28275443;63,55592257;52,72548411;61,21172889;1,4375;CALM;5;20
01/10/2015;2015;10;1;21;27,2;23,4;23,15;28,2;18;-;100;   ;918,55625;60,30644752;52,31590403;74,99594134;61,9811851;4,3125;0;9;270
02/10/2015;2015;10;2;23;28;22,2;24,05;29,8;19,6;-;71,25;   ;918,9625;60,82206403;54,20923888;60,00997078;58,96583443;3,5;90;7;90
03/10/2015;2015;10;3;22,4;26,4;22,6;23,45;27,3;16,7;ttu;78,75; RA  FG;919,1125;58,69803369;59,00942599;82,69573634;64,77530743;2,5;0;6;45
04/10/2015;2015;10;4;22,1;28,4;21,4;23,5;28,6;14,2;-;87,5;   ;919,28125;42,90425018;33,94654893;56,04806852;43,95077945;4,125;0;8;180
05/10/2015;2015;10;5;22,2;29;20,8;23,55;29,2;12,6;-;100;   ;918,2375;46,63153965;40,26881617;64,13195859;49,41596352;3,5625;0;9;270
06/10/2015;2015;10;6;22;26,2;21,4;22,9;26,8;15,6;ttu;67,5;RA;917,56875;70,84319314;65,88861774;74,52187469;70,52421967;2,8125;0;7;20
07/10/2015;2015;10;7;20;25;21,8;21,7;25,6;16,2;0,2;25;RATS;917,575;94,30710247;68,47804453;84,05021295;85,28561561;1,0625;0;5;270
08/10/2015;2015;10;8;20,2;27;21;22,1;28,6;16,4;-;87,5;   ;917,5;71,11256605;40,95897634;75,09619598;64,57007611;2,5625;330;6;360
09/10/2015;2015;10;9;20,9;27;21,8;22,65;28,2;17;-;100;   ;917,4125;72,49467683;49,19058004;58,04597096;63,05647617;2,375;0;6;45
10/10/2015;2015;10;10;22,4;27,8;21,6;23,55;28;16,8;-;77,5;   ;918,32;60,21656877;55,99073181;68,91036155;61,33355772;3,875;0;15;50
11/10/2015;2015;10;11;23;28,4;22,2;24,15;28,8;17,8;-;100;   ;918,89375;52,00560959;41,78119694;55,46051608;50,31323305;5,75;270;9;270
12/10/2015;2015;10;12;23,4;28,2;22,5;24,375;29,1;15,8;-;87,5;   ;918,19375;46,86832745;45,04654737;73,61923688;53,10060979;3;0;6;225
13/10/2015;2015;10;13;21,4;27,9;21,6;23,075;29;15,6;-;62,5;   ;917,91875;70,38222286;59,4610381;74,65512945;68,72015332;2,125;30;4;30
14/10/2015;2015;10;14;20,4;28;23,2;23;28,6;17,2;ttu;62,5; RA  ;917,425;76,41921365;54,00517197;84,60300527;72,86165113;2,75;30;6;30
15/10/2015;2015;10;15;23,6;28;23,6;24,7;28,4;19;-;71,25;   ;916,6125;49,91321607;48,02688964;75,11862654;55,74298708;2,5625;30;7;30
16/10/2015;2015;10;16;24,4;28,6;23;25,1;30;18,2;-;100;   ;916,9375;41,53651875;25,54586156;53,45021923;40,51727957;5,25;0;7;225
17/10/2015;2015;10;17;23,6;29,2;22,4;24,7;30;17,2;-;100;   ;917,51875;48,51997411;40,52453799;46,91095649;46,11886068;3,3125;0;9;20
18/10/2015;2015;10;18;21;28,6;22,7;23,325;30,2;17,8;-;88,75;   ;917,88125;66,76865125;51,91835326;74,55533906;65,00274871;1,9375;0;6;30
19/10/2015;2015;10;19;23,5;26,2;24,2;24,35;30;17,8;-;100;   ;917,325;56,91550236;38,82466736;67,86968614;55,13133955;3,4375;0;7;45
20/10/2015;2015;10;20;22,6;25,8;23,6;23,65;28,7;16,6;-;40;   ;916,425;61,94151567;65,11207538;79,88468951;67,21994906;2,5625;0;6;270
21/10/2015;2015;10;21;22;27,6;23,4;23,75;28,2;17;-;100;   ;916,55625;67,63422551;43,36536088;52,49008953;57,78097536;3,0625;0;7;45
22/10/2015;2015;10;22;21,6;28;21,4;23,15;28,4;15,2;-;85;   ;917,51875;53,22941442;38,34828226;48,44982989;48,31423525;3,0625;0;5;270
23/10/2015;2015;10;23;20,2;27,4;20;21,95;28;17;-;95;   ;916,5625;61,0645886;53,2519956;77,91973625;63,32522726;2,1875;0;5;45
24/10/2015;2015;10;24;22,2;27,3;21;23,175;29;15;-;100;   ;916,5625;67,8013164;42,2855586;58,71779076;59,15149554;2,6875;0;6;45
25/10/2015;2015;10;25;22,2;28;22,2;23,65;29,4;17;-;100;   ;917,075;64,65285015;40,26881617;66,22169554;58,949053;2,875;0;6;80
26/10/2015;2015;10;26;23,6;29,2;23,8;25,05;30,5;17,8;-;100;   ;916,61875;51,31590555;41,27526832;60,13349221;51,01014291;1,75;0;7;30
27/10/2015;2015;10;27;25;30;23,6;25,9;30,8;17,2;-;95;   ;916,6625;52,9573925;45,30638307;51,31590555;50,63426841;2,75;0;8;180
28/10/2015;2015;10;28;24,4;28,5;23,6;25,225;29,4;19;-;75;   ;916,65625;49,5317573;61,28013175;73,55218769;58,47395851;3,125;0;7;30
29/10/2015;2015;10;29;24,9;29,8;22;25,4;30,8;17;-;97,5;   ;917,06875;50,14085735;40,42463191;67,63422551;52,08514303;2,4375;0;8;180
30/10/2015;2015;10;30;21,6;29,2;23;23,85;30,2;15,4;-;100;   ;916,65;90,96785328;50,77219073;52,00560959;71,17837672;2,75;0;5;20
31/10/2015;2015;10;31;21;27,7;23,4;23,275;30,2;16,8;-;100;   ;916,38125;87,24491101;53,54065442;62,7033512;72,68345691;2,0625;0;7;20
01/11/2015;2015;11;1;23,7;29,6;23;25;30,2;17;-;92,5;   ;916,46875;62,23993947;38,71190475;57,8431936;55,25874432;2,125;0;7;180
02/11/2015;2015;11;2;22,2;29,4;23,2;24,25;30;17;-;72,5;   ;915,49375;79,16893155;56,99614387;73,28951823;72,1558813;2,1875;90;5;90
03/11/2015;2015;11;3;21,2;27,6;24,4;23,6;28,4;17,2;-;62,5;   ;915,7125;87,31177312;60,07307229;65,06958539;74,94155098;2,4375;0;6;360
04/11/2015;2015;11;4;21,6;29,2;23,4;23,95;29,8;16,4;-;100;   ;915,28125;75,48714497;49,73611104;56,80745014;64,37946278;2,1875;0;6;170
05/11/2015;2015;11;5;23;28,6;22,8;24,35;30;17;-;95;   ;915,15625;70,00813237;43,43516658;73,02076787;64,1180498;3,4375;0;7;360
06/11/2015;2015;11;6;22;27,4;24;23,85;28,6;18,6;-;47,5;   ;915,3875;77,39530801;58,79208393;83,28131187;74,21600296;1,8125;0;6;230
07/11/2015;2015;11;7;21,8;27,4;24;23,75;28,4;18,4;-;12,5;   ;916,25;80,64066791;65,73408056;83,28131187;77,57418206;1,75;90;4;30
08/11/2015;2015;11;8;21,4;26;23,6;23,1;28,5;18;ttu;23,75; RA  ;916,24375;88,25899785;68,63072556;88,05676978;83,30137276;0,5625;0;4;230
09/11/2015;2015;11;9;22;26,6;22,4;23,25;28;18,2;15,5;25;TS   ;915,3125;87,5715805;77,67286517;87,69705481;85,12827024;1,1875;0;5;270
10/11/2015;2015;11;10;22;27,2;21;23,05;27,6;18,8;13,8;26,25;TS RA LG ;915,03125;89,3096233;73,85725648;92,63484041;86,27783587;1,4375;0;6;20
11/11/2015;2015;11;11;21,2;27,5;23;23,225;28;18,74;-;30;   ;915,63125;92,67328779;74,56325964;87,87996906;86,94745107;0,5625;0;3;90
12/11/2015;2015;11;12;21,5;28;23,2;23,55;28,6;17,8;-;66,25;   ;916,43125;90,05637041;70,0182713;89,62573607;84,93918704;0,75;0;9;30
13/11/2015;2015;11;13;22;29,2;25;24,55;30;18,4;-;76,25;   ;916,09375;80,74012958;51,13103944;68,47804453;70,27233578;1,75;0;6;270
14/11/2015;2015;11;14;21,6;27,8;23;23,5;29,4;18;-;75;   ;915,975;89,19933287;60,41260609;74,74633411;78,38940149;2,375;0;6;180
15/11/2015;2015;11;15;21,2;28,2;22;23,15;29,1;18;ttu;60; RA  ;914,85;83,79928802;70,65130735;87,5715805;81,45536597;1;0;4;30
16/11/2015;2015;11;16;21;28,6;22,8;23,35;29,8;18,6;-;100;   ;914,86875;87,24491101;48,5560019;76,22916025;74,81874604;1,625;0;5;30
17/11/2015;2015;11;17;22,6;28,6;24,6;24,6;30;18;-;100;   ;915,4;77,73846676;52,71866197;75,71167366;70,97681729;1,375;0;5;20
18/11/2015;2015;11;18;21,4;29,2;25,2;24,3;30,4;17,8;-;100;   ;915,96875;85,6247912;53,10624588;74,54547905;74,72532683;2,5;0;6;180
19/11/2015;2015;11;19;22,6;29,9;24,4;24,875;30,2;18,5;-;85;   ;915,5375;69,70354294;49,61766262;74,05997944;65,77118199;1,6;0;5;180
20/11/2015;2015;11;20;22,8;28,8;24,8;24,8;30,2;18,6;-;95;   ;914,55;80,30325836;51,73721495;74,30543562;71,66229182;3,4375;0;5;20
21/11/2015;2015;11;21;22;27,8;24,2;24;28,8;18;-;56,25;   ;914,5;82,43010379;60,33527907;69,37010759;73,64139856;2,875;0;8;30
22/11/2015;2015;11;22;21,4;30;24,2;24,25;30,6;18,8;-;100;   ;914,69375;75,35835725;43,09574993;66,37973729;65,04805043;4;0;7;20
23/11/2015;2015;11;23;25,2;30,4;22,6;25,85;31;17,2;-;85;   ;914,86875;53,18135082;40,3000716;61,94151567;52,15107223;1,9375;0;4;20
24/11/2015;2015;11;24;23;27,2;25,2;24,6;27,8;17,7;29,6;47,5; RA  ;914,575;87,87996906;48,5560019;70,0900846;73,60150616;1,3125;0;7;30
25/11/2015;2015;11;25;21,2;26;22,6;22,75;29,2;18,6;55;15;TS RA  ;914,2625;92,67328779;76,48832784;98,21358877;90,01212305;0,9375;0;6;270
26/11/2015;2015;11;26;21,4;26;22,4;22,8;27,4;18,4;ttu;17,5;RA;914,959375;96,32990733;76,69948994;87,69705481;89,26408985;1,8;0;5;180
27/11/2015;2015;11;27;21;26,4;22,7;22,775;28,4;19,2;-;62,5;   ;915,38125;92,63484041;63,89432685;73,75257999;80,72914691;1,375;0;4;180
28/11/2015;2015;11;28;22,6;28,8;24;24,5;29,8;20;-;50;   ;916,3375;89,47037959;60,74497912;75,35986198;78,76140007;1,75;0;8;20
29/11/2015;2015;11;29;22,4;27,8;25,2;24,45;29,6;18,2;-;87,5;   ;916,83125;91,1499747;69,56173387;77,5691061;82,35769734;2;0;5;20
30/11/2015;2015;11;30;22,6;27,6;23,2;24;29;18,6;-;12,5;   ;915,98125;86,05913501;69,3027736;81,3134248;80,68361711;2,0625;0;5;360
01/12/2015;2015;12;1;21,8;29;25;24,4;26,8;19;-;77,5;   ;915,08125;91,01417176;56,493445;69,94929635;77,11777122;0,8125;0;7;30
02/12/2015;2015;12;2;22;27,6;24,2;23,95;30,4;18,6;2,2;22,5; RA  ;916,1375;85,84571988;62,0127231;73,9351721;76,90983374;0,625;0;4;170
03/12/2015;2015;12;3;20,5;27;22,4;22,6;28;18,4;3;43,75;TS   ;916,53125;93,45827311;73,17540526;92,89487225;88,24670593;2,875;8;6;20
04/12/2015;2015;12;4;21,4;25;21,4;22,3;26,2;18,4;19,5;0;TS RA  ;916,11875;90,92099633;94,67887453;90,92099633;91,86046588;0,1875;0;2;130
05/12/2015;2015;12;5;21,2;25,2;22,5;22,525;27;20,6;16,5;1,25;TS   ;915,49375;90,8735929;72,46019873;94,66558035;87,21824122;0,5625;0;5;90
06/12/2015;2015;12;6;22,2;23,4;20,4;22,05;25,6;18,6;33,5;27,5;TS   ;915,701875;92,85899324;92,96541688;98,10951906;94,19823061;0,6875;0;4;270
07/12/2015;2015;12;7;20,8;24,6;23,6;22,45;25,6;19;26,2;25;TS RA  ;915,91875;94,42752755;83,67229545;93,10181474;91,40729132;3,1875;8;6;20
08/12/2015;2015;12;8;21,6;25,4;23,6;23,05;26,8;18,4;-;30;TS   ;916,76875;96,34877172;75,12290491;89,72642202;89,38671759;2,1875;0;5;20
09/12/2015;2015;12;9;21,6;27,4;24,1;23,675;27,9;18,7;-;18,75;   ;916,50625;89,19933287;72,76381629;86,56189131;84,43109333;0,9375;0;3;45
10/12/2015;2015;12;10;22,4;27;22,8;23,65;29;19,4;23,4;5;TS RA  ;915,60625;91,1499747;78,36826988;92,96541688;88,40840904;2,0625;0;7;40
11/12/2015;2015;12;11;22,2;27,2;24;23,9;28,2;18,2;-;25;   ;915,49375;92,85899324;71,54067613;70,73971065;81,99959332;2,6875;7;5;20
12/12/2015;2015;12;12;22,2;27,2;23,4;23,75;27,2;18,6;-;2,5;   ;915,30625;89,36382349;69,4795509;83,03602116;82,81080476;1,5;0;4;130
13/12/2015;2015;12;13;21,6;25,1;22,8;22,775;26,4;19,1;27,2;2,5;TS RA  ;914,71875;85,69928962;86,04671947;93,83377507;87,81976845;0,375;0;2;30
14/12/2015;2015;12;14;21,8;24;20,6;22,05;25;18,6;45,7;1,25;TS RA  ;914,30625;94,57036981;96,32990733;97,18424476;95,66372293;0,625;0;4;260
15/12/2015;2015;12;15;20,4;25,4;22;22,05;25,6;18,6;-;1,25;   ;914,425;98,10951906;85,25239155;94,59796265;94,01734808;1,625;0;6;230
16/12/2015;2015;12;16;21;25;20;21,75;25,6;18,8;90,2;1,25;TS RA  ;914,3875;92,63484041;88,28344431;96,19153602;92,43616528;1,3125;0;4;20
17/12/2015;2015;12;17;21,2;24,7;22,7;22,45;25,4;19,3;-;0;   ;914,575;98,14889814;85,98148821;90,35486846;93,15853824;0,875;0;6;20
18/12/2015;2015;12;18;20,8;24;22,4;22;25,4;18,2;22,4;0;TS RA  ;914,81875;92,59594236;89,77592439;94,65221046;92,40500489;0,1875;0;3;180
19/12/2015;2015;12;19;20;24,6;20,4;21,25;25;18;64;0;TS RA  ;915,625;94,30710247;94,73130515;96,23223326;94,89443584;0,5;0;8;230
20/12/2015;2015;12;20;20,4;24,2;22,2;21,8;25,4;18;1;0;TS RA  ;915,351875;92,51676717;91,4903039;91,10522477;91,90726575;0,4375;0;4;30
21/12/2015;2015;12;21;20,6;25;23,2;22,35;26,5;18,1;10,1;0; RA  ;915,1625;92,5565869;84,04233428;81,3134248;87,61723322;1,9375;0;8;20
22/12/2015;2015;12;22;20,2;25,4;21,6;21,85;28,4;18,4;7,1;0; RA  ;916,175;94,33774194;78,07670594;89,19933287;88,98788067;2,875;0;6;30
23/12/2015;2015;12;23;22,2;27,3;24,4;24,025;29,4;18,9;-;35;TS   ;915,9375;79,16893155;61,93304361;86,65746527;76,73209299;4,25;0;12;90
24/12/2015;2015;12;24;21;28;23,8;23,45;28,8;19;-;0;   ;915,60625;90,82563483;75,00993843;84,8267666;85,37199367;2,1875;0;8;230
25/12/2015;2015;12;25;21;24,5;23,8;22,575;26;19,1;2;2,5; RA  ;916,06875;90,82563483;80,54598856;88,94366947;87,78523192;0,375;0;2;90
26/12/2015;2015;12;26;21,2;24,8;23,4;22,65;27,4;18,8;ttu;12,5;TS RA  ;916,03125;92,67328779;74,78026364;87,99849908;87,03133458;1,875;0;5;40
27/12/2015;2015;12;27;21,2;23,8;21,6;21,95;24,2;18,8;19,3;0; RA  ;917,0375;92,67328779;91,28120792;94,54245816;92,79256042;0,625;0;5;20
28/12/2015;2015;12;28;21,2;24,4;22;22,2;24,4;17,4;15,5;0; RA  ;917,7875;90,8735929;92,748857;96,38585608;92,72047472;0,6875;0;6;45
29/12/2015;2015;12;29;20,4;23,8;22,8;21,85;24,8;19;11,6;2,5; RA  ;916,975;96,23223326;83,59582269;92,96541688;92,25642652;0,875;0;5;30
30/12/2015;2015;12;30;21,4;25,4;23,4;22,9;25;19,2;6,6;2,5;TS RA  ;916,325;90,92099633;93,16775733;91,36625533;91,59400133;1,3125;0;5;20
31/12/2015;2015;12;31;21,4;24,8;22;22,4;25;18,4;174;6,25; RA  ;916,56875;90,92099633;92,748857;96,38585608;92,74417644;2,3125;0;6;270
01/01/2016;2016;1;1;21;24;22,4;22,1;25,2;18,6;5;0;0;917,5;96;82;95;92,25;0,4;0;6;180
02/01/2016;2016;1;2;21;21,6;22,4;21,5;25,2;18,8;22,3;0;0;917,5;94;93;93;93,5;1,1;0;4;40
03/01/2016;2016;1;3;21,4;24,8;22,7;22,575;25,4;19,4;3;0;0;917,9;93;87;94;91,75;0,8;0;4;90
04/01/2016;2016;1;4;21,8;24,2;23;22,7;25,4;18,4;0,5;0;0;918,5;94;92;91;92,75;3,3;270;6;270
05/01/2016;2016;1;5;21,2;25,8;23,2;22,85;26,4;16,8;0;0;0;917,8;91;82;90;88,5;2,2;0;8;130
06/01/2016;2016;1;6;20;26,8;21,4;22,05;28,1;17,4;0;58,8;0;918,2;98;68;75;84,75;1,4;0;4;130
07/01/2016;2016;1;7;20,4;27,8;22,8;22,85;28,6;17,6;0;57,5;0;918,2;95;66;79;83,75;2,9;0;6;30
08/01/2016;2016;1;8;20,6;27,6;24;23,2;28,8;18,2;0;37,5;0;917,1;89;74;77;82,25;3,8;270;6;315
09/01/2016;2016;1;9;21;26,2;24;23,05;27,6;19,2;1,3;0;0;916,8;93;70;83;84,75;0,8;0;4;180
10/01/2016;2016;1;10;21;25,7;23,1;22,7;26,7;19,2;0,5;0;0;917,5;94;78;90;89;2;140;5;130
11/01/2016;2016;1;11;21,3;25,6;21,6;22,45;25,4;18;0;43,8;0;917,4;97;82;84;90;4;0;8;45
12/01/2016;2016;1;12;21;26,8;22,6;22,85;27;18;0;0;0;916,9;80;64;83;76,75;1,9;0;5;230
13/01/2016;2016;1;13;21;26,8;23,6;23,1;27,8;18,8;13,5;81,3;0;916,5;91;69;83;83,5;4,1;360;8;270
14/01/2016;2016;1;14;21,6;27,2;23,6;23,5;27,6;18;0;0;0;915,9;98;74;86;89;1,3;0;3;130
15/01/2016;2016;1;15;21,8;27,4;23;23,5;28,8;18;0;100;0;915,5;95;56;75;80,25;5;270;7;135
16/01/2016;2016;1;16;21;27,2;22,8;23;27,2;17,8;ttu;33,8;0;914,8;80;77;93;82,5;0,9;0;6;20
17/01/2016;2016;1;17;20,8;26;22;22,4;27,6;18,2;14,6;0;0;915,3;96;76;96;91;1;0;5;180
18/01/2016;2016;1;18;21,6;23,8;23;22,5;24,6;18,6;4,5;0;0;915,1;94;91;93;93;0,9;0;3;183
19/01/2016;2016;1;19;21;25;21,6;22,15;26,7;19,8;29,5;26,3;0;915,4;95;89;96;93,75;1,3;0;3;180
20/01/2016;2016;1;20;21,4;24;22,4;22,3;27;18,9;4;15;0;916,1;94;95;95;94,5;1;0;5;20
21/01/2016;2016;1;21;20,2;25;21;21,6;26,6;18,2;32,8;0;0;916,2;91;96;93;92,75;0,9;0;5;180
22/01/2016;2016;1;22;21,8;24,6;21,8;22,5;27;19,2;7;18,8;0;916,2;92;87;96;91,75;2,7;0;8;135
23/01/2016;2016;1;23;20,6;26,2;20,6;22;27,2;19,1;5,8;33,8;0;916,3;93;91;96;93,25;3,9;0;12;230
24/01/2016;2016;1;24;20,4;23,6;21;21,35;27;18,6;0,3;0;0;917,2;96;82;89;90,75;1,9;0;5;180
25/01/2016;2016;1;25;20,4;24;20,8;21,4;24,4;19;18,9;0;0;916,8;93;95;93;93,5;1,2;0;7;135
26/01/2016;2016;1;26;21,1;21,9;22;21,525;24,2;19,9;0,7;0;0;917,1;91;86;95;90,75;0;0;0;0
27/01/2016;2016;1;27;19,8;24,2;21;21,2;24,8;17,2;4,9;1,3;0;915,7;94;87;93;92;0,6;0;4;180
28/01/2016;2016;1;28;21;25;23,8;22,7;27,2;17,8;6;0;0;915,4;94;79;85;88;3,6;0;8;140
29/01/2016;2016;1;29;21,4;24,4;22,3;22,375;26,6;19;43,5;0;0;915,7;94;86;94;92;1,1;0;4;0
30/01/2016;2016;1;30;21,6;24,5;23,2;22,725;25,4;20,1;52;15;0;914,8;96;84;96;93;1,8;0;6;230
31/01/2016;2016;1;31;21;23,8;22,2;22;26,2;18,8;2,4;26,3;0;913,8;98;78;86;90;1,1;0;7;20
01/02/2016;2016;2;1;21,2;26,6;22,8;22,95;27,4;19,4;29;56,25;TS RA  ;914,025;90,8735929;79,8410617;96,4575338;89,51144533;2,5;0;6;135
02/02/2016;2016;2;2;21,2;25,2;21,6;22,3;25,6;19,8;16,5;0;TS RA  ;914,9625;92,67328779;86,96484769;96,34877172;92,16504875;0,75;0;6;130
03/02/2016;2016;2;3;20,8;23,8;22,6;22;25,8;19,8;ttu;0; RA  ;914,85;96,27198665;85,60950795;92,93034483;92,77095652;0,6875;0;3;230
04/02/2016;2016;2;4;21;23;21;21,5;23,4;18;28;12,5;TS RA  ;914,1125;94,4567626;96,36742024;98,13922443;95,85504247;0,25;0;4;270
05/02/2016;2016;2;5;20,6;21,6;20,4;20,8;24,8;18,8;118,5;0;TS RA  ;914,16875;96,25222619;100;100;98,12611309;0,75;0;6;140
06/02/2016;2016;2;6;20;24,2;22,8;21,75;24,8;19;16,3;21,25; RA  ;914,46875;98,08912806;91,32397104;92,96541688;95,11691101;0;0;0;0
07/02/2016;2016;2;7;21;23,4;22,8;22,05;24,8;18,4;4,5;1,25; RA  ;915,00625;94,4567626;94,8077717;89,52275339;93,31101257;0;0;0;0
08/02/2016;2016;2;8;21,2;22,6;20,8;21,45;25;18,7;29,7;0; RA  ;914,25625;96,31082388;94,01102761;95,3481405;95,49520397;0;0;0;0
09/02/2016;2016;2;9;20,6;24,4;21,2;21,7;24,8;19;50,3;0;TS RA  ;914,15;98,11953659;93,16775733;98,14889814;96,88893216;0,875;0;6;180
10/02/2016;2016;2;10;20,6;23,6;22,2;21,75;24,8;19,7;45,5;0;TS RA  ;914,4;98,11953659;89,96851584;94,62524134;95,20820759;2,25;0;6;270
11/02/2016;2016;2;11;21;23,4;21,6;21,75;26,4;17,8;50,8;7,5; RA  ;914,1125;98,13922443;85,71322775;98,16791345;95,03989751;0,75;0;5;20
12/02/2016;2016;2;12;20,4;22;20,7;20,875;25,6;19,2;34,9;0; RA  ;915,41875;98,10951906;97,26375278;98,12450163;97,90182313;0,3125;0;3;230
13/02/2016;2016;2;13;21;23,8;22,6;22,1;25;19,2;1,4;0; RA  ;916,075;94,4567626;83,59582269;94,67887453;91,7970556;2,8125;0;7;225
14/02/2016;2016;2;14;20,4;25;22,2;22;25,2;19;3,9;0;TS RA  ;916,25625;94,36802241;86,84391759;96,40408231;92,99601118;0,3125;0;4;180
15/02/2016;2016;2;15;19,8;22,8;20,2;20,65;25,5;18,1;29;6,25;TS RA  ;916,35;96,17082455;96,47495174;98,09938348;96,72899608;0,5625;0;3;230
16/02/2016;2016;2;16;19,8;23;22,2;21,2;25,2;17,4;1,8;17,5; RA  ;917,19375;98,07875101;96,49217489;91,10522477;95,93872542;0,8125;0;4;30
17/02/2016;2016;2;17;19,8;25,8;22,4;21,95;26,6;18;1;0;TS   ;917,39375;96,17082455;80,9014676;91,1499747;91,09827285;2,4375;0;5;140
18/02/2016;2016;2;18;20,4;25,6;21,4;21,95;26,4;17,4;3;0;TS RA  ;916,91875;92,51676717;79,47723009;90,92099633;88,85794019;1,375;0;5;140
19/02/2016;2016;2;19;19,6;26;23,8;22,25;28;19,2;0,9;0; RA  ;915,95;96,1498663;74,78852326;93,98230452;90,2676401;1,125;0;4;230
20/02/2016;2016;2;20;21;24;21,8;21,95;27,6;20;63,5;18,75;TS RA  ;916,74375;97,21374502;72,58263119;92,78599178;89,94902825;3,8125;0;8;140
21/02/2016;2016;2;21;20,4;24;20,2;21,25;25,6;17,8;21,6;3,75;TS RA  ;917,2625;94,36802241;93,13496954;98,09938348;94,99259946;1,125;0;7;50
22/02/2016;2016;2;22;20,2;25;21,4;21,7;25,4;18;21,5;0;TS RA  ;917,5875;92,4764762;83,59582269;98,1584606;91,67680892;1,4375;0;5;180
23/02/2016;2016;2;23;20;24;20;21;25,6;17,9;23,3;0;TS RA  ;916,76875;96,19153602;82,76586414;99,04289642;93,54795815;0,5;0;4;130
24/02/2016;2016;2;24;20,8;24,6;21,8;22;25,8;18;11,1;37,5;TS RA  ;916,08125;92,59594236;94,8077717;98,17725829;94,54422868;1,625;0;7;135
25/02/2016;2016;2;25;19,8;24,6;21,2;21,35;25,2;18,8;23,9;0;TS RA  ;916,46875;94,2760986;93,00009422;94,48565941;94,00948771;2,5;0;6;135
26/02/2016;2016;2;26;20,8;24,2;21,2;21,75;24,4;19;22,7;0;TS RA  ;916,634375;94,42752755;86,52967706;96,31082388;92,92388901;1,0625;0;5;130
27/02/2016;2016;2;27;20;22,6;21;20,9;24,6;19,3;11,4;0; RA  FG;916,41875;98,08912806;82,51848187;96,29151809;93,74706402;0,8125;0;3;230
28/02/2016;2016;2;28;20,8;25,6;20,6;21,95;26,6;19;38,9;0;TS RA  ;916,63125;96,27198665;86,90471336;98,11953659;94,39205581;1,1875;0;6;140
29/02/2016;2016;2;29;20,8;24,4;21,8;21,95;25,6;18,8;27,5;0;TS RA  ;916,7375;98,12943781;89,82487711;96,36742024;95,61279324;0,875;0;6;230
01/03/2016;2016;3;1;20,8;25,8;23,8;22,8;27,6;19,2;1,8;15;RA;916;96;73;91;89;1,6;0;6;140
02/03/2016;2016;3;2;21,8;25,8;21,4;22,7;26,2;19,4;28;2,5;TSRA;917,4;93;99;97;95,5;0,4;0;3;230
03/03/2016;2016;3;3;21,4;22,3;21,8;21,725;26,4;18,6;15,2;16,3;TS RA;916,9;92;92;96;93;1,1;0;6;90
04/03/2016;2016;3;4;20,8;23,4;22,8;21,95;26;19;5,5;8,8;RA;915,5;96;85;96;93,25;1,4;0;6;90
05/03/2016;2016;3;5;21,5;24,8;22,4;22,55;25,4;19,2;0;17,5;0;916;97;95;91;95;1,3;0;4;180
06/03/2016;2016;3;6;21;24,7;21;21,925;25,8;18,6;32,5;13,8;TS RA;916,3;96;82;96;92,5;0,3;0;5;130
07/03/2016;2016;3;7;21;25;22,4;22,35;25,6;18,6;0;22,5;0;915,7;94;82;93;90,75;1,4;0;6;80
08/03/2016;2016;3;8;21;26;23;22,75;26,6;19;8,2;43,8;TS RA;915,3;94;81;95;91;2,4;0;7;135
09/03/2016;2016;3;9;20,4;25,6;22,4;22,2;26;19,2;19;21,3;RA;915,6;93;85;98;92,25;0,8;0;4;200
10/03/2016;2016;3;10;21,2;26,2;23,6;23,05;26,7;18;2,6;26,3;TSRA;916,1;98;86;95;94,25;2,5;0;7;230
11/03/2016;2016;3;11;22,2;25;22,4;22,95;26,7;17,5;44,3;12,5;TSRA;916;96;90;96;94,5;0,9;0;6;10
12/03/2016;2016;3;12;21;25,6;21,4;22,25;26;18,4;19,5;25;TSRA;916,2;94;85;96;92,25;1,1;0;7;135
13/03/2016;2016;3;13;20,2;23,8;21,4;21,4;26;18,2;13;30;TS RA;916,4;96;89;91;93;0,9;0;6;230
14/03/2016;2016;3;14;20,6;25,5;22,7;22,35;26,3;18,4;7,7;17,5;TS RA;916,4;98;82;94;93;0,9;0;5;230
15/03/2016;2016;3;15;21,4;26;22,6;22,85;27;18,7;6;42,5;RA;915,2;91;79;95;89;0,9;0;5;230
16/03/2016;2016;3;16;21,2;24;24;22,6;25;19,2;1,3;26,3;RA;915,4;94;84;91;90,75;2,6;0;8;90
17/03/2016;2016;3;17;21,4;25;22;22,45;25,8;19,2;0;25;0;915,9;86;87;91;87,5;0,9;0;5;180
18/03/2016;2016;3;18;21,2;24,8;23;22,55;25,9;19,4;52;8,8;TSRA;915,6;93;96;96;94,5;0,6;0;6;230
19/03/2016;2016;3;19;21;24,1;21,8;21,975;24I.6;19,6;6,8;8,8;TSRA;915,5;98;94;95;96,25;0,4;0;2;180
20/03/2016;2016;3;20;21,8;24;24;22,9;27,5;20;0;22,5;RA;915,6;96;70;93;88,75;1,1;0;6;20
21/03/2016;2016;3;21;21,4;25,8;23,8;23,1;27;18,6;0;18,8;0;915,3;98;87;93;94;1,3;0;6;20
22/03/2016;2016;3;22;20,6;25,3;22,8;22,325;26,2;19,4;4;16,3;RA;914,7;94;86;93;91,75;0,9;0;4;180
23/03/2016;2016;3;23;21,3;23,8;23,4;22,45;25,8;19,6;54,1;26,3;TSRA;915,9;97;85;95;93,5;0,8;0;4;20
24/03/2016;2016;3;24;21,6;25,6;22;22,7;26,2;19;0,2;18,8;TS RA;917,3;96;85;95;93;2;0;8;270
25/03/2016;2016;3;25;22;25;23,4;23,1;25,6;17,4;59,9;26,3;TS RA;917,7;91;95;97;93,5;1,3;0;6;135
26/03/2016;2016;3;26;20,4;27;22,2;22,5;28,4;18;0;86,3;0;918,5;96;67;91;87,5;2,5;0;6;180
27/03/2016;2016;3;27;20,6;26;22,4;22,4;27,8;19;38,4;37,5;TSRA;917,7;92;82;94;90;0,9;0;5;20
28/03/2016;2016;3;28;21,4;25;21,6;22,35;26,8;18,8;22,5;52,5;TS RA;917,5;88;81;98;88,75;2,4;0;7;135
29/03/2016;2016;3;29;20,6;24,4;23,4;22,25;26;19,2;3;16,3;RA;917,5;98;84;93;93,25;1,3;0;7;180
30/03/2016;2016;3;30;20,4;26,5;21,9;22,3;27,6;19,4;12,8;56,3;TS RA;917,7;98;76;93;91,25;1,4;0;5;180
31/03/2016;2016;3;31;20,7;26,6;22,6;22,65;27,4;19,2;9;50;TSRA;917;97;71;86;87,75;2,5;0;8;225
01/04/2016;2016;4;1;21,8;22,6;21;21,8;26,6;17,8;14,2;25;TS RA  ;916,30625;89,2547962;86,52967706;90,82563483;88,96622607;1;0;6;270
02/04/2016;2016;4;2;21,4;26,6;22,4;22,95;27,6;19;5,6;97,5;RA;916,85;89,14322384;72,70374664;91,1499747;85,53504225;2,25;0;8;130
03/04/2016;2016;4;3;20,2;26,3;22,2;22,225;27,8;19;0;87,5;   ;917,39375;96,21200439;76,23161585;82,51966965;87,79382357;2,125;0;8;90
04/04/2016;2016;4;4;21,3;27,2;21,4;22,8;28,2;19,8;34;90;TS RA;916,39375;93,59457422;71,6641669;100;89,71332884;2,8125;0;7;135
05/04/2016;2016;4;5;21,8;26,2;24,4;23,55;28,2;20,1;8,3;66,25;RA;915,95625;92,78599178;70,14934981;88,28344431;86,00119442;2,4375;0;6;140
06/04/2016;2016;4;6;21,8;26,8;22,6;23,25;27,4;19,2;0;37,5;   ;916,55625;96,36742024;75,4545312;91,19421696;89,84589716;1,125;0;6;130
07/04/2016;2016;4;7;21,6;24,2;22,6;22,5;27;19,5;1,3;25; RA  ;916,55;94,54245816;79,70646286;91,19421696;89,99639904;0,1875;0;3;90
08/04/2016;2016;4;8;23,5;26,7;22,8;24,125;27,4;20,2;31,4;75;TS RA LG ;915,95625;90,54283291;82,26862872;95,57981954;89,73352852;1,1875;0;6;50
09/04/2016;2016;4;9;22;24,4;22,4;22,7;25;19,2;4,9;25;TSRA;916,03125;96,38585608;91,28120792;96,42210202;95,11875552;1,4375;0;9;230
10/04/2016;2016;4;10;21,6;26,4;22,2;22,95;27,4;19;0;47,5;   ;916,18125;96,34877172;79,66111109;84,21271046;89,14284125;2,125;0;8;130
11/04/2016;2016;4;11;21;26;23,2;22,8;27,6;19,6;4,5;67,5; RA  ;915,725;96,29151809;70,58646346;92,1776479;88,83678689;1,625;0;6;10
12/04/2016;2016;4;12;21,6;25,4;21,8;22,6;27,8;20;96,7;21,25;TS RA  ;915,4125;96,34877172;91,57073272;98,17725829;95,61138361;0;0;0;0
13/04/2016;2016;4;13;22;24,2;22,4;22,65;24,8;19,2;17;6,25;TS RA  ;915,4125;96,38585608;98,23114582;96,42210202;96,85624;0,6875;0;5;135
14/04/2016;2016;4;14;21;25,4;23,4;22,7;26;19;0,4;31,25; RA  ;916,06875;94,4567626;77,5691061;91,36625533;89,46222166;1,3125;0;6;135
15/04/2016;2016;4;15;21;24;21,6;21,9;26,2;19,8;7,8;25; RA  ;916,5125;94,4567626;87,99849908;92,748857;92,41522032;1,0625;0;5;135
16/04/2016;2016;4;16;22,8;25,7;23,7;23,75;26,4;19,7;0;43,75;   ;916,05625;94,70523797;86,84391759;87,25732713;90,87793017;2,25;0;7;130
17/04/2016;2016;4;17;22;27,2;21,2;23,1;27,2;18,6;51,2;38,75;TS RA  ;916,175;87,5715805;81,07346755;98,14889814;88,59138167;1,0625;0;5;20
18/04/2016;2016;4;18;21,4;22,4;21,6;21,7;27;17,8;68,4;7,5;TS RA  ;915,93125;96,32990733;83,74793082;98,16791345;93,64391473;0,125;0;2;130
19/04/2016;2016;4;19;20;23,7;20;20,925;24,2;18,8;12;12,5; RA  ;916,05625;94,30710247;90,6336937;96,19153602;93,85985867;0,1875;0;3;90
20/04/2016;2016;4;20;21,4;25;22,4;22,55;26,4;18,4;40,5;22,5; RA  ;916,43125;94,51422297;89,72642202;91,1499747;92,47621066;0,625;0;4;20
21/04/2016;2016;4;21;20,6;25,8;24;22,75;27;18,8;1,5;51,25; RA  ;916,04375;98,11953659;72,46019873;75,35986198;86,01478347;3,1875;0;8;225
22/04/2016;2016;4;22;21;24,6;19,8;21,6;25,4;18;29,4;10; RA  ;916,38125;91,7286553;81,67443148;92,39445203;89,38154853;1,5;0;6;360
23/04/2016;2016;4;23;20,2;26,9;23,2;22,625;27,5;18,4;ttu;57,5; RA  ;915,8875;90,62808814;69,88577261;89,62573607;85,19192124;1,1875;0;5;90
24/04/2016;2016;4;24;21,2;27,6;22;23;28,8;17,4;0;77,5;   ;915,575;82,92876967;68,3574308;92,82270179;81,75941798;1,375;0;8;40
25/04/2016;2016;4;25;20,4;28,4;22,6;22,95;28,4;19,8;6,2;91,25; RA  ;915,39375;94,36802241;64,98990078;94,67887453;87,10120503;4,375;0;8;225
26/04/2016;2016;4;26;22,6;26,4;20,4;23;27;17,4;3,9;57,5; RA  ;916,075;79,37932137;91,4903039;94,36802241;86,15424226;1;0;4;180
27/04/2016;2016;4;27;20,6;26,7;22,4;22,575;27,1;17,4;0,1;37,5; RA  ;915,68125;90,72802144;77,67286517;91,1499747;87,56972069;1,1875;0;6;200
28/04/2016;2016;4;28;19,8;26;24,2;22,45;27,8;19,2;ttu;50; RA  ;915,283125;96,17082455;80,72567797;83,36125762;89,10714617;0,625;0;4;200
29/04/2016;2016;4;29;21,4;26,4;24,4;23,4;27,7;18,2;0;75;   ;915,68125;90,92099633;71,6641669;85,04312374;84,63732083;2,4375;0;8;270
30/04/2016;2016;4;30;22,4;26,8;23,4;23,75;27,4;18,6;0;55;   ;915,84375;94,65221046;77,97739324;93,06828757;90,08752543;1,5;0;6;200
01/05/2016;2016;5;1;23;25,9;22,6;23,625;27,7;18,8;0;50;   ;916,19375;82,8678151;75,12290491;89,47037959;82,58222868;1,9375;0;5;20
02/05/2016;2016;5;2;21,7;27,5;23;23,475;28,4;18,4;0;96,25;   ;916,23125;87,47556082;66,18314387;82,8678151;81,00052015;2;0;5;10
03/05/2016;2016;5;3;22,2;28;23,8;24,05;28,4;18,6;0;100;   ;915,54375;84,21271046;70,27902813;89,77592439;82,12009336;2;0;7;270
04/05/2016;2016;5;4;21,6;27;22,4;23,15;27,6;18;0;62,5;   ;915,475;87,44318247;76,48832784;89,41740591;85,19802468;1,5625;0;5;130
05/05/2016;2016;5;5;21,2;26,4;23,6;23,1;27,6;18,2;ttu;50; RA  ;914,99375;90,8735929;77,8769927;93,10181474;88,18149831;0,9375;0;5;20
06/05/2016;2016;5;6;21,8;25;22,1;22,675;26,8;18,6;16,5;12,5; RA  ;914,40625;91,01417176;93,98230452;99,09392573;93,77614344;0;0;0;0
07/05/2016;2016;5;7;21,6;24,8;22,4;22,6;27,4;18,8;3,6;15;TS RA  ;914,60625;94,54245816;91,61028552;92,89487225;93,39751853;0,875;0;7;230
08/05/2016;2016;5;8;21,4;24,8;22,4;22,5;26,4;19,2;34,7;25; RA  ;915,10625;98,1584606;98,23977741;96,42210202;97,74470016;0;0;0;0
09/05/2016;2016;5;9;21,6;24,6;21,6;22,35;26;19;11,7;15;TS RA  ;915,45;90,96785328;94,85734495;96,34877172;93,28545581;0;0;0;0
10/05/2016;2016;5;10;20,4;24,2;22,7;21,925;26,3;19,4;20,2;25;RA;915,21875;98,10951906;81,87016252;93,81845727;92,97691448;1,5625;0;5;90
11/05/2016;2016;5;11;22,2;27,2;22,8;23,6;27,6;17,8;0;91,25;   ;914,6;91,10522477;74,35371261;84,44955501;85,25342929;2,125;0;9;10
12/05/2016;2016;5;12;20,2;27,8;23;22,8;28;19,4;13,6;75; RA  ;914,625;96,21200439;70,14934981;94,73130515;89,32616594;1,2;0;6;230
13/05/2016;2016;5;13;22,6;28,5;23,2;24,225;28,8;19,7;0;76,25;   ;914,86875;82,69573634;72,65591805;87,93956874;81,49673986;2,625;230;9;230
14/05/2016;2016;5;14;23,7;26,4;24;24,45;27,8;20;0,2;58,75;TS RA  ;915,8875;81,54095926;76,80336505;89,82487711;82,42754017;0,8125;0;3;230
15/05/2016;2016;5;15;22,8;25;22;23,15;27,8;18,2;17,7;12,5;TS RA  ;914,8875;92,96541688;79,28930506;96,38585608;90,40149872;3,125;270;6;270
16/05/2016;2016;5;16;21,4;26,8;22,6;23,05;26,2;19,6;1,9;37,5; RA  ;914,6125;96,32990733;81,2417844;94,67887453;92,1451184;1,375;0;8;230
17/05/2016;2016;5;17;22;27;23,8;23,7;27,4;18;2,4;72,5; RA  ;915,13125;94,59796265;75,4545312;93,13496954;89,44635651;0,5625;0;3;20
18/05/2016;2016;5;18;21,2;28,2;22;23,15;28,8;18,4;0;73,75;   ;915,175;92,67328779;63,05770171;88,43907218;84,21083737;1,6875;0;5;10
19/05/2016;2016;5;19;24;24,8;23,6;24,1;26;19,8;5,7;17,5; RA  ;914,94375;81,67443148;85,3881136;94,8077717;85,88618707;1,625;0;7;270
20/05/2016;2016;5;20;21,4;26;23;22,95;26,6;19,2;11,5;26,25; RA  ;914,84375;96,32990733;82,50960343;96,47495174;92,91109246;1,875;0;8;230
21/05/2016;2016;5;21;21;24,8;22,8;22,4;26,8;18,4;47,1;7,5; RA  ;916;96,29151809;94,83269607;92,96541688;95,09528728;0,8125;0;4;10
22/05/2016;2016;5;22;20,4;24,3;22,2;21,825;26,8;18,4;18,8;25; RA  ;916,3875;96,23223326;98,1864967;96,40408231;96,76376138;1;0;5;90
23/05/2016;2016;5;23;21;23,4;22,4;21,95;26,4;18,8;61,4;50;RA;916,99375;95,37252886;96,34877172;94,65221046;95,43650997;2;0;7;270
24/05/2016;2016;5;24;21,4;27;22,4;23,05;27,3;18;ttu;60;RA;916,75625;96,32990733;70,0182713;91,1499747;88,45701516;0,875;0;6;230
25/05/2016;2016;5;25;21;25,8;21,6;22,35;26,2;17,4;0;55;   ;916,1125;94,4567626;80,09590521;89,19933287;89,55219082;1,0625;0;4;230
26/05/2016;2016;5;26;21;26,8;22,4;22,8;27,6;18,2;0;92,5;   ;916,84375;87,24491101;66,78733668;84,29256536;81,39243102;1,8125;0;6;90
27/05/2016;2016;5;27;23,2;28;20;23,6;28,4;18,6;94,5;62,5;TS RA  ;917,09375;80,49827166;74,46474212;100;83,86532136;3,25;0;8;230
28/05/2016;2016;5;28;21;26;23,6;22,9;26,8;18,4;0,2;71,25;RA;916,8875;94,4567626;75,12290491;91,40806772;88,86112446;1,733333333;0;6;230
29/05/2016;2016;5;29;21,8;25,8;22,6;23;26,4;18,6;4,2;42,5; RA  ;915,98125;92,78599178;96,50920604;94,67887453;94,19001603;0,8125;0;5;20
30/05/2016;2016;5;30;20,6;23,8;20,9;21,475;26,7;18,6;78;12,5;TS RA  ;916,65;94,3979492;94,62524134;98,13434533;95,38887127;0;0;0;0
31/05/2016;2016;5;31;20,6;25;20,8;21,75;25,4;17,4;8,6;27,5; RA  ;916,9375;95,32346596;86,39900394;94,42752755;92,86836585;1,25;0;9;240
01/06/2016;2016;6;1;20,6;25,8;21,2;22,05;26,8;17,4;21,6;50;TS RA;916,7;94;85;96;92,25;0,4;0;2;200
02/06/2016;2016;6;2;20;24,2;23;21,8;26,8;17,6;0;3,8;0;916,2;96;86;86;91;0,9;0;5;90
03/06/2016;2016;6;3;20,4;24,8;23,2;22,2;26,2;15;0;38,8;0;916,7;94;84;90;90,5;2,8;0;7;270
04/06/2016;2016;6;4;20,4;26,7;22,5;22,5;26,9;17;0;52,5;0;916,8;89;70;91;84,75;2,1;0;8;225
05/06/2016;2016;6;5;19,6;25,4;21,6;21,55;26,4;17,4;0;37,5;0;917,4;91;75;89;86,5;0,3;0;5;200
06/06/2016;2016;6;6;21,2;27,2;24,5;23,525;27,4;17,4;0;93,8;0;917,2;89;69;87;83,5;1,8;0;6;190
07/06/2016;2016;6;7;21,2;26,4;23,5;23,075;27,9;17,8;0;42,5;0;917,3;98;79;86;90,25;1,3;0;5;225
08/06/2016;2016;6;8;22;26,6;23,6;23,55;27,2;19;0;50;0;916,9;95;80;91;90,25;0,4;0;4;200
09/06/2016;2016;6;9;21;25;20,8;21,95;26,4;16,8;0;15;0;916,9;94;87;91;91,5;0,6;0;4;200
10/06/2016;2016;6;10;22;26,8;24,8;23,9;27,6;16,2;0;100;0;917,6;82;63;92;79,75;2,4;0;6;180
11/06/2016;2016;6;11;22,2;27,3;21,5;23,3;27,6;17,6;0;95;0;917,8;96;64;83;84,75;3,3;0;8;225
12/06/2016;2016;6;12;23;28;24,2;24,55;28;18,2;0;87,5;0;917,3;75;60;88;74,5;0,8;0;4;180
13/06/2016;2016;6;13;20,8;27,6;21,6;22,7;28,2;18,2;0;100;0;916,6;94;74;89;87,75;4,3;0;7;225
14/06/2016;2016;6;14;20,6;26,5;21,2;22,225;27,4;18;8,1;52,5;RA;916,2;80;70;98;82;2,1;0;8;340
15/06/2016;2016;6;15;22;26,5;22,2;23,175;27,6;18,3;2;50;RA;915,9;86;84;84;85;0,9;0;4;230
16/06/2016;2016;6;16;23,1;26,4;23,6;24,05;27,8;18,7;0;72,5;0;915;82;71;93;82;1,9;0;6;230
17/06/2016;2016;6;17;21;28;22,4;23,1;28;18;31,4;62,5;RA;914,8;94;81;95;91;1,2;0;6;225
18/06/2016;2016;6;18;21,6;27;23;23,3;27,6;18,2;11;80;RA;915;91;74;93;87,25;0,8;0;7;10
19/06/2016;2016;6;19;20,4;23,1;19,8;20,925;27,6;16,7;31,5;2,5;RA;915,2;98;88;96;95;0,3;0;3;90
20/06/2016;2016;6;20;20,1;25,5;21;21,675;25,6;16,4;44,6;33,8;RA;915;96;87;91;92,5;1,3;0;5;30
21/06/2016;2016;6;21;18,6;23,6;22;20,7;25;16,2;0,2;5;RA;914,9;96;90;91;93,25;0,4;0;3;200
22/06/2016;2016;6;22;20;24,2;21,2;21,35;25,6;17,4;0;50;0;915,4;85;79;94;85,75;5,1;0;8;225
23/06/2016;2016;6;23;19;24;21,1;20,775;25;17,2;24;22,5;RA;915,5;96;88;98;94,5;0,3;0;4;90
24/06/2016;2016;6;24;18,2;24,4;22,4;20,8;25,6;17,2;ttu;46,3;RA;915,3;96;85;93;92,5;1;0;5;225
25/06/2016;2016;6;25;19,8;24,6;22,4;21,65;26,2;17;0;37,5;0;916,1;96;79;91;90,5;0,9;0;5;360
26/06/2016;2016;6;26;20,2;26;21,4;21,95;27,4;17,6;35,1;73,8;RA;916,2;92;71;96;87,75;0,1;0;2;200
27/06/2016;2016;6;27;20,4;25,6;22,2;22,15;27,4;18,3;18,2;37,5;RA;915,5;94;82;95;91,25;1,2;0;5;90
28/06/2016;2016;6;28;21,1;25;21;22,05;25,6;18;45,2;36,3;RA;915,6;94;77;98;90,75;1,3;0;6;20
29/06/2016;2016;6;29;20,6;23,2;21;21,35;25,2;19;70,9;15;RA;916,4;96;86;94;93;0,3;0;4;180
30/06/2016;2016;6;30;20,6;20,4;21,4;20,75;25,2;18;18,6;1,3;RA;916,7;98;91;96;95,75;1,2;0;5;170
01/07/2016;2016;7;1;19,6;23,8;21,1;21,025;25,6;17,6;45,4;28,8;TSRA;916,5;92;100;100;96;1,3;0;8;225
02/07/2016;2016;7;2;20;23,6;22,6;21,55;24,4;19;2,4;17,5;RA;917,3;94;91;93;93;1,3;0;5;230
03/07/2016;2016;7;3;21;25;22,6;22,4;25,4;19;10;37,5;RA;917,1;96;85;95;93;1,9;0;6;80
04/07/2016;2016;7;4;21;26,3;18,5;21,7;27,7;16;0;95;0;916,4;94;69;87;86;1,9;0;5;80
05/07/2016;2016;7;5;21;23,4;22,6;22;25,4;17,2;0;30;0;916,2;91;80;93;88,75;1,5;0;6;80
06/07/2016;2016;7;6;19,8;26,6;22,7;22,225;27,4;17;0;51,3;0;915,7;94;72;89;87,25;2,8;0;8;90
07/07/2016;2016;7;7;21,2;25,4;22,8;22,65;27,4;15,2;0,5;100;RA;915,8;91;64;91;84,25;4,2;90;8;90
08/07/2016;2016;7;8;19,4;27,5;19,4;21,425;27,8;17,2;0;100;0;915,8;79;61;89;77;5,9;0;10;225
09/07/2016;2016;7;9;20,8;26,6;20,8;22,25;27,6;17;0;92,5;0;916,7;94;70;91;87,25;3,6;0;9;225
10/07/2016;2016;7;10;20,2;24,8;23,2;22,1;26;19,6;42,2;60;RA;915,5;94;81;90;89,75;2,6;0;9;225
11/07/2016;2016;7;11;21,2;26;23;22,85;27;17,4;2;53,8;RA;915,4;98;75;93;91;0,6;0;6;90
12/07/2016;2016;7;12;20;25,2;22,8;22;25,6;17,4;0;46,3;0;915,6;94;84;93;91,25;0,9;0;6;90
13/07/2016;2016;7;13;20,2;25,6;21,9;21,975;25,6;16,6;4,3;53,8;RA;915,4;94;85;87;90;2;0;8;90
14/07/2016;2016;7;14;20,3;26,4;21;22;26,6;18,8;10;80;RA;915,2;95;81;93;91;2,4;0;7;90
15/07/2016;2016;7;15;21,2;24,4;22;22,2;24,8;17,6;0;37,5;0;915,1;96;86;96;93,5;1,7;0;6;90
16/07/2016;2016;7;16;20,6;24;22,6;21,95;25,8;19;8,3;26,3;RA;916,3;95;83;91;91;0;0;0;0
17/07/2016;2016;7;17;20,2;24,2;21;21,4;24,8;19,2;169;25;TSRA;916,2;98;91;99;96,5;0,3;0;4;90
18/07/2016;2016;7;18;20,6;23;19,6;20,95;28,6;16,8;43,2;8,8;RA;915,3;98;98;96;97,5;0;0;0;0
19/07/2016;2016;7;19;18,8;25,2;22,8;21,4;26,2;17,8;1;46,3;RA;914,7;94;75;88;87,75;1,6;0;6;90
20/07/2016;2016;7;20;20,2;23,4;21,6;21,35;25,2;18;2,4;17,5;RA;915;96;83;95;92,5;0,6;0;5;30
21/07/2016;2016;7;21;19,4;24,7;21,2;21,175;24,8;17,8;21,6;26,3;RA;915,9;96;90;95;94,25;0,9;0;5;90
22/07/2016;2016;7;22;20,2;24,6;20;21,25;26;16,8;0;88,8;0;916;98;78;87;90,25;5,9;0;9;90
23/07/2016;2016;7;23;19,6;24,6;21,8;21,4;25;15;11,4;25;RA;915,6;92;84;98;91,5;2,1;0;7;135
24/07/2016;2016;7;24;18;24;20,2;20,05;24,8;15,2;0;40;0;915;96;83;91;91,5;0;0;0;0
25/07/2016;2016;7;25;18,8;25,2;20;20,7;25,9;15,5;0;50;0;915,6;92;77;92;88,25;1,7;0;6;90
26/07/2016;2016;7;26;19,3;25,6;21,4;21,4;25,6;16,4;0;72,5;0;915,5;91;78;89;87,25;1,9;0;9;225
27/07/2016;2016;7;27;19,6;25,3;22,4;21,725;25,6;16,8;18,2;65;RA;915,4;89;70;83;82,75;0,9;0;7;180
28/07/2016;2016;7;28;19;24,6;21,6;21,05;25,4;15,6;27,9;63,8;RA;916,5;98;76;98;92,5;0,2;0;2;130
29/07/2016;2016;7;29;18,2;25;23;21,1;26,2;16;0;65;0;915,1;94;68;85;85,25;0,9;0;4;90
30/07/2016;2016;7;30;19,8;25,4;21,8;21,7;25,6;16;0,4;52,5;RA;915,2;93;73;93;88;1,6;0;6;225
31/07/2016;2016;7;31;18,8;24,8;21,6;21;25,2;16;0;28,8;0;915,5;94;75;89;88;1,3;0;6;230
01/08/2016;2016;8;1;18,6;23;22;20,55;25;14,8;0;25;   ;915;96,04124072;80,17445195;92,82270179;91,26990879;0,4375;0;4;230
02/08/2016;2016;8;2;17;23,3;20,9;19,55;25;15,1;0;21,25;   ;914,50625;93,80052419;73,61692559;89,00006278;87,55450919;1,625;0;8;225
03/08/2016;2016;8;3;19,2;25,2;19,8;20,85;25,8;17,2;0;21,25;   ;914,8;92,2677002;66,70203351;88,66991698;84,97683772;1,0625;0;6;130
04/08/2016;2016;8;4;20,8;25;22,4;22,25;26;16,8;1,3;75; RA  ;915,55625;85,39600818;78,80102048;87,69705481;84,32252292;4,0625;0;6;225
05/08/2016;2016;8;5;19,8;22;22,1;20,925;25;17;2,2;26,25; RA  ;916,1375;98,07875101;81,49596538;90,20818784;91,96541381;0,6875;0;6;40
06/08/2016;2016;8;6;19;24,2;21,2;20,85;25;16,6;42,8;25; RA  ;916,01875;94,14832761;96,38585608;92,67328779;94,33894977;0,6875;0;4;45
07/08/2016;2016;8;7;20;24,2;21;21,3;25,6;17,2;0;51,25;   ;916,3125;96,19153602;88,17137018;92,63484041;93,29732066;2,6875;0;8;270
08/08/2016;2016;8;8;19,6;25,8;22;21,75;27,4;15,4;0;60;   ;916,46875;94,24472482;86,90471336;82,43010379;89,4560667;1,875;0;6;180
09/08/2016;2016;8;9;18,2;26,8;21,2;21,1;27,2;13,6;0;93,75;   ;916,125;78,63359927;71,78634512;75,22804852;76,07039805;2;0;7;30
10/08/2016;2016;8;10;19;25,4;21,7;21,275;27;16;0;35;   ;916,36875;86,53098912;77,97739324;90,10756109;85,28673315;1,1875;0;4;75
11/08/2016;2016;8;11;21;27,4;23,8;23,3;27,4;18;0;48,75;   ;916,85;73,40792349;65,42647932;83,20046603;73,86069808;4,125;0;8;225
12/08/2016;2016;8;12;21;26,8;23;22,95;27,6;17;4,5;46,25; RA  ;916,3125;90,82563483;70,14934981;91,28120792;85,77045685;0,625;0;4;230
13/08/2016;2016;8;13;21;22,8;21,2;21,5;23,4;17,4;4,2;2,5; RA  ;915,9125;96,29151809;92,82270179;92,67328779;94,51975644;0;0;0;0
14/08/2016;2016;8;14;20,2;24;20,8;21,3;25;16,6;138,9;36,25; RA  ;915,36875;98,09938348;78,59799192;98,12943781;93,23154917;2,0625;0;7;225
15/08/2016;2016;8;15;20;24,4;19,8;21,05;25,3;18,2;55,5;50; RA  ;915,85;94,30710247;87,005026;88,66991698;91,07228698;1;0;4;75
16/08/2016;2016;8;16;20,6;24,8;23;22,25;25,8;17;4,1;62,5; RA  ;915,925;92,5565869;74,89573064;89,57453602;87,39586011;1,625;0;7;130
17/08/2016;2016;8;17;21,2;24,4;23;22,45;26;15,4;1,8;22,5; RA  ;915,5875;87,31177312;83,28131187;85,36057791;85,81635901;0,75;0;8;20
18/08/2016;2016;8;18;19;24,2;22,4;21,15;26;15,4;0;21,25;   ;914,71875;96,08547332;78,80102048;90,28215617;90,31353082;0,1875;0;3;75
19/08/2016;2016;8;19;18,7;23,6;20,6;20,4;26,2;14,2;0;32,5;   ;914,75;93,12701901;76,80958092;85,31794039;87,09538983;4,5;0;6;225
20/08/2016;2016;8;20;18,2;23,8;21;20,3;24,4;14;0;25;   ;915,15;94,01426888;67,86968614;85,47316363;85,34284688;0,133333333;0;2;180
21/08/2016;2016;8;21;16,6;24;20,6;19,45;24,6;16;0;50;   ;914,78125;87,57526386;75,35986198;83,53940086;83,51244764;4;0;7;225
22/08/2016;2016;8;22;18,8;24,7;21,4;20,925;25,7;14,9;0;35;   ;914,375;94,1154173;68,17728798;82,15509228;84,64080372;0,857142857;0;4;75
23/08/2016;2016;8;23;19,8;24,6;20,6;21,2;25;15;0;30;   ;913,90625;88,66991698;75,30006374;88,91213582;85,38800838;1,5625;0;4;75
24/08/2016;2016;8;24;22;24,6;22;22,65;25,2;16;0;46,25;   ;914,0375;74,09661031;75,35986198;84,1319309;76,92125338;0,75;0;4;75
25/08/2016;2016;8;25;18,6;23,2;22,1;20,625;24,4;16,6;0,6;25; RA  ;914,60625;94,08210815;74,05997944;85,02561972;86,81245387;0,1875;0;3;180
26/08/2016;2016;8;26;19,2;23,1;21,4;20,725;24,5;17;1,5;6,25;RA;916,01875;94,18084506;78,77140971;86,49979561;88,40822386;2;0;4;75
27/08/2016;2016;8;27;20,8;24,8;22,2;22,15;25,4;13,6;0;18,75;   ;916,79375;97,19908081;75,93974322;77,51101975;86,96223115;0,5625;0;5;20
28/08/2016;2016;8;28;19;26,4;22,6;21,75;26,8;16,2;3,1;75;RA;916,80625;86,53098912;68,06638343;89,47037959;82,64968532;1,466666667;0;5;180
29/08/2016;2016;8;29;20;25;22,8;21,95;26,2;17;0;72,5;   ;916,675;92,43570689;80,72567797;92,96541688;89,64062716;2;0;6;30
30/08/2016;2016;8;30;20;25;23,5;22,125;26,5;17,4;0;50;   ;916,53125;96,19153602;81,19153953;87,19531424;90,19248145;2,125;0;6;30
31/08/2016;2016;8;31;21,3;27;21,2;22,7;28;17,2;0;98,75;   ;917,5125;81,24611236;65,88539014;85,54942022;78,48175877;2,5625;0;10;90
01/09/2016;2016;9;1;19,8;25;21,4;21,5;27,2;17;0;11,25;   ;916,21875;90,52576461;74,89573064;90,92099633;86,71706405;2,1875;0;8;230
02/09/2016;2016;9;2;20;25,4;23;22,1;26,8;16;0;25;   ;915,7;90,57722964;81,84893987;89,57453602;88,14448379;2,375;0;6;20
03/09/2016;2016;9;3;20,8;26,2;22;22,45;26,4;18,2;5,3;8,75; RA  ;915,5;81,87027601;76,16280737;87,5715805;81,86873497;0,375;0;6;100
04/09/2016;2016;9;4;21,4;24,6;22,4;22,45;25,1;17;0,9;32,5;RA;916,35;89,14322384;83,28131187;89,41740591;87,74629137;1,25;0;5;20
05/09/2016;2016;9;5;21;25,8;19,6;21,85;27,2;16;0;97,5;   ;916,99375;84,59189386;60,33527907;88,60754362;79,5316526;0,9375;0;3;40
06/09/2016;2016;9;6;20,6;26,8;21;22,25;27,4;16,8;0;100;   ;917,275;85,31794039;60,15733162;81,96633135;78,18988594;2,2;0;6;40
07/09/2016;2016;9;7;21,4;26,5;23,6;23,225;27,5;13;0;43,75;   ;917,1125;83,88390582;77,62112861;88,05676978;83,36142751;1,4375;0;4;75
08/09/2016;2016;9;8;21,6;27,2;22,4;23,2;28,4;17,8;34,6;100; RA  ;917,4;78,00048417;57,33624067;84,29256536;74,40744359;3,1875;0;8;270
09/09/2016;2016;9;9;21,8;26,2;22,4;23,05;27,8;17;0;37,5;   ;916,88125;75,61443409;80,3622857;89,41740591;80,25213995;0,75;0;6;180
10/09/2016;2016;9;10;20,6;28,2;21;22,6;28,8;14,8;0;81,25;   ;915,675;68,06910596;57,15025179;75,09619598;67,09616493;0,6875;0;4;170
11/09/2016;2016;9;11;21;27,2;23,8;23,25;28,5;15;0;95;   ;915,3875;65,13675969;44,69719186;76,02336949;62,74852018;2,25;0;6;75
12/09/2016;2016;9;12;24;26,2;23,4;24,4;27,4;17,8;0;56,25;   ;915,84375;69,97911616;64,36989932;78,17798973;70,62653034;1,5;0;4;75
13/09/2016;2016;9;13;20,3;24,8;21,4;21,7;25,6;16,4;0;3,75;   ;915,86875;86,10030183;68,62591712;84,75283259;81,39483835;0,875;0;5;20
14/09/2016;2016;9;14;18,8;26,8;23,6;22;27,8;15,8;0;47,5;   ;916,14375;77,16615892;66,81315809;83,11870692;76,06604571;2,666666667;0;7;180
15/09/2016;2016;9;15;21;26,6;23,6;23,05;26,8;17,2;0;47,5;   ;915,43125;98,13922443;71,43099678;76,69612227;86,10139198;1;0;4;180
16/09/2016;2016;9;16;21,2;26,7;22;22,775;27,4;17,6;7;73,75;RA;915,625;92,67328779;64,5274244;92,82270179;85,67417544;1,8125;0;5;80
17/09/2016;2016;9;17;20,2;26;21,2;21,9;27;17;7,4;70;RA;915,61875;98,09938348;68,06638343;87,31177312;87,89423088;2;0;7;180
18/09/2016;2016;9;18;20,8;26,2;22,4;22,55;27,1;17,2;0;93,75;   ;915,30625;92,59594236;64,95226096;80,93563363;82,76994483;0,875;0;6;20
19/09/2016;2016;9;19;21,8;26,1;22,8;23,125;26,8;16,5;0;37,5;   ;914,8625;82,33949598;73,54213019;76,22916025;78,6125706;1,875;0;5;45
20/09/2016;2016;9;20;20,1;25,4;21,8;21,85;26,6;17;0;40;   ;914,675;96,20180036;69,4795509;84,05021295;86,48334115;1,1875;0;5;10
21/09/2016;2016;9;21;20,4;26,8;20;21,9;27,6;17;0;75;   ;915,8125;88,85265066;66,96141194;86,89855598;82,89131731;1,875;0;6;10
22/09/2016;2016;9;22;20,4;26,2;21,4;22,1;27,4;17;0;60;   ;915,68125;96,23223326;72,21130697;87,37785981;88,01340832;0,5;0;4;20
23/09/2016;2016;9;23;21,8;25,8;22;22,85;27,2;18,2;0;56,25;   ;914,64375;87,50775236;72,46019873;89,3096233;84,19633169;1,6875;0;6;90
24/09/2016;2016;9;24;22;25;21,8;22,7;26,4;18,2;0;33,75;   ;913,9;92,82270179;71,69686828;91,01417176;87,08911091;3,8125;0;8;90
25/09/2016;2016;9;25;21;25,6;22,6;22,55;26,4;18;0;25;   ;914,64375;92,63484041;72,21130697;91,19421696;87,16880118;1,266666667;0;4;180
26/09/2016;2016;9;26;20,6;23;20,2;21,1;24,8;18;32,7;18,75; RA  ;914,8375;94,3979492;96,40408231;96,21200439;95,35299627;0;0;0;0
27/09/2016;2016;9;27;21,6;27;21,9;23,025;27,9;18,4;0;50;   ;914,70625;89,19933287;63,42140622;84,09119009;81,47781551;0,875;0;4;180
28/09/2016;2016;9;28;22,4;24,2;21,4;22,6;26,4;16,2;22,6;26,25; RA  ;915,1375;92,89487225;77,8769927;90,92099633;88,64693338;0,1875;0;3;180
29/09/2016;2016;9;29;19,6;25,8;21;21,5;26,2;17,8;0,9;50;RA;915,11;86,75416447;73,29866298;89,02903003;83,95900549;1,133333333;0;5;200
30/09/2016;2016;9;30;21,4;24,8;21,4;22,25;26,6;18,4;ttu;31,25; RA  ;914,80625;96,32990733;86,33255909;83,88390582;90,71906989;4,1875;0;8;90
01/10/2016;2016;10;1;21,4;25,8;23,2;22,95;28,4;18,8;0;46,25;0;914,975;89,14322384;70,14934981;87,93956874;84,09384156;4;270;9;270
02/10/2016;2016;10;2;21,2;24,2;20,8;21,85;24,8;17,9;0;21,25;TS;915,58125;96,31082388;86,72030334;96,27198665;93,90348444;0,3125;0;5;225
03/10/2016;2016;10;3;20,8;24,6;22,2;22,1;24,6;18,2;0;23,75;0;915,325;90,77711382;91,44941501;91,10522477;91,02721685;0;0;0;0
04/10/2016;2016;10;4;20,8;24,5;20,8;21,725;25,2;17;ttu;10; RA  ;914,35625;96,27198665;79,91200261;92,59594236;91,26297957;0,75;0;5;20
05/10/2016;2016;10;5;20,6;26;22;22,3;27;17,6;0;92,5;   ;914,7375;94,3979492;71,03320932;82,43010379;85,56480287;0,625;0;6;45
06/10/2016;2016;10;6;21,6;27,6;21,6;23,1;28,4;18;0;87,5;   ;915,6;83,96754266;56,06774147;82,24783074;76,56266438;5,0625;270;7;270
07/10/2016;2016;10;7;22,8;26,8;23,6;24;27;20;0;37,5;   ;915,85625;79,48271547;76,80336505;88,05676978;80,95639144;0,4375;0;2;130
08/10/2016;2016;10;8;23;25,8;21,6;23,35;26,6;18,6;2;26,25;TS RA  ;916,225;77,96074019;69,80692772;92,748857;79,61931628;2,875;0;8;180
09/10/2016;2016;10;9;21;25,8;21,5;22,325;26;18,3;11;18,75; RA  ;916,03125;96,29151809;77,30463167;95,43227522;91,32998577;0,75;0;4;90
10/10/2016;2016;10;10;20,7;25,2;20,8;21,85;24,5;18;35;25; RA  ;915,56875;98,12450163;82,1754413;94,42752755;93,21299303;1,125;0;6;270
11/10/2016;2016;10;11;20,8;26,2;21,4;22,3;27;18,8;10;58,75;RA;915,44375;92,59594236;65,42647932;87,37785981;84,49905596;1,9375;0;8;180
12/10/2016;2016;10;12;21,2;26,6;21,2;22,55;27,4;18;2;81,25;RA;914,68125;89,08645949;59,00942599;85,54942022;80,6829413;2,375;0;6;20
13/10/2016;2016;10;13;20,6;24,5;21,2;21,725;27,4;17,4;2;3,75; RA  ;914,7375;96,25222619;88,64145367;91,77186298;93,22944225;0,625;0;4;90
14/10/2016;2016;10;14;22;26,6;22;23,15;27,4;17,2;0;100;   ;914,83125;91,05995967;67,108061;72,46429388;80,42306856;2,25;0;7;230
15/10/2016;2016;10;15;22;27,6;21,6;23,3;28,2;16,2;0;80;   ;915,44375;69,23320458;50,07644582;78,84407272;66,84673193;1,5;0;4;180
16/10/2016;2016;10;16;20;28;23,8;22,95;28,4;16,2;0;67,5;   ;914,83125;86,89855598;61,19653736;83,20046603;79,54852884;1,375;0;5;20
17/10/2016;2016;10;17;20,2;27,4;22,4;22,55;28,4;16,2;0;60;   ;914,55625;83,36096234;56,96223642;83,44890771;76,7832672;1,1875;0;4;90
18/10/2016;2016;10;18;21;26,6;20,2;22,2;28,4;17,2;0;83,75;   ;914,39375;82,83849173;60,68539738;83,36096234;77,43083579;2,9375;0;8;90
19/10/2016;2016;10;19;21,2;28;21;22,85;28,4;17,4;0;36,25;   ;914,1375;85,54942022;59,72617301;83,71367457;78,63467201;2,9375;0;8;160
20/10/2016;2016;10;20;22;28;24;24;29,2;17;0;22,5;   ;913,94375;80,74012958;67,4471272;86,52967706;78,86426586;1;0;7;10
21/10/2016;2016;10;21;22,6;25,2;22,4;23,2;26,6;17,8;0;0;   ;914,55;91,19421696;86,19739839;71,14164584;84,93186954;0,5;0;3;10
22/10/2016;2016;10;22;22,5;26;21,2;23,05;27,2;19;0;0;0;915,9625;81,81649004;76,48832784;90,8735929;82,74872521;4,625;0;8;90
23/10/2016;2016;10;23;22;22;20,2;21,55;25;17;7,2;0; RA  ;915,78125;87,5715805;89,14322384;92,4764762;89,19071526;0,25;0;2;300
24/10/2016;2016;10;24;20,6;26,2;22,4;22,45;28;17,2;ttu;6,25; RA  ;914,45;90,72802144;69,17122052;82,60820883;83,30886806;2,3125;0;7;10
25/10/2016;2016;10;25;20,4;23;20,6;21,1;28,1;18;16,5;0;TS RA  ;915,2375;92,51676717;93,78756;98,11953659;94,23515773;0,25;0;4;90
26/10/2016;2016;10;26;21,4;25,6;20,8;22,3;27,4;17,6;12,1;21,25; RA  ;915,7875;98,1584606;86,78245082;90,77711382;93,46912146;1,3125;0;5;10
27/10/2016;2016;10;27;20,6;23,8;21,2;21,55;26,6;17,2;3,4;15; RA  ;916;96,25222619;91,4903039;96,31082388;95,07639504;0,625;0;6;180
28/10/2016;2016;10;28;21,2;25,2;21,2;22,2;26;18,2;1;58,75; RA  ;915,275;92,67328779;69,37010759;94,48565941;87,30058565;0;0;0;0
29/10/2016;2016;10;29;21;23,8;20,8;21,65;28,8;17;6,6;21,25; RA  ;915,14375;92,63484041;94,54245816;94,42752755;93,55991663;0,5;0;3;90
30/10/2016;2016;10;30;21,2;26;20,6;22,25;27;18;0;75;   ;915,14375;93,57788177;75,4545312;81,77308171;86,09584412;3,5;0;6;90
31/10/2016;2016;10;31;20,6;27;22,8;22,75;27,2;18,4;0,1;47,5;RA;915,725;81,77308171;68,20977953;81,1266891;78,22065802;1,0625;0;5;180
01/11/2016;2016;11;1;21,8;26;23,2;23,2;27;18,2;0;25;   ;914,64375;87,50775236;72,33643038;85,43270826;83,19616084;1,8125;0;12;10
02/11/2016;2016;11;2;22,6;26;20,6;22,95;27,6;17,4;0;21,25;   ;914,66875;87,75872219;66,73842219;81,77308171;81,00723707;0,125;0;2;270
03/11/2016;2016;11;3;21,4;28,4;22,8;23,5;28,8;17,8;0;87,5;   ;915,15;90,92099633;63,97167777;81,1266891;81,73508988;1,25;0;8;90
04/11/2016;2016;11;4;22;27,2;24,4;23,9;28,2;18,6;0,1;60;RA;915,15625;91,05995967;66,4745616;83,4403162;83,00869929;1,3125;0;5;180
05/11/2016;2016;11;5;21,4;29,5;25;24,325;29,8;18,9;0;100;   ;915,05625;94,51422297;55,94956548;83,67229545;82,16257672;1,4375;0;8;40
06/11/2016;2016;11;6;22,5;28,9;25,1;24,75;29,9;18,7;0;62,5;   ;916,13125;88,58445447;61,15067715;85,28660155;80,90154691;2,8125;0;8;120
07/11/2016;2016;11;7;23,1;28,8;22,4;24,35;29;18,2;0;95;   ;916,35;84,56496888;68,35931322;87,69705481;81,29657645;3,625;0;8;90
08/11/2016;2016;11;8;21;27,6;21,8;22,85;28;18,4;0,1;47,5; RA  ;916,2;90,82563483;71,54067613;92,78599178;86,49448439;1,875;0;7;180
09/11/2016;2016;11;9;21,2;24,8;19,3;21,625;25,4;18;56,2;5;TS RA  ;916,7875;92,67328779;100;100;96,33664389;0,6875;0;4;20
10/11/2016;2016;11;10;22;25,3;19,5;22,2;26;17,8;6,2;6,25; RA  ;916,51875;85,84571988;86,9401452;97,09945776;88,93276068;0;0;0;0
11/11/2016;2016;11;11;21,4;23;20;21,45;24,4;17,4;82,2;5; RA  ;915,83125;87,37785981;100;100;93,6889299;1,125;0;5;170
12/11/2016;2016;11;12;20;25,4;22,6;22;25,4;17,6;0;33,75;   ;915,8375;92,43570689;76,16280737;89,47037959;87,62615019;0,0625;0;1;180
13/11/2016;2016;11;13;21;24,4;22;22,1;25;18;0;3,75;   ;915,3875;96,29151809;88,33855661;91,05995967;92,99538812;1,6875;0;6;130
14/11/2016;2016;11;14;21,2;24,8;20,4;21,9;25,4;18;5,5;10; RA  ;914,78125;94,48565941;88,02771629;96,23223326;93,30781709;1,153846154;0;5;90
15/11/2016;2016;11;15;19,6;24,2;20,2;20,9;24,6;17,8;9,2;3,75;TS RA  ;914,6625;94,24472482;94,67887453;98,09938348;95,31692691;0,1875;0;3;90
16/11/2016;2016;11;16;20,8;26,8;22,4;22,7;27,6;17,6;0;47,5;   ;914,6125;90,77711382;74,24149006;87,69705481;85,87319313;1,5;0;8;180
17/11/2016;2016;11;17;21,6;26;21,8;22,75;27,4;17;65,6;30;RA;914,63125;92,748857;76,69948994;87,50775236;87,42623907;1,3125;0;5;20
18/11/2016;2016;11;18;21,6;27,3;23,4;23,475;28,7;17,5;0;85;   ;913,9125;82,24783074;62,50184436;79,78590264;76,69585212;2,25;0;6;90
19/11/2016;2016;11;19;21,7;26,3;22;22,925;27,6;17,8;0;37,5;   ;913,91875;83,14990192;75,00993843;89,3096233;82,65484139;1,75;0;5;40
20/11/2016;2016;11;20;21,8;28;24,2;23,95;28,2;17,2;0;75;   ;914,075;92,78599178;63,50129067;81,76217324;82,70886187;0,333333333;0;2;180
21/11/2016;2016;11;21;21,2;27,8;24,6;23,7;28,2;18,2;0;62,5;   ;914,15;87,31177312;67,67905758;85,11365227;81,85406402;1,5;0;7;130
22/11/2016;2016;11;22;21,2;24,6;20,8;21,95;28,2;18,2;5,2;0;TS RA  ;914,78125;98,14889814;84,27756813;96,27198665;94,21183776;1,4375;0;5;90
23/11/2016;2016;11;23;21,6;24,6;20,6;22,1;25,2;18;24;2,5;TS RA  ;914,2375;90,96785328;86,72030334;98,11953659;91,69388662;0,25;0;4;90
24/11/2016;2016;11;24;20,6;25,6;21,6;22,1;25,4;19;2,8;12,5;TS RA  ;913,375;98,11953659;89,8732881;96,34877172;95,61528325;1,0625;0;6;130
25/11/2016;2016;11;25;20,8;21;20,4;20,75;23,6;17,8;52,4;1,25;TS RA  ;913,7;96,27198665;100;96,23223326;97,19405164;0,9375;0;6;130
26/11/2016;2016;11;26;20;25;21,6;21,65;25,6;17,1;71,5;20;TS RA  ;913,58125;98,08912806;99,07521335;96,34877172;97,9005603;0,3125;0;3;180
27/11/2016;2016;11;27;20,2;26,6;22,4;22,35;22,6;18;0;72,5;   ;914,00625;96,21200439;70,27902813;87,69705481;87,60002293;3,625;0;7;90
28/11/2016;2016;11;28;22;26,2;21,4;22,9;27;18;0,2;15;TS RA  ;914,75;91,05995967;76,80336505;90,92099633;87,46107018;0,8125;0;6;180
29/11/2016;2016;11;29;21,2;25,6;23,6;22,9;25,4;17,6;0,1;12,5;RA;915,18125;98,14889814;82,26862872;91,40806772;92,49362318;0,25;0;4;10
30/11/2016;2016;11;30;21,2;25,12;20,1;21,905;26,4;17,9;19,5;15;TS RA  ;915,53125;90,8735929;79,86539251;97,14638587;89,68974105;0,875;0;4;90
01/12/2016;2016;12;1;22;21,8;20,8;21,7;24;18,8;65;0;0;914,9;93;95;98;95;0;0;0;0
02/12/2016;2016;12;2;20,8;24,2;20,6;21,6;24,8;17;40,7;0;0;914,9;94;91;96;94;0,4;0;5;130
03/12/2016;2016;12;3;20;23,6;20,2;21;24,8;17,4;32,7;0;0;914,2;92;96;98;95;0,6;0;5;20
04/12/2016;2016;12;4;20,6;23,8;21,6;21,7;24;17;6,5;0;0;914,2;96;93;98;96;0,4;0;3;10
05/12/2016;2016;12;5;20,8;23,6;19,6;21,2;24,4;17,8;18,8;0;0;913,6;96;95;96;96;0,8;0;6;130
06/12/2016;2016;12;6;20,6;22,6;22,4;21,6;24,2;18;ttu;0;0;913,6;96;91;95;95;0,5;0;2;180
07/12/2016;2016;12;7;20,2;25,2;22,4;22;27,2;18,6;1;17,5;0;913;98;75;93;91;4,9;0;12;90
08/12/2016;2016;12;8;21;23,6;22,2;22;26,3;19,1;27;0;0;912,6;94;93;93;94;0,9;0;5;90
09/12/2016;2016;12;9;20,7;24,8;20,8;21,8;25,6;19;36;0;0;913,3;98;82;98;94;0,9;0;5;130
10/12/2016;2016;12;10;21,2;24;21;21,9;24,6;18,6;4;0;0;913,2;98;90;96;96;0,7;0;6;20
11/12/2016;2016;12;11;21,6;24,2;22,6;22,5;24,8;17,6;1,8;0;0;913,6;96;85;93;93;0;0;0;0
12/12/2016;2016;12;12;20,2;22,4;22,2;21,3;24;18,9;0;0;0;914,5;98;90;96;95;0,5;0;2;90
13/12/2016;2016;12;13;21,3;20,2;19,2;20,5;24;17,6;103,3;0;0;914,7;95;100;96;97;0;0;0;0
14/12/2016;2016;12;14;20,4;22,2;20,6;20,9;23,4;17,2;60,5;0;0;914,2;98;93;96;96;0;0;0;0
15/12/2016;2016;12;15;20,2;23,6;20,8;21,2;24,6;17,2;41,5;2,5;0;914,5;98;86;96;95;0,1;0;2;130
16/12/2016;2016;12;16;20,4;23,7;21,6;21,5;24,8;18,5;95,4;0;0;914;96;85;98;94;1,5;0;4;90
17/12/2016;2016;12;17;20,9;25,8;21;22,2;26,4;18,8;15,2;0;0;914;96;78;91;90;2,3;0;7;130
18/12/2016;2016;12;18;20,8;26,6;22,6;22,7;27,4;19,2;2,3;0;0;913,4;93;70;67;80;4,5;0;10;230
19/12/2016;2016;12;19;23,6;27,8;21,2;24,1;28,2;18,2;34,5;0;0;912,9;77;73;96;81;3,5;0;8;230
20/12/2016;2016;12;20;20,8;26,4;23,5;22,9;28;18,5;ttu;17,5;0;911,9;96;68;88;87;1,7;0;4;90
21/12/2016;2016;12;21;22,2;26;23,4;23,5;27,4;17,2;5;15;0;911,6;85;67;83;80;3,9;0;12;180
22/12/2016;2016;12;22;20;26,8;23,6;22,6;28;17;0,1;15;0;911,7;91;65;91;84;0,7;0;4;90
23/12/2016;2016;12;23;21,4;26,1;24,6;23,4;27;16,8;0;1,3;0;911,2;89;63;73;78;0,3;0;5;20
24/12/2016;2016;12;24;20,4;27;23,1;22,7;27,5;17,4;2,2;0;0;912,5;91;61;94;84;0;0;0;0
25/12/2016;2016;12;25;20,2;25,2;23,8;22,4;26,4;18,2;1;0;0;913,1;97;82;88;91;1;0;6;90
26/12/2016;2016;12;26;21,4;25;23,2;22,8;25,4;19,2;0;0;0;913,2;87;79;90;86;0,8;0;5;130
27/12/2016;2016;12;27;21,6;25,5;21,4;22,5;25,6;18;14,6;0;0;912,6;95;92;95;94;1,1;0;8;90
28/12/2016;2016;12;28;21;24,7;22,7;22,4;25,3;18,5;ttu;8,8;0;913,7;93;84;91;90;0,6;0;4;270
29/12/2016;2016;12;29;21,1;24,2;22,4;22,2;26,4;18;3,9;5;0;913,6;94;77;95;90;0,2;0;3;20
30/12/2016;2016;12;30;21,2;21,8;19,6;21;26,4;19;29,3;0;0;913,8;89;96;98;93;0;0;0;0
31/12/2016;2016;12;31;20,2;23,2;21,8;21,4;26,4;18,6;2,2;1,3;0;913,4;98;83;96;94;0,3;0;5;30
01/01/2017;2017;1;1;21;24,4;21,2;21,9;26,6;18,4;75;0;0;913,49375;98,13922443;88,17137018;98,14889814;95,64967929;0,1875;0;3;200
02/01/2017;2017;1;2;21,6;23,2;22,3;22,175;24;18,2;1;0;0;913,3875;98,16791345;87,93956874;96,4131178;95,17212836;0;0;0;0
03/01/2017;2017;1;3;21,2;22,8;22;21,8;23,4;18,6;17,4;0;0;912,75;92,67328779;98,1584606;96,38585608;94,97272306;0;0;0;0
04/01/2017;2017;1;4;20,6;24,2;21;21,6;24,8;17,8;40,9;2,5;0;912,7875;96,25222619;89,15206646;96,29151809;94,48700923;0,466666667;0;7;230
05/01/2017;2017;1;5;21,4;25,8;19,6;22,05;26;16,4;76,6;30;0;913,025;90,92099633;75,4545312;100;89,32413097;0,5625;0;5;70
06/01/2017;2017;1;6;20,4;23,8;20,8;21,35;25,8;18,4;14,7;2,5;0;912,6875;90,67834912;98,13922443;96,27198665;93,94197733;1,0625;0;6;180
07/01/2017;2017;1;7;20,4;25,8;20,4;21,75;26,6;17,8;21,4;0;0;912,1625;96,23223326;89,67636196;96,23223326;94,59326544;0,6875;0;5;130
08/01/2017;2017;1;8;20,4;23,8;22,4;21,75;27,4;16;-;40;0;912,60625;98,10951906;82,3498311;91,1499747;92,42971098;1,5;0;6;45
09/01/2017;2017;1;9;19,6;25,8;21;21,5;27,5;16,4;17,5;42,5;0;912,5625;94,24472482;67,28965289;96,29151809;88,01765516;2,625;0;8;300
10/01/2017;2017;1;10;20;26;21,8;21,95;28;17,6;34,2;28,75;0;913,26875;98,08912806;76,59448295;92,78599178;91,38968271;2,0625;0;7;20
11/01/2017;2017;1;11;20,4;25,2;20,2;21,55;28,2;17,6;51,4;11,25;0;913,20625;94,36802241;80,54598856;98,09938348;91,84535421;0,071428571;0;1;130
12/01/2017;2017;1;12;20,2;25,4;20,8;21,65;25,6;17,4;15,2;0;0;912,84375;98,09938348;77,77548865;98,12943781;93,02592335;1,125;0;6;130
13/01/2017;2017;1;13;19,8;24,69;22,3;21,6475;25,2;17,6;35,2;3,75;0;912,55;96,17082455;88,3110766;86,80814194;91,86521691;0,25;0;4;300
14/01/2017;2017;1;14;20,3;23,8;20,6;21,25;24,4;16;38,2;0;0;913,175;97,16166286;80,26889267;96,25222619;92,71111114;0,3125;0;5;45
15/01/2017;2017;1;15;20,4;22,6;20,6;21;23;18,6;2,6;0;0;913,63125;98,10951906;91,19421696;96,25222619;95,91637032;0;0;0;0
16/01/2017;2017;1;16;20,2;22;20,6;20,75;22,6;17,4;19,8;0;0;913,80625;98,09938348;100;94,3979492;97,64917904;0;0;0;0
17/01/2017;2017;1;17;19,6;22,2;19,9;20,325;23,8;17,2;29,5;1,25;0;914,35;96,1498663;89,57453602;99,04030713;95,22864394;0,3125;0;5;300
18/01/2017;2017;1;18;19,9;22,2;22,8;21,2;23,4;17,8;1,2;0;0;915,375;97,13092785;94,65221046;86,12866023;93,7606816;0;0;0;0
19/01/2017;2017;1;19;20,4;22,2;21;21;24,4;18;29,8;0;0;915;98,10951906;91,28120792;94,4567626;95,48925216;0;0;0;0
20/01/2017;2017;1;20;20,4;23,4;22,2;21,6;24,2;17,6;24,3;0;0;914,275;96,23223326;93,03438258;92,85899324;94,58946059;0;0;0;0
21/01/2017;2017;1;21;20;23,2;20,8;21;23,7;17,5;14,2;11,25;0;915,0625;98,08912806;91,42879908;90,77711382;94,59604225;0,5625;0;5;30
22/01/2017;2017;1;22;20,5;24,6;21,2;21,7;25;18;36,4;0;0;916,125;96,242259;96,36742024;96,31082388;96,29069053;0,642857143;0;5;130
23/01/2017;2017;1;23;20;22,8;20,8;20,9;23,4;17;5,7;0;0;915,50625;98,08912806;94,59796265;92,59594236;95,84304028;0,875;0;8;45
24/01/2017;2017;1;24;20;23,8;20,4;21,05;24,4;18;97,5;0;0;915,625;98,08912806;84,8267666;96,23223326;94,30931399;0;0;0;0
25/01/2017;2017;1;25;20,4;23;21;21,2;25,5;16,4;32;0;0;915,45625;96,23223326;82,80629912;96,29151809;92,89057093;0,066666667;0;1;270
26/01/2017;2017;1;26;19,6;24,6;21,2;21,25;25,4;17,4;4,4;5;0;914,75;97,10739541;82,3498311;93,57788177;92,53562592;0,5625;0;5;30
27/01/2017;2017;1;27;19,8;24,2;22,4;21,55;27,2;17,6;1,8;5;0;913,475;94,2760986;75,5957162;91,1499747;88,82447202;0,133333333;0;2;130
28/01/2017;2017;1;28;20;23,8;22,7;21,625;25,6;18,4;6,6;0;0;913,35;98,08912806;80,45464606;89,49664093;91,53238578;1,6875;0;5;20
29/01/2017;2017;1;29;20,4;23,4;19,8;21;25,4;18;47,2;0;0;913,389375;94,36802241;94,57036981;100;95,82660366;0,3125;0;5;270
30/01/2017;2017;1;30;19,6;23,6;22,6;21,35;25;18;22;0;0;913,8;96,1498663;81,93474538;87,75872219;90,49830004;0,375;0;6;45
31/01/2017;2017;1;31;19,8;22,8;21,4;20,95;25;18;2,2;0;0;914,08125;96,17082455;96,27198665;98,1584606;96,69302409;0;0;0;0
01/02/2017;2017;2;1;20,6;23,6;20,4;21,3;24,4;18,2;26,9;0;0;913,825;92,5565869;89,67636196;96,23223326;92,75544226;0,3125;0;4;130
02/02/2017;2017;2;2;19,6;21,7;21;20,475;22,4;17,6;0,5;0;0;914,2125;98,06825048;94,54245816;94,4567626;96,28393043;0;0;0;0
03/02/2017;2017;2;3;19,4;23,6;20,4;20,7;23;17;13;0;0;913,225;98,05762462;86,33255909;98,10951906;95,13933185;0;0;0;0
04/02/2017;2017;2;4;20;24,4;23,6;22;24,8;17,6;0;25;0;913,1;90,57722964;78,80102048;77,48904804;84,36113195;0;0;0;0
05/02/2017;2017;2;5;19,8;25,8;22;21,85;27,2;17,4;-;25;0;911,65625;98,07875101;63,21755593;84,1319309;85,87674721;1,3125;0;5;230
06/02/2017;2017;2;6;20;26,7;24;22,675;28;19;4,7;75;0;911,51875;94,30710247;61,92470871;76,13943307;81,66958668;1,75;0;6;270
07/02/2017;2017;2;7;21,2;25,4;21;22,2;27,2;18,8;77;71,25;0;911,61875;80,3352388;56,77216558;90,82563483;77,0670695;9,75;90;15;90
08/02/2017;2017;2;8;20;23,1;20,8;20,975;24,6;18,8;37,2;0;0;911,98125;94,30710247;77,8502407;95,3481405;90,45314653;6,8125;90;16;90
09/02/2017;2017;2;9;21,2;22;22;21,6;24,6;19;12,8;0;0;912,23125;85,54942022;81,1266891;77,39530801;82,40520939;7,125;90;19;90
10/02/2017;2017;2;10;20,2;22,9;21,4;21,175;24,8;19;57,6;6,25;0;912,838125;94,33774194;88,64145367;91,8145713;92,28287721;2,8125;0;10;270
11/02/2017;2017;2;11;21,1;23;21,4;21,65;23,6;18,6;31,8;0;0;914,525;91,75032202;94,59796265;89,14322384;91,81045763;3,25;0;10;50
12/02/2017;2017;2;12;19,6;23,4;21,2;20,95;24,2;17;30,6;2,5;0;916,075;96,1498663;84,89969247;92,67328779;92,46817822;0;0;0;0
13/02/2017;2017;2;13;20;23;22;21,25;23,4;17,8;7,8;2,5;0;916,4;94,30710247;92,96541688;93,70876028;93,82209553;0;0;0;0
14/02/2017;2017;2;14;20,8;22,8;21;21,35;23,8;17,5;55,2;10;0;916,8125;96,27198665;93,06828757;97,21374502;95,70650147;0,25;0;4;270
15/02/2017;2017;2;15;19,6;24,3;21,1;21,15;24,6;17,2;29,1;5;0;916,7;98,06825048;81,76217324;99,07039918;94,24226835;1,375;0;8;20
16/02/2017;2017;2;16;19,6;22,8;21,2;20,8;24,6;17,4;19;12,5;0;915,78125;96,1498663;92,96541688;98,14889814;95,85351191;0;0;0;0
17/02/2017;2017;2;17;19;22,6;20;20,15;23,8;17,2;47,9;22,5;0;915,91875;96,08547332;100;97,13867966;97,32740658;0,4375;0;4;20
18/02/2017;2017;2;18;19,4;22,6;20,8;20,55;24,2;17,4;18,5;17,5;0;916,03125;98,05762462;87,99849908;96,27198665;95,09643375;0,625;0;4;20
19/02/2017;2017;2;19;20;23,2;21,6;21,2;24,2;17,8;75;26,25;0;915,18125;98,08912806;96,32990733;94,54245816;96,7626554;1,3125;0;6;45
20/02/2017;2017;2;20;21,2;23,8;21,2;21,85;26;17,8;49,6;8,75;0;914,64375;98,14889814;80,72567797;98,14889814;93,7930931;1;0;6;230
21/02/2017;2017;2;21;21;23,6;21,8;21,85;24;16,8;-;5;0;915,93125;98,13922443;81,49596538;92,78599178;92,6401015;1,75;0;5;40
22/02/2017;2017;2;22;19,6;24,5;21,4;21,275;24,9;17;12,3;26,25;0;915,1125;96,1498663;90,65609387;96,32990733;94,82143345;0,8;0;4;270
23/02/2017;2017;2;23;20,4;24,2;22,6;21,9;25,4;17,2;1;30;0;915,53125;96,23223326;83,67229545;91,19421696;91,83274473;2,1875;0;8;45
24/02/2017;2017;2;24;20,2;24;24;22,1;27,4;18,2;71;43,75;0;915,53125;98,09938348;77,8769927;81,67443148;88,93754778;2,4375;0;7;230
25/02/2017;2017;2;25;20;22,1;20,4;20,625;23,4;16,8;77,4;12,5;0;915,2875;98,08912806;100;96,23223326;98,10262234;0,375;0;3;10
26/02/2017;2017;2;26;19;25;23;21,5;25,4;16,8;4;37,5;0;914,5875;98,03598928;84,27756813;88,72574623;92,26882323;1,375;0;6;270
27/02/2017;2017;2;27;20,4;24,4;20,6;21,45;25,4;18,4;66,6;33,75;0;914,13125;95,29850094;92,93034483;96,25222619;94,94489323;2,8125;0;9;45
28/02/2017;2017;2;28;20,6;24,4;22,6;22,05;26,4;17,4;9;27,5;0;913,7;98,11953659;91,53074097;94,67887453;95,61217217;0,4375;0;3;230
01/03/2017;2017;3;1;19,8;24,2;21,4;21,3;25,6;16,8;14,8;38,75; RA  ;914,3625;98,07875101;86,65746527;96,32990733;94,78621865;2,4375;0;6;170
02/03/2017;2017;3;2;20,4;24,1;21,4;21,575;25,7;16,3;7,5;17,5; RA  ;914,06875;96,23223326;82,10352799;97,24256805;92,95264064;1;0;4;270
03/03/2017;2017;3;3;20,5;24,2;22;21,8;26;17,8;3,6;46,25;TS   ;913,0125;98,11454247;79,19378953;94,59796265;92,50520928;1,9375;0;8;45
04/03/2017;2017;3;4;21,2;25,8;22,2;22,6;27,4;17;-;73,75;   ;913,23125;89,08645949;75,12290491;87,63467775;85,23262541;2,625;0;7;230
05/03/2017;2017;3;5;20,2;25,6;22,6;22,15;26,2;17,4;0,3;37,5;TS RA  ;913,11875;98,09938348;80,72567797;91,19421696;92,02966547;1;0;5;20
06/03/2017;2017;3;6;20,2;24,5;19,7;21,15;26,3;16,5;4,8;3,75;TS   ;913,2625;94,33774194;80,72567797;97,11528608;91,62911198;1,1875;0;4;270
07/03/2017;2017;3;7;20;25,8;22;21,95;24,8;16,2;0,3;35;TS   ;913,44375;96,19153602;79,48271547;85,84571988;89,42787685;2,1875;0;6;45
08/03/2017;2017;3;8;20;24,6;21,6;21,55;26,2;16;1,5;30; RA  ;914,53125;90,57722964;80,72567797;92,748857;88,65724856;0;0;0;0
09/03/2017;2017;3;9;19,4;25,4;23,2;21,85;26;15,8;-;26,25;   ;913,50625;96,12865756;77,5691061;86,26536093;89,02294554;1,375;0;6;20
10/03/2017;2017;3;10;19,8;24,9;22,8;21,825;26;16;2,5;22,5; RA  ;913,95625;94,2760986;85,43270826;88,66971085;90,66365408;0,875;0;4;270
11/03/2017;2017;3;11;19,2;24,6;20,4;20,85;25;17;52,5;25;TS RA  ;915,25;94,18084506;83,20046603;96,23223326;91,94859735;0,375;0;4;180
12/03/2017;2017;3;12;19,8;22,6;20,2;20,6;23,8;17,6;65,1;13,75;TS RA  ;915,275;98,07875101;93,13496954;100;97,32311789;0,375;0;6;45
13/03/2017;2017;3;13;20,6;24,6;20,2;21,5;25,4;16,4;100,5;26,25;TS RA  ;915,1375;94,3979492;98,09938348;98,09938348;96,24866634;0,5625;0;5;20
14/03/2017;2017;3;14;19,8;20,1;20;19,925;23,7;16,8;44,5;17,5;TS RA  ;915,6;94,2760986;98,07875101;97,13867966;95,94240697;0;0;0;0
15/03/2017;2017;3;15;19,5;23,8;20,4;20,8;25,6;18;55;38,75;TS RA  ;914,7125;98,06295334;75,93974322;96,23223326;92,07447079;2,125;0;7;90
16/03/2017;2017;3;16;20,6;25,6;23,6;22,6;26;17,6;36,4;37,5;TS RA  ;914,95625;98,11953659;85,18340451;86,39900394;91,95537041;1,866666667;0;5;90
17/03/2017;2017;3;17;21;24;21,6;21,9;24,8;17,6;0,8;12,5; RA  ;915,16875;94,4567626;86,72030334;92,748857;92,09567138;0,3125;0;3;180
18/03/2017;2017;3;18;20,4;24;20,2;21,25;24,8;15,2;7;21,25; RA  ;915,4125;96,23223326;88,22771847;96,21200439;94,22604735;0,5625;0;3;180
19/03/2017;2017;3;19;20,4;25,6;22;22,1;25,6;17,4;0;22,5;TS RA  ;915,21875;96,23223326;81,76217324;96,38585608;92,65312396;3,25;0;8;45
20/03/2017;2017;3;20;20,6;20,6;20,6;20,6;23,6;17,4;11,7;3,75; RA  ;914,34375;94,3979492;92,82270179;96,25222619;94,46770659;0,875;0;5;120
21/03/2017;2017;3;21;20,2;25,8;20,4;21,65;27,8;18;27,4;25;RA;914,125;98,09938348;73,0593751;90,67834912;89,98412279;0,9375;0;4;180
22/03/2017;2017;3;22;20,6;25,7;23,1;22,5;28,3;18;-;6,25;   ;914,375;90,72802144;77,3342579;89,60020834;87,09762728;1,125;0;4;270
23/03/2017;2017;3;23;20,9;26,8;23,4;23;27,4;18,4;0;26,25; RA  ;915,41875;93,52721853;82,3498311;91,36625533;90,19263087;2,25;0;8;45
24/03/2017;2017;3;24;20,6;23;21,6;21,45;27,2;17,2;2;17,5; RA  ;915,4;94,3979492;94,65221046;94,54245816;94,49764176;0,875;0;5;180
25/03/2017;2017;3;25;20,8;24,8;22;22,1;27,4;17,6;14,6;0;TS RA  ;915,09375;90,77711382;81,84893987;94,59796265;89,50028254;1,0625;0;6;270
26/03/2017;2017;3;26;20,2;22,6;19,8;20,7;24,6;17,8;31,9;2,5; RA  ;916,13125;98,09938348;86,43194728;98,07875101;95,17736631;0,5;0;3;270
27/03/2017;2017;3;27;20,3;25;21,6;21,8;26;18,2;8,2;16,25; RA  ;915,9125;97,16166286;83,59582269;94,54245816;93,11540164;0,875;0;6;10
28/03/2017;2017;3;28;20,6;22,8;22,2;21,55;25,2;17;4,6;0; RA  ;915,81875;98,11953659;93,00009422;94,62524134;95,96610219;0,333333333;0;3;180
29/03/2017;2017;3;29;20,2;23;21;21,1;24,8;16;35;0; RA  ;915,96875;96,21200439;96,40408231;96,29151809;96,2799023;0;0;0;0
30/03/2017;2017;3;30;19,4;24,2;21,2;21,05;25,4;17,4;14,6;0;TS RA  ;916,6375;96,12865756;93,83377507;95,39663525;95,37193136;0,4375;0;4;270
31/03/2017;2017;3;31;19,8;23,4;21,2;21,05;25,4;17,4;7,5;17,5;TS RA  ;916,6625;98,07875101;92,78599178;96,31082388;96,31357942;0;0;0;0
01/04/2017;2017;4;1;21,2;26,6;21,6;22,65;27;17;52,3;50;TS RA  ;915,95625;90,8735929;96,23223326;96,34877172;93,5820477;0,5625;0;6;230
02/04/2017;2017;4;2;19,4;24,4;19,8;20,75;26,8;16,8;72,6;12,5; RA  ;915,35;96,12865756;82,26862872;98,07875101;93,15117371;0,75;0;5;20
03/04/2017;2017;4;3;20;25,2;20,6;21,45;26,2;17;5,5;6,25; RA  FG;915,01875;96,19153602;82,186532;94,3979492;92,24188831;0,5625;0;3;270
04/04/2017;2017;4;4;19,2;25,2;21,8;21,35;25,4;17,4;4,1;37,5; RA  ;914,925;96,10719452;89,72642202;98,17725829;95,02951733;0,5625;0;9;45
05/04/2017;2017;4;5;20,2;23,6;20,8;21,2;27,2;17,6;16,6;30;TS RA  ;913,8875;98,09938348;75,12290491;94,42752755;91,43729985;1,3125;0;10;230
06/04/2017;2017;4;6;19,8;21,8;21,8;20,8;23;19;5,9;2,5; RA  ;912,89375;96,17082455;89,62573607;94,57036981;94,13443874;0,5;0;5;270
07/04/2017;2017;4;7;20;21,9;22,8;21,175;26,8;18,5;10,8;13,75; RA  FG;913,60625;98,08912806;81,53827687;92,96541688;92,67048747;1,1875;0;6;180
08/04/2017;2017;4;8;20,3;22,2;19,6;20,6;22,4;17,2;35,8;0;TS RA  ;914,975;98,10446614;96,42210202;100;98,15775857;0;0;0;0
09/04/2017;2017;4;9;20,4;25,6;21,2;21,9;26,2;18,4;24;12,5;TS RA  ;915,06875;96,23223326;91,4903039;96,31082388;95,06639857;0,25;0;4;230
10/04/2017;2017;4;10;22;25,8;23;23,2;27,2;16;-;47,5;   ;914,46875;98,1864967;71,28968189;94,73130515;90,59849511;1,75;0;7;90
