Tanggal;year;month;day;T '07.00;T '13.00;T '18.00;TRata2;TMax;TMin;Curah Hujan (mm);SS (%);Cuaca;Tekanan Udara (mb);RH07.00;RH13.00;RH18.00;RHRata2;Kec Rata2;Arah Terbanyak;Kec,Max;Arah
01/01/2015;2015;1;1;25,0;31,8;26,8;27,2;32,2;24,6;-;3,1;;1.007,9;88;56;83;79;3,0;180;9,0;360
02/01/2015;2015;1;2;26,0;30,0;26,8;27,2;32,5;25,5;-;2,4;;1.008,4;86;65;74;78;3,0;180;14,0;220
03/01/2015;2015;1;3;26,0;29,6;27,8;27,4;34,8;24,0;-;0,6;;1.008,6;79;61;63;71;3,0;140;9,0;220
04/01/2015;2015;1;4;25,4;31,8;28,2;27,7;32,8;24,8;ttu;5,6;;1.008,1;81;64;78;76;2,0;220;8,0;140
05/01/2015;2015;1;5;26,4;27,6;26,2;26,7;32,0;22,8;1,0;4,5;;1.008,3;83;79;87;83;2,0;220;5,0;180
06/01/2015;2015;1;6;26,4;31,8;28,4;28,3;33,5;23,0;-;7,3;;1.007,7;78;64;75;74;2,0;220;8,0;90
07/01/2015;2015;1;7;25,6;32,5;29,3;28,3;34,6;24,6;-;8;;1.007,8;72;58;64;67;3,0;270;7,0;90
08/01/2015;2015;1;8;25,8;33,4;30,0;28,8;34,1;24,8;-;5,1;;1.009,2;79;51;59;67;5,0;220;10,0;360
09/01/2015;2015;1;9;26,8;32,8;29,2;28,9;33,2;25,4;-;5,8;;1.008,6;78;53;70;70;3,0;360;8,0;180
10/01/2015;2015;1;10;26,6;31,6;29,0;28,5;32,8;25,2;-;2,7;;1.007,6;81;60;75;74;2,0;360;6,0;360
11/01/2015;2015;1;11;26,4;32,0;26,4;27,8;32,4;23,9;6,3;4;;1.009,6;84;58;81;77;3,0;360;12,0;90
12/01/2015;2015;1;12;25,6;29,4;26,0;26,7;30,6;24,0;1,5;2,6;;1.010,3;87;69;86;82;1,0;50;5,0;50
13/01/2015;2015;1;13;26,0;31,2;24,9;27,0;31,4;24,2;21,0;3,3;;1.010,6;89;66;92;84;2,0;50;7,0;50
14/01/2015;2015;1;14;24,4;29,0;27,0;26,2;30,4;23,8;1,5;2,4;;1.010,8;93;74;84;86;3,0;180;7,0;180
15/01/2015;2015;1;15;24,4;32,0;28,4;27,3;32,8;24,5;ttu;5,9;;1.010,9;83;61;75;76;4,0;220;10,0;220
16/01/2015;2015;1;16;26,0;30,8;27,0;27,5;31,4;23,8;ttu;7,6;;1.010,5;75;62;83;74;2,0;90;7,0;90
17/01/2015;2015;1;17;26,6;30,0;25,6;27,2;31,6;24,3;24,2;3,5;;1.010,3;80;65;92;79;1,0;140;6,0;270
18/01/2015;2015;1;18;25,6;30,0;27,6;27,2;30,5;24,6;ttu;2;;1.010,3;92;68;77;82;1,0;180;5,0;180
19/01/2015;2015;1;19;26,6;30,2;24,3;26,9;31,4;23,4;19,0;5,1;;1.011,1;77;69;92;79;2,0;140;7,0;140
20/01/2015;2015;1;20;28,4;30,6;27,4;28,7;31,0;24,0;-;2;;1.012,5;72;64;80;72;2,0;50;7,0;50
21/01/2015;2015;1;21;26,8;29,4;28,6;27,9;30,5;24,0;2,3;4,6;;1.014,2;83;69;81;79;1,0;140;8,0;180
22/01/2015;2015;1;22;28,0;31,6;27,0;28,7;32,0;24,2;ttu;5,8;;1.013,0;78;66;83;76;2,0;140;8,0;140
23/01/2015;2015;1;23;25,4;31,8;26,0;27,2;32,0;22,7;3,2;4,9;;1.012,5;84;59;86;78;2,0;360;7,0;90
24/01/2015;2015;1;24;25,5;31,4;29,0;27,9;32,0;24,0;2,5;5,8;;1.011,3;83;69;79;79;2,0;90;6,0;50
25/01/2015;2015;1;25;25,6;33,4;27,2;28,0;33,6;24,4;1,2;5,9;;1.010,9;85;56;86;78;2,0;180;7,0;50
26/01/2015;2015;1;26;25,8;32,2;29,2;28,3;32,9;24,5;-;6,6;;1.010,5;86;59;69;75;1,0;140;5,0;180
27/01/2015;2015;1;27;25,0;27,8;29,0;26,7;31,8;24,0;9,0;3,4;;1.009,9;81;80;79;80;20,0;140;5,0;140
28/01/2015;2015;1;28;25,8;32,0;29,2;28,2;33,8;24,0;-;5,9;;1.008,5;83;65;73;76;2,0;180;10,0;220
29/01/2015;2015;1;29;26,0;30,4;26,0;27,1;32,6;23,6;32,9;5,5;;1.008,7;81;73;90;81;2,0;270;12,0;270
30/01/2015;2015;1;30;25,2;28,6;26,0;26,3;31,0;23,6;7,5;3,7;;1.009,3;89;79;90;87;2,0;220;9,0;220
31/01/2015;2015;1;31;25,0;29,0;25,0;27,3;30,4;23,8;17,0;1,5;;1.009,0;87;79;92;86;1,0;90;8,0;140
01/02/2015;2015;2;1;24,6;30,2;26,2;26,4;31,5;24,6;0,3;46,25;;1.010,7;88;64;84;81;2,0;270;5,0;130
02/02/2015;2015;2;2;26,2;30,0;28,2;27,7;31,5;24,0;0,0;100;;1.011,4;78;67;76;75;2,0;180;9,0;130
03/02/2015;2015;2;3;26,8;31,0;28,4;28,3;31,2;23,2;0,0;95;;1.011,5;80;67;75;76;3,0;130;9,0;130
04/02/2015;2015;2;4;25,8;31,4;29,0;28,0;31,4;24,0;2,4;97,5;;1.010,6;76;60;70;71;3,0;130;7,0;90
05/02/2015;2015;2;5;27,4;31,8;27,0;28,4;32,4;25,0;0,0;83,75;;1.010,5;73;59;80;71;2,0;40;7,0;90
06/02/2015;2015;2;6;26,4;31,9;29,0;28,4;32,6;23,8;0,0;80;;1.010,5;83;48;75;72;1,0;130;7,0;130
07/02/2015;2015;2;7;25,0;31,0;26,4;26,9;32,2;24,6;1,0;90;;1.010,4;76;65;87;76;2,0;130;8,0;180
08/02/2015;2015;2;8;27,0;30,6;28,0;28,2;32,2;24,5;0,0;100;;1.010,7;78;62;80;75;2,0;40;9,0;360
09/02/2015;2015;2;9;25,0;32,2;28,2;27,6;32,4;24,8;0,0;100;;1.010,5;84;59;78;76;3,0;40;12,0;40
10/02/2015;2015;2;10;27,4;30,5;28,1;28,4;32,8;24,9;1,2;65;;1.009,5;80;64;78;76;1,0;130;5,0;40
11/02/2015;2015;2;11;26,9;32,2;26,8;28,2;33,0;24,8;ttu;68,75;;1.008,4;85;66;78;79;2,0;130;10,0;180
12/02/2015;2015;2;12;26,2;29,7;25,8;27,0;31,2;24,0;1,4;45;;1.008,3;83;68;89;81;1,0;40;8,0;40
13/02/2015;2015;2;13;25,0;28,6;27,7;26,6;32,0;24,5;1,7;62,5;;1.009,0;90;81;77;85;2,0;40;13,0;220
14/02/2015;2015;2;14;26,0;28,4;24,0;26,1;30,6;23,4;58,5;27,5;;1.010,6;86;83;95;88;1,0;180;5,0;180
15/02/2015;2015;2;15;26,2;30,8;28,6;28,0;31,4;25,0;0,0;86,25;;1.009,4;84;68;72;77;2,0;40;6,0;40
16/02/2015;2015;2;16;27,6;32,4;29,2;29,2;32,4;23,6;ttu;100;;1.008,9;79;62;71;73;2,0;90;8,0;130
17/02/2015;2015;2;17;26,9;31,6;28,4;28,5;32,4;24,5;20,5;100;;1.008,6;80;58;75;73;3,0;180;7,0;180
18/02/2015;2015;2;18;26,2;31,1;25,4;27,2;31,8;23,6;26,0;78,75;;1.008,6;75;69;90;77;2,0;40;6,0;360
19/02/2015;2015;2;19;26,4;30,8;28,8;28,1;31,4;24,2;0,0;100;;1.009,3;81;67;76;76;4,0;40;14,0;360
20/02/2015;2015;2;20;25,7;33,6;30,0;28,8;31,0;24,5;0,0;77,5;;1.009,5;83;54;69;72;3,0;180;9,0;220
21/02/2015;2015;2;21;24,8;33,8;24,4;27,0;34,0;23,6;0,3;50;;1.008,9;82;54;88;77;3,0;220;11,0;220
22/02/2015;2015;2;22;25,2;32,4;29,0;28,0;32,6;22,8;0,0;93,75;;1.008,5;81;61;78;75;3,0;360;12,0;40
23/02/2015;2015;2;23;26,9;27,2;26,0;26,8;32,0;24,1;22,5;8,75;;1.009,6;81;80;92;84;3,0;360;11,0;130
24/02/2015;2015;2;24;26,5;30,7;24,6;27,1;32,0;23,2;16,5;60;;1.010,0;84;66;91;81;2,0;40;6,0;220
25/02/2015;2015;2;25;24,4;30,7;28,6;27,0;31,4;23,6;0,0;67,5;;1.009,0;90;69;76;81;2,0;270;5,0;130
26/02/2015;2015;2;26;25,4;28,8;28,2;27,0;32,0;24,5;10,4;50;;1.008,3;84;65;92;81;2,0;90;6,0;310
27/02/2015;2015;2;27;24,6;28,8;28,2;26,6;32,0;24,4;1,5;50;;1.008,5;85;78;79;82;1,0;270;6,0;270
28/02/2015;2015;2;28;26,2;30,8;25,2;27,1;31,8;23,4;38,5;55;;1.009,0;84;67;90;81;2,0;220;9,0;310
01/03/2015;2015;3;1;26,4;29,2;26,2;27,1;30,5;23,0;30,3;23;;1.009,2;89;78;90;87;1,0;220;4,0;"360 ; 220"
02/03/2015;2015;3;2;26,0;30,3;26,4;27,2;31,4;22,4;5,0;73;;1.008,7;84;61;89;80;3,0;270;9,0;40
03/03/2015;2015;3;3;25,0;30,2;24,2;26,1;31,2;23,5;87,5;66;;1.008,7;81;69;95;82;3,0;360;10,0;310
04/03/2015;2015;3;4;26,5;30,6;27,0;27,7;31,2;23,5;ttu ;70;;1.008,6;82;66;83;78;3,0;"40 ; 270";6,0;"40 ; 310"
05/03/2015;2015;3;5;24,0;30,8;25,8;26,2;31,0;24,0;16,8;44;;1.009,8;90;67;93;85;1,0;360;5,0;360
06/03/2015;2015;3;6;25,2;28,6;24,0;25,8;31,6;22,7;28,3;50;;1.009,8;92;76;91;88;2,0;"270 ; 40";6,0;"40 ; 310"
07/03/2015;2015;3;7;24,1;27,8;27,2;25,8;28,5;23,5;1,2;3;;1.009,0;93;83;83;88;2,0;40;12,0;40
08/03/2015;2015;3;8;24,4;30,0;27,7;26,6;31,5;24,4;ttu ;38;;1.009,8;93;70;80;84;1,0;90;5,0;180
09/03/2015;2015;3;9;25,6;31,6;28,2;27,8;32,3;25,5;2,0;71;;1.009,9;89;62;79;80;2,0;90;6,0;90
10/03/2015;2015;3;10;25,8;29,8;27,6;27,3;31,0;25,0;5,6;30;;1.009,7;87;73;85;83;2,0;220;9,0;360
11/03/2015;2015;3;11;25,6;27,6;27,4;26,6;30,4;24,8;2,3;29;;1.010,1;92;83;85;88;1,0;360;7,0;40
12/03/2015;2015;3;12;25,2;30,0;28,0;27,1;30,8;23,8;0,7;19;;1.010,9;92;74;79;84;2,0;360;6,0;360
13/03/2015;2015;3;13;25,8;30,2;27,0;27,2;31,0;25,2;0,2;43;;1.011,4;89;76;79;83;2,0;360;8,0;40
14/03/2015;2015;3;14;26,0;31,9;26,9;27,7;33,4;24,5;0,2;69;;1.011,8;87;66;89;82;2,0;130;6,0;130
15/03/2015;2015;3;15;25,5;30,2;25,4;26,7;31,6;23,2;11,5;63;;1.012,3;83;73;90;82;1,0;310;6,0;310
16/03/2015;2015;3;16;26,0;31,2;26,6;27,5;31,4;23,2;14,5;86;;1.011,5;84;66;90;81;1,0;90;6,0;130
17/03/2015;2015;3;17;25,4;25,6;25,3;25,4;30,8;23,0;16,6;31;;1.010,0;87;92;92;90;1,0;130;6,0;"130 ; 220"
18/03/2015;2015;3;18;26,0;30,8;28,4;27,8;31,4;24,3;- ;41;;1.009,7;86;62;76;78;1,0;180;5,0;"90 ; 360"
19/03/2015;2015;3;19;26,3;30,8;28,4;28,0;32,0;24,8;3,2;88;;1.010,6;85;70;81;80;1,0;130;5,0;180
20/03/2015;2015;3;20;26,4;30,2;28,4;27,9;31,4;25,2;- ;78;;1.011,3;89;73;83;84;3,0;130;8,0;180
21/03/2015;2015;3;21;27,0;31,6;29,0;28,7;32,2;24,5;- ;91;;1.011,1;80;69;79;77;2,0;130;7,0;130
22/03/2015;2015;3;22;27,7;32,0;27,0;28,6;32,4;24,5;- ;85;;1.010,8;77;61;84;75;2,0;360;11,0;360
23/03/2015;2015;3;23;26,0;31,2;29,4;28,2;31,8;22,8;- ;100;;1.010,5;75;68;73;73;3,0;360;12,0;360
24/03/2015;2015;3;24;27,2;31,6;28,6;28,7;32,2;22,8;ttu ;100;;1.010,3;77;62;78;74;4,0;360;12,0;360
25/03/2015;2015;3;25;27,0;31,8;28,4;28,6;32,4;24,0;- ;100;;1.011,1;77;57;78;72;5,0;40;15,0;40
26/03/2015;2015;3;26;27,2;32,0;28,8;28,8;32,4;24,0;- ;100;;1.012,2;77;59;76;72;4,0;40;13,0;360
27/03/2015;2015;3;27;25,0;32,2;29,6;28,0;33,6;24,2;- ;100;;1.011,3;84;57;73;75;3,0;40;9,0;40
28/03/2015;2015;3;28;27,4;30,0;29,0;28,5;32,4;24,0;- ;95;;1.009,8;74;67;78;73;3,0;130;7,0;130
29/03/2015;2015;3;29;25,8;32,6;28,8;28,3;33,0;24,1;- ;100;;1.009,4;79;54;79;73;2,0;90;10,0;360
30/03/2015;2015;3;30;27,7;32,6;29,8;29,5;33,4;23,6;- ;95;;1.010,3;78;55;70;70;4,0;270;11,0;40
31/03/2015;2015;3;31;26,6;32,8;29,0;28,8;33,0;25,2;- ;98;;1.009,9;82;58;78;75;1,0;130;7,0;90
01/04/2015;2015;4;1;25,0;31,6;28,4;27,5;32,2;25,6;ttu;100;;1.008,5;83;58;81;76;4,0;360;15,0;360
02/04/2015;2015;4;2;27,0;32,2;29,2;28,9;32,8;21,0;0,0;0;;1.007,8;86;63;79;79;3,0;270;8,0;130
03/04/2015;2015;4;3;27,6;30,0;29,0;28,6;32,0;24,5;ttu;71,25;;1.008,1;82;72;71;77;2,0;360;6,0;360
04/04/2015;2015;4;4;25,6;32,0;29,0;28,1;32,6;25,4;0,0;97,5;;1.008,0;81;61;81;76;2,0;130;6,0;90
05/04/2015;2015;4;5;28,0;32,6;30,0;29,7;33,4;24,4;0,0;100;;1.007,4;79;63;78;75;2,0;90;8,0;40
06/04/2015;2015;4;6;27,2;28,8;26,4;27,4;32,0;25,2;2,2;50;;1.008,1;87;79;87;85;3,0;360;8,0;360
07/04/2015;2015;4;7;26,2;23,5;25,4;25,3;27,8;23,5;10,2;0;;1.009,3;86;93;93;90;3,0;360;14,0;360
08/04/2015;2015;4;8;25,4;31,6;28,4;27,7;32,2;24,0;0,0;97,5;;1.009,3;88;66;81;81;2,0;360;9,0;360
09/04/2015;2015;4;9;27,0;32,0;29,0;28,8;32,4;24,8;0,0;100;;1.009,8;81;63;78;76;2,0;360;7,0;360
10/04/2015;2015;4;10;27,4;32,0;28,6;28,9;32,6;24,9;0,0;88,75;;1.010,0;83;58;83;77;2,0;180;6,0;180
11/04/2015;2015;4;11;27,2;31,6;28,2;28,6;32,4;22,6;0,0;73,75;;1.010,4;84;63;80;78;2,0;180;7,0;180
12/04/2015;2015;4;12;25,8;31,7;29,0;28,1;32,0;24,2;11,8;75;;1.011,0;83;62;82;78;2,0;130;9,0;40
13/04/2015;2015;4;13;25,0;27,8;27,2;26,3;31,0;24,2;0,0;61,25;;1.010,5;88;83;86;86;3,0;40;16,0;40
14/04/2015;2015;4;14;24,6;31,4;28,2;27,2;32,3;24,5;-;91,25;;1.010,1;88;65;83;81;3,0;310;9,0;90
15/04/2015;2015;4;15;27,6;31,0;28,4;28,7;31,8;24,2;0,0;100;;1.010,8;80;66;82;77;4,0;40;15,0;40
16/04/2015;2015;4;16;26,0;32,4;29,0;28,4;32,8;24,2;-;98,75;;1.011,1;86;58;79;77;2,0;40;7,0;40
17/04/2015;2015;4;17;26,8;31,4;28,8;28,5;31,8;24,2;0,0;100;;1.009,5;86;69;75;79;5,0;40;16,0;40
18/04/2015;2015;4;18;26,4;31,6;28,8;28,3;32,4;24,4;0,0;83,75;;1.009,4;86;69;82;81;2,0;90;6,0;90
19/04/2015;2015;4;19;26,6;27,4;29,0;27,4;33,0;24,2;0,0;97,5;;1.009,6;84;80;77;81;2,0;180;8,0;90
20/04/2015;2015;4;20;25,0;29,4;27,4;26,7;32,7;24,8;-;67,5;;1.008,7;84;74;82;81;2,0;40;8,0;40
21/04/2015;2015;4;21;26,2;30,2;28,0;27,7;32,6;25,0;0,0;45;;1.008,0;87;76;78;82;2,8;40;10,0;40
22/04/2015;2015;4;22;26,0;31,4;25,6;27,3;32,4;25,2;3,8;66,25;;1.008,6;86;74;89;84;2,0;90;14,0;180
23/04/2015;2015;4;23;26,4;30,6;27,0;27,6;31,6;23,2;24,0;46,25;;1.009,0;90;66;89;84;2,0;90;7,0;90
24/04/2015;2015;4;24;25,8;27,2;25,0;26,0;31,0;23,4;7,0;35;;1.008,7;88;84;95;89;2,0;180;15,0;180
25/04/2015;2015;4;25;24,4;27,8;26,0;25,7;30,2;23,6;2,6;13,75;;1.008,7;92;84;93;90;1,0;270;5,0;90
26/04/2015;2015;4;26;25,6;24,4;25,2;25,2;26,6;23,6;4,6;0;;1.009,2;92;97;93;94;2,0;220;5,0;220
27/04/2015;2015;4;27;24,8;25,2;24,4;24,8;30,4;23,5;15,3;26,25;;1.009,4;90;95;95;93;3,0;360;9,0;360
28/04/2015;2015;4;28;24,6;28,0;25,6;25,7;28,6;24,4;2,0;21,25;;1.009,6;93;83;93;91;4,0;40;9,0;90
29/04/2015;2015;4;29;25,6;27,0;26,0;26,1;28,4;25,3;0,8;8,75;;1.009,3;95;90;86;92;4,0;360;9,0;40
30/04/2015;2015;4;30;25,4;28,0;27,2;26,5;29,0;24,8;0,0;5;;1.009,9;95;85;86;90;3,0;40;12,0;40
01/05/2015;2015;5;1;26,0;30,0;27,3;27,3;31,6;24,0;0,0;87,5;;1.009,9;92;69;84;84;3,0;40;7,0;360
02/05/2015;2015;5;2;24,2;28,6;26,8;26,0;31,5;24,0;ttu;52,5;;1.010,7;87;74;86;84;1,0;180;6,0;90
03/05/2015;2015;5;3;26,6;31,2;28,0;28,1;32,0;24,1;6,4;78,75;;1.010,7;83;65;78;77;3,0;180;6,0;180
04/05/2015;2015;5;4;26,5;31,0;28,4;28,1;31,4;25,4;0,0;91,25;;1.010,9;83;66;74;77;2,0;130;7,0;130
05/05/2015;2015;5;5;26,8;30,4;28,0;28,0;31,4;22,8;0,0;90;;1.010,2;84;66;74;77;2,0;130;7,0;180
06/05/2015;2015;5;6;25,8;31,2;28,2;27,8;31,5;23,2;0,0;100;;1.010,4;76;53;73;70;2,0;180;11,0;180
07/05/2015;2015;5;7;25,0;30,7;27,4;27,0;31,4;23,8;0,0;100;;1.011,0;84;61;72;75;3,0;270;5,0;130
08/05/2015;2015;5;8;24,6;31,4;27,8;27,1;32,0;23,5;0,0;100;;1.009,8;87;51;79;76;3,0;130;5,0;130
09/05/2015;2015;5;9;24,8;30,4;28,6;27,2;31,2;25,0;0,0;100;;1.010,1;77;67;78;75;2,0;130;8,0;130
10/05/2015;2015;5;10;26,0;31,2;28,2;27,9;31,4;24,8;0,0;96,25;;1.010,5;84;65;80;78;2,0;130;6,0;130
11/05/2015;2015;5;11;27,6;30,2;28,0;28,4;31,2;25,8;0,0;97,5;;1.011,0;79;74;85;79;3,0;130;9,0;90
12/05/2015;2015;5;12;27,7;29,8;28,2;28,4;31,6;26,0;ttu;96,25;;1.010,9;82;76;83;81;4,0;130;9,0;130
13/05/2015;2015;5;13;28,0;30,9;27,7;28,7;31,8;26,0;ttu;91,25;;1.011,2;82;71;85;80;3,0;180;8,0;180
14/05/2015;2015;5;14;27,0;30,4;27,8;28,1;31,4;24,2;0,0;81,25;;1.011,9;84;72;80;80;3,0;270;9,0;130
15/05/2015;2015;5;15;26,4;30,0;27,8;27,7;31,0;25,0;0,0;100;;1.012,8;87;68;76;80;3,0;270;6,0;270
16/05/2015;2015;5;16;25,8;30,8;27,6;27,5;31,0;23,0;0,0;100;;1.011,4;78;64;80;75;2,0;180;8,0;180
17/05/2015;2015;5;17;25,4;29,8;27,2;27,0;30,4;22,8;0,0;100;;1.010,9;76;60;77;72;3,0;130;7,0;40
18/05/2015;2015;5;18;24,8;29,8;27,0;26,6;30,0;21,4;0,0;100;;1.012,3;78;52;74;71;2,0;130;6,0;180
19/05/2015;2015;5;19;22,0;29,3;26,4;24,9;29,8;22,0;0,0;100;;1.012,5;74;66;81;74;2,0;130;7,0;130
20/05/2015;2015;5;20;23,0;29,2;26,8;25,5;31,0;22,2;0,0;100;;1.012,9;83;63;86;79;3,0;130;6,0;130
21/05/2015;2015;5;21;24,4;30,0;27,0;26,5;31,0;23,4;0,0;100;;1.012,6;83;65;70;75;2,0;40;6,0;40
22/05/2015;2015;5;22;25,6;30,4;27,0;27,2;31,0;24,4;ttu;100;;1.012,4;82;63;84;78;3,0;270;6,0;130
23/05/2015;2015;5;23;26,8;30,4;27,0;27,8;30,6;22,8;0,0;90;;1.011,8;90;67;87;84;1,0;220;5,0;220
24/05/2015;2015;5;24;24,7;30,8;27,8;27,0;31,6;23,6;29,6;87,5;;1.011,7;86;66;82;80;2,0;360;10,0;40
25/05/2015;2015;5;25;24,6;30,5;27,7;26,9;30,8;23,8;20,4;52,5;;1.012,3;95;74;85;87;2,0;40;9,0;360
26/05/2015;2015;5;26;26,3;29,8;27,0;27,4;30,4;22,6;ttu;60;;1.012,5;87;70;89;83;2,0;180;6,0;180
27/05/2015;2015;5;27;26,0;29,8;27,2;27,3;31,2;23,5;0,0;100;;1.011,4;89;72;87;84;2,0;130;6,0;270
28/05/2015;2015;5;28;24,0;29,4;26,6;26,0;30,0;24,0;0,0;93,75;;1.011,5;83;74;86;82;0,8;130;5,0;130
29/05/2015;2015;5;29;27,4;30,0;27,4;28,1;31,0;24,8;6,7;100;;1.012,3;77;70;86;78;4,0;220;6,0;130
30/05/2015;2015;5;30;26,3;27,8;26,4;26,7;28,0;25,0;24,0;0;;1.011,3;87;85;95;89;2,0;220;6,0;220
31/05/2015;2015;5;31;26,0;28,9;27,0;27,0;29,4;24,0;ttu;50;;1.009,7;92;77;86;87;3,0;S;8,0;S
01/06/2015;2015;6;1;26,6;29,6;27,0;27,5;30,6;25,1;0,0;100;;1.010,2;83;76;87;82;3,0;220;5,0;180
02/06/2015;2015;6;2;26,2;29,6;27,6;27,4;30,4;24,5;25,0;73,75;;1.010,9;87;72;86;83;3,0;220;5,0;220
03/06/2015;2015;6;3;25,6;30,3;25,6;26,8;30,4;25,4;0,4;88,75;;1.011,2;87;72;90;84;4,0;220;8,0;270
04/06/2015;2015;6;4;27,0;29,8;27,4;27,8;30,5;24,8;0,0;0;;1.010,8;87;76;85;84;3,0;220;5,0;220
05/06/2015;2015;6;5;27,1;29,8;27,2;27,8;30,4;25,2;0,0;82,5;;1.010,1;81;74;87;81;3,0;180;8,0;180
06/06/2015;2015;6;6;26,4;29,4;27,4;27,4;30,4;25,0;17,0;82,5;;1.010,4;86;73;83;82;3,0;180;7,0;180
07/06/2015;2015;6;7;26,2;29,0;27,2;27,2;29,6;24,2;1,0;27,5;;1.010,6;90;79;87;87;4,0;220;8,0;180
08/06/2015;2015;6;8;26,8;28,4;26,2;27,1;30,0;24,5;11,9;52,5;;1.010,6;89;81;92;88;3,0;180;9,0;220
09/06/2015;2015;6;9;25,8;29,2;26,6;26,9;30,0;24,4;0,0;58,75;;1.010,6;90;77;86;86;4,0;220;9,0;180
10/06/2015;2015;6;10;25,6;29,4;27,0;26,9;30,0;22,6;0,0;88,75;;1.010,9;85;69;83;81;4,0;220;7,0;220
11/06/2015;2015;6;11;23,8;29,6;26,8;26,0;30,0;23,8;0,0;100;;1.010,7;81;65;83;78;3,0;180;7,0;180
12/06/2015;2015;6;12;24,4;29,6;26,4;26,2;29,8;22,4;0,0;100;;1.010,6;88;68;83;82;2,0;180;8,0;180
13/06/2015;2015;6;13;24,8;29,2;27,0;26,5;30,2;19,6;0,0;100;;1.010,5;87;67;81;81;3,0;220;7,0;180
14/06/2015;2015;6;14;25,2;29,2;26,0;26,4;29,8;21,2;0,0;100;;1.010,7;85;70;83;81;1,0;180;5,0;180
15/06/2015;2015;6;15;23,0;28,6;26,0;25,2;29,2;22,8;0,0;100;;1.010,6;76;63;81;74;2,6;270;6,0;90
16/06/2015;2015;6;16;24,2;28,8;26,2;25,9;29,5;22,6;-;100;;1.010,3;83;70;86;81;2,0;180;7,0;180
17/06/2015;2015;6;17;25,4;29,2;26,8;26,7;31,0;23,8;0,0;100;;1.009,9;78;64;84;76;2,0;180;9,0;180
18/06/2015;2015;6;18;25,0;29,2;26,2;26,4;29,8;23,2;ttu;93,75;;1.011,0;84;75;86;82;4,0;270;8,0;180
19/06/2015;2015;6;19;25,2;29,2;26,6;26,6;29,8;24,4;-;97,5;;1.012,4;82;67;83;79;3,0;180;7,0;180
20/06/2015;2015;6;20;24,8;28,2;26,4;26,1;29,8;23,5;0,0;92,5;;1.011,1;88;75;83;84;2,0;180;7,0;180
21/06/2015;2015;6;21;23,8;27,4;26,2;25,3;28,8;23,4;-;71,25;;1.012,9;83;77;81;81;4,0;220;7,0;180
22/06/2015;2015;6;22;25,8;28,6;25,6;26,5;29,2;24,0;-;91,25;;1.012,9;78;64;81;75;4,0;180;10,0;180
23/06/2015;2015;6;23;24,6;28,4;25,6;25,8;29,0;23,4;-;93,75;;1.013,7;80;74;81;79;3,0;220;9,0;130
24/06/2015;2015;6;24;24,6;28,8;26,0;26,0;29,2;23,8;0,0;88,75;;1.013,8;76;63;79;74;4,0;180;11,0;180
25/06/2015;2015;6;25;25,2;28,4;26,0;26,2;29,8;23,4;0,0;80;;1.013,3;82;64;84;78;2,0;220;8,0;220
26/06/2015;2015;6;26;25,2;28,4;26,2;26,3;29,0;25,0;-;16,25;;1.013,4;85;75;83;82;2,0;180;6,0;180
27/06/2015;2015;6;27;25,0;28,8;26,4;26,3;29,4;23,8;-;85;;1.015,1;92;74;83;85;3,0;220;8,0;180
28/06/2015;2015;6;28;24,8;29,0;25,6;26,1;29,4;23,0;-;97,5;;1.015,5;76;61;81;74;4,0;270;9,0;220
29/06/2015;2015;6;29;25,2;29,2;26,2;26,5;29,5;23,4;3,2;98,75;;1.015,1;78;63;81;75;2,0;220;5,0;220
30/06/2015;2015;6;30;24,0;27,0;25,6;25,2;28,6;23,0;0,0;61,25;;1.014,7;88;74;79;82;4,0;180;8,0;130
01/07/2015;2015;7;1;24,2;28,6;25,6;25,7;29,2;22,0;-;100;;1.014,8;83;55;75;74;4,0;SW;9,0;S
02/07/2015;2015;7;2;22,8;28,8;25,6;25,0;29,2;22,5;ttu;100;;1.013,9;79;62;84;76;3,0;SW;6,0;SW
03/07/2015;2015;7;3;23,0;28,0;25,2;24,8;29,0;21,6;-;95;;1.012,8;83;69;84;80;3,0;S;10,0;SE
04/07/2015;2015;7;4;24,2;29,2;25,6;25,8;29,6;21,0;-;100;;1.012,3;75;57;82;72;4,0;W;7,0;SW
05/07/2015;2015;7;5;22,8;28,2;25,0;24,7;28,8;22,8;-;100;;1.011,6;81;76;85;81;1,0;SE SW;5,0;SW
06/07/2015;2015;7;6;22,8;28,0;25,2;24,7;29,0;22,6;-;100;;1.010,9;88;65;85;82;3,0;SW;5,0;SE
07/07/2015;2015;7;7;23,0;29,0;25,2;25,1;29,8;22,2;-;99;;1.011,1;80;59;79;75;3,0;S;6,0;S
08/07/2015;2015;7;8;24,4;26,4;24,8;25,0;28,2;22,5;-;38;;1.011,4;79;74;79;78;4,0;W;7,0;S
09/07/2015;2015;7;9;23,0;27,2;25,4;24,7;28,0;21,4;-;59;;1.011,7;75;69;73;73;2,0;VRB;6,0;E
10/07/2015;2015;7;10;22,4;27,6;25,0;24,4;28,0;22,0;-;63;;1.011,6;81;62;84;77;6,0;SE;5,0;SE
11/07/2015;2015;7;11;24,0;28,2;25,8;25,5;29,6;24,0;-;94;;1.011,8;88;73;87;84;2,0;SE;5,0;SE
12/07/2015;2015;7;12;24,6;29,8;27,0;26,5;30,4;24,6;-;95;;1.010,6;92;64;76;81;8,0;N;14,0;N
13/07/2015;2015;7;13;27,0;30,0;27,2;27,8;31,0;25,0;-;100;;1.010,1;80;62;83;76;5,0;N;14,0;N
14/07/2015;2015;7;14;25,7;30,2;26,6;27,1;30,6;24,0;-;80;;1.010,4;91;53;81;79;2,0;NE;9,0;N
15/07/2015;2015;7;15;24,8;28,0;26,2;26,0;29,8;21,8;-;88;;1.011,2;90;75;84;85;2,0;SE;10,0;SE
16/07/2015;2015;7;16;23,6;28,6;26,0;25,5;30,6;22,6;-;88;;1.011,7;81;68;81;78;3,0;SE;7,0;SE
17/07/2015;2015;7;17;26,0;27,8;26,0;26,5;29,0;23,8;-;100;;1.012,6;81;77;86;81;2,0;SW;8,0;S
18/07/2015;2015;7;18;25,2;28,4;25,8;26,2;29,0;23,8;-;100;;1.012,6;85;74;82;82;3,0;SE;10,0;S
19/07/2015;2015;7;19;24,4;27,6;25,6;25,5;28,8;23,8;-;91;;1.011,7;88;74;84;84;2,0;S;6,0;SW S
20/07/2015;2015;7;20;25,4;27,8;25,8;26,1;28,4;22,0;-;74;;1.012,9;84;76;87;83;2,0;S;7,0;S
21/07/2015;2015;7;21;22,4;29,2;26,6;25,2;29,8;22,0;-;100;;1.013,4;84;67;77;78;2,0;S;5,0;NE
22/07/2015;2015;7;22;23,0;28,0;25,6;24,9;29,4;21,8;-;85;;1.014,3;91;72;89;86;2,0;S;6,0;SSW
23/07/2015;2015;7;23;23,4;29,0;25,6;25,4;29,6;22,0;-;99;;1.014,0;85;68;89;82;2,0;SW;5,0;S
24/07/2015;2015;7;24;22,2;28,2;25,6;24,6;29,0;22,4;-;90;;1.013,8;89;72;87;84;3,0;S;7,0;SW
25/07/2015;2015;7;25;24,4;29,0;25,8;25,9;29,6;22,8;-;100;;1.013,9;83;62;86;79;2,0;S;6,0;SW
26/07/2015;2015;7;26;24,4;28,4;26,0;25,8;28,8;24,5;-;91;;1.014,8;88;74;84;84;2,8;SW;6,0;SW E
27/07/2015;2015;7;27;24,8;28,6;26,8;26,3;29,0;22,2;-;100;;1.014,6;87;74;74;81;2,7;S;8,0;S
28/07/2015;2015;7;28;24,8;29,6;26,2;26,4;29,6;23,0;ttu;91;;1.014,7;82;61;84;77;3,0;S;6,0;SE W
29/07/2015;2015;7;29;24,0;28,8;26,0;25,7;29,0;19,2;ttu;88;;1.013,2;85;75;86;83;3,0;S;9,0;W
30/07/2015;2015;7;30;24,4;28,8;25,8;25,9;29,8;24,0;ttu;93;;1.013,1;88;70;84;83;2,0;S;7,0;SE
31/07/2015;2015;7;31;24,4;29,0;25,8;25,9;29,8;21,6;-;93;;1.012,9;90;74;84;85;4,0;SW;8,0;S
01/08/2015;2015;8;1;23,2;29,2;25,1;25,2;29,2;21,0;0,0;90;;1.014,3;78;64;83;76;4,0;SW;9,0;SW
02/08/2015;2015;8;2;21,8;28,7;25,4;24,4;29,0;21,8;ttu;98,75;;1.014,2;76;64;80;74;3,0;S;7,0;S
03/08/2015;2015;8;3;24,4;28,0;25,6;25,6;29,0;23,2;2,1;42,5;;1.013,6;88;64;81;80;3,0;SW;8,0;SW
04/08/2015;2015;8;4;25,4;26,6;25,0;25,6;29,0;21,8;3,0;55;;1.012,7;81;75;84;80;3,0;S;6,0;SWS
05/08/2015;2015;8;5;23,0;28,4;25,4;25,0;29,0;21,6;0,0;75;;1.011,3;91;65;84;83;3,0;S;10,0;S
06/08/2015;2015;8;6;22,0;28,4;25,8;24,6;28,8;22,0;ttu;90;;1.010,3;91;69;84;84;1,0;SE;5,0;SE
07/08/2015;2015;8;7;24,0;27,8;25,6;25,4;28,6;22,0;0,0;50;;1.011,3;91;74;85;85;3,0;SE;6,0;SE
08/08/2015;2015;8;8;22,6;28,4;25,6;24,8;29,0;22,6;1,6;77,5;;1.010,6;84;65;85;80;3,0;SE;6,0;SE
09/08/2015;2015;8;9;24,6;26,8;25,6;25,4;27,8;23,0;0,0;0;;1.010,8;88;78;84;85;1,0;S;5,0;S
10/08/2015;2015;8;10;24,4;29,0;26,0;26,0;30,0;24,2;0,0;70;;1.012,1;88;71;84;83;2,0;SE;6,0;SSE
11/08/2015;2015;8;11;25,4;28,6;26,4;26,5;29,0;23,8;2,6;66,25;;1.011,9;89;75;86;85;2,0;SE;6,0;SE
12/08/2015;2015;8;12;25,2;27,4;25,8;25,9;28,6;23,5;5,6;43,75;;1.013,2;92;77;86;87;2,0;S;9,0;SW
13/08/2015;2015;8;13;24,4;28,8;25,8;25,9;29,6;22,0;0,0;66,25;;1.012,0;90;75;87;86;2,0;W;5,0;S
14/08/2015;2015;8;14;23,0;29,0;26,8;25,5;27,6;23,2;0,0;100;;1.012,6;88;71;75;81;4,0;NE;11,0;NE
15/08/2015;2015;8;15;26,2;29,4;28,4;27,6;30,4;22,2;0,0;100;;1.013,9;84;61;82;78;3,0;N;11,0;N
16/08/2015;2015;8;16;24,2;29,6;26,0;26,0;30,2;23,8;ttu;100;;1.013,6;88;59;83;80;4,0;NE;13,0;NE
17/08/2015;2015;8;17;24,2;29,2;25,8;25,9;29,4;23,4;0,0;88,75;;1.013,8;87;67;79;80;2,0;SE;6,0;SE
18/08/2015;2015;8;18;23,6;28,2;25,2;25,2;29,2;22,5;0,0;97,5;;1.013,5;86;69;81;81;3,0;S;8,0;S
19/08/2015;2015;8;19;22,8;28,6;24,6;24,7;29,0;20,5;0,0;93,75;;1.013,7;88;60;82;80;3,0;W;6,0;W
20/08/2015;2015;8;20;22,4;28,0;25,0;24,5;28,7;21,2;-;100;;1.013,1;79;61;80;75;3,0;SW;8,0;SE
21/08/2015;2015;8;21;23,2;28,0;25,0;24,9;29,2;22,2;-;100;;1.013,1;78;57;79;73;3,0;SW;7,0;SW
22/08/2015;2015;8;22;24,2;28,2;25,0;25,4;28,6;21,0;-;82,5;;1.013,6;79;64;81;76;2,0;S;8,0;S
23/08/2015;2015;8;23;21,0;28,8;25,4;24,1;29,4;21,0;ttu;100;;1.013,9;89;62;82;81;3,0;SW;6,0;SE
24/08/2015;2015;8;24;24,6;29,0;25,8;26,0;29,6;22,8;-;100;;1.013,6;82;66;84;79;3,0;SW;12,0;S
25/08/2015;2015;8;25;25,0;28,8;26,2;26,3;29,8;24,5;-;100;;1.013,1;81;70;83;79;3,0;SW;6,0;W
26/08/2015;2015;8;26;25,0;29,6;26,6;26,6;30,3;23,8;-;100;;1.012,7;87;64;77;79;3,0;S;9,0;S
27/08/2015;2015;8;27;25,6;29,0;26,0;26,6;30,0;23,6;ttu;95;;1.013,2;81;71;83;79;3,0;S;7,0;SE
28/08/2015;2015;8;28;25,4;29,6;26,0;26,6;30,4;23,8;0,0;100;;1.013,4;84;66;86;80;3,0;SW;7,0;S
29/08/2015;2015;8;29;26,2;29,2;26,2;27,0;30,0;24,6;ttu;100;;1.013,3;81;74;86;81;3,0;S;6,0;SE
30/08/2015;2015;8;30;25,0;29,0;26,0;26,3;30,0;22,8;0,0;97,5;;1.014,4;88;70;85;83;3,0;S;7,0;S
31/08/2015;2015;8;31;24,8;29,2;25,6;26,1;29,8;23,0;0,0;96,25;;1.014,2;79;70;87;79;3,0;SW;6,0;S
01/09/2015;2015;9;1;24,0;28,4;25,0;25,4;29,2;23,6;0,0;100;;1.013,9;78;74;85;79;5,0;SW;9,0;SE
02/09/2015;2015;9;2;24,4;28,4;25,2;25,6;29,0;23,8;0,0;93,75;;1.014,3;80;71;82;78;3,0;S;9,0;SE
03/09/2015;2015;9;3;25,0;28,2;25,2;25,9;29,0;23,4;0,0;98,75;;1.015,0;81;72;84;80;4,0;S;7,0;SW
04/09/2015;2015;9;4;24,4;28,4;25,4;25,7;29,0;23,0;0,0;100;;1.015,2;85;71;84;81;4,0;S;8,0;SW
05/09/2015;2015;9;5;25,0;29,2;25,6;26,2;29,6;24,0;0,0;100;;1.015,3;81;71;85;80;3,0;SW;6,0;SW
06/09/2015;2015;9;6;24,8;29,0;25,8;26,1;29,6;23,5;0,8;100;;1.014,6;80;65;82;77;3,0;SW;8,0;S
07/09/2015;2015;9;7;24,2;29,6;26,0;26,0;30,4;22,5;0,0;93,75;;1.014,2;85;64;84;80;3,0;W;6,0;SE
08/09/2015;2015;9;8;23,0;30,0;26,0;25,5;30,2;22,0;0,0;100;;1.013,2;83;59;81;77;3,0;SW;6,0;S
09/09/2015;2015;9;9;23,0;28,8;25,8;25,2;29,4;23,6;0,0;100;;1.013,9;78;68;86;78;1,0;S;5,0;S
10/09/2015;2015;9;10;25,4;30,0;26,4;26,8;31,6;24,4;0,0;100;;1.014,5;82;65;81;78;3,0;W;9,0;SE
11/09/2015;2015;9;11;25,2;29,2;26,2;26,5;30,0;24,2;0,0;100;;1.013,3;89;71;83;83;2,0;S;6,0;S
12/09/2015;2015;9;12;25,8;29,0;26,0;26,7;29,5;23,0;-;93,75;;1.013,7;86;67;84;81;3,0;S;9,0;S
13/09/2015;2015;9;13;24,0;28,5;25,6;25,5;29,0;21,8;-;93,75;;1.013,7;87;60;78;78;5,0;S;8,0;S
14/09/2015;2015;9;14;24,6;29,6;25,2;26,0;30,3;21,2;-;100;;1.013,2;70;50;79;67;4,0;SW;6,0;SW
15/09/2015;2015;9;15;25,2;29,0;25,6;26,3;29,8;22,5;-;87,5;;1.011,8;73;61;82;72;3,0;SW;7,0;S
16/09/2015;2015;9;16;23,4;29,2;25,8;25,5;30,0;22,6;-;100;;1.011,8;85;66;86;81;3,0;SE;6,0;SE
17/09/2015;2015;9;17;25,0;29,0;26,0;26,3;29,8;23,2;-;100;;1.012,8;79;68;87;78;2,0;SE;8,0;S
18/09/2015;2015;9;18;25,4;30,0;26,8;26,9;30,4;24,2;-;97,5;;1.013,4;87;65;81;80;2,0;SW;5,0;SSE
19/09/2015;2015;9;19;26,0;30,6;26,2;27,2;31,2;24,2;-;85;;1.012,0;78;63;86;76;2,0;S;7,0;S
20/09/2015;2015;9;20;26,2;30,4;26,2;27,3;31,2;22,6;-;100;;1.011,4;83;62;87;79;4,0;S;8,0;SW
21/09/2015;2015;9;21;25,4;29,8;26,4;26,8;30,2;23,8;0,0;100;;1.012,1;79;64;83;76;2,0;SE;6,0;SE
22/09/2015;2015;9;22;25,6;30,2;26,2;26,9;31,2;23,6;-;98,75;;1.012,1;76;64;86;76;2,0;SW;7,0;SE
23/09/2015;2015;9;23;25,8;30,0;26,0;26,9;30,8;23,0;0,0;96,25;;1.012,4;76;64;83;75;4,0;SW;6,0;SE
24/09/2015;2015;9;24;25,2;30,0;25,2;26,4;30,6;22,8;0,0;100;;1.012,3;79;60;84;76;4,0;W;6,0;S
25/09/2015;2015;9;25;25,6;29,3;26,5;26,8;30,0;23,8;0,0;100;;1.011,8;73;69;82;74;3,0;SW;10,0;SE
26/09/2015;2015;9;26;25,0;29,6;26,3;26,5;30,0;23,5;0,0;100;;1.011,6;84;68;81;79;4,0;SWS;7,0;SWS
27/09/2015;2015;9;27;25,6;29,4;26,6;26,8;30,0;24,0;-;100;;1.011,1;81;69;81;78;3,0;SSE;6,0;SW
28/09/2015;2015;9;28;25,4;28,6;26,2;26,4;30,4;23,4;-;83,75;;1.011,3;87;72;86;83;3,0;S;6,0;S
29/09/2015;2015;9;29;25,2;29,2;26,0;26,4;30,4;23,8;-;95;;1.012,4;85;71;89;83;2,0;SW;5,0;S
30/09/2015;2015;9;30;25,8;30,0;26,4;27,0;30,4;24,5;ttu;87,5;;1.014,1;81;70;84;79;4,0;SW;6,0;S
01/10/2015;2015;10;1;;;;26,6;31,0;24,0;ttu;;;1.014,2;83;94;61;80;135,0;2;5,0;SE
02/10/2015;2015;10;2;;;;26,9;32,4;25,0;-;;;1.014,5;81;90;55;77;135,0;3;8,0;SE
03/10/2015;2015;10;3;;;;26,6;31,5;24,0;-;;;1.015,1;82;95;63;81;135,0;3;7,0;SE
04/10/2015;2015;10;4;;;;26,9;31,4;24,6;ttu;;;1.014,2;79;92;55;76;135,0;4;8,0;SE
05/10/2015;2015;10;5;;;;26,8;30,4;24,2;-;;;1.013,6;79;88;63;77;135,0;3;6,0;SE
06/10/2015;2015;10;6;;;;26,8;31,6;23,2;-;;;1.012,7;77;90;59;76;225,0;2;4,0;S
07/10/2015;2015;10;7;;;;26,8;30,6;24,4;-;;;1.013,3;79;87;61;77;225,0;3;7,0;SE
08/10/2015;2015;10;8;;;;27,2;31,2;25,0;-;;;1.013,2;74;85;57;73;225,0;3;6,0;SE
09/10/2015;2015;10;9;;;;27,1;31,2;23,4;-;;;1.012,9;80;90;63;78;180,0;2;9,0;E
10/10/2015;2015;10;10;;;;27,4;32,4;23,6;-;;;1.013,5;79;90;57;76;135,0;3;6,0;SE
11/10/2015;2015;10;11;;;;26,9;33,4;23,8;-;;;1.013,9;79;87;56;75;225,0;4;8,0;NE
12/10/2015;2015;10;12;;;;27,4;32,4;24,4;-;;;1.013,3;79;88;57;76;135,0;3;7,0;S
13/10/2015;2015;10;13;;;;27,1;31,4;23,8;-;;;1.013,1;80;92;65;79;135,0;3;6,0;SE
14/10/2015;2015;10;14;;;;27,5;31,8;25,0;-;;;1.013,1;74;84;60;73;225,0;5;12,0;S
15/10/2015;2015;10;15;;;;26,7;31,0;23,0;-;;;1.012,1;77;85;60;75;225,0;3;9,0;SE
16/10/2015;2015;10;16;;;;27,3;31,8;23,0;-;;;1.012,0;76;88;59;75;225,0;4;5,0;SW
17/10/2015;2015;10;17;;;;27,9;31,6;25,2;-;;;1.012,6;77;87;55;74;225,0;4;9,0;SW
18/10/2015;2015;10;18;;;;27,5;32,2;24,5;-;;;1.013,2;77;85;58;74;225,0;4;7,0;SW
19/10/2015;2015;10;19;;;;27,0;32,0;23,4;-;;;1.012,2;78;88;60;76;225,0;3;6,0;SW
20/10/2015;2015;10;20;;;;27,7;32,0;25,8;-;;;1.011,5;79;89;62;77;225,0;3;8,0;E
21/10/2015;2015;10;21;;;;27,3;32,0;23,6;-;;;1.011,5;79;90;62;78;135,0;2;7,0;SE
22/10/2015;2015;10;22;;;;26,9;32,0;23,2;-;;;1.012,1;79;89;61;77;270,0;3;5,0;W
23/10/2015;2015;10;23;;;;27,1;31,4;22,6;-;;;1.011,7;81;90;63;79;270,0;3;6,0;w
24/10/2015;2015;10;24;;;;26,9;32,8;23,5;-;;;1.011,5;74;88;52;72;270,0;3;6,0;S
25/10/2015;2015;10;25;;;;27,5;32,0;23,8;-;;;1.011,6;80;90;59;77;135,0;2;7,0;SE
26/10/2015;2015;10;26;;;;27,8;31,6;25,0;-;;;1.011,3;80;93;66;80;225,0;3;7,0;E
27/10/2015;2015;10;27;;;;27,7;32,0;24,0;-;;;1.011,3;80;90;64;79;225,0;3;7,0;SE
28/10/2015;2015;10;28;;;;27,9;32,4;24,4;-;;;1.011,3;81;95;55;78;180,0;3;7,0;SE
29/10/2015;2015;10;29;;;;28,6;33,2;25,6;-;;;1.011,4;78;92;53;75;180,0;3;10,0;E
30/10/2015;2015;10;30;;;;28,0;32,2;26,0;-;;;1.011,4;81;89;65;79;225,0;4;9,0;SE
31/10/2015;2015;10;31;;;;28,7;33,2;25,8;-;;;1.011,0;78;90;52;75;180,0;3;7,0;S
01/11/2015;2015;11;1;28,4;33,0;27,4;29,3;33,3;23,8;-;100;;1.011,0;78;54;85;74;1,0;S;6,0;S
02/11/2015;2015;11;2;27,0;31,8;28,2;28,5;33,2;24,5;-;100;;1.010,3;70;62;75;69;2,0;SE;8,0;SW
03/11/2015;2015;11;3;27,8;32,0;28,0;28,9;32,6;24,2;-;97,5;;1.010,4;66;55;73;65;2,0;SE;6,0;S
04/11/2015;2015;11;4;28,0;32,4;28,0;29,1;33,0;24,0;-;100;;1.009,7;71;51;79;68;3,0;SE;8,0;SE
05/11/2015;2015;11;5;28,2;33,0;28,2;29,4;33,8;26,0;-;100;;1.009,3;72;54;85;71;4,0;SE;12,0;NE
06/11/2015;2015;11;6;28,2;32,2;28,0;29,2;33,2;25,0;-;71,25;;1.009,9;79;60;78;74;4,0;SE;10,0;SE
07/11/2015;2015;11;7;29,0;32,8;28,6;29,9;33,4;25,2;-;83,75;;1.010,7;72;52;75;68;3,0;S;7,0;S
08/11/2015;2015;11;8;28,0;32,6;28,2;29,2;34,2;25,0;-;93,75;;1.010,6;75;60;79;72;3,0;S;8,0;S
09/11/2015;2015;11;9;28,0;31,2;28,0;28,8;33,6;25,5;-;80;;1.009,6;75;67;85;76;3,0;SE;7,0;SE
10/11/2015;2015;11;10;28,6;32,0;28,0;29,3;33,3;25,4;-;75;;1.009,0;74;67;80;74;3,0;S;7,0;SE
11/11/2015;2015;11;11;28,6;31,8;28,0;29,3;33,5;25,6;ttu;76,25;;1.010,2;78;64;80;75;3,0;S;7,0;SE
12/11/2015;2015;11;12;29,0;29,8;28,4;29,1;33,0;26,8;-;68,75;;1.011,1;77;66;82;76;3,0;SW;7,0;SE
13/11/2015;2015;11;13;29,0;31,2;27,8;29,3;32,8;26,4;-;100;;1.010,7;77;66;85;76;4,0;SW;7,0;SE
14/11/2015;2015;11;14;29,4;30,8;28,0;29,4;34,4;25,6;-;83,75;;1.009,8;73;62;83;73;3,0;SE;7,0;SE
15/11/2015;2015;11;15;28,0;32,8;28,0;29,2;34,2;24,4;-;100;;1.009,3;75;56;82;72;2,0;W;5,0;W
16/11/2015;2015;11;16;28,4;33,6;28,4;29,7;34,4;25,6;-;100;;1.009,1;69;50;78;67;2,0;SE;7,0;SE
17/11/2015;2015;11;17;29,0;32,0;29,0;29,8;33,4;25,6;-;90;;1.009,8;72;62;78;71;3,0;S;7,0;SE
18/11/2015;2015;11;18;29,0;33,0;28,4;29,9;34,0;25,8;-;100;;1.010,2;75;57;82;72;3,0;S;7,0;SE
19/11/2015;2015;11;19;28,8;33,0;28,6;29,8;34,0;26,2;-;100;;1.009,9;78;60;78;74;3,0;SE;8,0;SE
20/11/2015;2015;11;20;29,2;32,2;29,0;29,9;33,6;26,4;-;100;;1.008,7;74;63;81;73;3,0;S;6,0;S
21/11/2015;2015;11;21;28,4;32,8;29,0;29,7;33,2;26,5;-;100;;1.008,5;78;61;84;75;2,0;SE;8,0;SE
22/11/2015;2015;11;22;28,4;33,4;29,4;29,9;33,5;24,6;-;100;;1.008,4;81;58;84;76;3,0;SE;10,0;NE
23/11/2015;2015;11;23;29,4;32,4;29,2;30,1;34,0;26,6;-;100;;1.008,5;74;62;82;73;2,0;SE;6,0;SE
24/11/2015;2015;11;24;29,4;32,8;29,0;30,2;34,2;24,2;-;98,75;;1.008,1;74;60;82;73;2,0;S;6,0;SW
25/11/2015;2015;11;25;29,0;33,4;29,2;30,2;34,0;25,2;-;80;;1.008,1;75;54;78;71;3,0;SE;7,0;SE
26/11/2015;2015;11;26;28,0;32,2;28,8;29,3;32,2;25,0;-;67,5;;1.008,7;75;61;76;72;2,0;SE;7,0;SE
27/11/2015;2015;11;27;27,0;33,6;29,4;29,3;34,6;27,0;-;100;;1.009,3;76;54;82;72;3,0;SE;7,0;SE
28/11/2015;2015;11;28;30,4;33,8;29,3;31,0;34,5;26,8;-;97,5;;1.011,0;78;58;67;70;2,0;SE;8,0;SE
29/11/2015;2015;11;29;30,0;33,4;29,8;30,8;34,2;26,8;ttu;87,5;;1.010,8;70;62;80;71;2,0;SE;7,0;SE
30/11/2015;2015;11;30;28,0;33,6;29,4;29,8;34,0;26,5;-;98,75;;1.009,8;82;63;80;77;3,0;SE;11,0;SE
01/12/2015;2015;12;1;28,4;33,2;29,6;29,9;34,2;26,0;-;100;;1.009,2;75;60;74;71;3,0;SE;5,0;E
02/12/2015;2015;12;2;28,6;33,8;29,4;30,1;33,8;25,8;0,8;100;;1.010,4;74;58;82;72;4,0;SE;7,0;SE
03/12/2015;2015;12;3;28,2;33,2;29,0;29,7;34,4;25,5;1,0;81,25;;1.010,6;80;57;78;74;3,0;SE;6,0;SE
04/12/2015;2015;12;4;28,6;33,0;29,0;29,8;34,0;25,7;0,0;100;;1.009,9;79;55;78;73;2,0;SE;6,0;SE
05/12/2015;2015;12;5;28,8;28,0;28,4;28,5;33,2;25,0;17,0;37,5;;1.009,5;76;85;82;80;2,0;S;10,0;SW
06/12/2015;2015;12;6;27,4;27,6;27,8;27,6;31,8;23,8;1,0;18,75;;1.010,1;81;82;82;82;1,0;SW;5,0;W
07/12/2015;2015;12;7;28,0;32,8;29,4;29,6;33,7;25,4;0,0;75;;1.009,9;78;59;77;73;4,0;NE;12,0;NE
08/12/2015;2015;12;8;27,4;33,8;30,0;29,7;33,8;26,2;0,0;90;;1.010,4;86;58;78;77;2,0;SE;9,0;SE
09/12/2015;2015;12;9;28,6;32,4;29,4;29,8;34,2;26,0;-;77,5;;1.010,5;78;68;75;75;1,0;SE;8,0;SE
10/12/2015;2015;12;10;29,0;34,0;29,2;30,3;34,4;25,8;0,0;83,75;;1.009,6;78;57;75;72;2,0;S;8,0;S
11/12/2015;2015;12;11;28,8;32,0;30,0;29,9;33,6;25,6;0,0;61,25;;1.008,9;74;65;78;73;2,0;SE;6,0;E
12/12/2015;2015;12;12;29,6;33,0;27,2;29,9;34,0;24,6;2,1;92,5;;1.008,6;74;61;86;74;2,0;SE;7,0;S
13/12/2015;2015;12;13;27,6;33,0;25,4;28,4;33,8;24,8;13,6;81,25;;1.008,2;76;61;92;76;3,0;W;11,0;W
14/12/2015;2015;12;14;26,4;31,8;28,4;28,3;31,8;25,2;ttu;7,5;;1.007,8;86;63;86;80;2,0;SE;8,0;NE
15/12/2015;2015;12;15;27,0;30,4;29,2;28,4;31,4;25,2;0,0;2,5;;1.007,9;77;72;78;76;1,0;SE;6,0;NE
16/12/2015;2015;12;16;27,4;32,0;26,2;28,3;33,2;24,2;1,2;37,5;;1.007,9;82;65;89;80;2,0;SE;7,0;SE
17/12/2015;2015;12;17;27,4;33,6;26,0;28,6;34,2;24,3;5,6;65;;1.007,6;83;53;90;77;2,0;SE;9,0;SE
18/12/2015;2015;12;18;26,5;33,3;28,7;28,8;33,3;24,0;4,2;25;;1.008,3;85;59;75;76;3,0;SW;11,0;S
19/12/2015;2015;12;19;24,6;32,4;29,2;27,7;33,2;25,4;ttu;50;;1.008,6;92;58;65;77;5,0;SW;18,0;SW
20/12/2015;2015;12;20;27,8;31,0;29,0;28,9;33,4;25,2;0,0;40;;1.008,7;77;66;75;74;3,0;N;10,0;S
21/12/2015;2015;12;21;27,0;31,2;26,8;28,0;32,4;24,8;30,2;43,75;;1.010,2;84;67;89;81;1,0;SE;6,0;W
22/12/2015;2015;12;22;27,1;32,0;27,2;28,4;32,8;25,4;26,3;43,75;;1.010,6;84;63;91;81;1,0;S;6,0;S
23/12/2015;2015;12;23;26,6;31,7;26,8;27,9;32,0;24,8;22,0;31,25;;1.009,8;90;66;92;85;1,0;E;5,0;SE
24/12/2015;2015;12;24;26,8;31,1;28,0;28,2;31,8;24,6;2,0;56,25;;1.009,5;87;67;91;83;1,0;SW;6,0;SW
25/12/2015;2015;12;25;25,4;30,2;28,0;27,3;30,6;25,0;0,0;2,5;;1.010,0;93;69;86;85;1,0;N;7,0;NE
26/12/2015;2015;12;26;27,0;30,4;28,0;28,1;31,8;23,8;7,3;56,25;;1.010,6;86;66;86;81;1,0;NE;6,0;NE
27/12/2015;2015;12;27;27,0;31,4;25,4;27,7;32,4;23,2;10,9;65;;1.011,7;80;65;92;79;2,0;SE;6,0;SE
28/12/2015;2015;12;28;26,6;31,0;29,0;28,3;32,2;23,4;-;77,5;;1.012,4;84;72;75;79;2,0;S;7,0;E
29/12/2015;2015;12;29;26,2;30,6;28,2;27,8;32,8;25,0;ttu;62,5;;1.011,2;77;63;80;74;1,0;SE;6,0;SW
30/12/2015;2015;12;30;25,8;31,0;27,8;27,6;31,4;23,8;3,0;58,75;;1.010,5;86;70;86;82;2,0;S;7,0;SW
31/12/2015;2015;12;31;26,0;29,4;28,0;27,4;31,8;24,8;0,0;46,25;;1.011,1;84;75;80;81;2,0;NE;10,0;NE
01/01/2016;2016;1;1;27,0;32,0;28,4;28,6;32,5;24,8;0,0;77,5;;1.011,9;84;68;75;76;2,0;SW;7,0;W
02/01/2016;2016;1;2;27,0;28,4;29,8;28,1;33,8;25,0;5,5;97,5;;1.011,8;74;76;73;74;2,0;SE;7,0;NE
03/01/2016;2016;1;3;28,3;33,0;29,4;29,8;33,2;26,0;0,0;97,5;;1.012,4;82;58;78;73;2,0;SE;6,0;SE
04/01/2016;2016;1;4;27,4;32,6;29,0;29,1;33,0;26,0;0,0;100;;1.012,5;85;58;79;74;3,0;N;12,0;NE
05/01/2016;2016;1;5;28,2;32,6;29,0;29,5;34,6;24,2;0,0;100;;1.011,8;79;62;77;73;4,0;E;9,0;E
06/01/2016;2016;1;6;28,0;33,0;30,4;29,9;34,2;26,2;0,0;100;;1.012,4;78;56;73;69;3,0;E;9,0;NE
07/01/2016;2016;1;7;29,0;33,4;29,8;30,3;34,2;26,0;0,0;100;;1.012,3;74;55;80;70;2,0;SE;5,0;W
08/01/2016;2016;1;8;28,4;32,6;30,2;29,9;33,6;25,8;0,0;87,5;;1.011,2;78;66;76;73;2,0;S;6,0;S
09/01/2016;2016;1;9;28,8;32,4;28,4;29,6;33,4;24,5;25,0;100;;1.010,9;69;67;83;73;3,0;SE;9,0;SE
10/01/2016;2016;1;10;26,8;32,4;28,8;28,7;33,0;25,2;0,0;96,25;;1.011,2;78;59;76;71;2,0;E;7,0;NE
11/01/2016;2016;1;11;26,6;33,0;29,6;29,0;34,0;25,0;0,0;91,25;;1.011,1;83;49;68;67;3,0;NE;10,0;N
12/01/2016;2016;1;12;28,6;33,0;29,6;30,0;34,0;25,2;0,0;97,5;;1.010,4;74;52;74;67;3,0;NE;14,0;NE
13/01/2016;2016;1;13;28,2;33,2;29,4;29,8;33,8;25,8;0,0;87,5;;1.010,1;80;55;77;71;2,0;E;9,0;E
14/01/2016;2016;1;14;28,8;33,2;29,4;30,1;34,0;24,6;0,0;95;;1.009,5;78;55;75;69;2,0;SE;8,0;NE
15/01/2016;2016;1;15;28,0;34,6;30,0;30,2;32,4;26,5;0,0;100;;1.008,7;75;46;73;65;3,0;NE;9,0;NE
16/01/2016;2016;1;16;27,4;33,4;29,4;29,4;35,2;25,8;0,0;77,5;;1.008,8;76;54;75;68;3,0;W;8,0;SW
17/01/2016;2016;1;17;28,6;33,4;30,2;30,2;34,4;25,0;0,0;97,5;;1.008,2;74;49;72;65;2,0;SE;7,0;SE
18/01/2016;2016;1;18;27,5;32,8;29,4;29,3;34,2;24,2;0,0;85;;1.008,5;76;59;74;70;4,0;N;14,0;N
19/01/2016;2016;1;19;28,4;33,6;30,2;30,2;34,4;25,5;0,0;85;;1.009,4;62;53;66;60;3,0;NE;12,0;NE
20/01/2016;2016;1;20;28,8;29,4;26,0;28,3;34,4;24,5;9,9;62,5;;1.010,0;78;71;89;79;3,0;NE;10,0;NE
21/01/2016;2016;1;21;26,7;27,7;26,2;26,8;33,2;25,0;4,6;66,25;;1.009,8;82;81;90;84;2,0;E;9,0;E
22/01/2016;2016;1;22;27,0;32,0;26,6;28,2;32,7;25,0;2,4;75;;1.009,7;84;67;89;80;3,0;NE;8,0;NE
23/01/2016;2016;1;23;26,4;31,0;25,0;27,2;31,8;24,0;14,7;41,25;;1.010,7;81;72;95;83;3,0;NE;10,0;E
24/01/2016;2016;1;24;25,6;30,0;24,6;26,5;30,6;24,0;28,8;17,5;;1.011,5;92;74;95;87;3,0;NE;8,0;NE
25/01/2016;2016;1;25;27,2;29,1;27,8;27,8;30,4;25,4;0,0;15;;1.010,9;74;77;86;79;1,0;E;6,0;E
26/01/2016;2016;1;26;26,0;27,4;27,4;26,7;28,5;25,0;0,8;0;;1.010,7;89;85;85;86;1,0;S;6,0;S
27/01/2016;2016;1;27;25,0;28,2;25,0;25,8;30,2;25,0;15,3;12,5;;1.009,0;92;83;88;88;3,0;N;11,0;S
28/01/2016;2016;1;28;25,0;30,8;29,0;27,5;32,8;25,0;0,0;50;;1.008,7;85;67;77;76;3,0;NE;9,0;NE
29/01/2016;2016;1;29;25,6;32,4;27,6;27,8;32,8;25,0;4,0;70;;1.009,0;89;64;91;81;2,0;NE;9,0;E
30/01/2016;2016;1;30;26,0;30,2;27,4;27,4;32,2;24,8;ttu;47,5;;1.007,8;92;76;85;84;3,0;N;6,0;N
31/01/2016;2016;1;31;26,2;31,0;27,4;27,7;31,5;24,8;5,1;0;;1.007,2;89;71;89;83;2,0;NE;10,0;NE
01/02/2016;2016;2;1;26,0;31,2;26,0;27,3;32,4;25,0;16,0;58,75;;1.007,8;92;64;93;85;1,0;E;5,0;E
02/02/2016;2016;2;2;26,4;29,0;25,6;26,9;30,4;24,4;29,2;16,25;;1.008,7;92;84;95;91;1,0;NE;5,0;NE
03/02/2016;2016;2;3;25,2;27,4;26,4;26,05;30,2;25;0,7;0;;1008,7;95;89;89;92;1;W;8;SW
04/02/2016;2016;2;4;27;29,6;27,4;27,75;31,2;25,6;ttu;62,5;;1007,9;83;73;82;80,25;3;NE;9;N
05/02/2016;2016;2;5;26;26,6;26,8;26,35;27,8;25;ttu;0;;1008,2;92;90;92;91,5;2;N;9;N
06/02/2016;2016;2;6;25;31;28;27,25;32,4;25,2;10,3;62,5;;1008,1;90;70;88;84,5;2;W;7;SE
07/02/2016;2016;2;7;27,8;27;28;27,65;31,4;24,8;16,8;12,5;;1008,9;80;87;88;83,75;1;NE;6;NE
08/02/2016;2016;2;8;26,6;28;27,6;27,2;31,6;25;0;50;;1008,4;87;75;85;83,5;2;SE;5;E
09/02/2016;2016;2;9;25;30,6;27,4;27;31,6;25;5,6;72,5;;1008,3;84;69;91;82;2;E;7;E
10/02/2016;2016;2;10;26;27;26,6;26,4;30,6;26;0,6;0;;1008,4;90;89;81;87,5;5;NE;18;NE
11/02/2016;2016;2;11;27,4;28,6;26,4;27,45;31;24,8;1;7,5;;1008,9;86;81;90;85,75;3;NE;7;N
12/02/2016;2016;2;12;25,6;25;24,8;25,25;28,6;24;50;0;;1009,9;92;97;97;94,5;2;W;5;NE
13/02/2016;2016;2;13;24,4;31,2;27,6;26,9;30,6;24,4;ttu;2,5;;1010,5;97;69;91;88,5;1;E;4;E
14/02/2016;2016;2;14;25,4;28,4;28,6;26,95;30,8;24;1;60;;1010,4;92;78;79;85,25;2;SW;8;SW
15/02/2016;2016;2;15;26;27,8;26,7;26,625;30,5;24,4;12,3;33,75;;1010,6;83;85;83;83,5;2;W;6;E
16/02/2016;2016;2;16;25,4;28,4;28,6;26,95;30,8;25;0;97,5;;1011,3;84;66;77;77,75;3;NE;9;NE
17/02/2016;2016;2;17;27,2;33;29;29,1;33,2;25;33,2;100;;1011,5;81;61;90;78,25;2;SE;7;S
18/02/2016;2016;2;18;27,8;32,6;30;29,55;33;24,4;0;100;;1010,3;76;69;76;74,25;3;SE;8;SE
19/02/2016;2016;2;19;28;32;28,8;29,2;33,5;25,4;0;100;;1009,8;75;67;82;74,75;3;NE;8;NE
20/02/2016;2016;2;20;27,8;30,4;26;28;32;25,1;0,6;83,75;;1011;79;68;84;77,5;3;NE;8;NE
21/02/2016;2016;2;21;26,2;31;27,8;27,8;31,6;24,6;0;30;;1011,7;87;70;83;81,75;3;NE;9;NE
22/02/2016;2016;2;22;26;30,5;28,2;27,675;32,7;25;0;67,5;;1011,8;84;71;79;79,5;3;S;12;E
23/02/2016;2016;2;23;26,8;29,8;27;27,6;31,8;23,8;22,1;43,75;;1010,6;78;76;89;80,25;1;SE;7;SE
24/02/2016;2016;2;24;27;32;26,4;28,1;32,8;24,2;0,2;75;;1010,2;84;64;89;80,25;3;NE;7;N
25/02/2016;2016;2;25;27;32,2;29;28,8;32,8;24,8;2;87,5;;1010,9;80;68;79;76,75;2;SW;8;SE
26/02/2016;2016;2;26;25,8;30,4;25,3;26,825;31,6;24,4;25,6;58,75;;1010,8;90;72;96;87;1;S;5;SE
27/02/2016;2016;2;27;25;30,2;27,4;26,9;30,5;25,5;5,2;65;;1010,6;93;74;86;86,5;2;S;6;S
28/02/2016;2016;2;28;25,4;30,6;28,6;27,5;32;25;2,4;31,25;;1010,9;95;71;83;86;2;S;6;E
29/02/2016;2016;2;29;26;30;27,2;27,3;32,4;24,8;3,7;53,75;;1010,7;86;77;92;85,25;3;SW;6;NE
01/03/2016;2016;3;1;26,6;32,6;29;28,7;32,5;24,4;7,4;75;;1010,4;87;58;74;76,5;3;NE;6;E
02/03/2016;2016;3;2;25,6;30,8;26,4;27,1;32;25;10,2;17,5;;1011,7;95;75;90;88,75;1;SE;6;E
03/03/2016;2016;3;3;26,4;29;28;27,45;32,2;24,5;ttu;48,75;;1011;83;74;82;80,5;2;S;8;SE
04/03/2016;2016;3;4;26;32,2;29,4;28,4;32,8;26;0;95;;1009,3;84;59;75;75,5;3;NE;11;NE
05/03/2016;2016;3;5;26,4;31,6;29;28,35;32,1;26,6;0;95;;1009,7;83;66;81;78,25;6;NE;16;NE
06/03/2016;2016;3;6;29;29;28,2;28,8;32,8;25;0;50;;1010,1;79;78;80;79;4;NW;7;NW
07/03/2016;2016;3;7;27,8;32,6;29;29,3;33,6;25;0;100;;1009,3;76;60;78;72,5;3;NE;13;NE
08/03/2016;2016;3;8;26,4;33,6;29,4;28,95;34,2;26,3;0;98,75;;1008,7;81;60;81;75,75;3;E;8;E
09/03/2016;2016;3;9;28,2;33,6;29,8;29,95;34;26;0;100;;1009,4;80;60;78;74,5;3;E;11;E
10/03/2016;2016;3;10;27,8;33;30;29,65;33,7;25,8;0;77,5;;1010,2;79;64;76;74,5;1;SE;6;SE
11/03/2016;2016;3;11;27,6;31,6;29;28,95;32,8;25,8;ttu;57,5;;1010;79;71;82;77,75;3;E;9;E
12/03/2016;2016;3;12;27;33,4;30,4;29,45;34,2;25,2;0;93,75;;1009,8;83;54;76;74;3;W;9;NE
13/03/2016;2016;3;13;26,8;32,6;29,8;29;34,2;26,7;0;97,5;;1010,2;81;63;78;75,75;3;NW;6;S
14/03/2016;2016;3;14;27,8;32,8;27;28,85;33,4;25,1;5,6;90;;1009,9;77;60;89;75,75;2;S;6;SE
15/03/2016;2016;3;15;27,7;31;25,2;27,9;32;24,5;34,6;62,5;;1009,1;79;72;90;80;3;NW;6;S
16/03/2016;2016;3;16;25;32,6;27,8;27,6;33;25,5;3;68,75;;1009,1;76;62;86;75;1;SW;5;SW
17/03/2016;2016;3;17;26;31;29;28;32,6;26;0;68,75;;1009,5;89;67;78;80,75;3;W;6;SE
18/03/2016;2016;3;18;27,6;32;26,4;28,4;32,6;25;4;65;;1009,2;85;68;89;81,75;3;W;8;W
19/03/2016;2016;3;19;26,6;33;30,4;29,15;33,5;25,5;0;95;;1009,3;87;58;68;75;2;E;6;NE
20/03/2016;2016;3;20;27;32,6;29,6;29,05;33,2;25,4;0;100;;1009,2;83;67;80;78,25;3;E;12;NE
21/03/2016;2016;3;21;28,8;32,4;29,4;29,85;33,2;25,5;0;100;;1008,3;76;67;74;73,25;3;NE;10;E
22/03/2016;2016;3;22;27;33,4;29,8;29,3;34;25,4;0;100;;1007,8;78;59;78;73,25;2;E;10;NE
23/03/2016;2016;3;23;27;33,4;29,6;29,25;33,9;25,4;0;75;;1010,5;76;54;74;70;2;S;6;E
24/03/2016;2016;3;24;28,6;33;30,2;30,1;33,6;26,4;0;100;;1011,7;71;60;76;69,5;3;S;11;S
25/03/2016;2016;3;25;28;33;30;29,75;34,2;25,5;0;100;;1011,6;78;60;77;73,25;2;E;8;E
26/03/2016;2016;3;26;26,8;33,4;30;29,25;34,4;25,8;0;93,75;;1012,3;77;55;72;70,25;3;E;10;NE
27/03/2016;2016;3;27;28,4;32,2;30;29,75;33;24,8;0;77,5;;1011,8;76;62;72;71,5;2;SE;8;SE
28/03/2016;2016;3;28;28;33,2;29;29,55;33,8;25,2;0;93,75;;1011,5;75;60;77;71,75;3;NE;10;NE
29/03/2016;2016;3;29;26,2;32,8;28,8;28,5;32,8;25,8;0;68,75;;1011,7;78;57;78;72,75;3;E;9;E
30/03/2016;2016;3;30;28,8;31,8;28;29,35;33,4;25,8;2,1;66,25;;1011,4;78;67;89;78;4;NE;10;NE
31/03/2016;2016;3;31;27,6;33;29,4;29,4;33,4;25;0;83,75;;1010,5;86;58;75;76,25;2;E;7;E
01/04/2016;2016;4;1;26,4;32,6;29,6;28,8;33;25,6;0;100;;1009,9;80;59;73;73;4;NE;11;E
02/04/2016;2016;4;2;27,6;33,2;29,8;29,6;34;26,4;0;100;;1010,5;73;51;72;67;3;NE;12;E
03/04/2016;2016;4;3;27,6;33;29,2;29,4;33,6;26;0;100;;1011,1;83;57;78;75;3;NE;11;E
04/04/2016;2016;4;4;28,2;33;29,8;29,8;33,4;25,8;0;90;;1010;79;64;70;73;4;NW;8;E
05/04/2016;2016;4;5;28,4;33,6;29;29,9;34;25,4;0;75;;1009,3;74;52;78;70;2;E;8;E
06/04/2016;2016;4;6;29;32,8;28,4;29,8;33,4;26,8;0;94;;1010;74;61;85;74;4;NE;11;NE
07/04/2016;2016;4;7;29,4;32,6;28,6;30;33,4;26,2;0;70;;1009,8;73;58;82;72;3;NE;10;NE
08/04/2016;2016;4;8;29,2;33;29,8;30,3;33,6;25,4;25,5;81;;1009,5;77;61;72;72;4;NE;11;E
09/04/2016;2016;4;9;26;31;26,4;27,4;32;25;10,3;21;;1009,9;92;72;92;87;1;SW;6;SW
10/04/2016;2016;4;10;26;30,8;29;28;31,8;25,5;0,9;48;;1009,7;90;67;81;82;4;NE;9;NE
11/04/2016;2016;4;11;27,2;31,4;29;28,7;32;26,4;0;81;;1009,4;87;69;79;81;4;NE;12;E
12/04/2016;2016;4;12;27,6;30;28,4;28,4;32,4;25,8;ttu;54;;1008,9;83;76;78;80;3;NE;10;NE
13/04/2016;2016;4;13;27;30,4;26,4;27,7;32;25;4,3;9;;1009,4;84;72;89;82;2;E;6;E
14/04/2016;2016;4;14;27,6;31,8;28,8;29;32,4;25,4;0;76;;1009,9;80;67;86;78;2;SW;6;SW
15/04/2016;2016;4;15;27,2;28,8;26,2;27,4;32,4;25;6,7;60;;1010,5;86;81;90;86;4;NE;10;NE
16/04/2016;2016;4;16;26,8;31,6;28;28,3;32,4;25,2;ttu;100;;1010,3;89;66;80;81;4;E;9;E
17/04/2016;2016;4;17;28,6;32,4;28,8;29,6;33;25,2;0;100;;1009,6;70;67;82;72;4;NE;15;E
18/04/2016;2016;4;18;28,2;31,8;29,4;29,4;32,8;25,8;0;94;;1009,8;78;67;80;76;3;S;8;W
19/04/2016;2016;4;19;28,6;32,2;28,6;29,5;32,4;25;0;100;;1010,1;74;62;78;72;3;NE;11;NE
20/04/2016;2016;4;20;27;31,4;29,6;28,8;32,6;24,4;0;53;;1010,4;77;64;77;74;3;W;8;NE
21/04/2016;2016;4;21;27,6;32;28,6;29;32,7;25,5;0;60;;1009,9;76;62;81;74;2;W;6;W
22/04/2016;2016;4;22;26,2;30,4;29;28;32,2;25;0;56;;1010,3;89;66;77;80;3;SE;10;NE
23/04/2016;2016;4;23;27,4;32,4;28,6;29;33;26;0;100;;1009,4;82;59;81;76;3;E;9;E
24/04/2016;2016;4;24;28,6;32,8;29;29,8;33,4;25,5;0;100;;1009,3;79;59;70;72;3;NE;9;NE
25/04/2016;2016;4;25;26,6;31,8;29,4;28,6;32,4;24,8;0;100;;1009,5;84;68;77;78;2;SE;9;S
26/04/2016;2016;4;26;28,8;32,2;29;29,7;33;26;1;100;;1009,9;76;61;70;73;3;SE;8;E
27/04/2016;2016;4;27;27,8;32,2;28,8;29,2;33,1;26;0;99;;1009,3;83;54;82;76;2;S;7;s
28/04/2016;2016;4;28;27,4;32,6;29,4;29,2;33,4;26;0;100;;1009,6;82;54;80;75;4;w;6;SE
29/04/2016;2016;4;29;28,4;32,6;29,2;29,7;33,8;26,5;0;0;;1009,6;75;60;79;72;2;s;7;E
30/04/2016;2016;4;30;28;31,6;28,8;29,1;32,6;26;0;0;;1009,5;86;64;76;78;1;SE;7;SE
01/05/2016;2016;5;1;27,8;32,4;29;29,25;33;25,2;0;98;;1009,8;79;62;78;74,5;2;90;13;90
02/05/2016;2016;5;2;26,4;33;29,2;28,75;33,7;25,4;0;99;;1009,8;81;56;84;75,5;3;45;12;45
03/05/2016;2016;5;3;28;32,6;30;29,65;33,6;26,5;0;100;;1009,3;78;58;73;71,75;3;90;13;90
04/05/2016;2016;5;4;28,8;32,2;29;29,7;33;25,5;0;90;;1008,7;84;61;85;78,5;3;180;6;270
05/05/2016;2016;5;5;27;32,4;28,6;28,75;33,8;25;0;70;;1007,9;81;63;81;76,5;2;45;9;90
06/05/2016;2016;5;6;26,6;31,8;29,4;28,6;33;25,2;0;91;;1007,6;80;68;75;75,75;4;90;10;90
07/05/2016;2016;5;7;27,8;33,2;27;28,95;33,8;25;ttu;69;;1008,4;74;60;80;72;2;45;7;45
08/05/2016;2016;5;8;27,8;31,6;28,6;28,95;33,8;26,2;0;63;;1008,9;77;59;83;74;2;90;7;90
09/05/2016;2016;5;9;26,8;30,4;28,8;28,2;32,4;26,2;0;30;;1009,1;87;75;82;82,75;2;45;7;45
10/05/2016;2016;5;10;25,8;32,2;29,4;28,3;32,6;25;48;78;;1008,6;84;63;80;77,75;3;90;10;90
11/05/2016;2016;5;11;27;33;27,6;28,65;33,2;25,2;ttu;56;;1007,9;90;57;85;80,5;3;45;12;45
12/05/2016;2016;5;12;27;32,8;29,4;29,05;33,6;26,4;0;83;;1007,8;89;59;82;79,75;3;90;11;90
13/05/2016;2016;5;13;28,6;32;28,2;29,35;32,8;26,2;11,2;88;;1008,6;83;66;78;77,5;3;180;10;180
14/05/2016;2016;5;14;28,8;32,6;28,2;29,6;33;26,6;ttu;85;;1009,6;85;65;87;80,5;2;180;13;180
15/05/2016;2016;5;15;28,2;32;27,4;28,95;32,6;26,8;2,2;69;;1008,8;85;67;89;81,5;2;180;6;180
16/05/2016;2016;5;16;28,8;30;29;29,15;32,2;25,8;0;81;;1008,6;79;78;81;79,25;2;135;6;180
17/05/2016;2016;5;17;28,2;31,4;29;29,2;32,2;25,4;ttu;100;;1009,6;80;65;78;75,75;4;270;7;180
18/05/2016;2016;5;18;28;32,2;29,2;29,35;33;25,4;0,7;100;;1009,2;78;66;84;76,5;2;225;7;270
19/05/2016;2016;5;19;28;31,8;29,2;29,25;32,7;26,4;ttu;84;;1008,6;80;68;82;77,5;2;270;6;180
20/05/2016;2016;5;20;28;31,4;29;29,1;32,3;24,6;0;100;;1008,3;79;67;81;76,5;3;270;5;180
21/05/2016;2016;5;21;27,8;32,6;29;29,3;33;25,3;7,2;100;;1010,3;79;60;84;75,5;2;270;5;180
22/05/2016;2016;5;22;26,8;31,4;28,3;28,325;32;26;0;73;;1011,2;90;69;78;81,75;3;225;7;135
23/05/2016;2016;5;23;27;32;28,6;28,65;33,2;25;0;100;;1011,6;81;58;81;75,25;2;270;6;180
24/05/2016;2016;5;24;27,2;31,4;28,6;28,6;32;24,6;0;100;;1010,5;80;61;82;75,75;2;180;8;180
25/05/2016;2016;5;25;27;32,2;28,6;28,7;32,5;24;0;100;;1010,5;76;62;83;74,25;2;135;7;180
26/05/2016;2016;5;26;25,8;32;29,2;28,2;33;25,6;0;100;;1011,2;79;63;82;75,75;3;180;7;180
27/05/2016;2016;5;27;27,6;31;28,2;28,6;33;25;22,4;79;;1011,7;85;71;80;80,25;2;225;6;225
28/05/2016;2016;5;28;25,4;31;28;27,45;31,6;25;ttu;73;;1010,4;95;68;82;85;2;270;7;90
29/05/2016;2016;5;29;25,6;31;27,8;27,5;31,8;25;0;78;;1009,8;95;68;80;84,5;2;270;5;80
30/05/2016;2016;5;30;26;31,6;28;27,9;32,2;25;0,2;53;;1010,7;84;66;85;79,75;1;270;5;80
31/05/2016;2016;5;31;26;31,2;25,5;26,975;32;23,8;51,3;73;;1011,6;86;67;93;83;1;135;4;135
01/06/2016;2016;6;1;25,4;30,2;28,4;27,35;31,5;24,5;0;96,25;;1010,5;92;73;81;84,5;1;S;5;S
02/06/2016;2016;6;2;25,8;31;28;27,65;31,6;24;0;100;;1010,3;87;65;76;78,75;4;NE;10;N
03/06/2016;2016;6;3;26,8;32;29;28,65;32,8;24,4;0;100;;1011;71;56;75;68,25;2;NE;9;NE
04/06/2016;2016;6;4;25;31,6;28,6;27,55;32,4;24;0;100;;1011,1;77;63;78;73,75;2;NW;5;SE
05/06/2016;2016;6;5;26,3;32,2;28,5;28,325;32,6;25;0;75;;1011,2;71;57;77;69;2;NE;10;E
06/06/2016;2016;6;6;27,8;33,3;29,4;29,575;33;24,8;0;100;;1011,5;74;55;78;70,25;1;E;4;E
07/06/2016;2016;6;7;29,1;34,1;27,5;29,95;34,2;25;11,5;96,25;;1011,4;71;55;87;71;4;W;11;NE
08/06/2016;2016;6;8;29;31,8;28,6;29,6;33,8;24;0;81,25;;1011,4;73;62;76;71;1;W;4;W
09/06/2016;2016;6;9;25;32,2;28,1;27,575;32,4;24;ttu;97,5;;1011,8;76;53;74;69,75;1;E;6;SW
10/06/2016;2016;6;10;28,8;31,8;29,4;29,7;32,4;24,6;0;100;;1011,9;67;57;69;65;2;SE;8;N
11/06/2016;2016;6;11;26,8;33,1;29;28,925;32,8;23,8;0;100;;1011,9;83;53;79;74,5;2;SE;6;SE
12/06/2016;2016;6;12;26;31,3;28,4;27,925;32;24,7;1,5;100;;1011,2;83;63;76;76,25;1;SE;5;SE
13/06/2016;2016;6;13;26;32,4;28,6;28,25;32,6;25,8;0;100;;1010,4;84;62;78;77;3;E;6;NE
14/06/2016;2016;6;14;26,6;31,1;26,2;27,625;32,2;24,5;5;46,25;;1010,4;87;70;90;83,5;1;SE;7;SE
15/06/2016;2016;6;15;26;31,1;28,2;27,825;31,8;25,4;0;97,5;;1009,5;84;67;82;79,25;3;NE;12;NE
16/06/2016;2016;6;16;27,8;32;27,8;28,85;32,2;24,6;-;62,5;;1009;82;63;79;76,5;2;W;7;SE
17/06/2016;2016;6;17;29,4;31;29,6;29,85;33;25;0;55;;1008,1;70;65;72;69,25;3;NE;9;NE
18/06/2016;2016;6;18;27,4;31,7;27,2;28,425;32,4;25;2,7;95;;1008,8;82;66;89;79,75;2;SE;6;SE
19/06/2016;2016;6;19;25,4;32,4;28,2;27,85;32,6;24,8;ttu;62,5;;1009,3;89;61;78;79,25;2;W;5;SW
20/06/2016;2016;6;20;28,8;31,4;28,4;29,35;32;25,5;0;87,5;;1008,9;73;64;76;71,5;1;S;5;S
21/06/2016;2016;6;21;26;31;29;28;31,6;23,6;0;98,75;;1009,5;83;65;74;76,25;2;SE;7;SE
22/06/2016;2016;6;22;26,8;32;28,8;28,6;32;24,6;0;100;;1010,1;74;60;75;70,75;2;S;5;S
23/06/2016;2016;6;23;27;31,3;28,5;28,45;31,6;25,6;ttu;100;;1010,2;74;59;73;70;3;W;10;SE
24/06/2016;2016;6;24;26,8;31,7;28,8;28,525;32;24,5;0;100;;1010,2;80;62;72;73,5;2;W;6;S
25/06/2016;2016;6;25;28,8;31,5;28,6;29,425;32,2;24,7;0,5;100;;1011;70;59;74;68,25;2;SESW;5;SW
26/06/2016;2016;6;26;26,9;30,3;25,8;27,475;31,7;24,5;40,5;62,5;;1010,8;84;67;92;81,75;3;S;7;S
27/06/2016;2016;6;27;24,8;29,6;26,6;26,45;30;23,4;0;32,5;;1009,5;93;77;89;88;2;NW;6;S
28/06/2016;2016;6;28;24,5;30,1;27,3;26,6;30,3;23,6;53;3,75;;1010,6;84;67;86;80,25;2;E;7;E
29/06/2016;2016;6;29;25;28,8;27;26,45;30,6;23,6;40;6,25;;1010,3;92;79;87;87,5;4;NE;12;NE
30/06/2016;2016;6;30;25,2;27,3;27,5;26,3;28;24,6;18;2,5;;1010,4;92;86;81;87,75;5;NE;11;NE
01/07/2016;2016;7;1;26,7;31;27,2;28,3;31,5;24,4;0,2;66;;1011,3;85;66;84;78,33333333;3;NE;8;NE
02/07/2016;2016;7;2;27,6;31,7;27,8;29,03333333;32,2;24,5;0;100;;1011,4;78;62;79;73;2;NE;10;NE
03/07/2016;2016;7;3;25,8;31;27,8;28,2;31,4;25,6;0;100;;1010,9;84;70;77;77;5;NE;13;NE
04/07/2016;2016;7;4;26,5;31,6;27,8;28,63333333;31,9;24,2;0;100;;1010,6;79;60;75;71,33333333;4;NE;11;NE
05/07/2016;2016;7;5;27,9;32,2;28,6;29,56666667;32,2;23,8;0;100;;1010,5;68;53;70;63,66666667;2;NE;8;NE
06/07/2016;2016;7;6;26,8;31,7;28;28,83333333;32,2;25,2;0;100;;1009,9;75;60;71;68,66666667;2;E;6;E
07/07/2016;2016;7;7;28,2;31,4;29,5;29,7;31,6;24,5;0;100;;1010,1;71;61;64;65,33333333;1;E;5;E
08/07/2016;2016;7;8;25;30,6;28,4;28;31;23,5;0;73;;1010,2;84;69;75;76;2;S;5;NW
09/07/2016;2016;7;9;26,8;31,2;28,5;28,83333333;32;24,8;0;73;;1010,6;77;64;72;71;1;NE;6;N
10/07/2016;2016;7;10;25;31,1;27,8;27,96666667;31,5;25;0;90;;1009,8;84;67;85;78,66666667;2;SE;5;SE
11/07/2016;2016;7;11;26;30,6;28,2;28,26666667;31,6;24;0;70;;1009,8;87;68;79;78;3;NE;10;E
12/07/2016;2016;7;12;26,1;30;28;28,03333333;31,5;24;0;69;;1009,7;86;72;82;80;2;E;9;NE
13/07/2016;2016;7;13;26,2;31,4;28;28,53333333;31,4;25,4;0;73;;1009,6;86;67;79;77,33333333;3;NE;10;NE
14/07/2016;2016;7;14;27,4;31,2;28,3;28,96666667;32;24;1,8;75;;1009,3;82;68;78;76;3;NE;6;E
15/07/2016;2016;7;15;26,6;30,6;27,6;28,26666667;32;21;ttu;100;;1009,3;81;68;83;77,33333333;4;NE;12;NE
16/07/2016;2016;7;16;25,8;29,6;26,8;27,4;30;24,4;23,6;5;;1010,6;89;70;89;82,66666667;2;W;8;SE
17/07/2016;2016;7;17;24,4;29;27,4;26,93333333;30,6;25,2;2,2;33;;1010,9;93;78;83;84,66666667;1;W;5;W
18/07/2016;2016;7;18;26,3;27;26,7;26,66666667;28;24,6;ttu;1;;1009,9;86;78;76;80;2;SW;6;W
19/07/2016;2016;7;19;28;28,8;26,8;27,86666667;30,2;24;0;65;;1009,4;75;75;75;75;2;VRB;6;S
20/07/2016;2016;7;20;26;30;28;28;30,6;24,5;28,1;76;;1009,7;86;70;79;78,33333333;1;SE;4;S
21/07/2016;2016;7;21;24,8;29,6;26,6;27;30,4;23,8;0;40;;1010,2;85;70;81;78,66666667;3;NE;10;NE
22/07/2016;2016;7;22;26,2;31,4;28;28,53333333;31,2;25;ttu;84;;1010,3;87;63;83;77,66666667;3;NE;7;N
23/07/2016;2016;7;23;25,6;29,6;27,2;27,46666667;30;23;0;100;;1010,2;90;69;77;78,66666667;2;SE;8;SE
24/07/2016;2016;7;24;23,4;29,8;27,4;26,86666667;30;23,4;ttu;96;;1010,1;85;68;80;77,66666667;2;SE;4;W
25/07/2016;2016;7;25;27;30;27,4;28,13333333;30,6;23,4;0;100;;1010,8;81;65;77;74,33333333;2;SW;7;SW
26/07/2016;2016;7;26;25,2;28;27,2;26,8;30,6;24,8;1,5;38;;1010,8;87;75;86;82,66666667;2;VRB;6;S
27/07/2016;2016;7;27;25,5;30,4;25;26,96666667;30,6;23,8;24,5;69;;1010,7;83;63;92;79,33333333;2;W;10;E
28/07/2016;2016;7;28;25,8;29;27,2;27,33333333;30,4;23,8;0;80;;1011,2;86;71;79;78,66666667;1;W;5;SW
29/07/2016;2016;7;29;25,4;30;27,4;27,6;30,5;25;ttu;100;;1010,7;82;65;74;73,66666667;1;S;5;S
30/07/2016;2016;7;30;26,8;30,2;27,2;28,06666667;30,3;23,4;0;90;;1010,8;74;65;80;73;1;SE;5;SE
31/07/2016;2016;7;31;25,4;30,4;27,2;27,66666667;30,4;26;0;99;;1010,9;82;64;77;74,33333333;2;W;7;S
01/08/2016;2016;8;1;27,1;29,2;26,8;27,55;30;26;0;100;;1010,4;76;56;71;69,75;2;SW;10;SW
02/08/2016;2016;8;2;25,4;29,5;26,6;26,725;29,8;24;0;90;;1009,3;79;66;80;76;2;SE;5;S
03/08/2016;2016;8;3;25,4;29,8;27,2;26,95;29,8;24;0;95;;1010;81;65;77;76;2;SE;5;SW
04/08/2016;2016;8;4;25,9;30,2;27,8;27,45;31;25,4;TTU;97,5;;1010,1;83;67;76;77,25;2;NE;6;E
05/08/2016;2016;8;5;26,6;30;27,6;27,7;30,6;26,2;0,5;81,25;;1010,4;81;70;82;78,5;3;NE;13;N
06/08/2016;2016;8;6;25;31;27,5;27,125;31,4;25;0;85;;1010,5;95;62;78;82,5;4;NE;10;NE
07/08/2016;2016;8;7;26;30;27,4;27,35;31,2;23,6;0;97,5;;1011;78;73;80;77,25;2;NE;7;NE
08/08/2016;2016;8;8;25,6;30,6;27,8;27,4;31,5;24;0,3;88,75;;1011,3;85;69;83;80,5;2;NE;5;SE
09/08/2016;2016;8;9;26;30,6;27,4;27,5;31;23,4;0;100;;1011,6;83;64;80;77,5;1;S;8;S
10/08/2016;2016;8;10;26,4;30,4;27,2;27,6;30,6;24,8;1;100;;1012,1;81;59;73;73,5;1;SE/S;5;SE
11/08/2016;2016;8;11;26;27,8;27,2;26,75;28,6;24,8;3,5;12,5;;1012,1;84;80;77;81,25;1;SW;5;SW
12/08/2016;2016;8;12;25,8;28,6;27;26,8;29;24,4;11,2;10;;1011,4;89;79;84;85,25;4;SE;10;S
13/08/2016;2016;8;13;27;29,6;27,5;27,775;30,2;23,5;46;85;;1010,9;84;68;79;78,75;2;S;7;S
14/08/2016;2016;8;14;23,8;28,6;24,1;25,075;29;22;43;18,75;;1010,7;93;76;97;89,75;2;W/NW;6;SE
15/08/2016;2016;8;15;24,8;29,4;27;26,5;30;23,6;TTU;58,75;;1010,8;84;69;80;79,25;2;SE;7;SE
16/08/2016;2016;8;16;26,2;30,4;27,2;27,5;30,6;24,5;0;100;;1010,7;80;66;80;76,5;1;S;6;SW
17/08/2016;2016;8;17;26,8;30,4;27,8;27,95;30,8;25;0;97,5;;1010,4;74;67;80;73,75;1;SE;4;SE
18/08/2016;2016;8;18;25,8;29,2;26,8;26,9;29,4;23,4;2,8;55;;1010,4;82;70;80;78,5;2;S;8;S
19/08/2016;2016;8;19;26,8;29;27;27,4;30;23;0;97,5;;1010,4;70;65;70;68,75;3;S;6;S
20/08/2016;2016;8;20;26,2;30;26,8;27,3;30,4;24;0;95;;1010,3;75;55;73;69,5;2;S;8;S
21/08/2016;2016;8;21;25;28;26,8;26,2;29;22,6;0;61,25;;1010,1;79;68;71;74,25;2;SW;7;SW
22/08/2016;2016;8;22;25,4;29,3;26,2;26,575;30;23,4;TTU;100;;1009,8;66;65;68;66,25;4;W;9;S
23/08/2016;2016;8;23;25,1;30;26,6;26,7;29,8;22,8;1,8;72,5;;1009;75;59;74;70,75;2;SW;5;SW
24/08/2016;2016;8;24;24;27,7;26;25,425;29,8;22,6;4,6;75;;1009,4;88;75;75;81,5;3;S;9;S
25/08/2016;2016;8;25;24,2;29;26,6;26;29,9;23,6;3;75;;1010,4;87;62;75;77,75;2;W S;7;W
26/08/2016;2016;8;26;25,4;29;27,2;26,75;30;24;0;50;;1010,7;84;70;83;80,25;1;SE;6;SW
27/08/2016;2016;8;27;28,2;29,9;27,8;28,525;31,5;21;0;92,5;;1011,1;75;72;79;75,25;5;NE;12;NE
28/08/2016;2016;8;28;29;32;28;29,5;32,2;25;0;100;;1010,6;72;57;78;69,75;4;NE;14;NE
29/08/2016;2016;8;29;26,8;31;27,8;28,1;31,6;24,8;27,4;97,5;;1010,5;78;60;77;73,25;4;NE;12;N
30/08/2016;2016;8;30;27,8;31,3;27,4;28,575;31,6;23,6;0;100;;1010,9;72;57;77;69,5;5;NE;18;NE
31/08/2016;2016;8;31;26,2;31,3;28,5;28,05;31,5;23,6;0;100;;1011,9;75;65;85;75;1;S;8;SE
01/09/2016;2016;9;1;27;31,2;27,5;28,175;31,2;24,2;0;100;;1011;81;66;81;77,25;3;S;7;SE
02/09/2016;2016;9;2;27,5;31,4;28;28,6;31,8;23,8;0;100;;1010,3;78;52;79;71,75;3;W;6;S
03/09/2016;2016;9;3;27,4;31,2;27,8;28,45;31,8;24,8;0;90;;1010,4;74;58;80;71,5;2;S;5;S
04/09/2016;2016;9;4;27,2;31,2;27,8;28,35;31,6;24,4;5,5;100;;1011,4;76;55;79;71,5;2;SE;7;S
05/09/2016;2016;9;5;26,8;31;28;28,15;32,4;23,2;0;100;;1011,7;86;60;75;76,75;3;NE;14;NE
06/09/2016;2016;9;6;28,2;31,2;28,2;28,95;31,5;25,8;0;100;;1012,1;72;66;83;73,25;2;S;5;SE
07/09/2016;2016;9;7;27,6;30,8;27,5;28,375;32;25;0;98,75;;1012,1;80;68;72;75;3;W;8;S
08/09/2016;2016;9;8;28;30,4;28,6;28,75;31,6;25,2;0;100;;1012,5;76;68;74;73,5;2;SW S;7;SW
09/09/2016;2016;9;9;28;31,2;27,8;28,75;31,6;25;0;100;;1012,5;76;61;75;72;2;S;7;S
10/09/2016;2016;9;10;26;31,7;27,9;27,9;31,7;23;0;100;;1010,9;79;51;70;69,75;3;W;6;S
11/09/2016;2016;9;11;28;31,2;28,1;28,825;31;24,2;1,1;100;;1010,4;66;53;73;64,5;2;SW;5;SW
12/09/2016;2016;9;12;25,8;30,1;27;27,175;30,8;24,4;0;81,25;;1011,1;78;68;77;75,25;2;SW;8;SW
13/09/2016;2016;9;13;27;29,8;27,2;27,75;30,4;23,6;0;100;;1011;74;64;79;72,75;2;SW S;6;NE
14/09/2016;2016;9;14;27;29,8;27,4;27,8;30,6;24,8;0;98,75;;1010,5;77;70;79;75,75;3;SE;10;SE
15/09/2016;2016;9;15;26,8;30,4;27,7;27,925;31,2;24;0;91,25;;1010,3;83;69;84;79,75;3;SE;9;SE
16/09/2016;2016;9;16;25,4;30,6;27,4;27,2;32,4;25;0,5;91,25;;1009,2;79;68;85;77,75;2;SE;7;SE
17/09/2016;2016;9;17;27,2;33;28;28,85;32,4;25;0,2;87,5;;1009,6;83;55;86;76,75;3;E SE;12;NE
18/09/2016;2016;9;18;26;33,4;29,6;28,75;33,8;24,4;0;100;;1009,1;84;47;64;69,75;2;N NE;8;N
19/09/2016;2016;9;19;29,2;31,8;28;29,55;32,6;25;0;100;;1008,5;67;58;82;68,5;2;S;8;SE
20/09/2016;2016;9;20;27,4;31,2;28,6;28,65;32,4;26;0;100;;1009;83;67;82;78,75;2;SE;8;S
21/09/2016;2016;9;21;28,8;31,2;28,5;29,325;32;24,4;0;100;;1009,7;76;66;81;74,75;3;NE;12;NE
22/09/2016;2016;9;22;27,1;32,3;28,7;28,8;32,3;25;0;100;;1009,6;77;63;81;74,5;2;SE;6;SE
23/09/2016;2016;9;23;28,6;31,8;28;29,25;32;25,2;4,2;85;;1008,5;76;59;80;72,75;2;S;7;SE
24/09/2016;2016;9;24;27,8;31,2;26;28,2;31,6;24,4;8,8;100;;1008,5;79;67;90;78,75;2;VRB;6;S
25/09/2016;2016;9;25;25,6;30,6;28;27,45;31,2;24,8;0;61,25;;1008,6;92;65;83;83;4;SE;15;E
26/09/2016;2016;9;26;27,7;31,8;27,6;28,7;32;23,4;2,5;97,5;;1009,3;80;59;79;74,5;2;SE;9;SE
27/09/2016;2016;9;27;26,6;31,5;28,3;28,25;32,4;24;0;78,75;;1008,9;84;61;81;77,5;2;E;8;NE
28/09/2016;2016;9;28;28;33;28,8;29,45;33,3;25;0;93,75;;1008,9;75;56;79;71,25;2;NE;8;SE
29/09/2016;2016;9;29;28;32,4;28,2;29,15;33;25;0;100;;1008,2;76;60;85;74,25;2;E;9;E
30/09/2016;2016;9;30;29;32,4;29;29,85;32,7;25,4;0;100;;1007,9;77;62;74;72,5;6;NE;18;NE
01/10/2016;2016;10;1;29;26,4;26,8;27,8;33,4;24,6;7,2;0;;1009,3;75;83;87;80;2;NE;8;NE
02/10/2016;2016;10;2;29,5;32,2;26,5;29,425;32,2;24;4,5;70;;1009,8;74;60;83;72,75;1;E;7;E
03/10/2016;2016;10;3;28,4;31,8;25,6;28,55;32;24;9;82,5;;1008,9;74;65;93;76,5;3;W;6;SW
04/10/2016;2016;10;4;26,4;31,4;28,5;28,175;32,4;24,5;0;65;;1008,4;89;60;81;79,75;2;SE;9;NE
05/10/2016;2016;10;5;27,6;32,6;29,1;29,225;33,2;24,8;0;100;;1008,8;77;57;71;70,5;3;E;10;NE
06/10/2016;2016;10;6;29,8;32,2;29;30,2;33,2;25,6;0;97,5;;1009,8;69;59;78;68,75;2;SE;10;E
07/10/2016;2016;10;7;28,2;33,1;28,1;29,4;34;26;0;91,25;;1010,2;76;54;76;70,5;2;S;8;S
08/10/2016;2016;10;8;28;29,8;26,8;28,15;31,8;25;21,2;20;;1010,4;82;76;86;81,5;2;NE;16;SE
09/10/2016;2016;10;9;26,4;29;24,5;26,575;32;23,8;27;51,25;;1010,3;84;77;92;84,25;5;NE;10;NE
10/10/2016;2016;10;10;26,4;31,3;28,3;28,1;31,8;24,5;ttu;87,5;;1009,6;86;64;78;78,5;4;NE;14;NE
11/10/2016;2016;10;11;25,6;30,2;27,7;27,275;31,6;25,3;0;80;;1009,1;85;73;80;80,75;2;SE;6;SE
12/10/2016;2016;10;12;29;32,6;28,8;29,85;33,1;25,2;0;96,25;;1008,3;73;60;78;71;5;NE;14;NE
13/10/2016;2016;10;13;29,2;32;28,8;29,8;32,6;25;0;96,25;;1008,5;75;57;75;70,5;5;NE;15;NE
14/10/2016;2016;10;14;27;32,8;29,2;29;33;24,4;0;100;;1008,5;77;53;58;66,25;4;NE;13;NE
15/10/2016;2016;10;15;29,8;32,4;29;30,25;32,6;24;0,3;100;;1009,1;69;62;74;68,5;2;VRB;14;SE
16/10/2016;2016;10;16;28,4;31,8;28,6;29,3;32,6;24;0;86,25;;1009,2;69;67;76;70,25;2;W;6;S
17/10/2016;2016;10;17;27;32;28,8;28,7;32,8;24,2;0;100;;1008,8;68;45;70;62,75;2;S;7;S
18/10/2016;2016;10;18;28;33;28,8;29,45;32,6;25,8;0;100;;1008,7;66;45;74;62,75;2;S;5;W
19/10/2016;2016;10;19;29,6;33,2;30;30,6;33,5;25,6;0;100;;1007,8;70;57;78;68,75;1;S;5;E
20/10/2016;2016;10;20;29,2;31,8;29;29,8;32,6;26,6;0;100;;1008,2;71;65;71;69,5;2;S;11;S
21/10/2016;2016;10;21;29,2;32;27,8;29,55;32,8;0;0;75;;1009,2;75;67;75;73;2;E;12;NE
22/10/2016;2016;10;22;29,2;29,9;28;29,075;31,4;25,2;2,1;35;;1009,5;75;65;76;72,75;6;NE;21;E
23/10/2016;2016;10;23;25,8;29,9;28,1;27,4;31,6;25;0,5;2,5;;1009,1;92;67;70;80,25;4;NE;16;NE
24/10/2016;2016;10;24;27;28,6;25,8;27,1;31,2;24,2;0,8;43,75;;1009,2;81;75;87;81;1;S;7;S
25/10/2016;2016;10;25;27,4;31,6;28;28,6;32;25;0,1;63,75;;1009,2;74;63;80;72,75;3;NE;9;NE
26/10/2016;2016;10;26;27;29,7;28,7;28,1;31,8;25;0,7;58,75;;1010;77;67;75;74;1;SE;6;SE
27/10/2016;2016;10;27;27,8;32;28,6;29,05;33;25,6;1,3;87,5;;1010,2;79;61;74;73,25;3;W;9;SE
28/10/2016;2016;10;28;29,8;32,6;28,6;30,2;32,6;25;0;80;;1009,2;68;54;79;67,25;2;VRB;7;E
29/10/2016;2016;10;29;29,9;32,7;28,5;30,25;33,4;25,8;1,9;96,25;;1009,5;66;56;78;66,5;2;W;7;SE
30/10/2016;2016;10;30;30;32,5;28,6;30,275;33;25,2;0,1;92,5;;1009,4;69;62;79;69,75;2;SW;8;SE
31/10/2016;2016;10;31;30,2;31,8;28,9;30,275;33;25,2;0;97,5;;1009,4;67;64;77;68,75;3;VRB;8;SE
01/11/2016;2016;11;1;29,8;32,6;29,4;30,6;33,2;25,8;0;100;;1009,8;69;58;74;67;2;SE;8;SE
02/11/2016;2016;11;2;29,8;32,6;29,2;30,53333333;33;25,5;0;94;;1009,8;69;57;77;67,66666667;3;W;7;S
03/11/2016;2016;11;3;30;32,5;29,2;30,56666667;33;26;0;100;;1009,4;67;60;76;67,66666667;3;VRB;10;S
04/11/2016;2016;11;4;26,2;32,8;29,6;29,53333333;32,9;26,2;0,5;100;;1009,1;87;59;73;73;2;VRB;7;NE
05/11/2016;2016;11;5;30,7;32,7;29;30,8;33;25,8;0,1;100;;1009,6;67;57;81;68,33333333;3;SE;6;SE
06/11/2016;2016;11;6;27,8;33,6;29,5;30,3;32,6;26;0;94;;1010,4;82;56;68;68,66666667;1;VRB;5;S
07/11/2016;2016;11;7;29,2;33,2;29,8;30,73333333;34;25,8;0;90;;1010,2;74;59;78;70,33333333;3;NE;9;E
08/11/2016;2016;11;8;31;34;25,6;30,2;34,6;25,4;24,1;96;;1010,2;70;57;92;73;2;W;10;NW
09/11/2016;2016;11;9;27,6;30;26,2;27,93333333;31,6;24,2;0,5;35;;1010,8;88;68;86;80,66666667;2;NE;8;SE
10/11/2016;2016;11;10;29,6;30,4;27,8;29,26666667;32;25;0;6;;1010,7;66;69;72;69;2;W;7;W
11/11/2016;2016;11;11;28;28;25,7;27,23333333;30;24;2;60;;1010,2;71;71;81;74,33333333;2;SE;8;S
12/11/2016;2016;11;12;27,6;32;28,4;29,33333333;32;25;4,1;88;;1009,5;77;62;78;72,33333333;2;SE;6;SE
13/11/2016;2016;11;13;25,8;31,2;27,6;28,2;31,2;24,4;0,2;75;;1008,9;90;67;73;76,66666667;3;VRB;8;SE
14/11/2016;2016;11;14;29,4;32,6;28,6;30,2;33;25,2;0;60;;1008,3;70;52;79;67;3;NE;9;NE
15/11/2016;2016;11;15;28;29,7;25,7;27,8;32,6;24,5;15;59;;1009,1;79;68;93;80;2;VRB;6;W
16/11/2016;2016;11;16;27,6;30,2;28,8;28,86666667;32;25;3,5;100;;1008,9;82;73;82;79;2;SW;5;W
17/11/2016;2016;11;17;28,2;31,2;28,6;29,33333333;31,2;24,6;0;80;;1008,2;78;71;82;77;2;SE;8;SE
18/11/2016;2016;11;18;29,8;32;29,8;30,53333333;32;25,8;0;100;;1007,3;73;61;77;70,33333333;1;SE;6;SE
19/11/2016;2016;11;19;30;32,8;29;30,6;34;25,8;0;100;;1007,4;72;62;76;70;1;W;7;SE
20/11/2016;2016;11;20;30,4;33;29,8;31,06666667;33,2;25,8;0;96;;1007,1;69;60;76;68,33333333;2;VRB;7;NE
21/11/2016;2016;11;21;29;32;29,2;30,06666667;32,8;26,2;0;90;;1007,5;75;67;75;72,33333333;3;SE;9;SE
22/11/2016;2016;11;22;27,6;30,9;27,2;28,56666667;32,4;26;TTU;0;;1008,3;79;69;82;76,66666667;1;SE;8;SE
23/11/2016;2016;11;23;27,4;27,6;25,6;26,86666667;32;24;12,8;11;;1008,1;79;84;92;85;2;SW;8;S
24/11/2016;2016;11;24;25,6;30,5;27,7;27,93333333;32;25,4;0,3;50;;1007,2;89;65;77;77;2;W;6;SE
25/11/2016;2016;11;25;26,2;27,7;26,5;26,8;31,2;24,3;1,9;11;;1007,8;87;83;89;86,33333333;1;NW;6;W
26/11/2016;2016;11;26;26,6;31;28,4;28,66666667;32,6;24;52;94;;1007,5;80;65;82;75,66666667;3;W;10;SE
27/11/2016;2016;11;27;27;32,8;28,1;29,3;32,5;25,2;0;91;;1007,7;92;64;84;80;2;SE;6;S
28/11/2016;2016;11;28;30,1;31,4;28,8;30,1;32,6;25,5;0,5;69;;1008,5;71;69;82;74;1;S;5;SE
29/11/2016;2016;11;29;27,6;33,4;25,8;28,93333333;33,4;24,8;TTU;85;;1009,2;77;64;87;76;2;SE/S;8;SE
30/11/2016;2016;11;30;29,2;31,3;26,7;29,06666667;32,4;24,2;4,2;48;;1009,4;66;69;87;74;1;W;5;SE
01/12/2016;2016;12;1;28,3;27,5;26,3;27,6;32,6;24,2;9,1;54;;1009,6;77;75;90;80;2;W;10;SE
02/12/2016;2016;12;2;27;30;24,8;27,2;30;23,6;6,2;23;;1009,5;81;72;92;82;3;VRB;11;E
03/12/2016;2016;12;3;25,8;26,4;25,4;25,9;29,6;23;3;23;;1009,6;84;90;92;88;1;W;4;SW
04/12/2016;2016;12;4;25,8;26,2;27;26,2;30;24,8;4,9;19;;1008,3;81;86;86;84;1;VRB;8;S
05/12/2016;2016;12;5;26,8;29;25,7;27,1;29,6;24;4,3;8;;1007,9;81;78;91;82,75;2;NE;7;N
06/12/2016;2016;12;6;25,4;31;28,1;27,5;30,6;24,6;0;35;;1008,1;89;68;75;80;3;NE;10;NE
07/12/2016;2016;12;7;28,6;32;29;29,6;33,8;24,8;0;56;;1007,3;77;65;78;74;2;SW;8;E
08/12/2016;2016;12;8;26,5;29,5;27,8;27,6;30,4;24,8;21;0;;1008,1;89;73;79;83;2;VRB;11;N
09/12/2016;2016;12;9;26,8;30,6;27,3;27,9;30,9;24,4;0;0;;1006,9;84;72;80;80;1;SW;6;SE
10/12/2016;2016;12;10;28,3;29;27,2;28,2;30,8;23,5;0;83;;1007,8;74;75;81;76;1;VRB;5;SW
11/12/2016;2016;12;11;28;32,1;24,8;28,2;33,6;23;47;0;;1008,5;76;69;93;79;1;E;4;SW
12/12/2016;2016;12;12;24,6;29;24,5;25,7;30;23,8;2,8;0;;1008,3;90;75;95;88;1;SW;6;SW
13/12/2016;2016;12;13;27,4;29,4;26,4;27,7;30;23,6;1,6;1;;1009,7;76;73;83;77;2;E;9;NE
14/12/2016;2016;12;14;24,5;28,6;24,3;25,5;33,8;23,4;22,5;9;;1008,2;87;71;95;85;1;SE;9;W
15/12/2016;2016;12;15;25,4;30,9;27,3;27,3;31,2;24,2;0;44;;1010;85;67;79;79;2;SE;6;SE
16/12/2016;2016;12;16;27,7;30,2;25,6;27,8;32;24,5;15,6;43;;1009,1;75;72;95;79;1;NE;7;NE
17/12/2016;2016;12;17;25,8;31,3;26,1;27,3;31,2;24,5;13,8;38;;1008,9;87;69;93;84;2;NE;6;NE
18/12/2016;2016;12;18;27,7;31,6;25,4;28,1;33;25,2;9,4;75;;1008,4;78;66;90;78;1;E;9;E
19/12/2016;2016;12;19;28,8;32,2;25;28,7;33;24,4;54;75;;1007;77;60;98;78;2;SE;6;E
20/12/2016;2016;12;20;27;31,6;29,6;28,8;32,5;26,2;0,4;94;;1005,9;87;60;76;78;2;NE;9;NE
21/12/2016;2016;12;21;27,5;33,4;26,8;28,8;33,6;24,8;19,1;73;;1004,8;84;54;92;79;2;N;6;SE
22/12/2016;2016;12;22;27,4;33,3;29,4;29,4;33,2;25,9;0;88;;1005,6;83;53;69;72;2;E;6;E
23/12/2016;2016;12;23;29,7;29,6;27,3;29,1;33;25,4;ttu;63;;1005,1;73;70;89;76;3;NE;11;NE
24/12/2016;2016;12;24;28;30,7;29;28,9;32,5;25;0;50;;1007,1;80;66;71;74;2;NE;6;NE
25/12/2016;2016;12;25;26;32;27,4;27,9;34;25,2;0,5;50;;1006,7;83;62;62;88;2;SW;5;SW
26/12/2016;2016;12;26;28,4;33,3;29;29,8;33,5;24,4;0;79;;1007,9;71;62;70;69;3;S;14;SE
27/12/2016;2016;12;27;29;32,5;26,6;29,3;32,6;24,8;10,2;69;;1007,5;70;64;89;73;2;E;6;SE
28/12/2016;2016;12;28;25,9;32,4;28,5;28,2;32,6;24,1;0;53;;1007,8;87;59;76;77;1;SW;5;SW
29/12/2016;2016;12;29;29;28,5;26,7;28,3;31,4;25;3,5;0;;1009,1;68;78;90;76;2;SW;7;SESW
30/12/2016;2016;12;30;26,3;28,6;26,8;27;31,3;24,4;6;30;;1008,2;89;72;89;85;2;VRB;6;SE
31/12/2016;2016;12;31;"26;5";•30.0;27,4;27,6;31,4;25;0,9;38;;1008,5;80;69;86;79;2;SW;8;SE
01/01/2017;2017;1;1;27,8;29;25,9;27,56666667;31,3;24,4;13,5;46,25;;1003,6;74;77;93;79,5;1;S;7;E
02/01/2017;2017;1;2;27,2;29,8;26;27,66666667;29,8;23,6;2,7;2,5;;1003;81;76;92;82,5;1;NE;8;NE
03/01/2017;2017;1;3;26,6;27,4;26;26,66666667;28;24;4,9;25;;1002,8;83;85;92;85,75;1;E;5;E
04/01/2017;2017;1;4;27,7;30,8;28,9;29,13333333;31,6;24,8;-;88,75;;1002,1;80;70;77;76,75;2;E;7;S
05/01/2017;2017;1;5;28,8;31,2;27,6;29,2;32,2;24,4;1,5;78,75;;1002,8;76;70;91;78,25;2;NE;7;E
06/01/2017;2017;1;6;27,6;30,2;28;28,6;32;24,8;-;38,75;;1001,9;76;64;79;73,75;2;NE;8;NE
07/01/2017;2017;1;7;27,8;32;26,1;28,63333333;32,4;25,2;ttu;82,5;;1001,3;80;57;82;74,75;2;E;10;N
08/01/2017;2017;1;8;27,2;31,4;26,4;28,33333333;31,6;24,2;4,5;25;;1001,7;79;64;92;78,5;1;NE;6;NE
09/01/2017;2017;1;9;27;30,2;25,4;27,53333333;30,8;24,6;11,6;46,25;;1002,1;84;74;89;82,75;2;E;7;NE
10/01/2017;2017;1;10;26,6;30,8;27,4;28,26666667;31,2;24,4;0,5;27,5;;1003,1;89;68;88;83,5;1;VRB;5;SE
11/01/2017;2017;1;11;26,4;31,5;27,4;28,43333333;32,6;24,7;36,8;67,5;;1003,1;90;59;86;81,25;2;W;8;SE
12/01/2017;2017;1;12;26,5;30,7;26,1;27,76666667;31,8;23,6;32,5;60;;1002,3;84;66;91;81,25;2;VRB;7;N
13/01/2017;2017;1;13;27,5;30,8;26,2;28,16666667;31,6;24,6;0,5;55;;1002,3;81;64;84;77,5;3;E;7;NE
14/01/2017;2017;1;14;25,8;31,6;28,6;28,66666667;31,8;25,2;0,1;50;;1002,3;81;63;75;75;2;NE;7;E
15/01/2017;2017;1;15;26;29;27;27,33333333;29,8;24,2;1,5;0;;1003,2;92;73;84;85,25;1;NE;4;SE
16/01/2017;2017;1;16;26,2;27,8;26;26,66666667;29,4;24;1,5;15;;1003,6;81;80;89;82,75;2;NE;8;NE
17/01/2017;2017;1;17;24,4;26,8;25,2;25,46666667;29,6;24;2,5;6,25;;1003,9;95;84;90;91;2;E;8;NE
18/01/2017;2017;1;18;26,4;30;26,2;27,53333333;30,4;24,4;8,9;25;;1006,2;79;70;89;79,25;2;VRB;4;SW
19/01/2017;2017;1;19;26,8;30,5;25,2;27,5;31,2;24,2;19,5;40;;1006,1;83;66;92;81;1;S;4;E
20/01/2017;2017;1;20;26,6;30,7;28,2;28,5;30,8;24,2;-;37,5;;1004,3;83;72;75;78,25;2;SE;8;SE
21/01/2017;2017;1;21;28,4;30,7;25,8;28,3;31,3;23,6;9,5;38,75;;1004,7;70;64;90;73,5;2;NE;9;N
22/01/2017;2017;1;22;26,5;29,2;26,4;27,36666667;31,4;23,6;33,5;36,25;;1006,1;83;74;92;83;2;W;5;E
23/01/2017;2017;1;23;25,5;24,5;25;25;30,6;24;30,5;37,5;;1005,5;88;94;92;90,5;2;NW;8;SW
24/01/2017;2017;1;24;26,2;29,6;28;27,93333333;30,4;24;-;28,75;;1004,7;79;69;79;76,5;3;NE;14;NE
25/01/2017;2017;1;25;27,8;30,5;26,4;28,23333333;32,4;25;3;56,25;;1005;73;70;89;76,25;3;NW;14;SW
26/01/2017;2017;1;26;27;30,6;25,6;27,73333333;32;24,4;5,7;50;;1004,2;80;71;93;81;2;E;9;E
27/01/2017;2017;1;27;25,6;32,8;25,8;28,06666667;30,6;24,4;11,8;50;;1002,1;87;58;94;81,5;1;VRB;6;NE
28/01/2017;2017;1;28;25,8;30,2;27,2;27,73333333;30;24,8;ttu;7,5;;1001,5;89;71;84;83,25;3;NE;8;NE
29/01/2017;2017;1;29;26,4;29,6;26,3;27,43333333;32,2;25;1,8;16,25;;1002,8;81;65;83;77,5;3;NE;12;NE
30/01/2017;2017;1;30;25;28,2;27,4;26,86666667;31,6;24;5;0;;1003,8;91;83;85;87,5;3;SE;7;SE
31/01/2017;2017;1;31;24,5;28;25,4;25,96666667;31;23,2;0,2;0;;1003,8;91;83;85;87,5;2;VRB;6;SE
01/02/2017;2017;2;1;25,6;28,4;29,2;27,2;30,4;25;-;0;;1004,4;82;81;62;76,75;3;S;9;SW
02/02/2017;2017;2;2;26;28,3;27,3;26,9;29,8;23;1;3;;1003,5;83;73;68;76,75;4;SW;12;SW
03/02/2017;2017;2;3;25,1;26,5;26,6;25,825;29,4;31,7;0,2;11;;1002,2;86;75;75;80,5;2;SW;11;SW
04/02/2017;2017;2;4;26,5;31,6;28;28,15;31,7;25,2;-;69;;1001,7;77;55;75;71;2;NE;9;E
05/02/2017;2017;2;5;26,8;31,4;28,6;28,4;32,4;25,2;-;69;;1000,6;81;59;74;73,75;3;SW;10;SW
06/02/2017;2017;2;6;26,7;32;29,2;28,65;33;24,8;-;50;;999,7;75;61;65;69;4;NE;9;NE
07/02/2017;2017;2;7;28,8;32,6;28,1;29,575;33;24,8;7,5;81;;999,1;72;58;79;70,25;3;S;8;NE
08/02/2017;2017;2;8;27,4;30,9;27,6;28,325;32;25;-;64;;1000,3;74;67;80;73,75;2;VRB;5;E
09/02/2017;2017;2;9;27;30,2;27;27,8;30,8;24;124;19;;1001,2;81;69;89;80;1;NE;6;SW
10/02/2017;2017;2;10;25,6;31,2;27,6;27,5;31,2;24,6;22;40;;1001,8;90;70;82;83;1;SE;6;SE
11/02/2017;2017;2;11;27;29,8;26,4;27,55;31;24,6;15,2;30;;1004,3;84;72;87;81,75;2;E;7;S
12/02/2017;2017;2;12;24,7;28;25,6;25,75;28,4;23;25,2;0;;1006,6;96;85;90;91,75;1;SW;4;W
13/02/2017;2017;2;13;26,9;30;27;27,7;31;23,4;0,2;63;;1006,6;80;77;81;79,5;1;SE;5;E
14/02/2017;2017;2;14;28,8;26,2;25,5;27,325;31;23,4;9,9;30;;1007,5;67;89;91;78,5;2;VRB;6;NE
15/02/2017;2017;2;15;27,9;29,5;28,3;28,4;32,8;23,2;-;94;;1007,1;73;72;76;73,5;1;S;7;S
16/02/2017;2017;2;16;25,3;26,7;26;25,825;30,7;23,4;20;33;;1005,7;80;87;91;84,5;1;NE;5;SENE
17/02/2017;2017;2;17;28,6;29,3;25,4;27,975;32,8;23,8;10,5;56;;1006,1;71;76;93;77,75;1;SE;7;SE
18/02/2017;2017;2;18;27,4;30;27,8;28,15;31,4;25;-;46;;1006,6;76;70;85;76,75;5;NE;13;NE
19/02/2017;2017;2;19;27,8;31,4;28,2;28,8;32;25;-;71;;1005,7;83;69;83;79,5;3;NE;9;N
20/02/2017;2017;2;20;27,6;32;28,3;28,875;32,3;25;-;90;;1004,4;74;63;80;72,75;3;NE;10;E
21/02/2017;2017;2;21;29,2;31,5;28,5;29,6;32,3;25,6;-;93;;1005;73;68;81;73,75;4;NE;14;NE
22/02/2017;2017;2;22;29,2;32;28,7;29,775;32,4;25,8;-;89;;1006,5;75;60;74;71;2;SW;6;S
23/02/2017;2017;2;23;26,8;31,8;29;28,6;32,4;25;-;100;;1005,6;78;56;77;72,25;3;W;7;S
24/02/2017;2017;2;24;28;32;29;29,25;32,2;25;-;100;;1006,3;78;55;73;71;2;NW;5;NW
25/02/2017;2017;2;25;25;31,6;29;27,65;31,6;24;-;93;;1005,5;79;62;74;73,5;3;NW;7;SE
26/02/2017;2017;2;26;25,6;31,6;28,2;27,75;32,8;23,9;-;88;;1003,4;79;57;73;72;3;E;10;NE
27/02/2017;2017;2;27;29,1;32,1;27,4;29,425;33;24,2;-;85;;1003,9;67;63;76;68,25;3;NE;10;NE
28/02/2017;2017;2;28;28,9;31,6;28,2;29,4;32,4;24,8;-;100;;1004,2;65;63;79;68;3;E;9;E
01/03/2017;2017;3;1;28,8;32,5;29;29,775;32,6;25,6;-;93,75;;1003,9;69;58;77;68,25;3;VRB;9;NE
02/03/2017;2017;3;2;27;32,3;29,1;28,85;32,4;25,4;0,2;88,75;;1003,5;80;55;76;72,75;1;S;6;S
03/03/2017;2017;3;3;29,4;30,2;29,2;29,55;32,6;25;19,2;58,75;;1002,6;67;69;75;69,5;1;W;5;SW
04/03/2017;2017;3;4;27,6;32,2;28,8;29,05;32,5;25,4;-;96,25;;1002,2;74;62;78;72;2;SE;8;E
05/03/2017;2017;3;5;28;32;28,9;29,225;33,6;26;-;90;;1003,3;75;62;74;71,5;2;SE;7;SE
06/03/2017;2017;3;6;27,6;33;30;29,55;33;24,4;-;97,5;;1002,2;77;60;76;72,5;3;VRB;6;E
07/03/2017;2017;3;7;25,8;33;30;28,65;33,2;25;-;93,75;;1002,5;82;65;76;76,25;2;VRB;7;E
08/03/2017;2017;3;8;25,7;33,2;29;28,4;33,6;24;-;30;;1003,3;82;62;72;74,5;3;VRB;9;SW
09/03/2017;2017;3;9;27;31;29;28,5;32;24,2;-;70;;1003,5;71;65;74;70,25;1;SE;7;SE
10/03/2017;2017;3;10;24,4;30,5;27,8;26,775;31,8;23,2;-;58,75;;1003,4;83;60;74;75;1;VRB;9;SE
11/03/2017;2017;3;11;28,6;32;28,7;29,475;32,5;24,1;-;67,5;;1005;64;55;77;65;2;NE;10;N
12/03/2017;2017;3;12;28,5;32,5;28,6;29,525;33,3;24,6;ttu;98,75;;1005,4;72;61;76;70,25;2;VRB;12;NE
13/03/2017;2017;3;13;26,3;31,6;26,4;27,65;33;24,2;7,2;67,5;;1005,4;80;66;86;78;2;VRB;11;NW
14/03/2017;2017;3;14;25,4;28,3;24,8;25,975;31,6;23,5;25,5;50;;1004,8;85;77;92;84,75;1;VRB;12;W
15/03/2017;2017;3;15;26;30,3;27,4;27,425;31,6;24,5;-;81,25;;1004,3;81;71;77;77,5;3;NE;9;NE
16/03/2017;2017;3;16;26,8;32,2;28,4;28,55;32,2;24,6;-;100;;1004,3;80;66;78;76;4;NE;14;NE
17/03/2017;2017;3;17;26,4;28,4;28,2;27,35;32,4;25;-;43,75;;1005,6;81;79;82;80,75;1;S;5;S
18/03/2017;2017;3;18;28;30,4;27,8;28,55;32,4;25;-;47,5;;1006;78;69;79;76;2;W;8;NE
19/03/2017;2017;3;19;28,7;25,6;26,4;27,35;32;24;7,2;42,5;;1005,1;75;89;90;82,25;2;S;10;N
20/03/2017;2017;3;20;26;27,6;25;26,15;30,6;23,8;7,4;50;;1004;90;82;93;88,75;2;VRB;11;NE
21/03/2017;2017;3;21;25,2;25,7;26,8;25,725;31;24;24,3;20;;1003,6;92;92;85;90,25;2;NE;6;NE
22/03/2017;2017;3;22;26;31,3;29,1;28,1;31,5;25;7;0;;1004,2;83;66;76;77;2;NW;6;E
23/03/2017;2017;3;23;26,2;29,6;26,9;27,225;31,8;24,6;0,9;36,25;;1004,5;90;78;89;86,75;2;NE;8;SE
24/03/2017;2017;3;24;26;31,3;26,9;27,55;32;24,4;-;68,75;;1004,9;81;71;81;78,5;3;NE;9;E
25/03/2017;2017;3;25;26,7;32,3;26,5;28,05;32,7;25;12,4;62,5;;1004,7;81;59;94;78,75;2;VRB;10;N
26/03/2017;2017;3;26;25,2;29,1;27;26,625;29,4;24,7;0,6;0;;1005,2;95;76;83;87,25;1;E;6;E
27/03/2017;2017;3;27;25,6;28;26,9;26,525;28,6;24;ttu;0;;1007,1;89;71;84;83,25;1;NW;8;SE
28/03/2017;2017;3;28;28;32;28,6;29,15;32;24,2;-;93,75;;1006,6;72;62;78;71;3;NE;7;NE
29/03/2017;2017;3;29;25;29,6;28,3;26,975;32,7;23,6;-;62,5;;1005,9;84;76;74;79,5;2;NW;5;E
30/03/2017;2017;3;30;28,3;31,8;26,2;28,65;33;23,2;5,2;70;;1006,7;72;57;90;72,75;1;S;6;E
31/03/2017;2017;3;31;25,8;30,2;25,4;26,8;33,2;24,4;4;63,75;;1006,2;82;67;91;80,5;2;W;7;E
01/04/2017;2017;4;1;28,5;32,5;28,4;29,475;32,6;25;0,2;100;;1005,6;70;60;75;68,75;2;S;7;SE
02/04/2017;2017;4;2;29,1;31,8;28,7;29,675;33,2;24,5;15;87,5;;1005,3;69;63;79;70;2;SW;5;S
03/04/2017;2017;4;3;27,4;31,3;24,9;27,75;32,3;23,4;27,6;66,25;;1005;79;60;93;77,75;3;W;10;SE
04/04/2017;2017;4;4;24,8;27,2;25,2;25,5;28,2;23,6;2;0;;1004,8;88;84;95;88,75;2;W;6;SW
05/04/2017;2017;4;5;25,6;27,6;27,8;26,65;29,4;25;-;31,25;;1003,4;85;88;86;86;4;NE;14;NE
06/04/2017;2017;4;6;25,7;28,4;27,2;26,75;28,4;25;1,5;0;;1002,2;91;78;86;86,5;3;NE;8;NE
07/04/2017;2017;4;7;25;30,5;26,5;26,75;30,8;25;13,3;10;;1002,8;95;75;93;89,5;2;W;5;E
08/04/2017;2017;4;8;25,7;33,2;29;28,4;33,6;24,6;0,1;0;;1003,3;82;62;72;74,5;3;SW;9;SW
09/04/2017;2017;4;9;25,8;30,8;28;27,6;31,4;25,2;1;55;;1005,7;90;71;88;84,75;1;VRB;5;S
10/04/2017;2017;4;10;27;31,8;28,7;28,625;32;24,6;-;100;;1004,6;84;63;81;78;1;W;3;SW
11/04/2017;2017;4;11;28,3;32,8;29;29,6;32,8;24,5;24,5;100;;1004,4;74;57;76;70,25;1;SW;6;SW
12/04/2017;2017;4;12;26,4;32,2;29;28,5;32,4;24,8;20,6;98,75;;1004,4;83;61;77;76;2;VRB;6;SW
13/04/2017;2017;4;13;26,3;30,8;29,8;28,3;31,4;25,4;ttu;76,25;;1005,8;81;63;66;72,75;1;W;5;SW
14/04/2017;2017;4;14;29,1;30,3;29;29,375;31;24;-;62,5;;1006;69;62;66;66,5;1;W;4;S
15/04/2017;2017;4;15;26;31,2;28,6;27,95;31,8;22,5;-;87,5;;1005,2;78;61;75;73;1;SE;6;E
16/04/2017;2017;4;16;27,2;32,4;29,8;29,15;33;24,6;-;100;;1004,4;70;46;69;63,75;1;VRB;5;SE
17/04/2017;2017;4;17;27,3;32,2;29;28,95;32,8;24,6;0,4;77,5;;1004,3;78;56;78;72,5;2;NE;12;NE
18/04/2017;2017;4;18;28,5;32,6;28,4;29,5;33;25,6;-;81,25;;1005,3;83;58;77;75,25;2;NE;18;N
19/04/2017;2017;4;19;25,4;31,7;28,6;27,775;32;24,5;4;85;;1005;87;63;82;79,75;3;SE;8;SE
20/04/2017;2017;4;20;27,8;31,8;29,4;29,2;32;25;-;100;;1007;83;65;78;77,25;1;W;5;S
21/04/2017;2017;4;21;28,4;30,8;28,6;29,05;32,2;25,8; ttu;62,5;;1006,5;78;71;83;77,5;1;SE;6;S
22/04/2017;2017;4;22;28,2;32,2;29,4;29,5;32,2;25,2;0,9;91,25;;1005,7;76;64;79;73,75;2;S;9;S
23/04/2017;2017;4;23;28,3;31,4;29,4;29,35;33,8;24,8;-;100;;1005,6;81;65;77;76;3;SE;10;E
24/04/2017;2017;4;24;26,7;32,1;29;28,625;32,2;24,2;-;100;;1005,9;84;57;75;75;4;W;14;E
25/04/2017;2017;4;25;26,8;31,6;29;28,55;32,6;24,4;-;100;;1005,6;80;58;76;73,5;2;W;6;SE
26/04/2017;2017;4;26;29,7;32;28,2;29,9;32,4;25,7;-;96,25;;1005,5;64;67;76;67,75;2;NW;5;SW
27/04/2017;2017;4;27;29,4;32,3;29;30,025;32,6;25;-;91,25;;1005,4;69;57;75;67,5;2;W;5;W
28/04/2017;2017;4;28;27;32,2;28,6;28,7;32,4;25;-;100;;1006;73;61;76;70,75;2;S;8;W
29/04/2017;2017;4;29;28,6;31,7;29;29,475;32;26;0,2;100;;1005,9;72;60;76;70;2;S;8;S
30/04/2017;2017;4;30;26,8;32,2;28,8;28,65;32;24,7;ttu;100;;1006,9;78;59;78;73,25;3;W;5;S
01/05/2017;2017;5;1;29,2;31,5;27;29,225;32,5;25,4;25,9;98;;1006,4;72;66;89;74,75;4;W;8;SW
02/05/2017;2017;5;2;28,5;30,4;26,4;28,45;31,8;24;7,3;99;;1006,2;81;73;87;80,5;2;W;6;S
03/05/2017;2017;5;3;26;29,7;27,3;27,25;31,4;24;-;100;;1005,8;89;78;84;85;1;E;6;NE
04/05/2017;2017;5;4;27,4;30,8;27,9;28,375;31,7;25;-;90;;1006,5;74;69;82;74,75;2;S;6;S
05/05/2017;2017;5;5;27,2;30,2;26;27,65;32,2;25,8;2,5;70;;1006,9;80;71;89;80;2;W;6;W
06/05/2017;2017;5;6;28,2;31;28,4;28,95;31,4;25;0,5;91;;1008,3;79;70;79;76,75;1;SW;7;SW
07/05/2017;2017;5;7;27;30,2;27,8;28;31;26;-;69;;1007,6;86;68;80;80;4;W;10;SE
08/05/2017;2017;5;8;27,2;31,2;26,7;28,075;31,4;24,8;4,5;63;;1007;81;62;91;78,75;2;W;5;W
09/05/2017;2017;5;9;28,9;30,6;28,2;29,15;31,2;25;-;30;;1006,4;75;71;76;74,25;1;W;7;W
10/05/2017;2017;5;10;28,3;31,4;28,2;29,05;31,4;24,4;1,1;78;;1006,8;74;59;79;71,5;1;S;5;S
11/05/2017;2017;5;11;27,4;31;28,2;28,5;31,4;24,8;0,3;56;;1006,1;78;67;78;75,25;1;SW;8;W
12/05/2017;2017;5;12;27,4;30,4;28;28,3;31;23,8;-;83;;1005,8;76;71;79;75,5;4;W;6;SW
13/05/2017;2017;5;13;25,6;30,6;27,8;27,4;30,8;25,6;-;88;;1005,3;78;66;79;75,25;2;SW;7;W
14/05/2017;2017;5;14;27,2;31,1;27,9;28,35;31,2;25,8;-;85;;1005,6;83;62;80;77;2;W;4;E
15/05/2017;2017;5;15;27,7;30,8;28;28,55;31,6;26;-;69;;1005,4;81;70;82;78,5;1;SW;5;SW
16/05/2017;2017;5;16;27,6;31,1;27,5;28,45;31,4;24,5;-;81;;1005,5;80;62;77;74,75;3;W;5;SW
17/05/2017;2017;5;17;27,6;31,3;27,7;28,55;31,4;24,6;-;100;;1005,5;72;57;74;68,75;3;W;5;W
18/05/2017;2017;5;18;26,4;30,8;27,4;27,75;31,2;24,2;-;100;;1007,2;75;53;70;68,25;3;W;7;SW
19/05/2017;2017;5;19;26,8;30,5;27,4;27,875;31;23,4;-;84;;1006,6;84;57;76;75,25;3;W;6;SW
20/05/2017;2017;5;20;27,3;30,4;27,6;28,15;31;23,6;-;100;;1005,8;73;61;78;71,25;3;W;7;S
21/05/2017;2017;5;21;27;29,9;27,9;27,95;29,9;25,2;-;100;;1004,5;76;61;78;72,75;2;W;5;W
22/05/2017;2017;5;22;28,2;31,2;27,7;28,825;31,2;24,8;-;73;;1006,8;73;60;78;71;3;SW;10;SW
23/05/2017;2017;5;23;27,8;30,8;27,6;28,5;30,8;23,4;-;100;;1007,5;74;53;72;68,25;2;SW;7;SW
24/05/2017;2017;5;24;25,2;30,2;27,4;27;30,6;25,2;0,8;100;;1007;78;62;79;74,25;2;SW;7;E
25/05/2017;2017;5;25;26,7;29,6;28;27,75;32,3;25,6;12,5;100;;1005,7;82;74;85;80,75;4;W;6;W
26/05/2017;2017;5;26;26;27,6;26,4;26,5;28,8;25;21;100;;1005,6;94;88;94;92,5;3;SW;4;SW
27/05/2017;2017;5;27;25,6;29,5;26,6;26,825;30;25,1;2;79;;1004,8;87;78;87;84,75;2;S;6;SE
28/05/2017;2017;5;28;27,3;28,8;27;27,6;30,5;25;72,5;73;;1004,8;89;80;87;86,25;2;W;7;SE
29/05/2017;2017;5;29;27,2;29;26,5;27,475;30,2;25;-;78;;1005,2;86;77;87;84;2;W;6;SW
30/05/2017;2017;5;30;26,3;30;27,2;27,45;30,6;25,4;-;53;;1005,9;83;76;89;82,75;2;S;9;SE
31/05/2017;2017;5;31;26,2;30,6;27,6;27,65;30,6;25,8;-;73;;1006,2;92;74;89;86,75;2;S;5;SW
01/06/2017;2017;6;1;26,9;29;26,6;27,35;30;25,7;-;82,5;;1006,7;87;75;87;84;2;SW;8;SE
02/06/2017;2017;6;2;27,3;30;27;27,9;30;25;-;86,25;;1007,5;88;72;81;82,25;3;SW;10;S
03/06/2017;2017;6;3;27,1;29,6;26,6;27,6;30,3;25;-;92,5;;1008,7;79;69;83;77,5;3;W;6;SW
04/06/2017;2017;6;4;26;30,6;27,4;27,5;30,8;24,6;ttu;97,5;;1007,7;79;60;84;75,5;3;W;5;W
05/06/2017;2017;6;5;26,4;30;27,4;27,55;30,8;24;-;97,5;;1006,5;78;70;86;78;2;S;6;SE
06/06/2017;2017;6;6;26,2;30,2;27,6;27,55;31,2;25,1;-;100;;1007,1;83;71;82;79,75;2;W;6;SE
07/06/2017;2017;6;7;27,6;30,2;27,2;28,15;31,2;23,8;24,5;85;;1007,3;85;70;89;82,25;2;S;5;SW
08/06/2017;2017;6;8;23,8;29,5;27;26,025;29,8;24,2;1,9;43,75;;1007,4;97;75;87;89;2;SW;7;SW
09/06/2017;2017;6;9;25,6;29;27;26,8;29,7;25;-;81,25;;1006,7;92;77;86;86,75;3;S;7;S
10/06/2017;2017;6;10;26,4;30,1;27,2;27,525;30,2;25,4;1;100;;1008,2;86;71;83;81,5;3;S;8;W
11/06/2017;2017;6;11;25,6;29,8;27,2;27,05;30;25,6;1,5;65;;1006,8;92;73;86;85,75;2;S;5;W
12/06/2017;2017;6;12;25,6;28,7;24,2;26,025;30,6;23;113,5;0;;1006,4;95;83;96;92,25;1;N;5;SW
13/06/2017;2017;6;13;23,4;26;25,1;24,475;26,6;23,4;1,9;0;;1006,4;97;91;95;95;1;N;6;N
14/06/2017;2017;6;14;24,8;29;27,2;26,45;30;24,2;-;100;;1007,5;93;75;87;87;1;S;5;E
15/06/2017;2017;6;15;25,8;29,2;26,8;26,9;29,6;25;-;43,75;;1006,7;93;81;88;88,75;2;SE;6;SE
16/06/2017;2017;6;16;26,8;29,3;26,6;27,375;29,6;24,5;-;93,75;;1007,6;87;73;84;82,75;3;VRB;5;SE
17/06/2017;2017;6;17;24,9;29,2;26,1;26,275;30,3;24;-;98,75;;1007,7;84;60;77;76,25;2;SW;6;SW
18/06/2017;2017;6;18;24,2;28,8;26,3;25,875;29,6;24,2;-;50;;1006;82;69;83;79;2;S;6;S
19/06/2017;2017;6;19;25;28,9;26,7;26,4;29;24,6;-;87,5;;1006,7;88;72;82;82,5;3;S;6;SW
20/06/2017;2017;6;20;26,4;30,1;26,8;27,425;30,6;25;-;77,5;;1006,3;75;65;86;75,25;2;W;5;W
21/06/2017;2017;6;21;26;27,4;25,4;26,2;29,7;23,5;7,5;22,5;;1006,5;90;86;95;90,25;2;S;4;S
22/06/2017;2017;6;22;24;29,9;26,8;26,175;30,2;23,8;-;77,5;;1006,4;93;72;91;87,25;3;SE;7;SE
23/06/2017;2017;6;23;26,1;28,8;26,6;26,9;29,4;23,6;0,6;100;;1006,1;84;76;86;82,5;2;S;9;SE
24/06/2017;2017;6;24;25,6;29,8;26,7;26,925;30,3;24,4;-;100;;1005;87;68;87;82,25;2;W;6;SE
25/06/2017;2017;6;25;25,9;29,3;26,4;26,875;30;24,2;2,5;71,25;;1005,3;85;75;94;84,75;1;W;5;SE
26/06/2017;2017;6;26;26,7;28,6;26,2;27,05;30;24,4;2,8;62,5;;1006,4;84;77;92;84,25;6;W;7;SW
27/06/2017;2017;6;27;26,2;29,6;26,4;27,1;30,5;23;-;82,5;;1007,1;86;68;84;81;2;SW;6;SW
28/06/2017;2017;6;28;25,7;29,8;26,6;26,95;30,2;22,9;-;100;;1007,6;81;63;80;76,25;2;SW;6;S
29/06/2017;2017;6;29;26,3;30,3;26;27,225;30,4;23,6;-;100;;1007,4;64;54;80;65,5;2;W;6;S
30/06/2017;2017;6;30;25;28,5;26,5;26,25;29,8;24;-;72,5;;1006,9;85;72;83;81,25;2;VRB;6;S
01/07/2017;2017;7;1;24,8;29;26,7;26,325;29,2;24,7;-;55;;1006,8;84;71;85;81;2;S;6;S
02/07/2017;2017;7;2;25,4;30,4;26;26,8;30,4;24,8;-;100;;1008,4;84;56;90;78,5;2;S;4;SE
03/07/2017;2017;7;3;26,4;28,6;26,8;27,05;30,2;24,9;-;68,75;;1007,6;84;75;86;82,25;2;SW;6;SE
04/07/2017;2017;7;4;25,4;29;26,4;26,55;29,4;24,5;-;92,5;;1008,7;85;75;83;82;3;SW;7;S
05/07/2017;2017;7;5;24,6;28,8;26,6;26,15;29;24,2;ttu;75;;1007,8;87;71;81;81,5;3;S;6;S
06/07/2017;2017;7;6;26,1;28,8;26,6;26,9;30;23,8;3;100;;1008,1;78;66;80;75,5;3;W;6;SW
07/07/2017;2017;7;7;25;28,3;23,5;25,45;30,2;23;19,4;15;;1007,4;89;73;97;87;4;W;9;W
08/07/2017;2017;7;8;23,4;26,8;25,1;24,675;31;23,4;21,6;0;;1007,3;97;84;86;91;3;SW;6;W
09/07/2017;2017;7;9;24,8;27;24;25,15;27,5;22,8;28;6,25;;1008,4;89;77;93;87;2;SW;8;SW
10/07/2017;2017;7;10;22,8;27,4;24,1;24,275;29;23;15,5;12,5;;1006,3;96;77;93;90,5;2;S;6;SW
11/07/2017;2017;7;11;23;27,8;25;24,7;28,7;23,2;0,7;22,5;;1006,6;91;76;85;85,75;2;SW;6;SW
12/07/2017;2017;7;12;25;25,5;24,8;25,075;28,8;24,4;14;38,75;;1008;85;97;94;90,25;3;SW;8;S
13/07/2017;2017;7;13;24,6;27,5;26;25,675;28,6;24,8;2,2;32,5;;1007,5;95;84;89;90,75;4;S;9;S
14/07/2017;2017;7;14;25,4;27,6;26;26,1;28,4;24,2;-;6,25;;1007,1;90;82;89;87,75;2;W;6;W
15/07/2017;2017;7;15;25,6;28,6;25,8;26,4;29,2;23,8;-;87,5;;1008,3;86;72;84;82;2;S;5;S
16/07/2017;2017;7;16;25,6;28,2;25,8;26,3;28,8;23,2;-;88,75;;1008,1;78;70;78;76;3;SW;8;SW
17/07/2017;2017;7;17;25,5;27,4;25,8;26,05;29,5;23;-;86,25;;1006,9;76;73;81;76,5;3;SW;7;SE
18/07/2017;2017;7;18;25,7;28,9;26,4;26,675;29,2;24;-;75;;1008,3;77;69;80;75,75;2;VRB;7;S
19/07/2017;2017;7;19;24,8;29;26,6;26,3;29;24,8;ttu;75;;1008,2;84;72;81;80,25;1;S;5;S
20/07/2017;2017;7;20;25,2;29,8;26,2;26,6;30;24,2;0,5;88,75;;1005,8;86;65;88;81,25;3;W;4;W
21/07/2017;2017;7;21;26,4;29,9;26,5;27,3;30,2;25;0,5;100;;1007,9;76;65;86;75,75;2;VRB;6;SE
22/07/2017;2017;7;22;25,2;29,2;26,3;26,475;29,6;23;0,2;76,25;;1007,1;90;69;83;83;3;SW;8;SW
23/07/2017;2017;7;23;25,2;28,8;25,6;26,2;29,5;23,4;-;100;;1008,1;75;59;76;71,25;3;SW;11;SW
24/07/2017;2017;7;24;25,5;28,9;25,6;26,375;29,8;23,6;-;100;;1008,4;72;61;80;71,25;4;W;8;S
25/07/2017;2017;7;25;25,5;28,9;25,4;26,325;29;23,8;-;77,5;;1007,1;72;68;82;73,5;2;SW;5;SW
26/07/2017;2017;7;26;24,8;28,7;26,1;26,1;29,4;24,2;0,8;35;;1005,3;84;71;83;80,5;3;W;8;S
27/07/2017;2017;7;27;25,2;28;25;25,85;29,2;24,4;7,5;33,75;;1006,7;84;80;98;86,5;2;VRB;8;S
28/07/2017;2017;7;28;25,3;28,8;26,2;26,4;30;25;-;96,25;;1006,7;96;76;90;89,5;2;SE;11;SE
29/07/2017;2017;7;29;25,8;27,6;26;26,3;30;23,5;ttu;6,25;;1007,1;92;79;89;88;4;S;8;S
30/07/2017;2017;7;30;26,6;29,8;25,8;27,2;29,9;23,4;-;72,5;;1007,8;79;66;84;77;4;SW;7;W
31/07/2017;2017;7;31;24,4;29,8;26,2;26,2;30,2;24,5;-;96,25;;1008,2;76;58;80;86,75;2;SW;8;SW
01/08/2017;2017;8;1;24,4;28,7;26,2;25,925;29,1;23,6;8;62,5;;1008,1;80;67;79;76,5;4;SW;9;W
02/08/2017;2017;8;2;24,2;25,4;25,2;24,75;27;23,2;27,8;0;;1007,7;92;87;87;89,5;3;SW;10;SW
03/08/2017;2017;8;3;24;26,6;25,1;24,925;27,4;23;8,4;37,5;;1007,4;87;73;77;81;5;W;10;SW
04/08/2017;2017;8;4;22,8;27,8;25,6;24,75;28,3;23;2,6;37,5;;1006,5;96;72;79;85,75;2;VRB;9;SE
05/08/2017;2017;8;5;25,7;28;25,6;26,25;29,2;23,8;-;80;;1007,5;81;73;83;79,5;3;VRB;9;SE
06/08/2017;2017;8;6;24,6;27,8;25,9;25,725;29,4;24;-;72,5;;1007,5;87;72;87;83,25;2;SW;6;SW
07/08/2017;2017;8;7;24,8;28,5;26,6;26,175;29,4;24,2;-;100;;1007,5;85;74;85;82,25;2;S;9;S
08/08/2017;2017;8;8;24,8;29,4;26,6;26,4;29,4;23,9;-;90;;1007,1;92;71;89;86;2;S;9;SE
09/08/2017;2017;8;9;24,1;29,5;26,3;26;30,4;24;0,4;87,5;;1006,3;92;66;89;84,75;3;SW;7;SW
10/08/2017;2017;8;10;26;28,7;25,6;26,575;29,8;23,6;-;100;;1007,3;86;72;83;81,75;3;S;10;SE
11/08/2017;2017;8;11;24,4;28,8;26,2;25,95;29,4;24,2;-;100;;1007,5;82;66;84;78,5;3;SW;9;S
12/08/2017;2017;8;12;25,2;29,5;26;26,475;29,4;24,5;0,7;92,5;;1006,9;87;69;84;81,75;2;S;5;SW
13/08/2017;2017;8;13;24,8;29;26,1;26,175;29,4;23,4;-;85;;1007,7;90;74;86;85;1;SE;6;SE
14/08/2017;2017;8;14;24;30;25,8;25,95;30;23,2;-;100;;1008,5;87;57;87;79,5;2;SW;5;SW
15/08/2017;2017;8;15;24,9;29,5;25,7;26,25;29,6;24;-;83,75;;1008,6;78;69;84;77,25;4;SW;6;W
16/08/2017;2017;8;16;24;28,2;25,1;25,325;29,4;21,8;-;77,5;;1007,2;82;65;78;76,75;2;S;6;S
17/08/2017;2017;8;17;24;28,4;25,6;25,5;29,4;24;-;96,25;;1006,8;74;67;78;73,25;3;W;6;SW
18/08/2017;2017;8;18;25;27,4;26;25,85;28,4;24,2;-;5;;1005,6;79;72;81;77,75;1;S;5;SW
19/08/2017;2017;8;19;24,8;28,6;26;26,05;29,7;24,2;-;57,5;;1008,6;93;69;84;84,75;4;SW;10;SW
20/08/2017;2017;8;20;25;28,8;26;26,2;29,2;24,2;-;93,75;;1007,8;85;70;86;81,5;4;SW;10;S
21/08/2017;2017;8;21;25,9;29,6;26;26,85;29,8;24,2;-;100;;1006,6;80;65;83;77;4;W;6;W
22/08/2017;2017;8;22;25,2;29;25,8;26,3;30;23,8;-;100;;1006,9;82;70;86;80;3;VRB;8;SSE
23/08/2017;2017;8;23;26,1;29,4;26,1;26,925;29,9;23,8;0,3;100;;1007,8;76;70;85;76,75;2;SW;6;W
24/08/2017;2017;8;24;26,3;28,6;25,9;26,775;30;22,2;-;100;;1007,5;83;74;89;82,25;2;SW;6;SW
25/08/2017;2017;8;25;25,6;30,1;26,4;26,925;32;23,5;-;100;;1006,9;82;62;81;76,75;2;VRB;7;S
26/08/2017;2017;8;26;26,3;30,2;26,4;27,3;31;23,9;-;100;;1007,1;77;60;83;74,25;3;SW;8;S
27/08/2017;2017;8;27;24,8;28,7;26,1;26,1;29,2;24;-;100;;1006,5;84;73;83;81;2;SE;5;SE
28/08/2017;2017;8;28;24;28,2;26,4;25,65;29,4;23,2;-;96,25;;1006,3;91;72;83;84,25;2;S;7;SE
29/08/2017;2017;8;29;24,6;29,3;26,1;26,15;30;24,2;-;100;;1007,4;79;63;76;74,25;3;SW;5;SW
30/08/2017;2017;8;30;27,1;29;26,2;27,35;29;23,8;-;98,75;;1006,7;70;63;74;69,25;2;SW;7;S
31/08/2017;2017;8;31;24,6;29,4;26,8;26,35;30,3;22,4;-;100;;1008,7;76;60;78;86,75;2;VRB;6;SE
01/09/2017;2017;9;1;26;29;26,3;26,825;29,8;23,9;-;100;;1008,5;78;66;77;74,75;2;W;10;SE
02/09/2017;2017;9;2;24,6;30,2;26,4;26,45;30;24,5;-;95;;1008,2;82;61;77;75,5;2;SW;9;SW
03/09/2017;2017;9;3;25,2;29,3;26,7;26,6;30,3;24,4;-;92,5;;1008,2;82;71;81;79;3;S;8;SE
04/09/2017;2017;9;4;25,5;29;26,2;26,55;30;24,4;-;73,75;;1006,8;88;71;79;81,5;4;SW;8;S
05/09/2017;2017;9;5;25,6;29,6;26,4;26,8;29,5;23,8;-;85;;1007,6;84;70;86;81;2;S;7;SE
06/09/2017;2017;9;6;25,8;29,6;26,4;26,9;31;24,6;TTU;98,75;;1007,5;78;68;88;78;2;W;4;SE
07/09/2017;2017;9;7;26,7;31,8;28;28,3;32;24,5;-;100;;1007;78;51;63;67,5;3;NE;8;NE
08/09/2017;2017;9;8;24,8;30,8;27,1;26,875;31,2;24,4;0,3;100;;1007,3;85;62;84;79;2;SW;7;SW
09/09/2017;2017;9;9;26;30;26,8;27,2;30,2;24,4;-;81,25;;1006,1;89;70;85;83,25;2;SE;7;SE
10/09/2017;2017;9;10;25,4;30;26,8;26,9;30,8;22,8;-;72,5;;1005,3;87;75;87;84;3;SW;8;SW
11/09/2017;2017;9;11;24,8;29,6;26;26,3;30;23,5;-;96,25;;1006,2;85;61;84;78,75;1;SW;5;SW
12/09/2017;2017;9;12;25,5;29,9;25,5;26,6;30;23,6;0,9;75;;1008;75;59;80;72,25;3;S;10;SE
13/09/2017;2017;9;13;25,6;29,9;26,1;26,8;30;19,2;-;97,5;;1008,4;79;66;83;76,75;4;SW;6;S
14/09/2017;2017;9;14;25,7;30,9;26,5;27,2;31,2;23;-;100;;1007;79;53;81;73;4;W;8;W
15/09/2017;2017;9;15;24,8;29,4;26;26,25;30,2;24,8;-;100;;1006,9;77;61;83;74,5;3;VRB;8;SE
16/09/2017;2017;9;16;26,3;31,2;27;27,7;31,6;25,4;0,3;100;;1007,5;83;62;90;79,5;3;S;8;S
17/09/2017;2017;9;17;26,6;30,2;27;27,6;31,8;23,4;-;98,75;;1009,4;87;66;80;80;3;VRB;8;S
18/09/2017;2017;9;18;25,8;30,6;26,1;27,075;31;23,8;-;100;;1010;76;52;79;70,75;2;W;7;SE
19/09/2017;2017;9;19;24,4;30,2;26,4;26,35;30;22,4;-;100;;1009,5;79;56;78;73;1;SW;8;W
20/09/2017;2017;9;20;25,2;29,6;26;26,5;30;23,7;-;100;;1008,5;78;64;79;74,75;2;SW;10;SE
21/09/2017;2017;9;21;26,7;30,2;26;27,4;30,4;22,2;-;100;;1007,6;69;56;83;69,25;3;W;6;SW
22/09/2017;2017;9;22;25,6;30;26,6;26,95;30,4;25;-;97,5;;1007,1;79;65;87;77,5;3;SW;6;SW
23/09/2017;2017;9;23;27,1;30,6;26,6;27,85;31;25;-;98,75;;1007,6;78;68;87;77,75;2;SW;6;SW
24/09/2017;2017;9;24;26,8;30;26,9;27,625;31;25;2,8;53,75;;1006,7;81;70;90;80,5;2;S;8;SE
25/09/2017;2017;9;25;26,1;29;26;26,8;31;24,9;-;26,25;;1005,2;90;71;92;85,75;3;SE;7;SE
26/09/2017;2017;9;26;26,6;30,3;26,8;27,575;30,8;25,6;-;71,25;;1006,8;87;71;94;84,75;3;SE;7;SE
27/09/2017;2017;9;27;26,4;30,9;27,1;27,7;31,2;24;-;97,5;;1006,8;89;67;92;84,25;2;S;7;SW
28/09/2017;2017;9;28;26,4;30,8;27,4;27,75;31,8;25,6;-;88,75;;1007,4;81;66;91;79,75;3;S;8;S
29/09/2017;2017;9;29;27,6;30,4;27,4;28,25;31,4;24,6;1,9;100;;1007,7;80;69;83;78;2;SW;9;S
30/09/2017;2017;9;30;24,8;29,8;26,6;26,5;31;23;5,9;52,5;;1007,7;93;70;86;85,5;2;SW;5;SW
01/10/2017;2017;10;1;25,8;30,4;27;27,25;31,6;23,4;-;65;;1007,2;95,06742017;70,66233704;87,42320828;87,05509641;2,708333333;S;8;SE
02/10/2017;2017;10;2;26,2;30,4;27;27,45;31;24,4;1;98,75;;1006,3;78,82183896;63,08544839;82,89424883;75,90584379;2,791666667;SW;5;SW
03/10/2017;2017;10;3;26;31,6;27,4;27,75;31,6;24;-;78,75;;1007;80,98793454;54,01059262;81,56777857;74,38856007;2,416666667;SW;6;S
04/10/2017;2017;10;4;27;31;27,6;28,15;31,2;26;0,2;92,5;;1007;79,92959762;67,22315035;83,85352661;77,73396805;2,041666667;SE;5;SE
05/10/2017;2017;10;5;27,4;30,2;27;28;31,6;26;-;97,5;;1006,2;87,53180874;77,1467467;88,18775397;85,09952954;3,791666667;SW;7;W
06/10/2017;2017;10;6;27;31,7;27,6;28,325;32;26,2;TTU;100;;1006,1;82,89424883;68,28073765;90,62046427;81,17242489;1,416666667;S;5;S
07/10/2017;2017;10;7;26,6;29,2;27;27,35;31;25,4;-;63,75;;1004,8;88,85779949;75,31198191;87,42320828;85,11269729;2,083333333;W;5;S
08/10/2017;2017;10;8;27,1;29,8;27,2;27,8;30,4;24,8;27,8;72,5;;1004,5;82,18802079;72,93984299;85,96375009;80,81990867;2,708333333;SW;7;SW
09/10/2017;2017;10;9;27,2;30,2;27,2;27,95;30,6;26;2,4;77,5;;1004,8;87,47779542;76,47554525;89,00299558;85,10853292;2,625;S;6;S
10/10/2017;2017;10;10;26,7;30;27,4;27,7;31,6;26,4;2,3;51,25;;1003,5;96,76482137;79,77607129;96,81346989;92,52979598;3,333333333;SW;7;SE
11/10/2017;2017;10;11;28,5;30,8;27,5;28,825;32;25,5;0,5;100;;1004;85,6144481;72,17859456;92,91131073;84,07970037;1,375;SW;6;S
12/10/2017;2017;10;12;28,2;31,6;27,7;28,925;32;26;-;100;;1004,9;86,26052375;66,3743099;86,11408309;81,25236012;2,416666667;S;6;S
13/10/2017;2017;10;13;26,7;31,5;29,2;28,525;31,6;24,8;-;98,75;;1006;86,5734109;62,07346249;73,95420075;77,29362126;2,318181818;SW;6;S
14/10/2017;2017;10;14;27,4;31;27,8;28,4;31,2;25;TTU;100;;1004,9;72,24012044;66,60058666;82,45524897;73,38401913;4,625;S;9;W
15/10/2017;2017;10;15;27,4;31,2;27,9;28,475;32;24,8;33;68,75;;1005;80,98793454;71,11977637;83,95670968;79,26308878;2,19047619;S;7;SW
16/10/2017;2017;10;16;25,6;30,2;27,1;27,125;32,8;25,2;0,7;38,75;;1005,6;95,04508008;70,54503961;85,93320426;86,64210101;3,583333333;SW;10;S
17/10/2017;2017;10;17;27;30,2;27,2;27,85;30,8;26;-;65;;1005,7;85,90249605;73,15651806;87,47779542;83,1098264;2,125;S;6;SW
18/10/2017;2017;10;18;28,4;30,5;26,4;28,425;31;25;2,4;65;;1005,9;81,9563253;71,36585118;84,18481319;79,86582875;2;SW;7;W
19/10/2017;2017;10;19;27,8;30,4;26,2;28,05;31;24;-;93,75;;1007,1;75,98400493;71,95797343;87,19895647;77,78123494;2,625;SW;6;SE
20/10/2017;2017;10;20;27,9;31,4;27,3;28,625;31,6;22,5;-;98,75;;1008,9;73,23295912;69,34384519;77,15824302;73,24200161;3,083333333;SW;7;W
21/10/2017;2017;10;21;25,4;30,9;27,2;27,225;32,2;23,4;-;100;;1009;76,16280737;62,83986665;77,10835778;73,06845979;1,833333333;S;9;W
22/10/2017;2017;10;22;28,6;32,1;27,7;29,25;32,2;23,6;-;100;;1007,2;62,33434497;57,28143595;73,11754465;63,76691763;3,375;S;8;W
23/10/2017;2017;10;23;28,6;31,1;28,2;29,125;32;25,2;-;97,5;;1006,5;66,90019287;66,66584263;76,18803646;69,16356621;2;SW;9;SW
24/10/2017;2017;10;24;27;30,8;24,7;27,375;31;23;41,5;43,75;;1007,8;75,56270575;68,98325797;96,61541606;79,18102138;2,375;W;7;S
25/10/2017;2017;10;25;27,8;32,3;28;28,975;32,5;25;-;93,75;;1008,1;77,4037243;53,51227471;86,20240588;73,6305323;1,5;S;6;S
26/10/2017;2017;10;26;28;32,3;28;29,075;32,2;25,2;1,4;83,75;;1007,4;80,35841436;64,42310146;90,69980355;78,95993343;2,666666667;S;10;SE
27/10/2017;2017;10;27;26,6;30,8;28,4;28,1;32,1;26;-;81,25;;1007,1;90,41467422;69,61761527;86,31804031;84,19125101;3,208333333;SW;6;S
28/10/2017;2017;10;28;28,2;31,7;28,4;29,125;31,8;24,2;-;100;;1006,2;80,44149477;63,41398021;76,28845132;75,14635527;3,1;W;6;S
29/10/2017;2017;10;29;29,2;31,4;28;29,45;32;24,8;-;100;;1007,1;64,72300113;62,59952907;78,92403142;67,74239069;2,75;W;7;SE
30/10/2017;2017;10;30;28,6;32,4;27,6;29,3;32,8;23,4;-;100;;1006,4;61,69145607;57,52415217;75,88035799;64,19685558;2,458333333;SW;9;SW
31/10/2017;2017;10;31;28,6;32,4;27,8;29,35;32,8;24;-;100;;1005,5;64,27699106;54,15488996;73,17540526;68,75;2,541666667;SW;7;SW
01/11/2017;2017;11;1;25,8;32,2;28,2;28;32,4;26;-;100;;1010,4;71;50;82;68,5;2,5;W;6;SE
02/11/2017;2017;11;2;27;33;28,4;28,85;33,6;26,5;-;98,75;;1009,1;63;69;83;69,5;3;W;6;NW
03/11/2017;2017;11;3;29,8;31,8;28,6;30;32,8;25,8;-;86,25;;1008,6;66;60;72;66;3;W;12;S
04/11/2017;2017;11;4;29,5;32,1;29;30,025;33,5;21;-;80;;1007,6;69;63;82;70,75;2;SW;6;SW
05/11/2017;2017;11;5;29;29,2;25,2;28,1;31,8;24;11,2;45;;1008,5;79;85;96;84,75;2;SW;6;W
06/11/2017;2017;11;6;26,1;30,2;26;27,1;31,5;25,2;-;53,75;;1008,2;85;77;90;84,25;3;W;7;SE
07/11/2017;2017;11;7;29,3;30,2;28,9;29,425;32,6;25,2;-;22,5;;1009,2;71;72;83;74,25;2;S;5;S
08/11/2017;2017;11;8;29,7;32,9;28,8;30,275;33;25,8;-;72,5;;1008,5;75;60;85;73,75;2;W;7;S
09/11/2017;2017;11;9;28,6;32,3;28,8;29,575;33,2;26;-;82,5;;1008,5;78;62;66;71;2;W;6;SE
10/11/2017;2017;11;10;30,4;32,2;29;30,5;33,4;25,8;-;100;;1009,3;70;56;79;68,75;2;W;8;S
11/11/2017;2017;11;11;30;33,6;28,2;30,45;33,8;24,6;21;81,25;;1010;70;52;75;66,75;3;W;7;W
12/11/2017;2017;11;12;27,4;30,2;27,2;28,05;31,2;24;10,6;18,75;;1009,2;85;77;84;82,75;2;NW;6;SE
13/11/2017;2017;11;13;27;25,2;24,6;25,95;31,6;23,4;6,4;41,25;;1008,1;81;90;97;87,25;2;SW;6;E
14/11/2017;2017;11;14;26,4;29,6;27;27,35;31,2;23,8;TTU;26,25;;1009,5;83;69;90;81,25;2;W;6;N
15/11/2017;2017;11;15;28,5;30,4;24,3;27,925;31,8;23,8;56;53,75;;1009,6;73;75;98;79,75;2;NE;9;NE
16/11/2017;2017;11;16;26;29,6;24,7;26,575;31;24,2;1,9;5;;1009,7;92;78;91;88,25;1;NE;5;NE
17/11/2017;2017;11;17;26,2;29,4;26,6;27,1;31,6;24,6;3,5;62,5;;1008,7;87;80;74;82;2;S;6;SW
18/11/2017;2017;11;18;29,7;30,5;27,2;29,275;31,8;24,8;-;73,75;;1008,1;67;77;84;73,75;4;NW;6;S
19/11/2017;2017;11;19;28,2;30,6;26;28,25;31;23,8;4,4;63,75;;1008,3;78;72;92;80;2;SE;5;SE
20/11/2017;2017;11;20;26,8;30,8;27,4;27,95;31,2;25;2,2;42,5;;1008,2;80;60;91;77,75;1;W;6;N
21/11/2017;2017;11;21;25,8;25,4;26;25,75;29,5;24,4;8,2;1,25;;1006,3;90;97;92;92,25;2;N;10;NE
22/11/2017;2017;11;22;27,7;30,3;25,8;27,875;31;24,6;1,2;37,5;;1006,7;84;68;97;83,25;2;NE;7;NE
23/11/2017;2017;11;23;26,4;28,6;24,6;26,5;31,6;24,2;21,9;45;;1006,3;86;82;97;87,75;2;NE;10;NE
24/11/2017;2017;11;24;26;28;25,2;26,3;30,4;23,8;5,4;18,75;;1007,7;92;83;93;90;3;N;16;E
25/11/2017;2017;11;25;26,2;30,4;27,2;27,5;31,8;24,4;TTU;68,75;;1009;84;67;84;79,75;1;SW;8;SE
26/11/2017;2017;11;26;27,8;30;26;27,9;30,6;24,7;2,4;5;;1008,1;79;75;97;82,5;1;NW;5;S
27/11/2017;2017;11;27;27,7;27,6;26,6;27,4;31,2;24,4;1;20;;1006,3;84;88;90;86,5;2;S;5;S
28/11/2017;2017;11;28;27;30,4;25,2;27,4;31,6;24,2;30,2;12,5;;1005,5;80;68;95;80,75;1;SE;5;SE
29/11/2017;2017;11;29;25;29,8;25,4;26,3;31;24;5;53,75;;1007,6;93;79;87;88;2;NW;7;S
30/11/2017;2017;11;30;25,4;30;27,3;27,025;30,6;25,2;-;12,5;;1007,7;87;72;90;84;2;SE;6;SE
01/12/2017;2017;12;1;26,2;29,5;26,2;27,025;30,6;24,8;1,7;0;;1000,6;89;78;86;85,5;2;NE;8;NE
02/12/2017;2017;12;2;27,3;31,1;27,4;28,275;31,8;25,6;38,8;0;;1001,1;83;72;94;83;3;NE;10;NE
03/12/2017;2017;12;3;25,9;29,5;25,2;26,625;31;24,1;48,2;25;;1002,1;97;81;93;92;2;NE;15;E
04/12/2017;2017;12;4;26,7;27,6;27,9;27,225;30,4;23,8;14;50;;1002,6;86;88;83;85,75;2;NW;8;E
05/12/2017;2017;12;5;26,2;29;28,2;27,4;32,2;24,6;-;63,75;;1002,2;81;72;82;79;2;NE;6;NW
06/12/2017;2017;12;6;27,4;32;27,6;28,6;32,2;24,6;0,2;75;;1003,1;83;68;82;79;2;W;6;S
07/12/2017;2017;12;7;27,1;31,8;28,6;28,65;32,3;25;-;83,75;;1003,3;81;68;82;78;2;SW;8;SE
08/12/2017;2017;12;8;27,7;31,8;28,8;29;32,2;25;-;92,5;;1005,3;78;66;74;74;2;SE;7;SE
09/12/2017;2017;12;9;28;31,8;28,5;29,075;32;23,9;-;98,75;;1005,2;75;68;76;73,5;3;SE;12;S
10/12/2017;2017;12;10;27;31,4;26,6;28;32;24,2;0,5;100;;1005,3;75;69;86;76,25;4;SW;13;SE
11/12/2017;2017;12;11;26,5;27,5;26,2;26,675;32,3;24,2;1,6;17,5;;1006,1;83;88;87;85,25;3;W;7;W
12/12/2017;2017;12;12;27,3;31,2;25,8;27,9;31,8;23,5;4,4;71,25;;1006;79;71;97;81,5;3;SW;9;S
13/12/2017;2017;12;13;27,8;32,7;27,2;28,875;32,8;24,2;0,2;96,25;;1004,9;79;62;84;76;2;SE;4;S
14/12/2017;2017;12;14;28,3;31,8;26,3;28,675;31,9;23,8;6,2;96,25;;1005;78;69;95;80;2;SE;9;SE
15/12/2017;2017;12;15;26,4;31,7;28,4;28,225;32,4;25;-;60;;1005;81;62;76;75;3;SE;7;E
16/12/2017;2017;12;16;27,2;31,5;24,6;27,625;32,2;23,2;47,5;10;;1006,3;86;67;97;84;2;SW;6;W
