Tanggal;year;month;day;T '07.00;T '13.00;T '18.00;TRata2;TMax;TMin;Curah Hujan (mm);SS (%);Cuaca;Tekanan Udara (mb);RH07.00;RH13.00;RH18.00;RHRata2;Kec Rata2;Arah Terbanyak;Kec,Max;Arah
01/08/2016;2016;8;1;#REF!;30,5;28,8;#REF!;30,8;#REF!;5;0;;#REF!;100;64;71;84;5;50;7;0
02/08/2016;2016;8;2;24,0;29,7;29,2;26,7;30,6;23,8;-;0;;1009,2;83;63;63;73;5;200;12;0
03/08/2016;2016;8;3;23,8;31,0;29,4;27,0;33,0;23,8;0;100;;1009,3;83;61;70;74;5;190;10;0
04/08/2016;2016;8;4;24,3;31,2;29,2;27,3;31,2;24,3;0;100;;1010,2;90;67;76;81;6;70;10;0
05/08/2016;2016;8;5;26,0;30,8;29,0;28,0;31,2;24,8;-;100;;1010,7;86;71;77;80;6;90;10;0
06/08/2016;2016;8;6;24,8;30,8;29,2;27,4;31,2;22,9;62;100;;1010,7;95;70;75;84;7;40;11;0
07/08/2016;2016;8;7;23,8;28,4;29,2;26,3;30,2;23,8;-;33;;1011,2;97;84;73;87;5;80;11;0
08/08/2016;2016;8;8;25,0;30,6;29,0;27,4;35,4;25,0;5;95;;1011,2;93;75;77;84;6;70;9;0
09/08/2016;2016;8;9;25,8;30,4;29,0;27,8;30,9;23,4;-;100;;1011,0;92;72;77;83;5;60;9;0
10/08/2016;2016;8;10;23,8;30,5;29,0;26,8;30,8;23,2;1;100;;1011,2;93;70;77;83;4;40;10;0
11/08/2016;2016;8;11;23,2;31,4;29,8;26,9;31,4;23,2;-;100;;1011,5;91;59;69;78;4;190;7;0
12/08/2016;2016;8;12;24,6;31,6;29,5;27,6;31,8;24,6;5;100;;1011,0;88;68;77;80;4;90;8;0
13/08/2016;2016;8;13;24,8;29,6;29,0;27,1;30,0;24,8;5;63;;1010,6;95;71;75;84;4;170;10;0
14/08/2016;2016;8;14;25,2;30,4;28,0;27,2;31,6;24,6;0;78;;1010,3;88;67;80;81;4;90;9;0
15/08/2016;2016;8;15;25,0;30,6;29,0;27,4;31,4;24,6;2;100;;1010,4;92;69;75;82;9;50;99;0
16/08/2016;2016;8;16;24,8;30,6;28,8;27,3;31,4;24,2;-;100;;1010,3;93;71;75;83;7;60;12;0
17/08/2016;2016;8;17;24,6;30,8;29,0;27,3;32,4;24,4;-;100;;1010,2;95;72;77;85;7;60;12;0
18/08/2016;2016;8;18;24,8;31,2;30,2;27,8;31,4;23,8;-;100;;1009,2;92;65;65;78;5;30;9;0
19/08/2016;2016;8;19;23,8;30,0;29,0;26,7;30,8;23,2;-;100;;1009,2;85;68;71;77;4;190;9;0
20/08/2016;2016;8;20;23,2;30,6;29,0;26,5;31,2;21,8;-;100;;1009,6;86;62;66;75;5;190;10;0
21/08/2016;2016;8;21;22,2;30,4;29,2;26,0;30,7;22,2;-;100;;1009,6;93;62;71;80;4;180;9;0
22/08/2016;2016;8;22;24,8;32,2;28,6;27,6;32,7;21,2;-;100;;1009,3;74;47;67;66;5;#N/A;9;0
23/08/2016;2016;8;23;21,2;30,0;28,4;25,2;30,6;21,2;-;100;;1008,5;96;67;75;83;7;50;12;0
24/08/2016;2016;8;24;23,2;30,2;29,0;26,4;30,8;23,2;16;100;;1008,2;90;65;72;79;6;50;10;0
25/08/2016;2016;8;25;25,0;30,8;29,0;27,5;30,9;23,8;0;16;;1009,4;88;63;74;78;5;30;9;0
26/08/2016;2016;8;26;24,0;30,4;29,0;26,9;30,8;24,0;-;100;;1010,5;93;65;75;82;7;50;12;0
27/08/2016;2016;8;27;25,7;30,4;29,0;27,7;31,2;25,7;-;100;;1011,2;95;75;81;86;7;90;12;0
28/08/2016;2016;8;28;26,8;30,6;29,1;28,3;31,0;25,5;-;100;;1011,2;90;67;75;81;7;90;13;0
29/08/2016;2016;8;29;26,0;30,4;29,2;27,9;31,1;25,4;-;100;;1010,5;92;69;73;81;6;150;11;0
30/08/2016;2016;8;30;26,6;31,0;29,0;28,3;31,2;24,6;-;100;;1010,8;87;63;74;78;6;50;15;0
31/08/2016;2016;8;31;24,8;30,6;29,0;27,3;31,0;#REF!;-;0;;1011,8;94;68;74;83;6;70;10;0
01/09/2016;2016;9;1;26,2;30,4;29,4;28,1;30,9;24,6;7;100;;#REF!;100;71;77;87;5;90;10;0
02/09/2016;2016;9;2;25,0;30,9;29,4;27,6;31,2;24,0;10;100;;1010,3;88;65;75;79;4;90;8;0
03/09/2016;2016;9;3;24,2;30,0;29,0;26,9;30,6;24,2;1;100;;1010,3;97;72;75;85;5;50;12;0
04/09/2016;2016;9;4;25,2;30,4;29,0;27,5;31,0;25,2;-;100;;1011,2;96;68;71;83;5;50;10;0
05/09/2016;2016;9;5;25,2;30,6;28,8;27,5;31,2;24,8;-;100;;1011,9;93;68;74;82;6;70;14;0
06/09/2016;2016;9;6;26,4;30,6;29,0;28,1;30,8;24,8;-;100;;1012,1;87;69;71;79;6;50;10;0
07/09/2016;2016;9;7;25,0;31,2;29,5;27,7;31,2;24,4;-;100;;1011,7;90;70;71;80;7;100;15;0
08/09/2016;2016;9;8;24,6;31,4;29,4;27,5;32,0;23,8;-;100;;1011,8;93;62;69;79;5;170;13;0
09/09/2016;2016;9;9;24,6;31,4;29,2;27,5;32,2;23,6;-;100;;1011,8;90;66;74;80;6;170;12;0
10/09/2016;2016;9;10;24,2;31,2;29,2;27,2;32,0;23,8;-;98;;1010,6;88;66;75;79;4;160;10;0
11/09/2016;2016;9;11;23,8;32,2;29,4;27,3;32,8;23,8;-;100;;1009,7;88;55;71;76;5;190;9;0
12/09/2016;2016;9;12;24,4;32,8;29,2;27,7;33,4;23,6;1;85;;1010,4;82;43;71;69;4;180;7;0
13/09/2016;2016;9;13;24,6;31,6;29,2;27,5;31,8;23,8;-;100;;1010,8;76;50;66;67;6;180;11;0
14/09/2016;2016;9;14;23,8;30,6;29,0;26,8;31,4;23,8;-;100;;1010,2;91;66;72;80;6;180;12;0
15/09/2016;2016;9;15;24,7;31,4;29,4;27,6;31,6;24,7;0;100;;1010,3;90;63;73;79;10;60;99;0
16/09/2016;2016;9;16;25,8;30,4;29,2;27,8;31,3;25,8;-;100;;1009,5;89;73;77;82;7;40;11;0
17/09/2016;2016;9;17;27,4;31,2;29,6;28,9;31,4;25,3;6;100;;1009,6;83;67;73;77;6;50;11;0
18/09/2016;2016;9;18;25,6;31,0;29,0;27,8;31,3;25,4;0;100;;1009,6;92;68;75;82;5;70;9;0
19/09/2016;2016;9;19;25,8;31,0;29,0;27,9;31,4;25,6;-;100;;1008,7;92;68;77;82;5;40;10;0
20/09/2016;2016;9;20;26,6;30,8;29,0;28,3;31,2;25,4;-;100;;1008,8;87;68;77;80;4;60;8;0
21/09/2016;2016;9;21;26,2;31,4;29,0;28,2;31,9;26,0;-;84;;1009,9;89;69;77;81;6;60;10;0
22/09/2016;2016;9;22;26,0;30,7;29,4;28,0;31,2;25,1;-;100;;1010,1;91;69;73;81;4;50;9;0
23/09/2016;2016;9;23;25,4;31,1;29,8;27,9;31,5;24,8;17;100;;1008,9;92;69;71;81;5;50;11;0
24/09/2016;2016;9;24;25,0;30,0;27,4;26,9;31,0;24,2;0;59;;1008,6;93;73;79;85;#N/A;200;#N/A;0
25/09/2016;2016;9;25;24,9;30,5;29,0;27,3;31,0;23,8;0;94;;1008,6;89;69;75;81;5;160;10;0
26/09/2016;2016;9;26;26,0;31,0;28,2;27,8;31,8;24,8;-;75;;1009,4;90;66;75;80;5;60;9;0
27/09/2016;2016;9;27;25,4;30,8;29,8;27,9;31,4;23,6;17;94;;1009,3;87;73;76;81;5;40;8;0
28/09/2016;2016;9;28;24,2;30,8;29,4;27,2;31,2;24,2;3;69;;1009,5;95;70;73;83;4;200;9;0
29/09/2016;2016;9;29;26,6;31,0;29,8;28,5;31,8;25,4;0;100;;1009,0;90;71;72;81;5;50;11;0
30/09/2016;2016;9;30;28,6;31,4;29,2;29,5;31,8;24,6;-;100;;1008,6;76;67;74;74;6;30;12;0
01/10/2016;2016;10;1;28,0;31,4;30,0;29,4;31,6;24,6;#REF!;100;;#REF!;100;67;70;84;5;#N/A;13;0
02/10/2016;2016;10;2;25,2;31,0;28,0;27,4;31,8;24,6;-;85;;1010,1;93;66;79;83;6;190;22;0
03/10/2016;2016;10;3;24,8;32,7;30,0;28,1;30,6;24,8;-;100;;1009,1;93;59;73;80;5;210;20;0
04/10/2016;2016;10;4;26,1;30,2;29,4;28,0;31,3;25,0;-;66;;1008,5;88;70;73;80;4;70;8;0
05/10/2016;2016;10;5;25,6;31,5;30,0;28,2;31,8;25,6;-;93;;1008,9;93;69;69;81;6;50;10;0
06/10/2016;2016;10;6;26,0;32,1;30,4;28,6;32,4;25,5;-;100;;1009,8;90;67;72;80;5;170;9;0
07/10/2016;2016;10;7;25,6;31,2;30,0;28,1;32,0;25,6;-;45;;1010,1;82;64;68;74;5;200;9;0
08/10/2016;2016;10;8;26,9;24,1;24,6;25,6;31,3;24,1;64;100;;1010,8;84;97;97;90;3;200;5;0
09/10/2016;2016;10;9;25,0;31,4;27,4;27,2;31,7;25,0;43;54;;1010,2;91;66;84;83;5;150;8;0
10/10/2016;2016;10;10;25,1;26,9;26,8;26,0;34,6;25,0;7;24;;1009,9;94;84;86;90;5;90;9;0
11/10/2016;2016;10;11;25,2;31,2;29,0;27,7;31,4;23,8;29;100;;1009,4;90;65;78;81;5;160;15;0
12/10/2016;2016;10;12;25,6;31,0;29,6;28,0;31,2;25,2;-;100;;1008,9;95;72;75;84;4;40;19;0
13/10/2016;2016;10;13;26,5;28,9;28,4;27,6;29,8;25,6;-;15;;1008,8;90;82;80;85;4;160;8;0
14/10/2016;2016;10;14;26,4;29,2;29,0;27,8;30,6;24,8;-;31;;1009,0;89;78;79;84;4;140;9;0
15/10/2016;2016;10;15;25,1;31,0;29,8;27,8;31,6;25,1;-;93;;1009,2;93;63;66;79;9;30;99;0
16/10/2016;2016;10;16;25,8;31,2;29,8;28,2;31,6;25,6;-;88;;1009,0;90;71;76;82;4;190;10;0
17/10/2016;2016;10;17;26,2;31,6;30,0;28,5;32,2;25,4;-;100;;1008,5;86;69;72;78;4;180;9;0
18/10/2016;2016;10;18;25,8;32,0;30,2;28,5;32,2;25,4;-;100;;1008,6;82;61;72;74;4;200;7;0
19/10/2016;2016;10;19;25,6;31,6;30,4;28,3;32,0;24,6;-;100;;1008,1;89;64;69;78;5;170;11;0
20/10/2016;2016;10;20;26,0;31,8;30,0;28,5;32,2;25,4;0;100;;1007,7;90;68;78;82;5;60;10;0
21/10/2016;2016;10;21;26,4;26,8;28,2;27,0;29,4;25,2;0;3;;1009,1;84;84;82;84;6;200;25;0
22/10/2016;2016;10;22;26,6;29,2;28,0;27,6;30,6;24,2;30;65;;1009,9;84;78;82;82;5;90;13;0
23/10/2016;2016;10;23;24,2;28,2;23,8;25,1;28,2;23,4;38;0;;1010,4;98;82;97;94;3;170;11;0
24/10/2016;2016;10;24;24,0;24,6;26,6;24,8;27,7;24,0;11;9;;1009,9;95;95;84;92;5;270;10;0
25/10/2016;2016;10;25;25,2;30,2;29,0;27,4;30,8;23,8;-;31;;1009,6;92;72;75;83;5;50;8;0
26/10/2016;2016;10;26;26,5;28,6;29,8;27,9;31,2;24,6;19;75;;1010,4;91;75;72;82;4;60;9;0
27/10/2016;2016;10;27;25,4;30,5;27,9;27,3;31,0;25,3;0;70;;1010,7;93;69;78;83;5;20;8;0
28/10/2016;2016;10;28;25,6;30,0;28,8;27,5;30,4;25,6;-;0;;1010,0;93;74;77;84;4;340;6;0
29/10/2016;2016;10;29;26,1;31,6;27,2;27,8;32,1;25,4;0;100;;1009,3;86;66;85;81;5;40;9;0
30/10/2016;2016;10;30;26,7;31,8;30,3;28,9;32,0;25,6;-;100;;1009,5;83;66;71;76;5;20;9;0
31/10/2016;2016;10;31;25,9;31,8;30,0;28,4;32,0;#REF!;-;0;;1009,7;91;62;72;79;#N/A;90;#N/A;0
01/01/2017;2017;1;1;26,2;32,2;29,6;28,6;31,6;24,0;82;100;;1007,6;100;66;73;85;5;310;10;0
02/01/2017;2017;1;2;25,2;30,2;28,6;27,3;31,1;24,0;12;45;;1008,0;93;73;81;85;3;330;6;0
03/01/2017;2017;1;3;24,4;30,0;28,0;26,7;31,0;24,4;0;48;;1007,4;98;69;83;87;4;240;8;0
04/01/2017;2017;1;4;25,4;30,6;27,0;27,1;31,2;25,4;0;79;;1007,4;90;71;80;83;5;270;13;0
05/01/2017;2017;1;5;25,2;29,8;28,4;27,2;31,0;25,2;-;48;;1007,5;96;73;79;86;5;290;12;0
06/01/2017;2017;1;6;25,6;27,2;27,6;26,5;33,2;24,8;1;0;;1006,8;95;83;80;88;4;290;13;0
07/01/2017;2017;1;7;24,6;29,2;29,2;26,9;31,2;24,6;-;95;;1006,5;94;77;79;86;5;310;11;0
08/01/2017;2017;1;8;24,7;30,7;29,4;27,4;31,4;24,7;-;100;;1006,4;94;74;77;85;5;220;10;0
09/01/2017;2017;1;9;25,6;30,0;29,2;27,6;31,0;25,0;-;100;;1007,2;93;74;74;84;5;340;11;0
10/01/2017;2017;1;10;25,4;32,2;29,6;28,2;32,4;25,4;0;100;;1008,2;96;62;74;82;5;200;13;0
11/01/2017;2017;1;11;25,6;31,4;29,2;28,0;32,0;25,4;-;100;;1007,8;92;71;79;84;6;280;12;0
12/01/2017;2017;1;12;25,8;30,2;24,2;26,5;31,4;23,4;55;44;;1007,4;89;76;98;88;6;280;18;0
13/01/2017;2017;1;13;24,2;29,6;26,6;26,2;30,4;24,0;19;15;;1007,7;97;74;97;91;5;210;13;0
14/01/2017;2017;1;14;24,4;29,9;26,2;26,2;30,2;24,0;0;34;;1008,4;97;76;86;89;6;250;9;0
15/01/2017;2017;1;15;24,0;29,6;28,3;26,5;31,0;23,7;5;33;;1008,5;95;70;75;84;9;260;99;0
16/01/2017;2017;1;16;24,1;27,8;27,7;25,9;28,4;24,0;0;0;;1008,6;96;80;81;88;6;220;13;0
17/01/2017;2017;1;17;24,0;27,9;27,1;25,8;28,6;23,8;1;11;;1010,1;97;80;82;89;5;270;11;0
18/01/2017;2017;1;18;24,2;30,8;29,4;27,2;32,0;24,2;-;89;;1010,4;93;67;74;82;7;290;10;0
19/01/2017;2017;1;19;24,6;30,2;28,8;27,1;29,0;24,6;0;34;;1009,7;95;70;79;85;6;280;13;0
20/01/2017;2017;1;20;24,8;30,6;23,1;25,8;30,6;23,1;28;74;;1009,6;97;69;97;90;7;220;27;0
21/01/2017;2017;1;21;24,6;29,9;28,7;27,0;31,6;24,6;-;78;;1010,7;92;72;78;83;5;270;8;0
22/01/2017;2017;1;22;24,8;31,0;28,4;27,3;31,5;24,6;-;100;;1010,8;90;68;80;82;6;260;13;0
23/01/2017;2017;1;23;25,0;30,2;24,2;26,1;31,4;24,0;4;39;;1010,5;93;68;95;87;5;280;11;0
24/01/2017;2017;1;24;24,2;29,2;28,8;26,6;30,5;24,2;2;64;;1010,6;94;77;76;85;4;190;8;0
25/01/2017;2017;1;25;24,8;29,5;27,8;26,7;31,3;23,8;1;28;;1010,5;97;76;83;88;6;280;15;0
26/01/2017;2017;1;26;24,2;27,4;26,5;25,6;29,8;23,5;0;14;;1009,8;88;80;83;85;6;230;15;0
27/01/2017;2017;1;27;25,4;29,2;28,6;27,2;30,0;24,5;1;14;;1008,2;92;77;79;85;6;270;12;0
28/01/2017;2017;1;28;24,6;28,6;27,7;26,4;30,1;24,2;1;13;;1008,3;90;78;81;85;6;290;10;0
29/01/2017;2017;1;29;24,8;28,0;27,5;26,3;28,8;24,6;0;0;;1009,2;90;80;81;85;5;270;10;0
30/01/2017;2017;1;30;24,6;29,4;29,0;26,9;30,0;24,6;-;78;;1008,8;93;75;77;85;6;280;15;0
31/01/2017;2017;1;31;25,2;27,2;25,8;25,9;30,2;#REF!;-;0;;811,1;93;89;92;92;4;250;7;0
01/02/2017;2017;2;1;25,2;30,2;26,4;26,8;30,4;23,6;15;100;;1009,6;100;72;90;91;7;260;18;0
02/02/2017;2017;2;2;23,8;28,4;27,2;25,8;28,6;23,0;7;6;;1009,6;91;73;86;85;6;250;15;0
03/02/2017;2017;2;3;24,6;26,8;25,4;25,4;29,6;23,4;19;25;;1008,1;90;86;97;91;8;280;19;0
04/02/2017;2017;2;4;24,2;30,8;28,4;26,9;30,8;24,2;-;60;;1006,8;94;71;69;82;7;250;16;0
05/02/2017;2017;2;5;25,2;30,0;28,6;27,3;30,4;23,4;8;70;;1006,4;90;77;78;84;8;260;20;0
06/02/2017;2017;2;6;24,4;29,8;28,2;26,7;30,6;24,4;0;96;;1006,4;95;78;82;87;9;260;17;0
07/02/2017;2017;2;7;27,5;29,8;26,0;27,7;30,4;25,2;6;59;;1006,9;82;72;86;80;14;280;23;0
08/02/2017;2017;2;8;27,2;26,9;27,8;27,3;29,0;24,1;4;1;;1007,4;83;85;82;83;11;280;20;0
09/02/2017;2017;2;9;25,7;26,8;27,4;26,4;27,6;24,6;15;3;;1007,5;90;84;82;87;7;280;14;0
10/02/2017;2017;2;10;25,4;28,4;27,1;26,6;29,4;25,0;0;6;;1008,3;89;76;86;85;8;270;15;0
11/02/2017;2017;2;11;25,2;25,8;27,0;25,8;28,6;23,9;0;9;;1010,7;93;86;80;88;8;290;19;0
12/02/2017;2017;2;12;24,2;27,4;28,0;26,0;29,4;23,8;2;36;;1386,8;97;78;78;88;6;270;12;0
13/02/2017;2017;2;13;24,5;30,0;26,0;26,3;30,4;23,6;16;60;;1012,0;94;73;93;89;5;250;12;0
14/02/2017;2017;2;14;23,6;29,8;27,6;26,2;30,6;23,6;0;61;;1012,1;97;70;86;87;5;90;11;0
15/02/2017;2017;2;15;24,2;30,8;27,9;26,8;31,2;23,2;18;94;;1011,6;93;70;84;85;9;210;99;0
16/02/2017;2017;2;16;23,6;30,2;28,0;26,4;30,8;23,6;-;38;;1011,1;95;67;80;84;5;220;9;0
17/02/2017;2017;2;17;24,6;30,0;28,6;27,0;30,8;24,4;1;85;;1011,3;92;70;81;84;4;220;9;0
18/02/2017;2017;2;18;24,7;27,4;27,0;26,0;29,0;24,0;3;14;;1011,3;95;78;83;88;3;290;6;0
19/02/2017;2017;2;19;24,2;30,0;28,8;26,8;31,0;24,2;0;88;;1009,8;97;74;78;86;5;290;10;0
20/02/2017;2017;2;20;25,5;29,0;29,0;27,3;30,8;24,2;50;44;;1009,4;96;78;81;88;4;290;9;0
21/02/2017;2017;2;21;24,4;30,6;27,8;26,8;30,8;24,2;-;99;;1011,0;98;69;85;88;5;190;11;0
22/02/2017;2017;2;22;24,2;29,8;26,8;26,3;30,0;24,0;-;33;;1011,0;97;73;81;87;3;280;7;0
23/02/2017;2017;2;23;25,0;30,0;29,2;27,3;30,6;22,6;30;100;;1010,4;95;72;81;86;5;40;8;0
24/02/2017;2017;2;24;24,4;30,0;29,0;27,0;30,2;24,0;5;73;;1010,3;97;74;74;85;4;310;8;0
25/02/2017;2017;2;25;25,0;29,0;27,4;26,6;30,6;24,2;7;25;;1010,0;95;78;82;87;5;180;12;0
26/02/2017;2017;2;26;24,2;29,6;29,2;26,8;30,4;24,2;-;88;;1008,7;95;71;77;84;5;20;11;0
27/02/2017;2017;2;27;25,0;30,2;29,0;27,3;30,6;23,8;34;88;;1009,1;95;70;77;84;4;340;11;0
28/02/2017;2017;2;28;24,4;30,0;29,0;27,0;30,6;24,4;-;13;;1008,7;98;76;78;88;4;220;10;0
01/03/2017;2017;3;1;26,4;30,4;29,0;28,1;31,2;23,8;1;94;;1008,9;100;73;77;87;4;330;9;0
02/03/2017;2017;3;2;23,8;30,6;29,4;26,9;31,2;23,8;2;100;;1008,3;97;64;75;83;3;200;6;0
03/03/2017;2017;3;3;24,4;31,2;29,6;27,4;31,6;24,2;8;88;;1007,1;95;62;71;81;3;20;6;0
04/03/2017;2017;3;4;24,2;30,8;30,0;27,3;31,4;24,2;-;88;;1007,6;97;62;73;82;5;10;9;0
05/03/2017;2017;3;5;24,6;31,2;30,2;27,7;31,4;24,6;-;81;;1007,6;90;66;69;79;4;200;9;0
06/03/2017;2017;3;6;25,8;30,2;28,6;27,6;30,4;24,8;-;15;;1007,7;90;74;81;84;4;260;8;0
07/03/2017;2017;3;7;25,0;31,2;27,6;27,2;31,4;25,0;-;65;;1008,6;93;70;83;85;6;260;14;0
08/03/2017;2017;3;8;25,8;31,9;28,9;28,1;32,0;25,4;-;81;;1008,8;76;63;76;73;6;260;10;0
09/03/2017;2017;3;9;25,4;31,4;29,0;27,8;31,8;24,4;-;44;;1008,1;95;70;78;84;4;210;10;0
10/03/2017;2017;3;10;24,2;30,4;29,6;27,1;31,6;23,2;70;73;;1008,5;97;71;70;83;4;300;9;0
11/03/2017;2017;3;11;24,6;30,0;29,2;27,1;30,4;24,6;-;54;;1009,9;95;73;73;84;4;200;9;0
12/03/2017;2017;3;12;25,0;30,9;28,9;27,5;31,0;24,4;6;100;;1010,3;98;65;76;84;5;250;9;0
13/03/2017;2017;3;13;24,6;29,6;23,6;25,6;31,4;22,7;83;44;;1010,8;95;75;98;91;6;190;17;0
14/03/2017;2017;3;14;22,8;30,4;24,4;25,1;31,6;22,8;26;79;;1385,3;98;73;97;92;5;260;10;0
15/03/2017;2017;3;15;23,0;30,0;28,8;26,2;30,4;23,0;-;79;;1009,5;96;65;74;83;4;190;8;0
16/03/2017;2017;3;16;24,6;30,2;29,2;27,2;30,0;24,6;-;100;;1009,3;93;74;73;83;4;160;8;0
17/03/2017;2017;3;17;24,8;30,6;29,4;27,4;31,0;24,8;-;100;;1010,0;95;68;77;84;5;190;10;0
18/03/2017;2017;3;18;25,2;29,2;27,2;26,7;31,0;24,2;7;16;;1011,1;92;77;87;87;4;200;9;0
19/03/2017;2017;3;19;24,9;30,6;28,4;27,2;31,6;24,9;-;26;;1009,9;92;70;78;83;4;260;7;0
20/03/2017;2017;3;20;25,2;30,8;27,6;27,2;31,4;24,2;18;63;;1009,1;85;68;80;80;5;260;13;0
21/03/2017;2017;3;21;24,4;30,2;27,4;26,6;30,6;24,4;-;48;;1009,4;92;72;82;84;7;270;16;0
22/03/2017;2017;3;22;25,2;29,8;28,8;27,3;30,4;25,2;-;63;;1009,6;95;70;74;83;6;290;18;0
23/03/2017;2017;3;23;25,2;31,0;28,2;27,4;31,2;25,2;-;41;;1010,1;97;72;83;87;4;220;10;0
24/03/2017;2017;3;24;25,2;30,2;29,0;27,4;30,4;24,0;-;50;;1010,1;98;74;77;87;4;350;9;0
25/03/2017;2017;3;25;25,2;31,4;29,2;27,8;31,6;22,0;-;50;;1009,9;97;72;74;85;6;330;10;0
26/03/2017;2017;3;26;25,4;26,8;26,0;25,9;30,0;24,0;1;6;;1011,8;95;80;87;89;5;280;11;0
27/03/2017;2017;3;27;24,6;30,0;28,8;27,0;30,5;24,0;-;79;;1011,1;95;72;79;85;4;220;6;0
28/03/2017;2017;3;28;25,5;29,6;29,0;27,4;30,2;24,0;1;41;;1011,1;93;78;77;85;4;60;10;0
29/03/2017;2017;3;29;24,5;30,8;29,6;27,4;31,6;24,0;1;81;;1011,0;97;66;71;83;5;200;10;0
30/03/2017;2017;3;30;24,0;31,0;29,2;27,1;31,8;24,0;-;100;;1011,5;95;67;77;83;5;190;9;0
31/03/2017;2017;3;31;24,8;30,8;28,8;27,3;31,8;24,8;-;0;;813,5;93;65;76;82;4;190;9;0
01/04/2017;2017;4;1;26,2;31,2;29,6;28,3;31,4;24,0;-;81;;1010,5;100;62;69;83;3;210;9;0
02/04/2017;2017;4;2;24,0;30,4;27,8;26,6;31,4;24,0;-;75;;1010,2;95;69;79;84;4;220;8;0
03/04/2017;2017;4;3;25,2;30,0;28,2;27,2;30,0;23,4;0;45;;1010,3;95;74;82;87;4;70;6;0
04/04/2017;2017;4;4;23,6;30,2;28,4;26,5;31,2;23,6;4;88;;1009,6;96;70;76;85;4;310;8;0
05/04/2017;2017;4;5;25,0;30,5;28,6;27,3;30,8;24,8;10;94;;1007,7;97;69;78;85;5;230;8;0
06/04/2017;2017;4;6;24,8;28,4;26,6;26,2;28,8;24,2;33;0;;1007,6;98;82;92;93;4;300;11;0
07/04/2017;2017;4;7;24,2;29,6;28,0;26,5;30,2;24,2;-;38;;1008,6;98;75;85;89;5;300;9;0
08/04/2017;2017;4;8;25,3;27,6;27,4;26,4;29,2;25,0;-;6;;1009,9;96;82;83;89;4;280;9;0
09/04/2017;2017;4;9;25,0;31,4;27,6;27,3;31,6;25,0;-;84;;1009,7;95;75;89;89;4;30;11;0
10/04/2017;2017;4;10;25,6;31,0;29,6;28,0;31,8;25,6;-;96;;1008,7;95;72;77;85;5;40;10;0
11/04/2017;2017;4;11;26,4;30,6;29,4;28,2;31,4;25,0;-;100;;1008,6;90;73;75;82;3;70;6;0
12/04/2017;2017;4;12;25,2;31,4;29,2;27,8;31,6;24,7;18;100;;1009,4;93;67;74;82;4;190;9;0
13/04/2017;2017;4;13;25,4;30,8;29,4;27,8;31,6;24,5;-;70;;1010,0;97;70;74;84;3;50;8;0
14/04/2017;2017;4;14;26,0;29,7;28,3;27,5;30,0;24,6;-;19;;1010,3;92;76;80;85;3;30;7;0
15/04/2017;2017;4;15;24,6;31,2;29,4;27,5;31,2;24,0;-;94;;1009,4;88;65;74;79;8;210;99;0
16/04/2017;2017;4;16;24,4;31,0;30,0;27,5;31,6;24,4;5;100;;1009,4;87;67;72;78;4;90;8;0
17/04/2017;2017;4;17;25,2;30,8;29,2;27,6;31,2;25,2;-;100;;1009,8;97;72;77;86;4;330;10;0
18/04/2017;2017;4;18;25,4;30,8;29,6;27,8;31,4;25,0;-;90;;1010,4;97;73;77;86;5;340;9;0
19/04/2017;2017;4;19;25,0;31,2;29,6;27,7;31,8;24,0;-;69;;1011,3;95;69;78;84;4;190;7;0
20/04/2017;2017;4;20;25,2;30,6;29,4;27,6;31,4;25,2;13;100;;1010,6;90;73;81;84;4;80;9;0
21/04/2017;2017;4;21;26,0;31,2;30,0;28,3;32,0;24,2;1;88;;1010,4;93;72;70;82;4;230;7;0
22/04/2017;2017;4;22;24,8;31,6;28,6;27,5;32,0;24,6;-;85;;1010,6;95;68;82;85;5;60;10;0
23/04/2017;2017;4;23;25,0;31,4;28,0;27,4;32,0;23,8;-;100;;1011,1;97;69;86;87;5;210;12;0
24/04/2017;2017;4;24;24,4;31,0;30,0;27,5;31,8;23,8;-;100;;1010,6;97;68;76;84;4;30;5;0
25/04/2017;2017;4;25;24,7;31,4;30,2;27,8;31,4;24,7;0;100;;1010,4;93;69;72;82;4;170;7;0
26/04/2017;2017;4;26;24,8;30,6;30,0;27,6;31,8;23,8;1;100;;1010,3;95;71;70;83;4;180;8;0
27/04/2017;2017;4;27;24,6;31,2;30,0;27,6;31,8;23,6;-;66;;1010,5;95;64;69;81;4;190;7;0
28/04/2017;2017;4;28;24,1;31,4;30,0;27,4;31,8;24,1;-;100;;1010,7;96;65;69;81;4;180;7;0
29/04/2017;2017;4;29;25,0;31,4;30,3;27,9;32,0;24,8;-;100;;1011,3;92;63;64;77;4;40;8;0
30/04/2017;2017;4;30;25,2;31,4;29,8;27,9;31,8;0,0;-;0;;1011,3;88;67;70;79;5;30;11;0
01/05/2017;2017;5;1;27,0;31,0;28,4;28,4;32,0;24,0;-;79;;1010,7;100;70;83;88;4;150;9;0
02/05/2017;2017;5;2;25,6;32,2;30,6;28,5;32,8;25,6;0;80;;1010,5;87;65;72;78;4;190;6;0
03/05/2017;2017;5;3;26,2;29,3;28,6;27,6;30,2;25,4;-;13;;1011,0;95;82;78;87;4;150;8;0
04/05/2017;2017;5;4;25,4;32,0;29,2;28,0;32,5;25,0;-;88;;1011,1;90;69;79;82;6;170;11;0
05/05/2017;2017;5;5;25,1;30,8;28,6;27,4;31,8;24,8;1;69;;1011,4;93;71;83;85;6;90;10;0
06/05/2017;2017;5;6;25,2;30,8;25,8;26,8;31,8;24,0;-;39;;1012,1;90;67;85;83;4;200;8;0
07/05/2017;2017;5;7;25,6;30,8;27,4;27,4;31,2;25,4;-;25;;1011,6;87;66;84;81;4;90;10;0
08/05/2017;2017;5;8;25,4;31,0;29,5;27,8;31,6;24,3;-;100;;1010,6;91;71;73;82;6;90;11;0
09/05/2017;2017;5;9;25,6;31,6;29,0;28,0;32,4;24,4;-;100;;1009,8;90;65;70;79;5;110;9;0
10/05/2017;2017;5;10;26,0;31,6;29,8;28,4;32,2;23,4;-;100;;1010,0;87;64;72;77;5;100;9;0
11/05/2017;2017;5;11;24,4;31,0;30,0;27,5;31,8;24,4;-;88;;1010,1;92;67;73;81;4;60;7;0
12/05/2017;2017;5;12;25,2;30,8;30,2;27,9;31,6;24,6;27;100;;1009,6;85;69;70;77;5;180;10;0
13/05/2017;2017;5;13;25,2;31,8;29,8;28,0;32,2;24,6;-;100;;1009,2;81;60;69;73;3;190;5;0
14/05/2017;2017;5;14;24,7;31,6;30,0;27,8;32,2;23,0;-;100;;1009,6;80;61;69;73;3;140;7;0
15/05/2017;2017;5;15;25,0;30,0;28,8;27,2;31,8;25,0;-;100;;1009,5;87;65;74;78;4;190;8;0
16/05/2017;2017;5;16;24,6;30,8;29,6;27,4;31,6;24,6;0;58;;1009,0;93;73;81;85;4;160;7;0
17/05/2017;2017;5;17;24,8;31,8;29,4;27,7;32,0;22,2;-;100;;1009,7;82;57;73;73;#N/A;190;#N/A;0
18/05/2017;2017;5;18;24,7;31,8;29,5;27,7;32,5;24,0;-;100;;1010,5;80;55;67;70;3;140;6;0
19/05/2017;2017;5;19;24,2;31,9;30,0;27,6;32,2;23,6;-;100;;1009,7;84;54;68;73;4;130;8;0
20/05/2017;2017;5;20;24,0;32,6;30,2;27,7;33,4;24,0;-;63;;1008,5;80;51;65;69;4;190;9;0
21/05/2017;2017;5;21;25,2;30,8;30,0;27,8;31,7;23,3;-;100;;1008,9;74;62;65;69;4;200;9;0
22/05/2017;2017;5;22;24,9;31,2;29,8;27,7;32,0;24,9;-;100;;1009,9;88;64;74;78;5;130;10;0
23/05/2017;2017;5;23;24,4;31,7;29,5;27,5;32,4;22,6;-;100;;1010,1;79;57;71;72;5;190;8;0
24/05/2017;2017;5;24;22,6;30,6;30,0;26,5;31,8;22,6;-;100;;1010,1;88;55;63;73;4;200;10;0
25/05/2017;2017;5;25;24,4;32,0;29,8;27,7;31,6;24,4;-;100;;1009,7;83;53;70;72;4;200;9;0
26/05/2017;2017;5;26;26,0;31,6;27,4;27,8;32,6;24,0;-;93;;1009,2;82;63;84;78;4;140;9;0
27/05/2017;2017;5;27;25,4;31,7;29,6;28,0;32,6;25,4;-;64;;1008,8;90;68;77;81;4;80;7;0
28/05/2017;2017;5;28;25,4;31,6;26,4;27,2;32,4;24,0;19;75;;1009,1;95;66;94;87;5;150;15;0
29/05/2017;2017;5;29;24,4;28,2;25,4;25,6;28,2;24,0;21;0;;1010,3;97;80;92;91;3;150;6;0
30/05/2017;2017;5;30;25,5;30,6;29,0;27,7;31,2;24,8;-;40;;1010,5;95;73;79;86;4;60;8;0
31/05/2017;2017;5;31;26,0;30,9;29,3;28,1;31,8;24,8;-;0;;813,0;90;69;82;83;3;10;6;0
01/06/2017;2017;6;1;26,8;30,8;28,8;28,3;31,6;25,4;0;78;;1010,8;100;68;79;87;5;190;10;0
02/06/2017;2017;6;2;25,4;31,2;29,2;27,8;31,6;24,2;3;78;;1011,6;87;72;75;80;5;190;10;0
03/06/2017;2017;6;3;24,6;31,1;28,7;27,3;31,6;24,2;-;100;;1011,7;88;63;77;79;3;210;6;0
04/06/2017;2017;6;4;24,2;29,0;28,6;26,5;31,2;22,0;-;44;;1010,9;82;68;71;76;4;190;5;0
05/06/2017;2017;6;5;23,0;30,4;29,0;26,4;31,2;23,0;-;100;;1010,8;91;59;72;79;4;120;7;0
06/06/2017;2017;6;6;24,6;31,0;29,0;27,3;31,6;24,6;-;100;;1011,0;92;67;77;82;4;100;8;0
07/06/2017;2017;6;7;25,0;31,2;29,4;27,7;31,6;25,0;-;100;;1011,0;92;69;73;81;4;350;9;0
08/06/2017;2017;6;8;25,2;31,4;29,5;27,8;31,6;24,4;-;100;;1010,7;92;71;77;83;4;150;9;0
09/06/2017;2017;6;9;24,4;31,2;29,2;27,3;31,8;24,4;-;100;;1010,5;95;67;81;84;5;160;8;0
10/06/2017;2017;6;10;24,6;30,6;29,6;27,4;31,6;24,0;-;100;;1010,8;88;69;73;80;4;190;10;0
11/06/2017;2017;6;11;24,2;31,4;29,8;27,4;32,2;24,2;-;100;;1010,7;88;61;70;77;3;180;5;0
12/06/2017;2017;6;12;25,8;29,8;27,6;27,3;31,0;24,4;0;31;;1011,4;90;74;82;84;4;100;9;0
13/06/2017;2017;6;13;25,0;29,4;28,2;26,9;29,8;25,0;-;1;;1012,0;93;77;80;86;6;100;10;0
14/06/2017;2017;6;14;25,4;30,2;29,2;27,6;31,4;25,4;-;68;;1011,5;93;70;71;82;5;150;12;0
15/06/2017;2017;6;15;25,8;29,8;29,2;27,7;31,0;24,3;-;65;;1011,1;92;72;74;82;4;50;8;0
16/06/2017;2017;6;16;25,2;31,0;29,0;27,6;31,4;24,8;0;100;;1011,0;93;66;77;82;5;80;10;0
17/06/2017;2017;6;17;24,8;30,8;29,2;27,4;31,2;21,8;-;100;;1010,2;92;67;67;79;5;90;10;0
18/06/2017;2017;6;18;22,0;30,4;29,2;25,9;31,2;22,0;-;100;;1010,1;86;53;58;71;5;200;9;0
19/06/2017;2017;6;19;21,4;31,0;28,9;25,7;31,4;21,4;-;96;  ;1010,1;93;55;73;78;3;200;6;0
20/06/2017;2017;6;20;24,1;30,0;29,2;26,9;31,4;24,1;-;90;  ;1010,3;87;64;73;78;4;70;6;0
21/06/2017;2017;6;21;24,6;29,4;28,4;26,8;30,4;24,6;-;38; TS ;1011,3;85;70;78;79;7;110;15;0
22/06/2017;2017;6;22;25,4;29,8;25,2;26,5;30,2;24,7;1;15;  ;1011,3;91;69;93;86;5;130;12;0
23/06/2017;2017;6;23;25,4;30,1;28,7;27,4;31,4;23,0;-;100;  ;1009,8;93;68;76;83;4;50;7;0
24/06/2017;2017;6;24;23,8;30,0;28,6;26,6;30,5;23,8;8;6;  ;1010,2;93;70;74;83;6;100;12;0
25/06/2017;2017;6;25;24,0;29,8;28,6;26,6;30,8;24,0;-;94;  ;1010,2;96;76;79;87;5;40;9;0
26/06/2017;2017;6;26;25,2;30,4;28,4;27,3;31,2;24,4;-;100;  ;1011,2;93;71;80;84;5;60;8;0
27/06/2017;2017;6;27;24,4;30,4;29,0;27,1;31,4;23,2;11;100; TS ;1011,6;88;69;72;80;5;180;10;0
28/06/2017;2017;6;28;23,6;29,8;28,6;26,4;30,4;23,5;-;100;  ;1011,1;97;74;74;85;5;40;10;0
29/06/2017;2017;6;29;23,5;30,0;28,6;26,4;31,2;22,5;-;100;  ;1010,6;92;65;76;81;6;50;11;0
30/06/2017;2017;6;30;22,5;30,4;29,4;26,2;31,0;22,5;-;0;  ;1010,4;92;62;69;79;5;50;10;0
01/07/2017;2017;7;1;25,0;30,6;29,2;27,5;31,2;23,8;0;100;  ;1010,6;100;63;74;84;6;70;10;0
02/07/2017;2017;7;2;25,0;30,2;28,8;27,3;31,6;23,8;-;100;  ;1011,1;90;70;78;82;6;60;12;0
03/07/2017;2017;7;3;24,0;30,4;28,8;26,8;31,0;23,4;-;100;  ;1011,5;90;71;76;82;#N/A;140;#N/A;0
04/07/2017;2017;7;4;24,0;30,6;29,4;27,0;31,4;22,2;-;100;  ;1011,4;88;69;73;80;5;180;11;0
05/07/2017;2017;7;5;24,6;31,8;29,2;27,6;32,0;23,2;-;68;  ;1011,7;80;57;73;73;4;180;7;0
06/07/2017;2017;7;6;23,2;29,8;29,3;26,4;30,7;23,2;-;69;  ;1011,5;86;64;73;77;3;200;7;0
07/07/2017;2017;7;7;24,1;32,0;29,8;27,5;32,0;23,6;1;100;  ;1011,5;79;57;66;70;5;190;11;0
08/07/2017;2017;7;8;23,6;30,8;29,4;26,9;31,5;21,8;-;100;  ;1011,5;86;58;71;76;4;190;10;0
09/07/2017;2017;7;9;24,0;30,8;28,8;26,9;31,2;23,6;0;100;  ;1011,3;83;61;75;76;4;230;8;0
10/07/2017;2017;7;10;24,8;30,3;28,4;27,1;31,0;24,8;-;94;  ;1011,3;76;62;75;72;4;200;10;0
11/07/2017;2017;7;11;25,6;31,0;29,0;27,8;31,4;24,4;-;31;  ;1011,8;72;57;74;69;5;200;8;0
12/07/2017;2017;7;12;24,6;31,0;29,2;27,4;31,8;22,4;-;79;  ;1011,7;74;55;70;68;4;190;8;0
13/07/2017;2017;7;13;24,4;31,6;29,8;27,6;32,4;23,0;1;100;  ;1010,7;83;56;69;73;4;200;6;0
14/07/2017;2017;7;14;25,3;30,2;29,4;27,6;31,6;23,9;-;26;  ;1011,0;81;63;75;75;3;190;7;0
15/07/2017;2017;7;15;23,9;31,0;29,4;27,1;31,6;22,6;-;100;  ;1011,2;92;60;70;79;#N/A;150;#N/A;0
16/07/2017;2017;7;16;23,0;30,6;28,4;26,3;31,2;22,6;-;100;  ;1010,9;83;55;67;72;5;200;8;0
17/07/2017;2017;7;17;22,6;29,6;28,4;25,8;31,0;21,8;-;84;  ;1011,3;81;57;68;72;4;120;9;0
18/07/2017;2017;7;18;24,2;30,6;29,0;27,0;31,4;23,8;2;63;  ;1012,9;83;59;67;73;5;160;11;0
19/07/2017;2017;7;19;24,2;29,6;28,6;26,7;30,6;23,4;-;34;  ;1011,5;90;70;78;82;5;130;12;0
20/07/2017;2017;7;20;23,6;30,5;28,7;26,6;31,3;23,4;-;100;  ;1010,8;93;66;77;82;4;190;9;0
21/07/2017;2017;7;21;24,6;30,0;28,4;26,9;30,8;24,0;-;13;  ;1012,3;92;64;76;81;4;50;5;0
22/07/2017;2017;7;22;24,0;30,4;28,6;26,8;31,0;24,0;-;88;  ;1011,9;95;67;79;84;5;170;12;0
23/07/2017;2017;7;23;24,6;30,4;29,0;27,2;31,4;22,6;-;100;  ;1011,3;83;62;71;75;5;180;9;0
24/07/2017;2017;7;24;22,6;29,4;28,6;25,8;30,3;20,0;-;100;  ;1011,1;79;60;67;71;5;190;9;0
25/07/2017;2017;7;25;22,4;31,4;30,0;26,6;32,2;22,4;-;100;  ;1010,2;79;43;55;64;5;190;10;0
26/07/2017;2017;7;26;22,9;31,3;29,8;26,7;32,4;22,9;2;100;  ;1010,0;79;48;65;68;4;190;8;0
27/07/2017;2017;7;27;24,6;27,4;26,8;25,9;28,0;23,8;3;0;  ;1011,8;87;70;78;80;5;200;10;0
28/07/2017;2017;7;28;24,4;29,8;28,6;26,8;31,2;24,4;0;46;  ;1011,9;93;74;74;84;6;80;10;0
29/07/2017;2017;7;29;24,6;29,8;28,6;26,9;31,6;22,3;4;69;  ;1011,7;93;74;77;84;5;150;11;0
30/07/2017;2017;7;30;23,8;30,6;28,8;26,8;31,6;21,0;-;100;  ;1010,7;87;66;81;80;5;200;8;0
31/07/2017;2017;7;31;21,0;29,4;28,6;25,0;31,6;#REF!;-;0;  ;813,6;91;66;64;78;6;200;12;0
01/08/2017;2017;8;1;25,2;30,6;30,6;27,9;31,8;24,0;-;100;;1012,6;100;50;52;76;6;170;9;0
02/08/2017;2017;8;2;24,0;31,4;29,8;27,3;32,6;23,6;-;100;;1011,7;78;53;65;69;5;180;7;0
03/08/2017;2017;8;3;23,7;31,2;29,0;26,9;31,8;23,6;-;100;;1010,9;77;55;66;69;5;190;10;0
04/08/2017;2017;8;4;23,6;30,2;29,6;26,8;31,4;22,2;-;100;;926,1;75;56;56;65;6;190;9;0
05/08/2017;2017;8;5;0,0;31,8;29,2;15,3;32,0;0,0;-;68;;1011,7;100;57;73;82;4;190;7;0
06/08/2017;2017;8;6;23,2;29,8;29,3;26,4;30,7;23,2;-;69;;1011,5;86;64;73;77;3;200;7;0
07/08/2017;2017;8;7;24,1;32,0;29,8;27,5;32,0;23,6;1;100;;1011,5;79;57;66;70;5;190;11;0
08/08/2017;2017;8;8;23,6;30,8;29,4;26,9;31,5;21,8;-;100;;1011,5;86;58;71;76;4;190;10;0
09/08/2017;2017;8;9;24,0;30,8;28,8;26,9;31,2;23,6;0;100;;1011,3;83;61;75;76;4;230;8;0
10/08/2017;2017;8;10;24,8;30,3;28,4;27,1;31,0;24,8;-;94;;1011,3;76;62;75;72;4;200;10;0
11/08/2017;2017;8;11;25,6;31,0;29,0;27,8;31,4;24,4;-;31;;1011,8;72;57;74;69;5;200;8;0
12/08/2017;2017;8;12;24,6;31,0;29,2;27,4;31,8;22,4;-;79;;1011,7;74;55;70;68;4;190;8;0
13/08/2017;2017;8;13;24,4;31,6;29,8;27,6;32,4;23,0;-;100;;1010,7;83;56;69;73;4;200;6;0
14/08/2017;2017;8;14;25,3;30,2;29,4;27,6;31,6;23,4;-;100;;1011,0;81;63;75;75;3;190;7;0
15/08/2017;2017;8;15;23,9;31,0;30,0;27,2;31,8;23,4;-;100;;1011,1;92;50;57;73;#N/A;150;#N/A;0
16/08/2017;2017;8;16;23,4;32,0;28,2;26,8;33,0;22,4;-;100;;1010,1;78;45;69;68;#N/A;200;#N/A;0
17/08/2017;2017;8;17;22,8;30,2;28,8;26,2;31,0;22,8;-;95;;1010,2;71;52;63;64;5;200;10;0
18/08/2017;2017;8;18;24,3;30,0;29,0;26,9;32,0;24,3;0;71;;1011,6;77;57;67;69;5;190;10;0
19/08/2017;2017;8;19;24,6;31,4;29,4;27,5;32,2;24,0;-;94;;1011,3;78;55;70;70;6;170;10;0
20/08/2017;2017;8;20;24,6;31,6;28,8;27,4;32,4;23,4;-;100;;1010,0;73;54;72;68;5;190;12;0
21/08/2017;2017;8;21;22,6;31,4;29,2;26,5;32,2;22,6;-;100;;1010,0;86;51;69;73;6;170;12;0
22/08/2017;2017;8;22;23,6;31,1;29,0;26,8;32,0;23,6;-;100;;1010,7;78;53;66;69;5;190;11;0
23/08/2017;2017;8;23;24,2;30,4;28,8;26,9;31,1;23,8;-;100;;1010,8;75;55;66;68;5;190;10;0
24/08/2017;2017;8;24;23,8;31,5;29,0;27,0;32,4;22,4;-;100;;1010,6;83;60;67;73;6;130;13;0
25/08/2017;2017;8;25;22,8;32,0;28,6;26,6;32,2;20,8;-;100;;1010,5;88;49;64;72;7;150;16;0
26/08/2017;2017;8;26;21,0;30,8;28,6;25,4;31,2;21,0;-;100;;1010,1;89;54;68;75;6;200;11;0
27/08/2017;2017;8;27;23,0;30,6;29,0;26,4;31,4;23,0;-;100;;1009,7;83;60;65;73;6;90;12;0
28/08/2017;2017;8;28;23,8;30,8;29,0;26,9;31,8;23,7;-;100;;1010,1;83;60;65;73;7;140;15;0
29/08/2017;2017;8;29;24,3;31,8;28,8;27,3;32,4;22,8;-;90;;1010,4;78;59;66;70;6;40;12;0
30/08/2017;2017;8;30;22,8;30,0;28,4;26,0;30,8;22,8;10;100;;1011,5;80;58;71;72;6;40;14;0
31/08/2017;2017;8;31;24,0;30,9;28,4;26,8;31,0;#REF!;-;0;;812,7;83;58;72;74;5;180;10;0
01/10/2017;2017;10;1;28,0;32,7;29,4;29,5;33,6;25,2;0;100;  ;1010,3;100;57;70;82;7;30;13;0
02/10/2017;2017;10;2;25,8;31,3;29,6;28,1;31,6;24,9;5;100;;1009,6;84;63;70;75;5;40;9;0
03/10/2017;2017;10;3;25,4;32,6;29,6;28,3;32,8;25,4;2;100;;1010,1;76;55;71;70;6;180;11;0
04/10/2017;2017;10;4;26,0;32,6;30,0;28,7;33,0;25,3;-;100;;1010,5;82;61;70;74;7;170;13;0
05/10/2017;2017;10;5;25,8;32,2;29,7;28,4;32,0;25,6;-;100;;1009,9;79;57;73;72;5;200;14;0
06/10/2017;2017;10;6;26,3;32,0;29,9;28,6;32,6;25,4;-;100;;1008,6;79;61;71;72;5;50;11;0
07/10/2017;2017;10;7;25,8;32,4;29,0;28,3;33,0;25,8;-;100;;1008,3;82;62;68;74;5;190;11;0
08/10/2017;2017;10;8;26,6;31,7;29,6;28,6;32,4;25,3;-;100;;1008,3;75;63;70;71;6;50;10;0
09/10/2017;2017;10;9;26,2;32,2;29,6;28,6;33,8;26,2;-;100;;1007,2;80;62;74;74;#N/A;#N/A;#N/A;0
10/10/2017;2017;10;10;26,4;32,8;30,6;29,1;33,0;26,4;-;100;;1007,0;81;60;66;72;#N/A;210;#N/A;0
11/10/2017;2017;10;11;27,0;32,6;30,2;29,2;33,1;25,7;-;100;;1007,8;81;63;74;75;7;40;15;0
12/10/2017;2017;10;12;26,4;32,6;30,8;29,1;33,2;24,8;-;100;;1008,3;80;63;71;74;5;170;9;0
13/10/2017;2017;10;13;27,4;33,8;30,4;29,8;34,6;26,4;-;88;;1008,1;74;51;73;68;5;210;9;0
14/10/2017;2017;10;14;27,0;33,8;30,8;29,7;34,0;26,6;-;69;;1008,1;70;55;62;64;#N/A;#N/A;#N/A;0
15/10/2017;2017;10;15;26,8;33,4;30,6;29,4;34,6;26,8;-;70;;1008,5;70;53;68;65;#N/A;200;#N/A;0
16/10/2017;2017;10;16;27,2;32,1;24,2;27,7;32,2;23,6;56;38;;1009,4;71;58;95;74;6;270;11;0
17/10/2017;2017;10;17;25,4;30,4;28,0;27,3;31,2;25,4;-;51;;1009,5;92;72;72;82;4;260;8;0
18/10/2017;2017;10;18;25,8;32,2;28,6;28,1;33,0;25,8;-;90;;1009,9;85;63;76;78;6;210;12;0
19/10/2017;2017;10;19;26,8;32,2;30,2;29,0;32,8;25,8;-;94;;1011,1;77;60;68;70;5;210;10;0
20/10/2017;2017;10;20;26,2;33,1;30,2;28,9;34,0;25,2;-;81;;1011,6;75;56;72;70;5;140;9;0
21/10/2017;2017;10;21;26,3;32,4;29,8;28,7;33,0;25,5;-;100;;1011,3;73;61;74;70;5;180;10;0
22/10/2017;2017;10;22;26,0;31,6;30,4;28,5;32,6;25,5;-;100;;1010,6;71;56;66;66;5;180;9;0
23/10/2017;2017;10;23;26,2;32,8;30,3;28,9;33,0;24,2;2;80;;1011,2;75;53;66;67;5;350;11;0
24/10/2017;2017;10;24;24,6;31,0;31,0;27,8;32,6;24,0;-;6;;1011,9;85;52;57;70;#N/A;200;#N/A;0
25/10/2017;2017;10;25;25,0;31,0;29,8;27,7;32,0;25,0;-;100;;1011,5;82;63;68;74;5;340;13;0
26/10/2017;2017;10;26;26,4;31,6;30,2;28,7;32,3;26,4;-;100;;1010,8;83;62;65;73;5;220;12;0
27/10/2017;2017;10;27;26,8;32,4;29,4;28,9;33,4;26,0;-;100;;1009,4;78;61;67;71;6;200;13;0
28/10/2017;2017;10;28;26,8;32,5;30,0;29,0;32,8;26,2;-;100;;1009,8;81;63;73;75;6;160;11;0
29/10/2017;2017;10;29;27,0;32,2;30,6;29,2;32,8;25,8;-;100;;1009,9;77;63;63;70;5;210;15;0
30/10/2017;2017;10;30;26,2;33,4;30,6;29,1;33,6;25,8;-;100;;1009,1;77;45;64;66;5;190;9;0
31/10/2017;2017;10;31;25,8;31,6;30,5;28,4;32,6;#REF!;-;0;;812,3;73;58;61;66;5;190;10;0
01/11/2017;2017;11;1;27,3;32,5;29,8;29,2;33,6;26,3;-;100;;1008,2;100;57;70;82;5;340;8;0
02/11/2017;2017;11;2;26,5;32,8;30,6;29,1;32,8;26,5;-;75;;1007,4;76;53;66;68;5;200;10;0
03/11/2017;2017;11;3;27,0;33,2;30,7;29,5;33,4;26,8;-;66;;1006,5;77;55;67;69;5;190;9;0
04/11/2017;2017;11;4;27,0;32,6;29,0;28,9;33,6;24,8;6;100;;1007,5;77;58;72;71;5;70;13;0
05/11/2017;2017;11;5;25,0;30,0;29,0;27,3;32,8;25,0;4;63;;1007,9;95;76;72;85;6;180;19;0
06/11/2017;2017;11;6;26,2;32,0;29,8;28,6;32,4;26,2;-;75;;1007,9;84;58;74;75;6;180;11;0
07/11/2017;2017;11;7;27,1;31,0;28,3;28,4;32,0;25,5;0;15;;1008,1;84;70;77;79;5;280;12;0
08/11/2017;2017;11;8;26,0;32,4;29,8;28,6;33,4;25,8;-;51;;1007,5;87;59;74;77;4;90;12;0
09/11/2017;2017;11;9;26,6;32,2;30,4;29,0;33,2;26,0;-;100;;1008,0;77;62;68;71;4;#N/A;7;0
10/11/2017;2017;11;10;26,4;32,6;29,6;28,8;34,0;23,8;56;100;;1008,7;72;59;81;71;#N/A;170;#N/A;0
11/11/2017;2017;11;11;25,8;29,2;30,1;27,7;32,4;25,8;-;64;;1008,4;90;71;71;81;#N/A;260;#N/A;0
12/11/2017;2017;11;12;26,3;32,4;29,6;28,7;32,4;25,6;-;69;;1007,8;83;63;74;76;5;190;15;0
13/11/2017;2017;11;13;26,0;31,4;23,8;26,8;32,0;23,6;22;39;;1008,4;89;65;98;85;#N/A;210;#N/A;0
14/11/2017;2017;11;14;25,0;29,4;29,4;27,2;30,8;25,0;0;69;;1008,7;92;74;74;83;#N/A;230;#N/A;0
15/11/2017;2017;11;15;26,0;23,4;27,0;25,6;30,0;23,1;20;0;  ;1009,0;97;97;86;94;4;270;10;0
16/11/2017;2017;11;16;24,8;29,2;27,6;26,6;29,9;23,3;0;10;  ;1008,7;95;79;85;88;#N/A;30;#N/A;0
17/11/2017;2017;11;17;24,8;30,4;29,0;27,3;31,0;24,8;21;91;;1008,0;90;68;75;81;5;220;10;0
18/11/2017;2017;11;18;25,0;30,4;29,2;27,4;31,6;24,2;-;25;;1007,7;92;64;74;80;4;190;10;0
19/11/2017;2017;11;19;26,4;27,8;28,2;27,2;29,6;24,4;1;19;;1008,2;83;88;82;84;3;210;7;0
20/11/2017;2017;11;20;24,8;30,9;28,9;27,4;31,6;24,8;-;88;;1008,1;95;65;76;83;4;210;8;0
21/11/2017;2017;11;21;25,4;28,7;27,6;26,8;30,0;24,6;0;0;;1007,2;89;77;82;84;4;230;8;0
22/11/2017;2017;11;22;25,8;31,2;26,8;27,4;31,4;24,8;11;13;;1006,1;84;67;95;83;5;250;11;0
23/11/2017;2017;11;23;24,9;29,8;27,9;26,9;31,1;24,9;0;24;;1006,1;94;73;80;85;4;230;8;0
24/11/2017;2017;11;24;25,6;26,4;26,0;25,9;30,4;24,6;11;4;;1007,7;93;94;97;94;3;30;7;0
25/11/2017;2017;11;25;25,0;30,8;29,0;27,5;32,0;24,6;-;59;;1007,8;97;70;76;85;3;170;6;0
26/11/2017;2017;11;26;25,8;30,4;27,5;27,4;31,0;25,2;0;65;;1006,8;93;71;82;85;#N/A;200;#N/A;0
27/11/2017;2017;11;27;25,4;30,0;28,6;27,4;30,8;24,8;6;13;;1005,7;92;75;82;85;4;350;10;0
28/11/2017;2017;11;28;25,4;30,0;25,0;26,5;31,4;24,0;48;0;;1006,6;93;78;95;90;5;230;15;0
29/11/2017;2017;11;29;24,8;31,8;24,6;26,5;32,4;24,2;2;99;;1006,7;87;64;97;84;5;210;23;0
30/11/2017;2017;11;30;25,2;29,8;25,8;26,5;30,8;25,0;5;45;;1006,1;96;74;92;89;5;290;9;0
01/12/2017;2017;12;1;26,0;26,6;27,5;26,5;28,2;25,3;0;0;;1006,2;100;91;85;94;#N/A;260;#N/A;0
02/12/2017;2017;12;2;25,9;31,0;29,6;28,1;31,8;25,4;-;69;;1006,7;95;70;74;83;5;290;10;0
03/12/2017;2017;12;3;25,4;31,6;29,8;28,1;32,0;24,6;-;100;;1007,3;84;66;80;78;5;180;10;0
04/12/2017;2017;12;4;25,4;31,6;29,4;28,0;32,0;24,2;-;100;;1007,1;93;68;82;84;5;300;14;0
05/12/2017;2017;12;5;25,2;32,4;29,8;28,2;32,8;25,2;-;100;;1007,6;79;54;67;70;4;270;8;0
06/12/2017;2017;12;6;26,4;31,3;29,8;28,5;32,1;25,0;5;85;;1008,3;92;66;78;82;4;50;8;0
07/12/2017;2017;12;7;26,0;32,0;29,8;28,5;32,5;23,4;7;88;;1009,0;97;68;74;84;5;220;9;0
08/12/2017;2017;12;8;26,0;30,2;29,0;27,8;31,1;23,0;18;53;;1009,6;92;74;82;85;5;290;12;0
09/12/2017;2017;12;9;25,6;31,6;25,8;27,2;32,2;24,9;52;88;;1009,8;95;64;98;88;4;220;9;0
10/12/2017;2017;12;10;25,4;30,0;24,4;26,3;31,8;23,8;3;66;;1010,4;95;72;94;89;5;210;16;0
11/12/2017;2017;12;11;25,2;31,0;24,4;26,5;31,4;24,2;11;13;;1010,5;93;66;94;87;4;230;10;0
12/12/2017;2017;12;12;25,0;29,0;28,6;26,9;30,1;24,3;13;14;;1010,0;92;77;82;86;4;300;6;0
13/12/2017;2017;12;13;24,7;30,6;29,0;27,3;31,2;24,5;-;100;;1009,7;97;72;80;86;5;280;10;0
14/12/2017;2017;12;14;25,8;28,2;24,2;26,0;30,8;24,0;70;0;;1009,8;88;73;98;87;5;320;12;0
15/12/2017;2017;12;15;24,8;30,4;28,3;27,1;31,0;24,3;-;100;;1009,5;97;72;80;86;5;290;11;0
16/12/2017;2017;12;16;25,1;30,4;28,5;27,3;30,8;24,8;-;100;;1009,6;95;73;81;86;7;250;15;0
17/12/2017;2017;12;17;25,0;29,0;28,3;26,8;30,4;25,0;0;40;;1009,7;90;74;78;83;5;280;14;0
18/12/2017;2017;12;18;25,0;30,2;27,9;27,0;30,4;24,6;4;50;;1009,5;88;68;80;81;7;270;15;0
19/12/2017;2017;12;19;25,0;26,8;28,0;26,2;29,8;25,0;2;25;;#REF!;89;90;77;87;8;260;18;0
20/12/2017;2017;12;20;25,4;29,2;26,8;26,7;29,8;24,8;10;0;;1009,6;85;77;89;84;6;250;11;0
21/12/2017;2017;12;21;24,8;29,2;28,2;26,8;30,2;23,7;6;63;;1008,3;93;77;83;87;7;290;15;0
22/12/2017;2017;12;22;24,6;29,5;26,0;26,2;31,0;23,4;2;100;;1007,4;92;73;86;86;5;260;11;0
23/12/2017;2017;12;23;23,8;31,8;29,8;27,3;33,0;21,6;-;100;;1005,8;93;56;73;79;6;220;11;0
24/12/2017;2017;12;24;21,6;31,6;30,0;26,2;32,4;21,6;-;100;;1005,3;95;57;74;80;5;180;10;0
25/12/2017;2017;12;25;23,4;31,7;29,5;27,0;32,2;23,4;8888;100;;FALSE;88;56;73;76;6;320;11;0
26/12/2017;2017;12;26;26,2;29,3;28,4;27,5;30,3;26,2;2;100;;1006,9;87;75;76;81;8;270;18;0
27/12/2017;2017;12;27;27,6;29,4;28,4;28,3;30,0;23,0;9;8;;1007,8;85;79;78;81;7;280;14;0
28/12/2017;2017;12;28;23,6;29,6;28,2;26,3;30,0;23,6;-;23;;1007,9;97;74;82;87;6;290;15;0
29/12/2017;2017;12;29;24,8;29,8;28,6;27,0;30,4;24,8;-;23;;1008,3;95;72;82;86;5;290;12;0
30/12/2017;2017;12;30;25,2;30,4;26,0;26,7;32,0;23,6;16;25;;1008,1;97;71;93;90;4;230;7;0
31/12/2017;2017;12;31;24,2;32,0;26,1;26,6;32,2;#REF!;-;0;;809,2;97;62;86;85;5;#N/A;9;0
01/01/2018;2018;1;1;26,0;26,6;27,5;26,5;28,2;25,3;0;0;;1006,2;100;91;85;94;#N/A;260;#N/A;0
02/01/2018;2018;1;2;25,9;31,0;29,6;28,1;31,8;25,4;-;69;;1006,7;95;70;74;83;5;290;10;0
03/01/2018;2018;1;3;25,4;31,6;29,8;28,1;32,0;24,6;-;100;;1007,3;84;66;80;78;5;180;10;0
04/01/2018;2018;1;4;25,4;31,6;29,4;28,0;32,0;24,2;-;100;;1007,1;93;68;82;84;5;300;14;0
05/01/2018;2018;1;5;25,2;32,4;29,8;28,2;32,8;25,2;-;100;;1007,6;79;54;67;70;4;270;8;0
06/01/2018;2018;1;6;26,4;31,3;29,8;28,5;32,1;25,0;5;85;;1008,3;92;66;78;82;4;50;8;0
07/01/2018;2018;1;7;26,0;32,0;29,8;28,5;32,5;23,4;7;88;;1009,0;97;68;74;84;5;220;9;0
08/01/2018;2018;1;8;26,0;30,2;29,0;27,8;31,1;23,0;18;53;;1009,6;92;74;82;85;5;290;12;0
09/01/2018;2018;1;9;25,6;31,6;25,8;27,2;32,2;24,9;52;88;;1009,8;95;64;98;88;4;220;9;0
10/01/2018;2018;1;10;25,4;30,0;24,4;26,3;31,8;23,8;3;66;;1010,4;95;72;94;89;5;210;16;0
11/01/2018;2018;1;11;25,2;31,0;24,4;26,5;31,4;24,2;11;13;;1010,5;93;66;94;87;4;230;10;0
12/01/2018;2018;1;12;25,0;29,0;28,6;26,9;30,1;24,3;13;14;;1010,0;92;77;82;86;4;300;6;0
13/01/2018;2018;1;13;24,7;30,6;29,0;27,3;31,2;24,7;-;88;;1009,6;97;72;80;86;5;280;10;0
14/01/2018;2018;1;14;27,0;33,8;30,8;29,7;34,0;26,6;-;69;;1008,1;70;55;62;64;#N/A;#N/A;#N/A;0
15/01/2018;2018;1;15;26,8;33,4;30,6;29,4;34,6;26,8;-;70;;1008,5;70;53;68;65;#N/A;200;#N/A;0
16/01/2018;2018;1;16;27,2;32,1;24,2;27,7;32,2;23,6;56;38;;1009,4;71;58;95;74;6;270;11;0
17/01/2018;2018;1;17;25,4;30,4;28,0;27,3;31,2;25,4;-;51;;1009,5;92;72;72;82;4;260;8;0
18/01/2018;2018;1;18;25,8;32,2;28,6;28,1;33,0;25,8;-;90;;1009,9;85;63;76;78;6;210;12;0
19/01/2018;2018;1;19;26,8;32,2;30,2;29,0;32,8;25,8;-;94;;1011,1;77;60;68;70;5;210;10;0
20/01/2018;2018;1;20;26,2;33,1;30,2;28,9;34,0;25,2;-;81;;1011,6;75;56;72;70;5;140;9;0
21/01/2018;2018;1;21;26,3;32,4;29,8;28,7;33,0;25,5;-;100;;1011,3;73;61;74;70;5;180;10;0
22/01/2018;2018;1;22;26,0;31,6;30,4;28,5;32,6;25,5;-;100;;1010,6;71;56;66;66;5;180;9;0
23/01/2018;2018;1;23;26,2;32,8;30,3;28,9;33,0;24,2;2;80;;1011,2;75;53;66;67;5;350;11;0
24/01/2018;2018;1;24;24,6;31,0;31,0;27,8;32,6;24,0;-;6;;1011,9;85;52;57;70;#N/A;200;#N/A;0
25/01/2018;2018;1;25;25,0;31,0;29,8;27,7;32,0;25,0;-;100;;1011,5;82;63;68;74;5;340;13;0
26/01/2018;2018;1;26;26,4;31,6;30,2;28,7;32,3;26,4;-;100;;1010,8;83;62;65;73;5;220;12;0
27/01/2018;2018;1;27;26,8;32,4;29,4;28,9;33,4;26,0;-;100;;1009,4;78;61;67;71;6;200;13;0
28/01/2018;2018;1;28;26,8;32,5;30,0;29,0;32,8;26,2;-;100;;1009,8;81;63;73;75;6;160;11;0
29/01/2018;2018;1;29;27,0;32,2;30,6;29,2;32,8;25,8;-;100;;1009,9;77;63;63;70;5;210;15;0
30/01/2018;2018;1;30;26,2;33,4;30,6;29,1;33,6;25,8;-;100;;1009,1;77;45;64;66;5;190;9;0
31/01/2018;2018;1;31;25,8;31,6;30,5;28,4;32,6;#REF!;-;0;;810,4;73;58;61;66;5;200;10;0
01/02/2018;2018;2;1;25,4;29,0;27,8;26,9;29,2;24,8;2;6;;1008,4;100;81;86;92;#N/A;#N/A;#N/A;0
02/02/2018;2018;2;2;24,8;29,8;28,0;26,9;30,4;23,8;5;49;;1008,7;97;73;83;87;5;270;12;0
03/02/2018;2018;2;3;24,4;27,8;26,5;25,8;30,2;23,8;-;65;;1009,4;98;75;79;88;8;270;21;0
04/02/2018;2018;2;4;23,8;27,8;28,2;25,9;30,3;23,8;18;78;;1009,8;97;81;80;88;6;280;12;0
05/02/2018;2018;2;5;25,1;28,8;25,2;26,1;29,4;23,4;40;13;;1010,8;91;79;89;88;5;270;11;0
06/02/2018;2018;2;6;23,8;27,6;27,2;25,6;28,2;23,8;0;0;;1010,4;84;80;76;81;7;270;17;0
07/02/2018;2018;2;7;24,6;28,8;26,8;26,2;29,2;24,4;9;50;;1009,5;87;74;84;83;6;250;11;0
08/02/2018;2018;2;8;24,8;25,2;27,6;25,6;29,2;23,0;22;34;;1009,4;93;93;82;90;#N/A;260;#N/A;0
09/02/2018;2018;2;9;24,4;28,7;27,1;26,2;29,2;23,6;10;56;;1009,2;93;78;87;88;6;230;13;0
10/02/2018;2018;2;10;23,6;29,4;28,3;26,2;30,0;23,6;6;90;;1009,4;97;75;83;88;#N/A;250;#N/A;0
11/02/2018;2018;2;11;25,0;29,0;27,8;26,7;29,6;24,3;0;13;;1010,2;94;75;82;86;8;290;16;0
12/02/2018;2018;2;12;24,4;28,0;27,4;26,1;30,0;24,4;1;25;;1011,3;95;79;89;89;7;260;18;0
13/02/2018;2018;2;13;25,0;26,1;26,9;25,8;29,6;24,4;1;51;;1011,5;90;91;83;88;8;270;17;0
14/02/2018;2018;2;14;24,8;30,0;27,8;26,9;30,6;23,8;0;25;;1010,9;90;72;80;83;7;250;14;0
15/02/2018;2018;2;15;23,9;28,0;25,4;25,3;29,6;23,7;16;33;;1011,3;93;85;95;91;6;280;20;0
16/02/2018;2018;2;16;24,2;28,6;28,2;26,3;30,2;23,8;-;26;;1009,3;92;76;82;85;6;290;15;0
17/02/2018;2018;2;17;24,0;29,2;28,6;26,5;30,0;24,0;-;83;;1008,4;91;75;79;84;7;250;14;0
18/02/2018;2018;2;18;24,4;30,3;28,0;26,8;30,8;24,4;0;88;;1008,7;93;69;85;85;6;260;11;0
19/02/2018;2018;2;19;24,4;30,6;28,1;26,9;31,4;24,3;0;88;;1008,5;97;71;84;87;5;260;11;0
20/02/2018;2018;2;20;24,3;30,4;29,0;27,0;31,0;23,8;49;69;;1008,2;97;69;78;85;5;240;11;0
21/02/2018;2018;2;21;24,0;30,0;28,6;26,7;30,4;24,0;2;54;;1006,8;97;76;76;87;#N/A;320;#N/A;0
22/02/2018;2018;2;22;24,4;29,8;28,4;26,8;30,4;24,2;0;46;;1007,4;92;70;80;83;4;310;7;0
23/02/2018;2018;2;23;24,4;29,3;28,4;26,6;33,0;24,4;1;76;;1008,8;97;76;80;87;4;210;8;0
24/02/2018;2018;2;24;25,0;28,1;27,8;26,5;28,4;24,4;2;10;;1010,3;97;83;82;90;6;290;13;0
25/02/2018;2018;2;25;24,4;29,2;28,6;26,7;30,6;24,3;0;63;;1008,4;97;79;76;88;4;240;8;0
26/02/2018;2018;2;26;24,4;30,0;27,8;26,7;30,4;23,4;40;6;;1008,8;95;73;91;88;4;250;9;0
27/02/2018;2018;2;27;23,4;30,8;29,4;26,8;31,4;23,2;21;94;;1008,3;96;67;71;83;4;330;9;0
28/02/2018;2018;2;28;24,0;29,2;28,7;26,5;32,0;24,0;2;100;;1007,8;97;71;81;86;4;330;8;0
01/03/2018;2018;3;1;25,9;29,8;27,7;27,3;30,6;24,6;1,5;39; ;1008,3;93;74;81;86;3;C;9;N
02/03/2018;2018;3;2;26,2;30,3;27,8;27,8;31,5;25,4;-;50;RA;1008,6;90;75;86;84;3;C;10;NW
03/03/2018;2018;3;3;26,0;30,0;28,6;27,5;30,8;24,0;0,6;36;SL / MOD TS NO HA + RA;1008,1;92;74;83;86;4;C;12;W
04/03/2018;2018;3;4;25,6;31,2;28,8;28,2;31,8;25,4;12,0;89;LIGHTNING;1008,5;95;71;82;85;3;C;9;N
05/03/2018;2018;3;5;26,3;29,3;27,4;26,7;30,4;24,0;-;35;RA;1008,8;95;79;87;89;2;C;8;N
06/03/2018;2018;3;6;24,7;30,9;28,2;27,9;31,4;24,7;TTU;98;LIGHTNING;1009,3;96;69;85;84;3;C;10;W
07/03/2018;2018;3;7;26,0;30,8;25,6;26,5;31,2;24,2;-;63;SL / MOD TS NO HA + RA;1007,8;92;71;87;86;3;C;9;W
08/03/2018;2018;3;8;25,2;29,8;27,9;27,0;30,2;24,6;3,6;18;TS NO PREC;1008,1;93;76;80;86;2;C;9;N
09/03/2018;2018;3;9;25,3;30,1;28,8;26,9;31,2;24,0;-;29;SL / MOD TS NO HA + RA;1008,3;95;72;82;88;3;C;10;S
10/03/2018;2018;3;10;24,6;30,2;27,7;27,5;31,3;24,0;31,0;94;SL / MOD TS NO HA + RA;1008,7;97;77;85;87;4;SW;12;N
11/03/2018;2018;3;11;24,8;29,7;27,4;26,8;30,0;23,8;0,5;48;SL / MOD TS NO HA + RA;1009,3;93;70;85;88;3;C;7;NE
12/03/2018;2018;3;12;23,6;29,2;27,4;26,6;29,6;23,6;28,0;78;SL / MOD TS NO HA + RA;1009,0;98;75;88;88;3;C;9;NE
13/03/2018;2018;3;13;25,5;26,6;25,4;25,6;28,8;24,2;9,3;0;RA;1008,9;96;90;98;94;2;C;13;N
14/03/2018;2018;3;14;25,0;31,4;28,0;27,7;31,4;24,8;2,6;100;SL / MOD TS NO HA + RA;1010,3;93;68;83;84;3;SW;8;W
15/03/2018;2018;3;15;26,3;30,6;24,0;27,1;31,4;23,8;TTU;100;SL / MOD TS NO HA + RA;1010,2;86;60;96;84;3;C;13;SW
16/03/2018;2018;3;16;25,5;31,1;28,3;27,1;31,4;23,6;11,0;76;RA;1009,2;95;63;83;84;3;C;6;N
17/03/2018;2018;3;17;25,4;27,4;27,2;26,5;30,8;24,0;30,0;56;RA;1009,0;95;83;80;87;3;C;13;NW
18/03/2018;2018;3;18;25,8;29,6;28,4;27,2;30,2;24,8;8,8;75; ;1010,3;89;73;83;86;3;C;10;E
19/03/2018;2018;3;19;26,0;30,0;27,8;27,2;31,6;24,8;-;40;RA;1009,5;90;77;75;85;3;C;8;W
20/03/2018;2018;3;20;25,6;30,4;28,5;28,2;32,4;25,0;0,2;100;LIGHTNING;1009,0;93;72;83;82;4;W;8;NE
21/03/2018;2018;3;21;26,6;29,5;27,8;27,3;30,2;24,9;-;41;RA;1006,3;89;73;82;86;7;W;19;W
22/03/2018;2018;3;22;25,6;28,4;26,8;26,4;30,4;23,8;1,9;44; ;1006,6;80;80;85;85;3;C;10;W
23/03/2018;2018;3;23;26,0;30,6;27,2;27,9;31,7;24,7;-;100; ;1008,5;90;71;77;79;3;C;9;NW
24/03/2018;2018;3;24;27,0;31,2;25,2;27,7;32,0;25,0;-;94;RA;1009,5;83;67;92;83;3;C;7;SE
25/03/2018;2018;3;25;26,8;32,4;24,4;26,7;33,0;22,8;1,0;65;RA;1010,6;86;55;97;86;4;C;13;SW
26/03/2018;2018;3;26;25,2;30,5;28,0;27,7;31,1;25,2;18,5;90;TS NO PREC;1010,7;92;68;83;84;2;C;4;NE
27/03/2018;2018;3;27;26,6;30,8;25,5;26,8;31,2;23,8;-;50;RA;1010,5;89;70;91;86;2;C;6;N
28/03/2018;2018;3;28;25,8;31,2;24,4;27,1;31,6;23,7;0,9;100;SL / MOD TS NO HA + RA;1010,0;86;66;98;85;3;C;10;N
29/03/2018;2018;3;29;25,2;31,2;28,0;28,1;32,4;25,2;26,0;100;LIGHTNING;1009,3;84;67;83;81;3;C;10;N
30/03/2018;2018;3;30;26,5;30,6;28,2;28,2;32,0;25,1;-;100;RA;1008,0;84;73;86;83;5;W;11;NW
31/03/2018;2018;3;31;25,4;31,3;28,0;28,0;31,6;25,0;;85;;1008,4;93;69;86;85;4;W;9;N
01/04/2018;2018;4;1;27,8;31,2;28,4;28,1;31,4;25,2;-;100;TS NO PREC;1008,6;82;70;81;83;4;C;11;W
02/04/2018;2018;4;2;26,8;31,4;27,8;27,5;31,6;24,7;-;98;TS NO PREC;1009,0;89;67;82;84;3;C;10;W
03/04/2018;2018;4;3;26,3;31,5;23,4;26,8;31,8;22,8;17,5;100;SL / MOD TS NO HA + RA;1010,2;87;69;97;86;3;C;13;S
04/04/2018;2018;4;4;25,6;31,2;28,8;28,2;31,9;25,2;-;100; ;1009,7;92;70;79;83;3;C;7;N
05/04/2018;2018;4;5;27,0;31,4;29,0;28,9;32,0;25,4;0,8;100;RA;1008,1;85;72;79;81;3;C;8;E
06/04/2018;2018;4;6;27,2;31,6;29,0;28,4;31,7;24,2;11,2;100;SL / MOD TS NO HA + RA;1007,9;87;67;72;79;3;C;11;NE
07/04/2018;2018;4;7;26,2;30,6;28,2;28,1;30,8;25,2;-;89;LIGHTNING;1009,9;86;71;79;81;4;NE;8;E
08/04/2018;2018;4;8;26,6;28,8;27,8;27,5;31,6;24,6;-;93; ;1009,5;87;78;85;86;3;C;9;N
09/04/2018;2018;4;9;26,6;31,3;28,6;28,0;31,4;24,4;-;100; ;1011,2;90;67;78;82;3;C;9;E
10/04/2018;2018;4;10;26,6;31,0;28,9;27,9;31,3;24,6;-;95; ;1010,5;83;68;80;83;3;C;9;E
11/04/2018;2018;4;11;26,5;31,0;29,0;29,1;31,8;26,4;-;100; ;1009,1;88;68;72;78;5;NE;11;NE
12/04/2018;2018;4;12;28,2;31,2;29,0;28,6;31,8;25,7;-;83; ;1009,4;86;69;81;82;3;C;9;NE
13/04/2018;2018;4;13;27,2;31,4;29,4;29,1;31,8;26,2;-;100;LIGHTNING;1009,0;88;75;82;83;4;NE;9;NE
14/04/2018;2018;4;14;27,2;31,8;29,0;28,7;31,9;25,4;-;79; ;1008,1;87;70;84;83;3;C;9;NE
15/04/2018;2018;4;15;27,3;31,6;29,6;28,7;32,0;24,8;-;100; ;1007,5;89;70;81;81;3;C;9;E
16/04/2018;2018;4;16;27,0;32,1;29,6;28,8;32,5;25,5;1,0;100;RA;1007,7;84;64;74;80;3;C;10;N
17/04/2018;2018;4;17;27,0;30,8;29,2;27,9;31,8;24,6;7,5;81;RA;1009,8;87;71;79;83;3;C;10;N
18/04/2018;2018;4;18;26,8;30,6;28,8;28,2;31,6;25,6;-;98;LIGHTNING;1009,2;87;69;81;83;2;C;7;NE
19/04/2018;2018;4;19;26,6;31,3;29,2;28,8;32,0;25,4;;88;RA;1008,8;88;58;71;75;4;E;7;NW
20/04/2018;2018;4;20;27,2;32,0;29,2;28,4;32,4;24,4;13,0;100;SL / MOD TS NO HA + RA;1008,0;87;65;75;80;4;NE;8;E
21/04/2018;2018;4;21;26,8;31,0;25,4;27,8;32,0;25,4;3,5;81;SL / MOD TS NO HA + RA;1008,4;92;72;95;85;2;C;9;E
22/04/2018;2018;4;22;27,2;27,6;27,9;27,7;32,0;26,0;;54;SL / MOD TS NO HA + RA;1007,6;86;82;87;85;2;C;10;SE
23/04/2018;2018;4;23;26,4;29,2;29,0;27,9;31,4;25,2;-;13;TS NO PREC;1007,8;84;77;75;82;3;C;9;E
24/04/2018;2018;4;24;26,2;30,6;29,4;28,4;31,4;25,0;-;56; ;1007,7;86;71;73;80;3;C;8;N
25/04/2018;2018;4;25;26,3;31,2;28,8;28,0;31,4;25,2;-;100; ;1008,3;90;61;74;80;3;C;8;N
26/04/2018;2018;4;26;26,8;31,0;29,0;28,2;31,6;24,8;-;100; ;1009,2;86;69;75;80;4;E;10;NE
27/04/2018;2018;4;27;26,6;31,4;29,0;28,4;32,0;25,0;-;100; ;1010,1;86;64;77;79;4;C;10;E
28/04/2018;2018;4;28;26,4;32,2;29,0;28,2;32,6;24,0;-;100; ;1011,2;86;61;72;73;4;NE;8;NE
29/04/2018;2018;4;29;25,7;31,0;28,6;28,0;31,6;24,0;-;100; ;1010,9;76;55;69;72;4;C;8;N
30/04/2018;2018;4;30;26,0;32,2;28,8;28,3;33,2;0,0;-;100; ;1010,0;79;46;71;69;4;E;10;E
01/05/2018;2018;5;1;25,8;31,8;28,8;27,7;31,9;24,0;-;100; ;1010,1;82;61;76;73;5;E;8;SE
02/05/2018;2018;5;2;25,8;31,6;28,2;27,5;32,2;24,0;-;76; ;1011,0;72;52;73;71;3;C;7;E
03/05/2018;2018;5;3;25,2;30,6;28,8;27,8;31,2;24,2;-;100; ;1011,1;79;63;68;75;4;C;8;NE
04/05/2018;2018;5;4;25,4;31,2;29,0;27,7;31,6;22,6;-;100; ;1011,2;78;59;71;72;4;C;11;NE
05/05/2018;2018;5;5;25,2;31,3;29,2;28,6;31,8;24,8;-;98; ;1012,0;79;60;69;73;5;E;10;E
06/05/2018;2018;5;6;27,0;32,2;30,0;28,7;32,6;24,6;-;100; ;1012,1;87;63;67;75;5;E;12;E
07/05/2018;2018;5;7;27,0;31,6;29,3;28,7;32,2;24,6;-;100; ;1010,9;83;66;81;78;4;NE;11;E
08/05/2018;2018;5;8;26,8;31,8;29,0;28,5;32,2;24,4;-;100;TS NO PREC;1010,5;81;67;72;76;4;C;9;E
09/05/2018;2018;5;9;25,7;31,7;29,2;28,4;32,2;24,8;-;100; ;1010,5;85;59;71;73;6;NE;11;NE
10/05/2018;2018;5;10;26,6;32,0;29,4;28,4;32,2;24,0;-;100; ;1011,1;83;62;70;75;4;E;8;E
11/05/2018;2018;5;11;26,0;31,6;28,9;28,4;32,0;24,8;-;100; ;1009,7;81;62;79;75;4;E;8;NE
12/05/2018;2018;5;12;26,0;31,6;29,8;28,4;32,3;24,3;-;95; ;1009,8;76;59;66;71;3;C;8;NE
13/05/2018;2018;5;13;26,4;32,2;29,2;28,5;32,8;25,0;-;100; ;1009,6;75;57;77;72;4;E;7;E
14/05/2018;2018;5;14;26,0;31,8;29,3;29,3;32,6;26,0;-;100; ;1008,9;79;61;78;74;6;E;10;NE
15/05/2018;2018;5;15;27,8;32,0;28,7;28,2;32,6;25,5;-;69;SL / MOD TS NO HA + RA;1008,1;80;67;79;80;4;C;13;E
16/05/2018;2018;5;16;27,2;30,6;28,2;28,2;32,0;22,8;6,9;56;SL / MOD TS NO HA + RA;1008,2;81;66;85;81;4;C;11;E
17/05/2018;2018;5;17;27,8;30,8;28,0;27,9;32,0;24,8;2,7;45;TS NO PREC;1006,7;85;71;75;78;3;NE;7;E
18/05/2018;2018;5;18;26,2;31,0;29,4;27,9;31,8;24,4;-;88; ;1007,2;81;62;73;76;4;S;9;SE
19/05/2018;2018;5;19;25,7;31,6;29,0;28,1;32,4;25,0;-;95; ;1007,1;79;57;69;74;4;C;9;E
20/05/2018;2018;5;20;26,4;30,2;29,1;28,5;31,6;25,2;-;26;RA;1007,4;81;67;71;75;3;E;8;NE
21/05/2018;2018;5;21;27,4;30,6;28,1;28,3;32,0;26,1;0,0;94; ;1007,9;80;68;78;77;5;E;16;E
22/05/2018;2018;5;22;26,8;31,6;29,2;28,4;32,2;26,0;-;66; ;1008,0;86;69;78;80;5;SE;14;E
23/05/2018;2018;5;23;27,5;31,8;29,2;28,8;32,4;25,4;-;98;LIGHTNING;1007,5;81;65;78;79;5;E;14;E
24/05/2018;2018;5;24;26,8;31,7;29,4;28,5;32,6;25,0;-;79;RA;1007,7;82;60;79;78;4;C;11;E
25/05/2018;2018;5;25;26,0;31,6;29,4;28,5;32,2;25,6;2,0;96; ;1007,3;87;64;73;76;4;S;9;E
26/05/2018;2018;5;26;27,0;32,0;29,0;28,6;32,2;25,2;-;100; ;1008,0;78;64;78;74;5;S;11;E
27/05/2018;2018;5;27;26,2;32,8;30,0;28,5;33,2;25,0;-;26; ;1008,1;74;50;72;67;4;S;7;S
28/05/2018;2018;5;28;25,2;32,0;28,2;27,9;32,6;24,1;-;81; ;1008,4;79;55;73;71;3;C;9;NE
29/05/2018;2018;5;29;26,4;30,8;29,2;28,1;31,8;24,1;-;100; ;1008,3;70;65;70;70;5;S;10;E
30/05/2018;2018;5;30;25,4;31,0;28,8;27,7;32,0;23,5;-;100; ;1009,2;76;59;71;70;4;S;9;N
31/05/2018;2018;5;31;25,2;31,2;28,2;27,2;31,6;23,7;-;100;;1009,0;68;61;67;70;3;C;9;NE
01/06/2018;2018;6;1;25,0;30,6;28,6;27,3;31,0;24,8;-;98; ;1009,1;75;59;68;75;4;C;13;NE
02/06/2018;2018;6;2;25,4;30,8;28,4;27,2;31,0;24,6;-;100; ;1009,2;82;61;75;74;5;E;11;NE
03/06/2018;2018;6;3;25,7;30,5;28,4;28,1;31,2;24,8;-;100; ;1008,7;81;66;74;76;5;E;12;NE
04/06/2018;2018;6;4;26,6;30,9;28,6;28,2;31,8;25,1;-;94; ;1010,5;84;62;74;77;5;E;13;E
05/06/2018;2018;6;5;26,6;31,6;28,4;28,2;32,1;24,8;-;100; ;1010,5;90;67;68;75;4;S;11;NE
06/06/2018;2018;6;6;25,6;31,0;29,0;28,0;31,8;24,6;-;89; ;1010,3;83;66;75;77;5;NE;10;NE
07/06/2018;2018;6;7;26,0;31,0;29,2;28,5;31,5;25,0;-;100; ;1010,1;84;62;79;75;4;E;8;E
08/06/2018;2018;6;8;26,0;31,5;29,0;28,1;32,0;23,9;-;98; ;1009,7;75;56;77;73;4;E;9;NE
09/06/2018;2018;6;9;26,2;31,8;29,0;28,1;32,6;23,6;-;90; ;1012,0;90;55;70;70;4;S;8;NE
10/06/2018;2018;6;10;24,6;31,3;29,2;28,3;32,3;24,6;-;90; ;1011,3;78;60;74;72;5;S;12;E
11/06/2018;2018;6;11;26,2;32,2;29,6;28,6;33,0;25,2;-;63; ;1011,3;71;61;71;68;3;S;7;NE
12/06/2018;2018;6;12;27,0;31,8;29,2;28,4;32,4;25,4;-;94; ;1010,1;64;60;75;65;5;S;10;NE
13/06/2018;2018;6;13;26,6;31,4;29,0;27,9;32,0;24,2;-;88; ;1010,5;69;56;67;67;5;E;11;NE
14/06/2018;2018;6;14;26,0;31,1;28,7;27,4;32,0;22,5;-;100; ;1011,0;76;59;70;71;4;E;9;E
15/06/2018;2018;6;15;25,0;30,4;28,2;26,9;31,4;22,6;-;100; ;1011,4;79;58;69;73;6;E;14;E
16/06/2018;2018;6;16;24,8;30,6;28,4;27,7;31,4;24,2;-;103; ;1010,2;82;67;68;72;7;NE;14;E
17/06/2018;2018;6;17;25,4;30,6;28,6;27,9;31,6;24,0;-;93; ;1010,2;82;54;68;72;5;E;14;E
18/06/2018;2018;6;18;25,2;31,5;29,0;28,0;32,0;24,8;-;100; ;1010,7;75;59;73;70;6;S;12;S
19/06/2018;2018;6;19;26,2;32,0;28,2;28,2;32,8;24,8;-;100; ;1010,8;69;62;93;78;6;NE;13;NE
20/06/2018;2018;6;20;26,2;30,8;25,0;27,3;31,6;24,2;-;63;RA;1011,5;88;65;82;80;5;C;11;SE
21/06/2018;2018;6;21;24,8;31,0;28,6;27,4;32,2;24,4;4,6;35;RA;1011,0;85;65;76;77;4;S;10;E
22/06/2018;2018;6;22;25,2;31,2;28,6;27,6;31,8;24,6;;51;TS NO PREC;1010,4;81;65;82;78;4;C;10;E
23/06/2018;2018;6;23;25,3;30,0;28,4;27,6;31,0;24,4;;98; ;1009,7;84;68;75;77;5;S;11;NE
24/06/2018;2018;6;24;25,6;30,9;27,8;27,7;31,6;24,6;;96;RA;1009,4;85;64;72;78;4;SW;8;N
25/06/2018;2018;6;25;25,2;30,2;26,6;26,5;31,0;23,5;;25;RA;1009,7;80;60;72;73;5;S;8;NE
26/06/2018;2018;6;26;24,8;30,2;28,2;27,2;32,2;24,0;1,0;38;PREC IN SIGHT;1009,9;75;46;62;65;5;S;11;S
27/06/2018;2018;6;27;25,2;32,0;29,4;27,8;32,6;24,4;-;100; ;1009,2;69;51;69;65;5;SW;8;NE
28/06/2018;2018;6;28;25,6;31,0;28,6;27,5;31,8;24,0;-;98; ;1009,8;67;56;54;62;5;S;9;S
29/06/2018;2018;6;29;25,8;31,3;29,6;27,9;32,0;24,3;-;100; ;1008,9;69;55;71;67;5;S;0;0
30/06/2018;2018;6;30;25,5;31,6;28,8;27,6;32,4;23,2;-;100; ;1010,7;88;57;73;76;9;E;15;100
01/07/2018;2018;7;1;24,8;30,2;28,0;27,2;31,6;22,6;-;100;;1009,6;73;62;72;73;5;E;12;NE
02/07/2018;2018;7;2;23,6;30,8;27,6;26,9;31,2;23,6;-;100;;1010,6;85;57;73;73;4;S;9;NE
03/07/2018;2018;7;3;24,2;31,2;29,0;27,7;32,0;24,2;-;69;;1010,5;77;47;66;65;4;S;10;NE
04/07/2018;2018;7;4;26,2;32,0;28,8;28,0;33,0;25,0;-;88;RA;1010,0;72;52;70;62;5;S;10;E
05/07/2018;2018;7;5;25,5;30,0;28,4;26,7;31,4;22,3;0,0;100;;1010,8;65;59;47;58;7;S;10;S
06/07/2018;2018;7;6;23,6;30,8;28,0;26,8;31,2;23,6;-;100;;1010,0;67;50;64;63;5;S;10;E
07/07/2018;2018;7;7;25,0;31,0;28,8;27,3;31,6;23,5;-;100;;1009,3;68;52;58;64;4;S;10;E
08/07/2018;2018;7;8;25,0;30,7;28,4;27,6;31,6;24,0;-;100;;1009,3;73;54;72;66;5;S;12;E
09/07/2018;2018;7;9;25,4;30,0;28,4;27,2;31,2;23,0;-;100;;1010,2;67;60;67;68;6;S;14;S
10/07/2018;2018;7;10;25,0;31,6;28,6;27,4;32,0;23,6;-;95;;1010,0;71;56;68;66;5;S;9;E
11/07/2018;2018;7;11;24,4;32,2;27,6;26,6;32,6;22,8;-;83;RA;1011,0;68;43;72;69;5;S;11;SW
12/07/2018;2018;7;12;24,2;30,6;27,6;27,0;31,2;23,0;7,0;100;;1009,8;77;53;70;66;4;S;10;NE
13/07/2018;2018;7;13;24,0;31,7;27,6;26,8;31,8;22,8;-;95;;1009,3;72;52;70;68;5;S;12;NE
14/07/2018;2018;7;14;24,7;30,4;27,6;26,9;30,6;24,0;-;95;;1009,2;68;55;72;64;7;S;11;SE
15/07/2018;2018;7;15;24,8;31,4;28,2;26,5;32,4;22,2;-;86;;1010,2;65;43;63;59;5;S;9;S
16/07/2018;2018;7;16;24,0;30,8;27,6;26,7;31,0;22,8;-;100;RA;1009,7;66;53;73;70;5;NE;12;E
17/07/2018;2018;7;17;23,8;30,2;27,6;27,1;31,0;23,4;1,2;100;;1008,4;80;59;76;72;5;NE;9;E
18/07/2018;2018;7;18;24,6;30,6;27,8;27,3;31,8;23,0;-;100;;1009,4;77;62;79;74;5;NE;12;NE
19/07/2018;2018;7;19;24,6;30,6;28,0;27,1;31,0;23,0;-;100;RA;1010,4;79;64;75;74;6;S;10;E
20/07/2018;2018;7;20;24,6;30,5;28,0;27,3;31,0;23,8;0,0;113;;1009,9;79;63;76;73;5;E;11;NE
21/07/2018;2018;7;21;25,0;32,0;28,0;27,9;32,4;24,6;-;99;;1010,8;76;52;76;70;4;S;9;SE
22/07/2018;2018;7;22;26,0;32,4;28,6;28,3;33,0;24,0;-;96;;1011,7;71;52;72;69;5;S;12;N
23/07/2018;2018;7;23;26,0;31,0;28,1;27,7;31,8;23,0;-;100;RA;1010,8;76;66;80;75;5;S;12;NE
24/07/2018;2018;7;24;24,4;31,0;27,5;27,0;31,8;22,0;0,0;100;;1010,1;79;60;79;75;5;E;10;NE
25/07/2018;2018;7;25;23,6;31,2;28,0;26,4;32,0;21,9;-;100;;1010,8;83;52;68;71;5;E;11;NE
26/07/2018;2018;7;26;23,0;30,6;27,6;26,4;31,2;22,6;-;100;;1011,4;76;57;74;66;6;SW;13;NE
27/07/2018;2018;7;27;24,2;31,0;28,0;27,0;31,4;23,6;-;100;;1010,5;71;54;72;66;6;S;13;NE
28/07/2018;2018;7;28;24,8;32,1;28,0;27,4;32,5;23,4;-;100;;1010,1;70;47;68;62;6;S;12;NE
29/07/2018;2018;7;29;24,8;31,4;28,2;27,7;31,8;24,0;-;0;;1009,8;66;51;68;66;4;S;7;NE
30/07/2018;2018;7;30;25,2;30,6;27,8;27,2;31,0;23,4;-;0;;1010,0;69;62;76;73;5;NE;0;0
31/07/2018;2018;7;31;24,6;30,8;28,2;27,5;31,2;24,2;-;0;;1010,6;79;62;77;71;5;NE;0;0
01/08/2018;2018;8;1;25,2;31,8;27,8;27,5;32,6;23,2;-;100;;1011,6;72;54;76;65;5;S;8;NE
02/08/2018;2018;8;2;25,0;32,5;27,7;27,2;33,4;22,8;-;100;;1012,8;63;32;45;50;7;S;14;S
03/08/2018;2018;8;3;24,2;30,7;27,2;25,9;31,2;22,2;-;100;;1012,5;56;37;51;55;7;S;17;S
04/08/2018;2018;8;4;23,8;30,6;27,6;26,5;31,0;23,0;-;100;;1011,6;62;44;54;54;6;S;11;SE
05/08/2018;2018;8;5;24,0;31,4;27,8;26,5;32,0;22,8;-;91;;1012,1;63;38;55;53;7;S;11;SW
06/08/2018;2018;8;6;24,2;30,8;27,6;26,6;31,8;22,4;-;100;;1011,0;51;40;60;54;6;S;10;S
07/08/2018;2018;8;7;24,0;30,2;27,6;27,0;31,7;24,0;-;100;;1010,6;66;56;68;65;5;S;9;N
08/08/2018;2018;8;8;25,0;29,6;27,6;27,2;30,4;24,0;-;74;;1009,2;76;64;76;73;5;E;10;NE
09/08/2018;2018;8;9;25,4;31,0;27,8;27,7;32,2;24,2;-;100;;1010,2;79;62;77;71;6;E;12;NE
10/08/2018;2018;8;10;25,8;30,8;27,8;27,4;31,8;23,8;-;100;;1011,6;72;59;75;66;5;E;13;E
11/08/2018;2018;8;11;25,2;31,2;29,6;27,5;31,8;23,8;0,0;100;RA;1010,7;70;59;55;66;6;S;11;NE
12/08/2018;2018;8;12;25,5;30,6;27,8;27,4;31,6;24,0;-;100;;1010,5;65;55;73;67;5;S;10;NE
13/08/2018;2018;8;13;25,6;31,0;28,0;27,4;31,6;23,2;-;100;;1011,3;69;56;71;70;6;E;13;NE
14/08/2018;2018;8;14;24,8;30,2;27,6;27,3;31,2;24,7;-;100;;1011,7;79;63;76;71;5;E;12;NE
15/08/2018;2018;8;15;25,4;30,8;27,8;27,0;31,6;22,8;-;98;;1011,7;67;48;70;61;6;S;12;NE
16/08/2018;2018;8;16;24,5;31,0;28,2;26,9;31,4;22,4;-;100;;1010,3;56;38;56;51;6;S;12;E
17/08/2018;2018;8;17;24,0;30,8;27,0;26,6;32,6;22,6;-;100;;1009,7;59;44;57;54;6;NE;13;NE
18/08/2018;2018;8;18;24,4;29,6;27,4;26,8;30,8;23,0;-;100;;1009,8;61;54;69;66;6;NE;11;NE
19/08/2018;2018;8;19;24,8;30,2;27,8;27,1;30,8;23,2;-;100;;1010,9;70;58;76;72;6;E;11;NE
20/08/2018;2018;8;20;24,4;30,6;28,4;27,4;31,5;23,7;-;100;;1010,4;80;63;72;75;5;E;11;NE
21/08/2018;2018;8;21;25,4;30,6;28,2;27,6;31,0;24,2;-;100;;1010,4;76;64;72;71;5;S;12;E
22/08/2018;2018;8;22;25,5;29,6;27,8;27,4;31,6;23,6;-;100;;1010,3;64;55;76;65;6;S;15;E
23/08/2018;2018;8;23;25,6;30,8;28,0;27,3;31,6;23,4;-;100;;1011,5;65;54;75;65;5;S;13;NE
24/08/2018;2018;8;24;25,0;30,4;27,4;27,0;30,9;23,2;-;100;;1011,0;71;58;74;66;6;NE;15;NE
25/08/2018;2018;8;25;24,8;30,6;27,8;26,8;31,2;23,0;-;100;;1009,8;57;49;62;64;5;NE;10;E
26/08/2018;2018;8;26;24,6;30,8;28,0;27,2;31,2;23,8;-;100;;1010,0;71;55;73;70;7;E;14;NE
27/08/2018;2018;8;27;25,3;30,4;28,0;27,7;30,8;24,6;-;100;;1010,8;71;56;72;71;6;E;12;E
28/08/2018;2018;8;28;26,2;30,6;28,2;27,9;31,2;25,0;-;100;;1011,4;81;66;78;72;6;E;13;NE
29/08/2018;2018;8;29;26,0;31,5;28,2;27,7;32,8;23,8;-;81;;1011,1;72;60;71;67;6;S;11;NE
30/08/2018;2018;8;30;25,4;30,8;27,8;27,7;31,6;24,6;-;100;;1011,0;70;55;77;69;6;S;14;NE
31/08/2018;2018;8;31;26,4;31,2;28,2;27,9;31,4;24,6;-;100;;1011,4;71;58;73;70;6;NE;14;NE
01/09/2018;2018;9;1;26,0;31,0;28,6;27,9;31,4;25,0;-;100;;1011,8;71;58;70;69;5;C;12;NE
02/09/2018;2018;9;2;26,7;30,8;28,0;27,7;31,3;24,8;-;70;;1011,7;69;57;69;63;5;S;10;E
03/09/2018;2018;9;3;26,2;31,8;28,2;27,5;33,2;23,4;-;100;;1011,9;58;49;68;59;7;S;12;S
04/09/2018;2018;9;4;24,8;32,0;28,6;27,8;33,4;24,8;-;100;;1011,4;65;45;67;57;7;S;13;SW
05/09/2018;2018;9;5;26,4;31,6;29,2;28,4;32,8;24,7;-;59;;1010,5;63;53;65;61;6;S;11;S
06/09/2018;2018;9;6;26,6;32,4;29,0;28,7;33,6;25,2;0,8;99;RA;1009,9;61;46;66;62;7;E;13;NE
07/09/2018;2018;9;7;26,6;31,4;28,6;28,0;32,6;24,2;-;81;;1010,4;71;58;69;65;5;S;10;NE
08/09/2018;2018;9;8;26,8;30,4;28,1;27,8;31,8;23,0;-;100;;1010,0;70;63;77;73;6;E;11;NE
09/09/2018;2018;9;9;26,8;33,0;29,0;28,1;33,2;22,8;-;100;;1010,9;68;48;63;64;7;E;14;NE
10/09/2018;2018;9;10;26,0;32,0;29,6;28,3;32,2;23,0;-;100;;1012,5;71;56;61;60;7;E;14;NE
11/09/2018;2018;9;11;26,7;31,2;28,5;28,2;31,8;25,0;-;100;;1012,6;62;51;67;63;6;NE;12;NE
12/09/2018;2018;9;12;26,6;33,4;29,0;28,1;33,6;22,8;-;100;;1011,5;61;38;56;55;6;S;11;S
13/09/2018;2018;9;13;25,6;31,0;28,0;27,5;32,6;23,4;-;100;;1010,3;61;54;64;59;7;S;13;NE
14/09/2018;2018;9;14;25,4;30,8;28,2;27,2;32,2;23,2;-;68;;1010,6;62;50;65;61;6;S;12;NE
15/09/2018;2018;9;15;25,0;30,8;28,4;27,2;31,8;22,5;-;100;;1011,3;64;48;60;61;6;NE;13;NE
16/09/2018;2018;9;16;26,4;30,6;28,6;27,8;31,8;23,2;-;99;;1009,2;63;56;70;65;6;NE;15;NE
17/09/2018;2018;9;17;26,3;30,5;28,2;27,9;31,6;24,0;-;96;;1009,6;69;60;73;69;5;NE;11;E
18/09/2018;2018;9;18;26,8;30,4;28,6;28,1;32,0;25,0;-;55;;1010,3;71;63;66;66;7;NE;12;E
19/09/2018;2018;9;19;27,4;30,6;28,0;28,2;32,0;25,8;0,0;26;RA;1010,5;65;57;78;70;4;C;13;NE
20/09/2018;2018;9;20;27,0;30,4;28,4;28,1;31,0;26,5;-;4;;1010,1;76;69;75;73;4;NE;11;E
21/09/2018;2018;9;21;27,4;32,4;28,8;28,9;33,6;25,4;-;93;;1011,4;71;60;72;70;4;C;12;NE
22/09/2018;2018;9;22;27,2;31,6;28,6;28,2;31,7;23,9;-;100;;1012,8;66;56;66;70;6;NE;14;NE
23/09/2018;2018;9;23;27,0;31,9;29,0;28,3;33,0;24,2;-;100;;1012,6;68;57;66;67;6;S;12;NE
24/09/2018;2018;9;24;26,0;31,2;28,6;28,2;32,0;23,4;-;96;;1011,4;72;60;74;70;6;NE;12;NE
25/09/2018;2018;9;25;26,5;32,6;29,6;29,1;33,3;25,2;-;98;;1010,4;69;53;66;63;5;NE;11;NE
26/09/2018;2018;9;26;26,9;31,0;28,8;28,3;31,6;24,4;-;98;;1010,8;65;59;74;67;6;E;12;NE
27/09/2018;2018;9;27;26,0;30,0;28,4;27,5;31,4;23,0;-;98;;1010,5;67;63;68;66;6;NE;13;NE
28/09/2018;2018;9;28;25,6;32,0;28,2;28,1;32,4;24,2;-;98;;1009,8;65;42;73;64;6;NE;12;NE
29/09/2018;2018;9;29;26,8;31,6;28,8;28,3;32,4;23,2;-;98;;1009,9;70;56;71;69;6;E;13;E
30/09/2018;2018;9;30;27,0;31,2;29,0;28,4;31,6;25,0;-;98;;1009,7;68;62;70;71;8;NE;14;NE
01/10/2018;2018;10;1;26,9;31,2;29,0;28,5;31,8;25,0;-;98;;1009,9;71;61;71;70;6;E;14;N
02/10/2018;2018;10;2;27,0;31,7;29,0;28,7;32,0;25,4;-;98;;1010,0;70;63;70;71;7;NE;14;NE
03/10/2018;2018;10;3;27,2;31,5;28,6;28,5;31,6;24,8;-;98;;1010,8;71;67;78;73;7;E;16;NE
04/10/2018;2018;10;4;26,4;31,6;28,6;28,3;32,4;24,4;-;98;;1010,6;72;56;70;70;8;E;16;E
05/10/2018;2018;10;5;26,8;31,2;29,0;28,3;31,6;24,6;-;98;;1010,7;73;64;66;72;7;SE;14;NE
06/10/2018;2018;10;6;26,2;30,9;29,2;28,3;32,0;23,0;-;98;;1010,4;75;62;73;69;7;E;15;NE
07/10/2018;2018;10;7;26,6;30,8;29,0;28,1;31,8;21,8;-;98;;1010,7;72;65;68;65;5;E;10;E
08/10/2018;2018;10;8;26,6;31,3;29,0;28,1;31,8;23,8;-;98;;1009,9;68;60;71;69;6;E;15;NE
09/10/2018;2018;10;9;27,0;32,0;28,8;28,2;32,6;24,2;-;83;;1009,0;64;54;72;68;5;NE;12;NE
10/10/2018;2018;10;10;26,8;31,6;29,0;28,3;32,2;24,1;-;98;;1009,0;68;53;71;66;6;E;11;NE
11/10/2018;2018;10;11;27,0;31,8;29,5;28,7;32,6;24,2;-;95;;1009,6;66;54;62;65;6;E;12;E
12/10/2018;2018;10;12;26,5;30,4;29,0;28,8;31,8;26,4;-;93;;1010,4;70;61;70;67;4;NE;11;NE
13/10/2018;2018;10;13;28,0;32,8;30,0;29,4;33,4;26,0;-;81;;1011,3;66;52;68;62;5;S;11;SE
14/10/2018;2018;10;14;27,8;32,0;29,0;28,7;32,4;25,3;-;81;;1011,2;60;54;77;68;5;SW;13;NE
15/10/2018;2018;10;15;28,2;32,0;29,8;29,3;33,0;26,0;-;73;;1012,3;63;58;66;59;7;E;15;NE
16/10/2018;2018;10;16;28,0;32,0;29,9;29,3;33,0;26,3;-;93;;1011,4;65;56;66;63;6;SW;10;NE
17/10/2018;2018;10;17;28,3;34,0;30,2;29,9;34,2;27,0;-;95;;1011,3;65;47;67;59;6;NE;12;N
18/10/2018;2018;10;18;28,2;32,2;29,6;29,4;34,2;26,0;-;100;;1010,3;63;60;72;61;6;S;13;S
19/10/2018;2018;10;19;28,0;32,4;29,8;29,1;33,0;25,8;-;99;;1011,0;59;53;64;60;7;S;14;S
20/10/2018;2018;10;20;28,0;33,2;30,0;29,4;33,8;26,0;-;75;;1012,0;60;49;64;60;6;S;11;NE
21/10/2018;2018;10;21;28,2;30,8;28,8;28,8;32,8;25,4;-;65;;1012,6;64;65;74;70;6;NE;12;E
22/10/2018;2018;10;22;27,7;32,4;29,7;29,3;33,4;25,6;-;100;;1011,9;67;55;66;63;7;NE;13;NE
23/10/2018;2018;10;23;28,6;32,6;29,3;29,6;33,8;26,0;-;94;;1010,8;86;51;73;64;5;S;12;N
24/10/2018;2018;10;24;28,6;32,2;29,6;29,5;33,0;26,6;-;76;;1010,9;67;62;76;68;5;S;13;N
25/10/2018;2018;10;25;28,6;32,0;29,6;29,3;32,4;26,4;-;86;;1011,3;64;62;72;66;6;S;14;NE
26/10/2018;2018;10;26;29,0;32,8;29,6;29,7;34,0;26,2;-;100;;1012,2;57;52;73;63;7;S;14;NE
27/10/2018;2018;10;27;28,6;32,2;30,0;29,9;33,6;27,1;-;100;;1011,7;66;59;68;62;5;NE;11;NE
28/10/2018;2018;10;28;28,6;32,0;30,0;29,2;34,2;24,6;6,6;98;RA;1010,4;64;61;65;68;7;N;13;E
29/10/2018;2018;10;29;26,4;30,2;28,0;27,6;30,6;26,1;0,0;8;PREC IN SIGHT;1009,6;75;60;78;73;3;C;8;E
30/10/2018;2018;10;30;27,6;31,2;29,6;29,0;33,6;24,6;0,0;100;;1008,6;66;57;72;65;6;S;14;NE
31/10/2018;2018;10;31;27,4;32,9;29,2;29,6;33,8;26,4;-;99;;1008,9;57;52;75;64;7;S;13;E
01/11/2018;2018;11;1;28,6;32,4;29,7;29,1;32,6;25,3;-;100;;1009,1;68;56;67;67;7;E;14;NE
02/11/2018;2018;11;2;27,7;32,5;29,6;29,8;33,2;27,2;-;44;;1010,0;70;55;74;68;6;NE;15;NE
03/11/2018;2018;11;3;29,4;32,6;28,0;29,6;33,6;27,2;0,0;99;RA;1009,5;69;65;81;71;6;S;15;N
04/11/2018;2018;11;4;29,0;32,4;30,6;30,1;33,2;26,8;-;100;;1008,8;65;58;66;65;4;C;13;N
05/11/2018;2018;11;5;29,0;32,8;30,0;30,1;33,4;27,0;-;100;;1008,3;68;51;67;65;5;NE;13;NE
06/11/2018;2018;11;6;29,4;33,0;25,1;28,9;33,4;25,1;12,0;88;SL / MOD TS NO HA + RA;1008,0;73;58;91;77;5;S;16;S
07/11/2018;2018;11;7;27,8;31,0;29,0;28,5;32,4;25,6;0,9;38;SL / MOD TS NO HA + RA;1007,4;77;69;79;80;3;C;10;NE
08/11/2018;2018;11;8;27,2;30,4;28,2;28,2;32,0;25,4;3,1;54;RA;1007,7;86;71;79;80;4;C;19;NE
09/11/2018;2018;11;9;27,2;31,4;29,0;27,7;31,4;25,2;0,7;51;RA;1008,0;86;58;74;84;3;C;8;N
10/11/2018;2018;11;10;27,5;31,8;30,0;29,1;32,2;26,0;-;100;TS NO PREC;1008,3;79;59;67;74;4;C;11;NE
11/11/2018;2018;11;11;28,0;32,4;29,4;29,3;32,8;25,8;-;100;TS NO PREC;1009,0;73;55;71;70;5;NE;12;NE
12/11/2018;2018;11;12;28,2;31,6;29,4;29,1;33,0;26,2;-;38;TS NO PREC;1008,8;73;66;75;75;3;C;10;N
13/11/2018;2018;11;13;27,2;31,6;29,4;28,8;32,2;26,2;3,0;75;RA;1008,1;79;60;74;75;4;C;11;N
14/11/2018;2018;11;14;28,4;32,2;30,0;29,5;33,2;26,6;-;96;TS NO PREC;1008,3;75;61;67;69;5;SW;9;N
15/11/2018;2018;11;15;29,3;33,0;30,0;30,2;35,4;26,8;2,0;84;RA;1009,5;69;61;78;68;5;S;11;S
16/11/2018;2018;11;16;28,2;33,6;28,4;30,0;34,4;27,0;-;88;;1010,1;71;54;62;63;5;S;11;NE
17/11/2018;2018;11;17;29,0;33,6;30,7;29,9;34,2;26,2;0,0;73;SL / MOD TS NO HA + RA;1009,6;65;51;68;70;4;NE;12;N
18/11/2018;2018;11;18;27,8;32,8;30,0;29,7;33,2;26,0;-;93;;1010,8;82;64;68;71;3;C;11;NE
19/11/2018;2018;11;19;28,3;33,0;30,4;29,8;33,6;26,2;-;100;PREC IN SIGHT;1010,6;73;55;71;69;5;N;12;N
20/11/2018;2018;11;20;29,0;33,2;29,6;28,5;33,6;23,2;11,6;99;SL / MOD TS NO HA + RA;1010,4;68;56;72;77;5;NW;15;NW
21/11/2018;2018;11;21;27,4;31,9;29,4;28,2;33,0;24,2;32,6;100;SL / MOD TS NO HA + RA;1010,0;76;62;75;79;6;NW;27;SW
22/11/2018;2018;11;22;27,2;34,0;28,0;28,8;34,4;25,2;0,2;94;RA;1010,3;81;49;75;74;3;C;9;S
23/11/2018;2018;11;23;27,6;32,6;29,8;29,4;34,0;26,0;-;100;;1010,8;69;55;72;64;6;S;11;NE
24/11/2018;2018;11;24;27,2;31,0;28,6;28,4;32,2;26,0;-;21;;1010,5;71;60;75;75;4;S;10;N
25/11/2018;2018;11;25;26,9;31,7;29,0;27,6;32,6;24,0;23,3;73;RA;1010,8;78;58;77;80;4;C;12;N
26/11/2018;2018;11;26;25,0;28,6;27,8;26,8;29,8;24,2;0,0;3;RA;1011,0;92;76;86;87;2;C;5;E
27/11/2018;2018;11;27;27,0;30,9;29,0;28,3;31,3;25,6;-;100;LIGHTNING;1011,1;76;66;77;78;4;NE;10;NE
28/11/2018;2018;11;28;27,2;31,0;28,2;28,1;31,2;25,8;-;6;PREC IN SIGHT;1011,0;80;60;78;77;3;C;8;NE
29/11/2018;2018;11;29;27,8;31,6;25,8;27,8;32,2;25,0;1,3;84;RA;1010,9;77;64;95;82;5;SW;12;N
30/11/2018;2018;11;30;25,6;30,7;25,8;27,4;31,6;25,6;0,0;4;RA;1010,5;90;65;89;82;2;C;11;W
01/12/2018;2018;12;1;27,2;31,5;28,8;27,8;32,3;25,3;0,0;20;SL / MOD TS NO HA + RA;1009,6;84;60;75;79;3;C;10;N
02/12/2018;2018;12;2;27,8;31,0;29,0;27,8;31,6;24,0;0,0;49;SL / MOD TS NO HA + RA;1008,6;72;66;75;80;5;NE;10;S
03/12/2018;2018;12;3;26,4;29,8;27,0;27,0;30,4;24,8;20,9;18;RA;1008,7;89;73;84;86;2;C;8;NE
04/12/2018;2018;12;4;27,1;30,8;29,4;27,9;31,2;24,4;6,0;100;SL / MOD TS NO HA + RA;1008,4;82;69;74;82;4;NE;10;NE
05/12/2018;2018;12;5;27,4;26,6;26,5;26,6;31,2;24,4;30,0;45;SL / MOD TS NO HA + RA;1007,8;86;90;96;90;3;C;14;N
06/12/2018;2018;12;6;26,6;31,0;29,2;28,4;31,6;25,2;6,0;100;;1007,4;84;68;73;81;2;C;9;N
07/12/2018;2018;12;7;27,6;32,0;29,5;29,4;32,6;26,8;-;100;TS NO PREC;1007,3;80;64;75;77;3;C;9;N
08/12/2018;2018;12;8;27,8;31,4;28,4;28,6;33,0;25,4;-;50;PREC IN SIGHT;1008,0;85;74;75;80;3;C;8;N
09/12/2018;2018;12;9;27,0;31,6;29,6;29,0;32,2;24,0;-;84;SL / MOD TS NO HA + RA;1008,8;81;65;73;77;3;C;9;N
10/12/2018;2018;12;10;26,3;31,4;28,6;28,0;31,6;25,4;18,8;43;TS NO PREC;1007,4;95;71;88;84;2;C;5;NE
11/12/2018;2018;12;11;26,6;31,8;24,5;28,0;32,6;24,2;-;51;SL / MOD TS NO HA + RA;1008,4;89;68;96;84;3;C;10;E
12/12/2018;2018;12;12;27,4;31,8;29,4;28,2;32,0;25,0;16,4;81;SL / MOD TS NO HA + RA;1008,3;86;67;78;82;4;C;8;E
13/12/2018;2018;12;13;25,6;28,4;27,2;27,0;30,0;25,4;2,2;0;RA;1008,1;89;81;89;89;2;C;5;N
14/12/2018;2018;12;14;25,9;30,9;27,0;27,0;31,2;24,2;1,2;26;TS NO PREC;1008,6;93;71;88;84;3;C;10;NE
15/12/2018;2018;12;15;27,2;31,8;29,2;27,6;32,6;23,2;-;90;SL / MOD TS NO HA + RA;1009,1;79;64;80;82;5;C;15;S
16/12/2018;2018;12;16;25,9;31,7;29,2;28,3;32,0;25,2;5,2;9;RA;1010,6;93;65;82;79;2;C;7;SW
17/12/2018;2018;12;17;27,0;33,0;29,8;29,0;33,6;25,4;0,0;93;TS NO PREC;1010,5;83;55;77;72;4;NE;12;SW
18/12/2018;2018;12;18;26,8;32,6;29,6;28,8;33,2;25,2;-;91;RA;1010,1;80;58;70;73;4;S;8;SW
19/12/2018;2018;12;19;26,7;31,1;29,6;28,4;32,4;25,4;1,4;100;PREC IN SIGHT;1010,3;78;58;69;75;4;C;8;N
20/12/2018;2018;12;20;26,8;30,4;27,2;27,5;31,4;25,2;-;48;TS NO PREC;1010,2;84;68;84;83;3;C;11;W
21/12/2018;2018;12;21;25,7;29,8;28,4;28,1;30,8;25,6;-;8;;1009,1;89;70;74;79;3;NW;7;NW
22/12/2018;2018;12;22;27,0;31,2;28,8;28,3;32,8;25,6;-;56;RA;1008,8;81;67;78;77;6;W;15;NW
23/12/2018;2018;12;23;26,6;31,2;23,8;26,5;32,8;23,4;0,0;1;SL / MOD TS NO HA + RA;1008,6;83;61;95;84;5;W;15;SW
24/12/2018;2018;12;24;25,4;29,6;25,0;25,9;31,2;22,8;17,3;19;RA;1008,3;90;66;97;87;4;SW;10;W
25/12/2018;2018;12;25;25,4;29,4;25,0;26,2;30,6;24,4;7,5;5;RA;1007,9;89;74;95;88;2;C;7;N
26/12/2018;2018;12;26;25,1;28,8;27,8;26,5;29,6;24,4;1,8;0;SL / MOD TS NO HA + RA;1009,0;92;75;85;83;3;SW;8;NW
27/12/2018;2018;12;27;26,6;32,0;28,5;28,2;32,6;24,4;1,2;100;SL / MOD TS NO HA + RA;1007,3;81;55;78;76;7;SW;14;N
28/12/2018;2018;12;28;26,2;31,1;28,4;28,3;31,6;25,2;5,0;39;LIGHTNING;1006,7;72;60;76;69;6;SW;10;W
29/12/2018;2018;12;29;27,0;32,0;29,2;28,8;32,8;26,0;-;66;RA;1007,4;73;61;78;73;7;SW;13;W
30/12/2018;2018;12;30;27,2;31,3;26,0;27,4;32,4;25,0;0,0;51;SL / MOD TS NO HA + RA;1007,5;77;63;92;82;4;W;13;W
31/12/2018;2018;12;31;26,4;29,8;29,1;27,9;31,0;24,8;4,2;36;;1007,9;82;73;75;79;7;W;15;W
;;;;;;;;;;;;;;;;;;;;;
;;;;;;;;;;;;;;;;;;;;;
;;;;;;;;;;;;;;;;;;;;;
;;;;;;;;;;;;;;;;;;;;;
;;;;;;;;;;;;;;;;;;;;;
;;;;;;;;;;;;;;;;;;;;;
;;;;;;;;;;;;;;;;;;;;;
;;;;;;;;;;;;;;;;;;;;;
;;;;;;;;;;;;;;;;;;;;;
;;;;;;;;;;;;;;;;;;;;;
;;;;;;;;;;;;;;;;;;;;;
;;;;;;;;;;;;;;;;;;;;;
;;;;;;;;;;;;;;;;;;;;;
;;;;;;;;;;;;;;;;;;;;;
;;;;;;;;;;;;;;;;;;;;;
;;;;;;;;;;;;;;;;;;;;;
;;;;;;;;;;;;;;;;;;;;;
;;;;;;;;;;;;;;;;;;;;;
;;;;;;;;;;;;;;;;;;;;;
;;;;;;;;;;;;;;;;;;;;;
;;;;;;;;;;;;;;;;;;;;;
;;;;;;;;;;;;;;;;;;;;;
;;;;;;;;;;;;;;;;;;;;;
;;;;;;;;;;;;;;;;;;;;;
;;;;;;;;;;;;;;;;;;;;;
;;;;;;;;;;;;;;;;;;;;;
;;;;;;;;;;;;;;;;;;;;;
;;;;;;;;;;;;;;;;;;;;;
;;;;;;;;;;;;;;;;;;;;;
;;;;;;;;;;;;;;;;;;;;;
;;;;;;;;;;;;;;;;;;;;;
;;;;;;;;;;;;;;;;;;;;;
;;;;;;;;;;;;;;;;;;;;;
;;;;;;;;;;;;;;;;;;;;;
;;;;;;;;;;;;;;;;;;;;;
;;;;;;;;;;;;;;;;;;;;;
;;;;;;;;;;;;;;;;;;;;;
;;;;;;;;;;;;;;;;;;;;;
;;;;;;;;;;;;;;;;;;;;;
;;;;;;;;;;;;;;;;;;;;;
;;;;;;;;;;;;;;;;;;;;;
;;;;;;;;;;;;;;;;;;;;;
;;;;;;;;;;;;;;;;;;;;;
;;;;;;;;;;;;;;;;;;;;;
;;;;;;;;;;;;;;;;;;;;;
;;;;;;;;;;;;;;;;;;;;;
;;;;;;;;;;;;;;;;;;;;;
;;;;;;;;;;;;;;;;;;;;;
;;;;;;;;;;;;;;;;;;;;;
;;;;;;;;;;;;;;;;;;;;;
;;;;;;;;;;;;;;;;;;;;;
;;;;;;;;;;;;;;;;;;;;;
;;;;;;;;;;;;;;;;;;;;;
;;;;;;;;;;;;;;;;;;;;;
;;;;;;;;;;;;;;;;;;;;;
;;;;;;;;;;;;;;;;;;;;;
;;;;;;;;;;;;;;;;;;;;;
;;;;;;;;;;;;;;;;;;;;;
;;;;;;;;;;;;;;;;;;;;;
;;;;;;;;;;;;;;;;;;;;;
;;;;;;;;;;;;;;;;;;;;;
;;;;;;;;;;;;;;;;;;;;;
;;;;;;;;;;;;;;;;;;;;;
;;;;;;;;;;;;;;;;;;;;;
;;;;;;;;;;;;;;;;;;;;;
;;;;;;;;;;;;;;;;;;;;;
;;;;;;;;;;;;;;;;;;;;;
;;;;;;;;;;;;;;;;;;;;;
;;;;;;;;;;;;;;;;;;;;;
;;;;;;;;;;;;;;;;;;;;;
;;;;;;;;;;;;;;;;;;;;;
;;;;;;;;;;;;;;;;;;;;;
;;;;;;;;;;;;;;;;;;;;;
;;;;;;;;;;;;;;;;;;;;;
;;;;;;;;;;;;;;;;;;;;;
;;;;;;;;;;;;;;;;;;;;;
;;;;;;;;;;;;;;;;;;;;;
;;;;;;;;;;;;;;;;;;;;;
;;;;;;;;;;;;;;;;;;;;;
;;;;;;;;;;;;;;;;;;;;;
;;;;;;;;;;;;;;;;;;;;;
;;;;;;;;;;;;;;;;;;;;;
;;;;;;;;;;;;;;;;;;;;;
;;;;;;;;;;;;;;;;;;;;;
;;;;;;;;;;;;;;;;;;;;;
;;;;;;;;;;;;;;;;;;;;;
;;;;;;;;;;;;;;;;;;;;;
;;;;;;;;;;;;;;;;;;;;;
;;;;;;;;;;;;;;;;;;;;;
;;;;;;;;;;;;;;;;;;;;;
;;;;;;;;;;;;;;;;;;;;;
;;;;;;;;;;;;;;;;;;;;;
;;;;;;;;;;;;;;;;;;;;;
;;;;;;;;;;;;;;;;;;;;;
;;;;;;;;;;;;;;;;;;;;;
;;;;;;;;;;;;;;;;;;;;;
;;;;;;;;;;;;;;;;;;;;;
;;;;;;;;;;;;;;;;;;;;;
;;;;;;;;;;;;;;;;;;;;;
;;;;;;;;;;;;;;;;;;;;;
;;;;;;;;;;;;;;;;;;;;;
;;;;;;;;;;;;;;;;;;;;;
;;;;;;;;;;;;;;;;;;;;;
;;;;;;;;;;;;;;;;;;;;;
;;;;;;;;;;;;;;;;;;;;;
;;;;;;;;;;;;;;;;;;;;;
;;;;;;;;;;;;;;;;;;;;;
;;;;;;;;;;;;;;;;;;;;;
;;;;;;;;;;;;;;;;;;;;;
;;;;;;;;;;;;;;;;;;;;;
;;;;;;;;;;;;;;;;;;;;;
;;;;;;;;;;;;;;;;;;;;;
;;;;;;;;;;;;;;;;;;;;;
;;;;;;;;;;;;;;;;;;;;;
;;;;;;;;;;;;;;;;;;;;;
;;;;;;;;;;;;;;;;;;;;;
;;;;;;;;;;;;;;;;;;;;;
;;;;;;;;;;;;;;;;;;;;;
;;;;;;;;;;;;;;;;;;;;;
;;;;;;;;;;;;;;;;;;;;;
;;;;;;;;;;;;;;;;;;;;;
;;;;;;;;;;;;;;;;;;;;;
;;;;;;;;;;;;;;;;;;;;;
;;;;;;;;;;;;;;;;;;;;;
;;;;;;;;;;;;;;;;;;;;;
;;;;;;;;;;;;;;;;;;;;;
;;;;;;;;;;;;;;;;;;;;;
;;;;;;;;;;;;;;;;;;;;;
;;;;;;;;;;;;;;;;;;;;;
;;;;;;;;;;;;;;;;;;;;;
;;;;;;;;;;;;;;;;;;;;;
;;;;;;;;;;;;;;;;;;;;;
;;;;;;;;;;;;;;;;;;;;;
;;;;;;;;;;;;;;;;;;;;;
;;;;;;;;;;;;;;;;;;;;;
;;;;;;;;;;;;;;;;;;;;;
;;;;;;;;;;;;;;;;;;;;;
;;;;;;;;;;;;;;;;;;;;;
;;;;;;;;;;;;;;;;;;;;;
;;;;;;;;;;;;;;;;;;;;;
;;;;;;;;;;;;;;;;;;;;;
;;;;;;;;;;;;;;;;;;;;;
;;;;;;;;;;;;;;;;;;;;;
;;;;;;;;;;;;;;;;;;;;;
;;;;;;;;;;;;;;;;;;;;;
;;;;;;;;;;;;;;;;;;;;;
;;;;;;;;;;;;;;;;;;;;;
;;;;;;;;;;;;;;;;;;;;;
;;;;;;;;;;;;;;;;;;;;;
;;;;;;;;;;;;;;;;;;;;;
;;;;;;;;;;;;;;;;;;;;;
;;;;;;;;;;;;;;;;;;;;;
;;;;;;;;;;;;;;;;;;;;;
;;;;;;;;;;;;;;;;;;;;;
;;;;;;;;;;;;;;;;;;;;;
;;;;;;;;;;;;;;;;;;;;;
;;;;;;;;;;;;;;;;;;;;;
;;;;;;;;;;;;;;;;;;;;;
;;;;;;;;;;;;;;;;;;;;;
;;;;;;;;;;;;;;;;;;;;;
;;;;;;;;;;;;;;;;;;;;;
;;;;;;;;;;;;;;;;;;;;;
;;;;;;;;;;;;;;;;;;;;;
;;;;;;;;;;;;;;;;;;;;;
;;;;;;;;;;;;;;;;;;;;;
;;;;;;;;;;;;;;;;;;;;;
;;;;;;;;;;;;;;;;;;;;;
;;;;;;;;;;;;;;;;;;;;;
;;;;;;;;;;;;;;;;;;;;;
;;;;;;;;;;;;;;;;;;;;;
;;;;;;;;;;;;;;;;;;;;;
;;;;;;;;;;;;;;;;;;;;;
;;;;;;;;;;;;;;;;;;;;;
;;;;;;;;;;;;;;;;;;;;;
;;;;;;;;;;;;;;;;;;;;;
;;;;;;;;;;;;;;;;;;;;;
;;;;;;;;;;;;;;;;;;;;;
;;;;;;;;;;;;;;;;;;;;;
;;;;;;;;;;;;;;;;;;;;;
;;;;;;;;;;;;;;;;;;;;;
;;;;;;;;;;;;;;;;;;;;;
;;;;;;;;;;;;;;;;;;;;;
;;;;;;;;;;;;;;;;;;;;;
;;;;;;;;;;;;;;;;;;;;;
;;;;;;;;;;;;;;;;;;;;;
;;;;;;;;;;;;;;;;;;;;;
;;;;;;;;;;;;;;;;;;;;;
;;;;;;;;;;;;;;;;;;;;;
;;;;;;;;;;;;;;;;;;;;;
;;;;;;;;;;;;;;;;;;;;;
;;;;;;;;;;;;;;;;;;;;;
;;;;;;;;;;;;;;;;;;;;;
;;;;;;;;;;;;;;;;;;;;;
;;;;;;;;;;;;;;;;;;;;;
;;;;;;;;;;;;;;;;;;;;;
;;;;;;;;;;;;;;;;;;;;;
;;;;;;;;;;;;;;;;;;;;;
;;;;;;;;;;;;;;;;;;;;;
;;;;;;;;;;;;;;;;;;;;;
;;;;;;;;;;;;;;;;;;;;;
;;;;;;;;;;;;;;;;;;;;;
;;;;;;;;;;;;;;;;;;;;;
;;;;;;;;;;;;;;;;;;;;;
;;;;;;;;;;;;;;;;;;;;;
;;;;;;;;;;;;;;;;;;;;;
;;;;;;;;;;;;;;;;;;;;;
;;;;;;;;;;;;;;;;;;;;;
;;;;;;;;;;;;;;;;;;;;;
;;;;;;;;;;;;;;;;;;;;;
;;;;;;;;;;;;;;;;;;;;;
;;;;;;;;;;;;;;;;;;;;;
;;;;;;;;;;;;;;;;;;;;;
;;;;;;;;;;;;;;;;;;;;;
;;;;;;;;;;;;;;;;;;;;;
;;;;;;;;;;;;;;;;;;;;;
;;;;;;;;;;;;;;;;;;;;;
;;;;;;;;;;;;;;;;;;;;;
;;;;;;;;;;;;;;;;;;;;;
;;;;;;;;;;;;;;;;;;;;;
;;;;;;;;;;;;;;;;;;;;;
;;;;;;;;;;;;;;;;;;;;;
;;;;;;;;;;;;;;;;;;;;;
;;;;;;;;;;;;;;;;;;;;;
;;;;;;;;;;;;;;;;;;;;;
;;;;;;;;;;;;;;;;;;;;;
;;;;;;;;;;;;;;;;;;;;;
;;;;;;;;;;;;;;;;;;;;;
;;;;;;;;;;;;;;;;;;;;;
;;;;;;;;;;;;;;;;;;;;;
;;;;;;;;;;;;;;;;;;;;;
;;;;;;;;;;;;;;;;;;;;;
;;;;;;;;;;;;;;;;;;;;;
;;;;;;;;;;;;;;;;;;;;;
;;;;;;;;;;;;;;;;;;;;;
;;;;;;;;;;;;;;;;;;;;;
;;;;;;;;;;;;;;;;;;;;;
;;;;;;;;;;;;;;;;;;;;;
;;;;;;;;;;;;;;;;;;;;;
;;;;;;;;;;;;;;;;;;;;;
;;;;;;;;;;;;;;;;;;;;;
;;;;;;;;;;;;;;;;;;;;;
;;;;;;;;;;;;;;;;;;;;;
;;;;;;;;;;;;;;;;;;;;;
;;;;;;;;;;;;;;;;;;;;;
;;;;;;;;;;;;;;;;;;;;;
;;;;;;;;;;;;;;;;;;;;;
;;;;;;;;;;;;;;;;;;;;;
;;;;;;;;;;;;;;;;;;;;;
;;;;;;;;;;;;;;;;;;;;;
;;;;;;;;;;;;;;;;;;;;;
;;;;;;;;;;;;;;;;;;;;;
;;;;;;;;;;;;;;;;;;;;;
;;;;;;;;;;;;;;;;;;;;;
;;;;;;;;;;;;;;;;;;;;;
;;;;;;;;;;;;;;;;;;;;;
;;;;;;;;;;;;;;;;;;;;;
;;;;;;;;;;;;;;;;;;;;;
;;;;;;;;;;;;;;;;;;;;;
;;;;;;;;;;;;;;;;;;;;;
;;;;;;;;;;;;;;;;;;;;;
;;;;;;;;;;;;;;;;;;;;;
;;;;;;;;;;;;;;;;;;;;;
;;;;;;;;;;;;;;;;;;;;;
;;;;;;;;;;;;;;;;;;;;;
;;;;;;;;;;;;;;;;;;;;;
;;;;;;;;;;;;;;;;;;;;;
;;;;;;;;;;;;;;;;;;;;;
;;;;;;;;;;;;;;;;;;;;;
;;;;;;;;;;;;;;;;;;;;;
;;;;;;;;;;;;;;;;;;;;;
;;;;;;;;;;;;;;;;;;;;;
;;;;;;;;;;;;;;;;;;;;;
;;;;;;;;;;;;;;;;;;;;;
;;;;;;;;;;;;;;;;;;;;;
;;;;;;;;;;;;;;;;;;;;;
;;;;;;;;;;;;;;;;;;;;;
;;;;;;;;;;;;;;;;;;;;;
;;;;;;;;;;;;;;;;;;;;;
;;;;;;;;;;;;;;;;;;;;;
;;;;;;;;;;;;;;;;;;;;;
;;;;;;;;;;;;;;;;;;;;;
;;;;;;;;;;;;;;;;;;;;;
;;;;;;;;;;;;;;;;;;;;;
;;;;;;;;;;;;;;;;;;;;;
;;;;;;;;;;;;;;;;;;;;;
;;;;;;;;;;;;;;;;;;;;;
;;;;;;;;;;;;;;;;;;;;;
;;;;;;;;;;;;;;;;;;;;;
;;;;;;;;;;;;;;;;;;;;;
;;;;;;;;;;;;;;;;;;;;;
;;;;;;;;;;;;;;;;;;;;;
;;;;;;;;;;;;;;;;;;;;;
;;;;;;;;;;;;;;;;;;;;;
;;;;;;;;;;;;;;;;;;;;;
;;;;;;;;;;;;;;;;;;;;;
;;;;;;;;;;;;;;;;;;;;;
;;;;;;;;;;;;;;;;;;;;;
;;;;;;;;;;;;;;;;;;;;;
;;;;;;;;;;;;;;;;;;;;;
;;;;;;;;;;;;;;;;;;;;;
;;;;;;;;;;;;;;;;;;;;;
;;;;;;;;;;;;;;;;;;;;;
;;;;;;;;;;;;;;;;;;;;;
;;;;;;;;;;;;;;;;;;;;;
;;;;;;;;;;;;;;;;;;;;;
;;;;;;;;;;;;;;;;;;;;;
;;;;;;;;;;;;;;;;;;;;;
;;;;;;;;;;;;;;;;;;;;;
;;;;;;;;;;;;;;;;;;;;;
;;;;;;;;;;;;;;;;;;;;;
;;;;;;;;;;;;;;;;;;;;;
;;;;;;;;;;;;;;;;;;;;;
;;;;;;;;;;;;;;;;;;;;;
;;;;;;;;;;;;;;;;;;;;;
;;;;;;;;;;;;;;;;;;;;;
;;;;;;;;;;;;;;;;;;;;;
;;;;;;;;;;;;;;;;;;;;;
;;;;;;;;;;;;;;;;;;;;;
;;;;;;;;;;;;;;;;;;;;;
;;;;;;;;;;;;;;;;;;;;;
;;;;;;;;;;;;;;;;;;;;;
;;;;;;;;;;;;;;;;;;;;;
;;;;;;;;;;;;;;;;;;;;;
;;;;;;;;;;;;;;;;;;;;;
;;;;;;;;;;;;;;;;;;;;;
;;;;;;;;;;;;;;;;;;;;;
;;;;;;;;;;;;;;;;;;;;;
;;;;;;;;;;;;;;;;;;;;;
;;;;;;;;;;;;;;;;;;;;;
;;;;;;;;;;;;;;;;;;;;;
;;;;;;;;;;;;;;;;;;;;;
;;;;;;;;;;;;;;;;;;;;;
;;;;;;;;;;;;;;;;;;;;;
;;;;;;;;;;;;;;;;;;;;;
;;;;;;;;;;;;;;;;;;;;;
;;;;;;;;;;;;;;;;;;;;;
;;;;;;;;;;;;;;;;;;;;;
;;;;;;;;;;;;;;;;;;;;;
;;;;;;;;;;;;;;;;;;;;;
;;;;;;;;;;;;;;;;;;;;;
;;;;;;;;;;;;;;;;;;;;;
;;;;;;;;;;;;;;;;;;;;;
;;;;;;;;;;;;;;;;;;;;;
;;;;;;;;;;;;;;;;;;;;;
;;;;;;;;;;;;;;;;;;;;;
;;;;;;;;;;;;;;;;;;;;;
;;;;;;;;;;;;;;;;;;;;;
;;;;;;;;;;;;;;;;;;;;;
;;;;;;;;;;;;;;;;;;;;;
;;;;;;;;;;;;;;;;;;;;;
;;;;;;;;;;;;;;;;;;;;;
;;;;;;;;;;;;;;;;;;;;;
;;;;;;;;;;;;;;;;;;;;;
;;;;;;;;;;;;;;;;;;;;;
;;;;;;;;;;;;;;;;;;;;;
;;;;;;;;;;;;;;;;;;;;;
;;;;;;;;;;;;;;;;;;;;;
;;;;;;;;;;;;;;;;;;;;;
;;;;;;;;;;;;;;;;;;;;;
;;;;;;;;;;;;;;;;;;;;;
;;;;;;;;;;;;;;;;;;;;;
;;;;;;;;;;;;;;;;;;;;;
;;;;;;;;;;;;;;;;;;;;;
;;;;;;;;;;;;;;;;;;;;;
;;;;;;;;;;;;;;;;;;;;;
;;;;;;;;;;;;;;;;;;;;;
;;;;;;;;;;;;;;;;;;;;;
;;;;;;;;;;;;;;;;;;;;;
;;;;;;;;;;;;;;;;;;;;;
;;;;;;;;;;;;;;;;;;;;;
;;;;;;;;;;;;;;;;;;;;;
;;;;;;;;;;;;;;;;;;;;;
;;;;;;;;;;;;;;;;;;;;;
;;;;;;;;;;;;;;;;;;;;;
;;;;;;;;;;;;;;;;;;;;;
;;;;;;;;;;;;;;;;;;;;;
;;;;;;;;;;;;;;;;;;;;;
;;;;;;;;;;;;;;;;;;;;;
;;;;;;;;;;;;;;;;;;;;;
;;;;;;;;;;;;;;;;;;;;;
;;;;;;;;;;;;;;;;;;;;;
;;;;;;;;;;;;;;;;;;;;;
;;;;;;;;;;;;;;;;;;;;;
;;;;;;;;;;;;;;;;;;;;;
;;;;;;;;;;;;;;;;;;;;;
;;;;;;;;;;;;;;;;;;;;;
;;;;;;;;;;;;;;;;;;;;;
;;;;;;;;;;;;;;;;;;;;;
;;;;;;;;;;;;;;;;;;;;;
;;;;;;;;;;;;;;;;;;;;;
;;;;;;;;;;;;;;;;;;;;;
;;;;;;;;;;;;;;;;;;;;;
;;;;;;;;;;;;;;;;;;;;;
;;;;;;;;;;;;;;;;;;;;;
;;;;;;;;;;;;;;;;;;;;;
;;;;;;;;;;;;;;;;;;;;;
;;;;;;;;;;;;;;;;;;;;;
;;;;;;;;;;;;;;;;;;;;;
;;;;;;;;;;;;;;;;;;;;;
;;;;;;;;;;;;;;;;;;;;;
;;;;;;;;;;;;;;;;;;;;;
;;;;;;;;;;;;;;;;;;;;;
;;;;;;;;;;;;;;;;;;;;;
;;;;;;;;;;;;;;;;;;;;;
;;;;;;;;;;;;;;;;;;;;;
;;;;;;;;;;;;;;;;;;;;;
;;;;;;;;;;;;;;;;;;;;;
;;;;;;;;;;;;;;;;;;;;;
;;;;;;;;;;;;;;;;;;;;;
;;;;;;;;;;;;;;;;;;;;;
;;;;;;;;;;;;;;;;;;;;;
;;;;;;;;;;;;;;;;;;;;;
;;;;;;;;;;;;;;;;;;;;;
;;;;;;;;;;;;;;;;;;;;;
;;;;;;;;;;;;;;;;;;;;;
;;;;;;;;;;;;;;;;;;;;;
;;;;;;;;;;;;;;;;;;;;;
;;;;;;;;;;;;;;;;;;;;;
;;;;;;;;;;;;;;;;;;;;;
;;;;;;;;;;;;;;;;;;;;;
;;;;;;;;;;;;;;;;;;;;;
;;;;;;;;;;;;;;;;;;;;;
;;;;;;;;;;;;;;;;;;;;;
;;;;;;;;;;;;;;;;;;;;;
;;;;;;;;;;;;;;;;;;;;;
;;;;;;;;;;;;;;;;;;;;;
;;;;;;;;;;;;;;;;;;;;;
;;;;;;;;;;;;;;;;;;;;;
;;;;;;;;;;;;;;;;;;;;;
;;;;;;;;;;;;;;;;;;;;;
;;;;;;;;;;;;;;;;;;;;;
;;;;;;;;;;;;;;;;;;;;;
;;;;;;;;;;;;;;;;;;;;;
;;;;;;;;;;;;;;;;;;;;;
;;;;;;;;;;;;;;;;;;;;;
;;;;;;;;;;;;;;;;;;;;;
;;;;;;;;;;;;;;;;;;;;;
;;;;;;;;;;;;;;;;;;;;;
;;;;;;;;;;;;;;;;;;;;;
;;;;;;;;;;;;;;;;;;;;;
;;;;;;;;;;;;;;;;;;;;;
;;;;;;;;;;;;;;;;;;;;;
;;;;;;;;;;;;;;;;;;;;;
;;;;;;;;;;;;;;;;;;;;;
;;;;;;;;;;;;;;;;;;;;;
;;;;;;;;;;;;;;;;;;;;;
;;;;;;;;;;;;;;;;;;;;;
;;;;;;;;;;;;;;;;;;;;;
;;;;;;;;;;;;;;;;;;;;;
;;;;;;;;;;;;;;;;;;;;;
;;;;;;;;;;;;;;;;;;;;;
;;;;;;;;;;;;;;;;;;;;;
;;;;;;;;;;;;;;;;;;;;;
;;;;;;;;;;;;;;;;;;;;;
;;;;;;;;;;;;;;;;;;;;;
;;;;;;;;;;;;;;;;;;;;;
;;;;;;;;;;;;;;;;;;;;;
;;;;;;;;;;;;;;;;;;;;;
;;;;;;;;;;;;;;;;;;;;;
;;;;;;;;;;;;;;;;;;;;;
;;;;;;;;;;;;;;;;;;;;;
;;;;;;;;;;;;;;;;;;;;;
;;;;;;;;;;;;;;;;;;;;;
;;;;;;;;;;;;;;;;;;;;;
;;;;;;;;;;;;;;;;;;;;;
;;;;;;;;;;;;;;;;;;;;;
;;;;;;;;;;;;;;;;;;;;;
;;;;;;;;;;;;;;;;;;;;;
;;;;;;;;;;;;;;;;;;;;;
;;;;;;;;;;;;;;;;;;;;;
;;;;;;;;;;;;;;;;;;;;;
;;;;;;;;;;;;;;;;;;;;;
;;;;;;;;;;;;;;;;;;;;;
;;;;;;;;;;;;;;;;;;;;;
;;;;;;;;;;;;;;;;;;;;;
;;;;;;;;;;;;;;;;;;;;;
;;;;;;;;;;;;;;;;;;;;;
;;;;;;;;;;;;;;;;;;;;;
;;;;;;;;;;;;;;;;;;;;;
;;;;;;;;;;;;;;;;;;;;;
;;;;;;;;;;;;;;;;;;;;;
;;;;;;;;;;;;;;;;;;;;;
;;;;;;;;;;;;;;;;;;;;;
;;;;;;;;;;;;;;;;;;;;;
;;;;;;;;;;;;;;;;;;;;;
;;;;;;;;;;;;;;;;;;;;;
;;;;;;;;;;;;;;;;;;;;;
;;;;;;;;;;;;;;;;;;;;;
;;;;;;;;;;;;;;;;;;;;;
;;;;;;;;;;;;;;;;;;;;;
;;;;;;;;;;;;;;;;;;;;;
;;;;;;;;;;;;;;;;;;;;;
;;;;;;;;;;;;;;;;;;;;;
;;;;;;;;;;;;;;;;;;;;;
;;;;;;;;;;;;;;;;;;;;;
;;;;;;;;;;;;;;;;;;;;;
;;;;;;;;;;;;;;;;;;;;;
;;;;;;;;;;;;;;;;;;;;;
;;;;;;;;;;;;;;;;;;;;;
;;;;;;;;;;;;;;;;;;;;;
;;;;;;;;;;;;;;;;;;;;;
;;;;;;;;;;;;;;;;;;;;;
;;;;;;;;;;;;;;;;;;;;;
;;;;;;;;;;;;;;;;;;;;;
;;;;;;;;;;;;;;;;;;;;;
;;;;;;;;;;;;;;;;;;;;;
;;;;;;;;;;;;;;;;;;;;;
;;;;;;;;;;;;;;;;;;;;;
;;;;;;;;;;;;;;;;;;;;;
;;;;;;;;;;;;;;;;;;;;;
;;;;;;;;;;;;;;;;;;;;;
;;;;;;;;;;;;;;;;;;;;;
;;;;;;;;;;;;;;;;;;;;;
;;;;;;;;;;;;;;;;;;;;;
;;;;;;;;;;;;;;;;;;;;;
;;;;;;;;;;;;;;;;;;;;;
;;;;;;;;;;;;;;;;;;;;;
;;;;;;;;;;;;;;;;;;;;;
;;;;;;;;;;;;;;;;;;;;;
;;;;;;;;;;;;;;;;;;;;;
;;;;;;;;;;;;;;;;;;;;;
;;;;;;;;;;;;;;;;;;;;;
;;;;;;;;;;;;;;;;;;;;;
;;;;;;;;;;;;;;;;;;;;;
;;;;;;;;;;;;;;;;;;;;;
;;;;;;;;;;;;;;;;;;;;;
;;;;;;;;;;;;;;;;;;;;;
;;;;;;;;;;;;;;;;;;;;;
;;;;;;;;;;;;;;;;;;;;;
;;;;;;;;;;;;;;;;;;;;;
;;;;;;;;;;;;;;;;;;;;;
;;;;;;;;;;;;;;;;;;;;;
;;;;;;;;;;;;;;;;;;;;;
;;;;;;;;;;;;;;;;;;;;;
;;;;;;;;;;;;;;;;;;;;;
;;;;;;;;;;;;;;;;;;;;;
;;;;;;;;;;;;;;;;;;;;;
;;;;;;;;;;;;;;;;;;;;;
;;;;;;;;;;;;;;;;;;;;;
;;;;;;;;;;;;;;;;;;;;;
;;;;;;;;;;;;;;;;;;;;;
;;;;;;;;;;;;;;;;;;;;;
;;;;;;;;;;;;;;;;;;;;;
;;;;;;;;;;;;;;;;;;;;;
;;;;;;;;;;;;;;;;;;;;;
;;;;;;;;;;;;;;;;;;;;;
;;;;;;;;;;;;;;;;;;;;;
;;;;;;;;;;;;;;;;;;;;;
;;;;;;;;;;;;;;;;;;;;;
;;;;;;;;;;;;;;;;;;;;;
;;;;;;;;;;;;;;;;;;;;;
;;;;;;;;;;;;;;;;;;;;;
;;;;;;;;;;;;;;;;;;;;;
;;;;;;;;;;;;;;;;;;;;;
;;;;;;;;;;;;;;;;;;;;;
;;;;;;;;;;;;;;;;;;;;;
;;;;;;;;;;;;;;;;;;;;;
;;;;;;;;;;;;;;;;;;;;;
;;;;;;;;;;;;;;;;;;;;;
;;;;;;;;;;;;;;;;;;;;;
;;;;;;;;;;;;;;;;;;;;;
;;;;;;;;;;;;;;;;;;;;;
;;;;;;;;;;;;;;;;;;;;;
;;;;;;;;;;;;;;;;;;;;;
;;;;;;;;;;;;;;;;;;;;;
;;;;;;;;;;;;;;;;;;;;;
;;;;;;;;;;;;;;;;;;;;;
;;;;;;;;;;;;;;;;;;;;;
;;;;;;;;;;;;;;;;;;;;;
;;;;;;;;;;;;;;;;;;;;;
;;;;;;;;;;;;;;;;;;;;;
;;;;;;;;;;;;;;;;;;;;;
;;;;;;;;;;;;;;;;;;;;;
;;;;;;;;;;;;;;;;;;;;;
;;;;;;;;;;;;;;;;;;;;;
;;;;;;;;;;;;;;;;;;;;;
;;;;;;;;;;;;;;;;;;;;;
;;;;;;;;;;;;;;;;;;;;;
;;;;;;;;;;;;;;;;;;;;;
;;;;;;;;;;;;;;;;;;;;;
;;;;;;;;;;;;;;;;;;;;;
;;;;;;;;;;;;;;;;;;;;;
;;;;;;;;;;;;;;;;;;;;;
;;;;;;;;;;;;;;;;;;;;;
;;;;;;;;;;;;;;;;;;;;;
;;;;;;;;;;;;;;;;;;;;;
;;;;;;;;;;;;;;;;;;;;;
;;;;;;;;;;;;;;;;;;;;;
;;;;;;;;;;;;;;;;;;;;;
;;;;;;;;;;;;;;;;;;;;;
;;;;;;;;;;;;;;;;;;;;;
;;;;;;;;;;;;;;;;;;;;;
;;;;;;;;;;;;;;;;;;;;;
;;;;;;;;;;;;;;;;;;;;;
;;;;;;;;;;;;;;;;;;;;;
;;;;;;;;;;;;;;;;;;;;;
;;;;;;;;;;;;;;;;;;;;;
;;;;;;;;;;;;;;;;;;;;;
;;;;;;;;;;;;;;;;;;;;;
;;;;;;;;;;;;;;;;;;;;;
;;;;;;;;;;;;;;;;;;;;;
;;;;;;;;;;;;;;;;;;;;;
;;;;;;;;;;;;;;;;;;;;;
;;;;;;;;;;;;;;;;;;;;;
;;;;;;;;;;;;;;;;;;;;;
;;;;;;;;;;;;;;;;;;;;;
;;;;;;;;;;;;;;;;;;;;;
;;;;;;;;;;;;;;;;;;;;;
;;;;;;;;;;;;;;;;;;;;;
;;;;;;;;;;;;;;;;;;;;;
;;;;;;;;;;;;;;;;;;;;;
;;;;;;;;;;;;;;;;;;;;;
;;;;;;;;;;;;;;;;;;;;;
;;;;;;;;;;;;;;;;;;;;;
;;;;;;;;;;;;;;;;;;;;;
;;;;;;;;;;;;;;;;;;;;;
;;;;;;;;;;;;;;;;;;;;;
;;;;;;;;;;;;;;;;;;;;;
;;;;;;;;;;;;;;;;;;;;;
;;;;;;;;;;;;;;;;;;;;;
;;;;;;;;;;;;;;;;;;;;;
;;;;;;;;;;;;;;;;;;;;;
;;;;;;;;;;;;;;;;;;;;;
;;;;;;;;;;;;;;;;;;;;;
;;;;;;;;;;;;;;;;;;;;;
;;;;;;;;;;;;;;;;;;;;;
;;;;;;;;;;;;;;;;;;;;;
;;;;;;;;;;;;;;;;;;;;;
;;;;;;;;;;;;;;;;;;;;;
;;;;;;;;;;;;;;;;;;;;;
;;;;;;;;;;;;;;;;;;;;;
;;;;;;;;;;;;;;;;;;;;;
;;;;;;;;;;;;;;;;;;;;;
;;;;;;;;;;;;;;;;;;;;;
;;;;;;;;;;;;;;;;;;;;;
;;;;;;;;;;;;;;;;;;;;;
;;;;;;;;;;;;;;;;;;;;;
;;;;;;;;;;;;;;;;;;;;;
;;;;;;;;;;;;;;;;;;;;;
;;;;;;;;;;;;;;;;;;;;;
;;;;;;;;;;;;;;;;;;;;;
;;;;;;;;;;;;;;;;;;;;;
;;;;;;;;;;;;;;;;;;;;;
;;;;;;;;;;;;;;;;;;;;;
;;;;;;;;;;;;;;;;;;;;;
;;;;;;;;;;;;;;;;;;;;;
;;;;;;;;;;;;;;;;;;;;;
;;;;;;;;;;;;;;;;;;;;;
;;;;;;;;;;;;;;;;;;;;;
;;;;;;;;;;;;;;;;;;;;;
;;;;;;;;;;;;;;;;;;;;;
;;;;;;;;;;;;;;;;;;;;;
;;;;;;;;;;;;;;;;;;;;;
;;;;;;;;;;;;;;;;;;;;;
;;;;;;;;;;;;;;;;;;;;;
;;;;;;;;;;;;;;;;;;;;;
;;;;;;;;;;;;;;;;;;;;;
;;;;;;;;;;;;;;;;;;;;;
;;;;;;;;;;;;;;;;;;;;;
;;;;;;;;;;;;;;;;;;;;;
;;;;;;;;;;;;;;;;;;;;;
;;;;;;;;;;;;;;;;;;;;;
;;;;;;;;;;;;;;;;;;;;;
;;;;;;;;;;;;;;;;;;;;;
;;;;;;;;;;;;;;;;;;;;;
;;;;;;;;;;;;;;;;;;;;;
;;;;;;;;;;;;;;;;;;;;;
;;;;;;;;;;;;;;;;;;;;;
;;;;;;;;;;;;;;;;;;;;;
;;;;;;;;;;;;;;;;;;;;;
;;;;;;;;;;;;;;;;;;;;;
;;;;;;;;;;;;;;;;;;;;;
;;;;;;;;;;;;;;;;;;;;;
;;;;;;;;;;;;;;;;;;;;;
;;;;;;;;;;;;;;;;;;;;;
;;;;;;;;;;;;;;;;;;;;;
;;;;;;;;;;;;;;;;;;;;;
;;;;;;;;;;;;;;;;;;;;;
;;;;;;;;;;;;;;;;;;;;;
;;;;;;;;;;;;;;;;;;;;;
;;;;;;;;;;;;;;;;;;;;;
;;;;;;;;;;;;;;;;;;;;;
;;;;;;;;;;;;;;;;;;;;;
;;;;;;;;;;;;;;;;;;;;;
;;;;;;;;;;;;;;;;;;;;;
;;;;;;;;;;;;;;;;;;;;;
;;;;;;;;;;;;;;;;;;;;;
;;;;;;;;;;;;;;;;;;;;;
;;;;;;;;;;;;;;;;;;;;;
;;;;;;;;;;;;;;;;;;;;;
;;;;;;;;;;;;;;;;;;;;;
;;;;;;;;;;;;;;;;;;;;;
;;;;;;;;;;;;;;;;;;;;;
;;;;;;;;;;;;;;;;;;;;;
;;;;;;;;;;;;;;;;;;;;;
;;;;;;;;;;;;;;;;;;;;;
;;;;;;;;;;;;;;;;;;;;;
;;;;;;;;;;;;;;;;;;;;;
;;;;;;;;;;;;;;;;;;;;;
;;;;;;;;;;;;;;;;;;;;;
;;;;;;;;;;;;;;;;;;;;;
;;;;;;;;;;;;;;;;;;;;;
;;;;;;;;;;;;;;;;;;;;;
;;;;;;;;;;;;;;;;;;;;;
;;;;;;;;;;;;;;;;;;;;;
;;;;;;;;;;;;;;;;;;;;;
;;;;;;;;;;;;;;;;;;;;;
;;;;;;;;;;;;;;;;;;;;;
;;;;;;;;;;;;;;;;;;;;;
;;;;;;;;;;;;;;;;;;;;;
;;;;;;;;;;;;;;;;;;;;;
;;;;;;;;;;;;;;;;;;;;;
;;;;;;;;;;;;;;;;;;;;;
;;;;;;;;;;;;;;;;;;;;;
;;;;;;;;;;;;;;;;;;;;;
;;;;;;;;;;;;;;;;;;;;;
;;;;;;;;;;;;;;;;;;;;;
;;;;;;;;;;;;;;;;;;;;;
;;;;;;;;;;;;;;;;;;;;;
;;;;;;;;;;;;;;;;;;;;;
;;;;;;;;;;;;;;;;;;;;;
;;;;;;;;;;;;;;;;;;;;;
;;;;;;;;;;;;;;;;;;;;;
;;;;;;;;;;;;;;;;;;;;;
;;;;;;;;;;;;;;;;;;;;;
;;;;;;;;;;;;;;;;;;;;;
;;;;;;;;;;;;;;;;;;;;;
;;;;;;;;;;;;;;;;;;;;;
;;;;;;;;;;;;;;;;;;;;;
;;;;;;;;;;;;;;;;;;;;;
;;;;;;;;;;;;;;;;;;;;;
;;;;;;;;;;;;;;;;;;;;;
;;;;;;;;;;;;;;;;;;;;;
;;;;;;;;;;;;;;;;;;;;;
;;;;;;;;;;;;;;;;;;;;;
;;;;;;;;;;;;;;;;;;;;;
;;;;;;;;;;;;;;;;;;;;;
;;;;;;;;;;;;;;;;;;;;;
;;;;;;;;;;;;;;;;;;;;;
;;;;;;;;;;;;;;;;;;;;;
;;;;;;;;;;;;;;;;;;;;;
;;;;;;;;;;;;;;;;;;;;;
;;;;;;;;;;;;;;;;;;;;;
;;;;;;;;;;;;;;;;;;;;;
;;;;;;;;;;;;;;;;;;;;;
;;;;;;;;;;;;;;;;;;;;;
;;;;;;;;;;;;;;;;;;;;;
;;;;;;;;;;;;;;;;;;;;;
;;;;;;;;;;;;;;;;;;;;;
;;;;;;;;;;;;;;;;;;;;;
;;;;;;;;;;;;;;;;;;;;;
;;;;;;;;;;;;;;;;;;;;;
;;;;;;;;;;;;;;;;;;;;;
;;;;;;;;;;;;;;;;;;;;;
;;;;;;;;;;;;;;;;;;;;;
;;;;;;;;;;;;;;;;;;;;;
;;;;;;;;;;;;;;;;;;;;;
;;;;;;;;;;;;;;;;;;;;;
;;;;;;;;;;;;;;;;;;;;;
;;;;;;;;;;;;;;;;;;;;;
;;;;;;;;;;;;;;;;;;;;;
;;;;;;;;;;;;;;;;;;;;;
;;;;;;;;;;;;;;;;;;;;;
;;;;;;;;;;;;;;;;;;;;;
;;;;;;;;;;;;;;;;;;;;;
;;;;;;;;;;;;;;;;;;;;;
;;;;;;;;;;;;;;;;;;;;;
;;;;;;;;;;;;;;;;;;;;;
;;;;;;;;;;;;;;;;;;;;;
;;;;;;;;;;;;;;;;;;;;;
;;;;;;;;;;;;;;;;;;;;;
;;;;;;;;;;;;;;;;;;;;;
;;;;;;;;;;;;;;;;;;;;;
;;;;;;;;;;;;;;;;;;;;;
;;;;;;;;;;;;;;;;;;;;;
;;;;;;;;;;;;;;;;;;;;;
;;;;;;;;;;;;;;;;;;;;;
;;;;;;;;;;;;;;;;;;;;;
;;;;;;;;;;;;;;;;;;;;;
;;;;;;;;;;;;;;;;;;;;;
;;;;;;;;;;;;;;;;;;;;;
;;;;;;;;;;;;;;;;;;;;;
;;;;;;;;;;;;;;;;;;;;;
;;;;;;;;;;;;;;;;;;;;;
;;;;;;;;;;;;;;;;;;;;;
;;;;;;;;;;;;;;;;;;;;;
;;;;;;;;;;;;;;;;;;;;;
;;;;;;;;;;;;;;;;;;;;;
;;;;;;;;;;;;;;;;;;;;;
;;;;;;;;;;;;;;;;;;;;;
;;;;;;;;;;;;;;;;;;;;;
;;;;;;;;;;;;;;;;;;;;;
;;;;;;;;;;;;;;;;;;;;;
;;;;;;;;;;;;;;;;;;;;;
;;;;;;;;;;;;;;;;;;;;;
;;;;;;;;;;;;;;;;;;;;;
;;;;;;;;;;;;;;;;;;;;;
;;;;;;;;;;;;;;;;;;;;;
;;;;;;;;;;;;;;;;;;;;;
;;;;;;;;;;;;;;;;;;;;;
;;;;;;;;;;;;;;;;;;;;;
;;;;;;;;;;;;;;;;;;;;;
;;;;;;;;;;;;;;;;;;;;;
;;;;;;;;;;;;;;;;;;;;;
;;;;;;;;;;;;;;;;;;;;;
;;;;;;;;;;;;;;;;;;;;;
;;;;;;;;;;;;;;;;;;;;;
;;;;;;;;;;;;;;;;;;;;;
;;;;;;;;;;;;;;;;;;;;;
;;;;;;;;;;;;;;;;;;;;;
;;;;;;;;;;;;;;;;;;;;;
;;;;;;;;;;;;;;;;;;;;;
;;;;;;;;;;;;;;;;;;;;;
;;;;;;;;;;;;;;;;;;;;;
;;;;;;;;;;;;;;;;;;;;;
;;;;;;;;;;;;;;;;;;;;;
;;;;;;;;;;;;;;;;;;;;;
;;;;;;;;;;;;;;;;;;;;;
;;;;;;;;;;;;;;;;;;;;;
;;;;;;;;;;;;;;;;;;;;;
;;;;;;;;;;;;;;;;;;;;;
;;;;;;;;;;;;;;;;;;;;;
;;;;;;;;;;;;;;;;;;;;;
;;;;;;;;;;;;;;;;;;;;;
;;;;;;;;;;;;;;;;;;;;;
;;;;;;;;;;;;;;;;;;;;;
;;;;;;;;;;;;;;;;;;;;;
;;;;;;;;;;;;;;;;;;;;;
;;;;;;;;;;;;;;;;;;;;;
;;;;;;;;;;;;;;;;;;;;;
;;;;;;;;;;;;;;;;;;;;;
;;;;;;;;;;;;;;;;;;;;;
;;;;;;;;;;;;;;;;;;;;;
;;;;;;;;;;;;;;;;;;;;;
;;;;;;;;;;;;;;;;;;;;;
;;;;;;;;;;;;;;;;;;;;;
;;;;;;;;;;;;;;;;;;;;;
;;;;;;;;;;;;;;;;;;;;;
;;;;;;;;;;;;;;;;;;;;;
;;;;;;;;;;;;;;;;;;;;;
;;;;;;;;;;;;;;;;;;;;;
;;;;;;;;;;;;;;;;;;;;;
;;;;;;;;;;;;;;;;;;;;;
;;;;;;;;;;;;;;;;;;;;;
;;;;;;;;;;;;;;;;;;;;;
;;;;;;;;;;;;;;;;;;;;;
;;;;;;;;;;;;;;;;;;;;;
;;;;;;;;;;;;;;;;;;;;;
;;;;;;;;;;;;;;;;;;;;;
;;;;;;;;;;;;;;;;;;;;;
;;;;;;;;;;;;;;;;;;;;;
;;;;;;;;;;;;;;;;;;;;;
;;;;;;;;;;;;;;;;;;;;;
;;;;;;;;;;;;;;;;;;;;;
;;;;;;;;;;;;;;;;;;;;;
;;;;;;;;;;;;;;;;;;;;;
;;;;;;;;;;;;;;;;;;;;;
;;;;;;;;;;;;;;;;;;;;;
;;;;;;;;;;;;;;;;;;;;;
;;;;;;;;;;;;;;;;;;;;;
;;;;;;;;;;;;;;;;;;;;;
;;;;;;;;;;;;;;;;;;;;;
;;;;;;;;;;;;;;;;;;;;;
;;;;;;;;;;;;;;;;;;;;;
;;;;;;;;;;;;;;;;;;;;;
;;;;;;;;;;;;;;;;;;;;;
;;;;;;;;;;;;;;;;;;;;;
;;;;;;;;;;;;;;;;;;;;;
;;;;;;;;;;;;;;;;;;;;;
;;;;;;;;;;;;;;;;;;;;;
;;;;;;;;;;;;;;;;;;;;;
;;;;;;;;;;;;;;;;;;;;;
;;;;;;;;;;;;;;;;;;;;;
;;;;;;;;;;;;;;;;;;;;;
;;;;;;;;;;;;;;;;;;;;;
;;;;;;;;;;;;;;;;;;;;;
;;;;;;;;;;;;;;;;;;;;;
;;;;;;;;;;;;;;;;;;;;;
;;;;;;;;;;;;;;;;;;;;;
;;;;;;;;;;;;;;;;;;;;;
;;;;;;;;;;;;;;;;;;;;;
;;;;;;;;;;;;;;;;;;;;;
;;;;;;;;;;;;;;;;;;;;;
;;;;;;;;;;;;;;;;;;;;;
;;;;;;;;;;;;;;;;;;;;;
;;;;;;;;;;;;;;;;;;;;;
;;;;;;;;;;;;;;;;;;;;;
;;;;;;;;;;;;;;;;;;;;;
;;;;;;;;;;;;;;;;;;;;;
;;;;;;;;;;;;;;;;;;;;;
;;;;;;;;;;;;;;;;;;;;;
;;;;;;;;;;;;;;;;;;;;;
;;;;;;;;;;;;;;;;;;;;;
;;;;;;;;;;;;;;;;;;;;;
;;;;;;;;;;;;;;;;;;;;;
;;;;;;;;;;;;;;;;;;;;;
;;;;;;;;;;;;;;;;;;;;;
;;;;;;;;;;;;;;;;;;;;;
;;;;;;;;;;;;;;;;;;;;;
;;;;;;;;;;;;;;;;;;;;;
;;;;;;;;;;;;;;;;;;;;;
;;;;;;;;;;;;;;;;;;;;;
;;;;;;;;;;;;;;;;;;;;;
;;;;;;;;;;;;;;;;;;;;;
;;;;;;;;;;;;;;;;;;;;;
;;;;;;;;;;;;;;;;;;;;;
;;;;;;;;;;;;;;;;;;;;;
;;;;;;;;;;;;;;;;;;;;;
;;;;;;;;;;;;;;;;;;;;;
;;;;;;;;;;;;;;;;;;;;;
;;;;;;;;;;;;;;;;;;;;;
;;;;;;;;;;;;;;;;;;;;;
;;;;;;;;;;;;;;;;;;;;;
;;;;;;;;;;;;;;;;;;;;;
;;;;;;;;;;;;;;;;;;;;;
;;;;;;;;;;;;;;;;;;;;;
;;;;;;;;;;;;;;;;;;;;;
;;;;;;;;;;;;;;;;;;;;;
;;;;;;;;;;;;;;;;;;;;;
;;;;;;;;;;;;;;;;;;;;;
;;;;;;;;;;;;;;;;;;;;;
;;;;;;;;;;;;;;;;;;;;;
;;;;;;;;;;;;;;;;;;;;;
;;;;;;;;;;;;;;;;;;;;;
;;;;;;;;;;;;;;;;;;;;;
;;;;;;;;;;;;;;;;;;;;;
;;;;;;;;;;;;;;;;;;;;;
;;;;;;;;;;;;;;;;;;;;;
;;;;;;;;;;;;;;;;;;;;;
;;;;;;;;;;;;;;;;;;;;;
;;;;;;;;;;;;;;;;;;;;;
;;;;;;;;;;;;;;;;;;;;;
;;;;;;;;;;;;;;;;;;;;;
;;;;;;;;;;;;;;;;;;;;;
;;;;;;;;;;;;;;;;;;;;;
;;;;;;;;;;;;;;;;;;;;;
;;;;;;;;;;;;;;;;;;;;;
;;;;;;;;;;;;;;;;;;;;;
;;;;;;;;;;;;;;;;;;;;;
;;;;;;;;;;;;;;;;;;;;;
;;;;;;;;;;;;;;;;;;;;;
;;;;;;;;;;;;;;;;;;;;;
;;;;;;;;;;;;;;;;;;;;;
;;;;;;;;;;;;;;;;;;;;;
;;;;;;;;;;;;;;;;;;;;;
;;;;;;;;;;;;;;;;;;;;;
;;;;;;;;;;;;;;;;;;;;;
;;;;;;;;;;;;;;;;;;;;;
;;;;;;;;;;;;;;;;;;;;;
;;;;;;;;;;;;;;;;;;;;;
;;;;;;;;;;;;;;;;;;;;;
;;;;;;;;;;;;;;;;;;;;;
;;;;;;;;;;;;;;;;;;;;;
;;;;;;;;;;;;;;;;;;;;;
;;;;;;;;;;;;;;;;;;;;;
;;;;;;;;;;;;;;;;;;;;;
;;;;;;;;;;;;;;;;;;;;;
;;;;;;;;;;;;;;;;;;;;;
;;;;;;;;;;;;;;;;;;;;;
;;;;;;;;;;;;;;;;;;;;;
;;;;;;;;;;;;;;;;;;;;;
;;;;;;;;;;;;;;;;;;;;;
;;;;;;;;;;;;;;;;;;;;;
;;;;;;;;;;;;;;;;;;;;;
;;;;;;;;;;;;;;;;;;;;;
;;;;;;;;;;;;;;;;;;;;;
;;;;;;;;;;;;;;;;;;;;;
;;;;;;;;;;;;;;;;;;;;;
;;;;;;;;;;;;;;;;;;;;;
;;;;;;;;;;;;;;;;;;;;;
;;;;;;;;;;;;;;;;;;;;;
;;;;;;;;;;;;;;;;;;;;;
;;;;;;;;;;;;;;;;;;;;;
;;;;;;;;;;;;;;;;;;;;;
;;;;;;;;;;;;;;;;;;;;;
;;;;;;;;;;;;;;;;;;;;;
;;;;;;;;;;;;;;;;;;;;;
;;;;;;;;;;;;;;;;;;;;;
;;;;;;;;;;;;;;;;;;;;;
;;;;;;;;;;;;;;;;;;;;;
;;;;;;;;;;;;;;;;;;;;;
;;;;;;;;;;;;;;;;;;;;;
;;;;;;;;;;;;;;;;;;;;;
;;;;;;;;;;;;;;;;;;;;;
;;;;;;;;;;;;;;;;;;;;;
;;;;;;;;;;;;;;;;;;;;;
;;;;;;;;;;;;;;;;;;;;;
;;;;;;;;;;;;;;;;;;;;;
;;;;;;;;;;;;;;;;;;;;;
;;;;;;;;;;;;;;;;;;;;;
;;;;;;;;;;;;;;;;;;;;;
;;;;;;;;;;;;;;;;;;;;;
;;;;;;;;;;;;;;;;;;;;;
;;;;;;;;;;;;;;;;;;;;;
;;;;;;;;;;;;;;;;;;;;;
;;;;;;;;;;;;;;;;;;;;;
;;;;;;;;;;;;;;;;;;;;;
;;;;;;;;;;;;;;;;;;;;;
;;;;;;;;;;;;;;;;;;;;;
;;;;;;;;;;;;;;;;;;;;;
;;;;;;;;;;;;;;;;;;;;;
;;;;;;;;;;;;;;;;;;;;;
;;;;;;;;;;;;;;;;;;;;;
;;;;;;;;;;;;;;;;;;;;;
;;;;;;;;;;;;;;;;;;;;;
;;;;;;;;;;;;;;;;;;;;;
;;;;;;;;;;;;;;;;;;;;;
;;;;;;;;;;;;;;;;;;;;;
;;;;;;;;;;;;;;;;;;;;;
;;;;;;;;;;;;;;;;;;;;;
;;;;;;;;;;;;;;;;;;;;;
;;;;;;;;;;;;;;;;;;;;;
;;;;;;;;;;;;;;;;;;;;;
;;;;;;;;;;;;;;;;;;;;;
;;;;;;;;;;;;;;;;;;;;;
;;;;;;;;;;;;;;;;;;;;;
;;;;;;;;;;;;;;;;;;;;;
;;;;;;;;;;;;;;;;;;;;;
;;;;;;;;;;;;;;;;;;;;;
;;;;;;;;;;;;;;;;;;;;;
;;;;;;;;;;;;;;;;;;;;;
;;;;;;;;;;;;;;;;;;;;;
;;;;;;;;;;;;;;;;;;;;;
;;;;;;;;;;;;;;;;;;;;;
;;;;;;;;;;;;;;;;;;;;;
;;;;;;;;;;;;;;;;;;;;;
;;;;;;;;;;;;;;;;;;;;;
;;;;;;;;;;;;;;;;;;;;;
;;;;;;;;;;;;;;;;;;;;;
;;;;;;;;;;;;;;;;;;;;;
;;;;;;;;;;;;;;;;;;;;;
;;;;;;;;;;;;;;;;;;;;;
;;;;;;;;;;;;;;;;;;;;;
;;;;;;;;;;;;;;;;;;;;;
;;;;;;;;;;;;;;;;;;;;;
;;;;;;;;;;;;;;;;;;;;;
;;;;;;;;;;;;;;;;;;;;;
;;;;;;;;;;;;;;;;;;;;;
;;;;;;;;;;;;;;;;;;;;;
;;;;;;;;;;;;;;;;;;;;;
;;;;;;;;;;;;;;;;;;;;;
;;;;;;;;;;;;;;;;;;;;;
;;;;;;;;;;;;;;;;;;;;;
;;;;;;;;;;;;;;;;;;;;;
;;;;;;;;;;;;;;;;;;;;;
;;;;;;;;;;;;;;;;;;;;;
;;;;;;;;;;;;;;;;;;;;;
;;;;;;;;;;;;;;;;;;;;;
;;;;;;;;;;;;;;;;;;;;;
;;;;;;;;;;;;;;;;;;;;;
;;;;;;;;;;;;;;;;;;;;;
;;;;;;;;;;;;;;;;;;;;;
;;;;;;;;;;;;;;;;;;;;;
;;;;;;;;;;;;;;;;;;;;;
;;;;;;;;;;;;;;;;;;;;;
;;;;;;;;;;;;;;;;;;;;;
;;;;;;;;;;;;;;;;;;;;;
;;;;;;;;;;;;;;;;;;;;;
;;;;;;;;;;;;;;;;;;;;;
;;;;;;;;;;;;;;;;;;;;;
;;;;;;;;;;;;;;;;;;;;;
;;;;;;;;;;;;;;;;;;;;;
;;;;;;;;;;;;;;;;;;;;;
;;;;;;;;;;;;;;;;;;;;;
;;;;;;;;;;;;;;;;;;;;;
;;;;;;;;;;;;;;;;;;;;;
;;;;;;;;;;;;;;;;;;;;;
;;;;;;;;;;;;;;;;;;;;;
;;;;;;;;;;;;;;;;;;;;;
;;;;;;;;;;;;;;;;;;;;;
;;;;;;;;;;;;;;;;;;;;;
;;;;;;;;;;;;;;;;;;;;;
;;;;;;;;;;;;;;;;;;;;;
;;;;;;;;;;;;;;;;;;;;;
;;;;;;;;;;;;;;;;;;;;;
;;;;;;;;;;;;;;;;;;;;;
;;;;;;;;;;;;;;;;;;;;;
;;;;;;;;;;;;;;;;;;;;;
;;;;;;;;;;;;;;;;;;;;;
;;;;;;;;;;;;;;;;;;;;;
;;;;;;;;;;;;;;;;;;;;;
;;;;;;;;;;;;;;;;;;;;;
;;;;;;;;;;;;;;;;;;;;;
;;;;;;;;;;;;;;;;;;;;;
;;;;;;;;;;;;;;;;;;;;;
;;;;;;;;;;;;;;;;;;;;;
;;;;;;;;;;;;;;;;;;;;;
;;;;;;;;;;;;;;;;;;;;;
;;;;;;;;;;;;;;;;;;;;;
;;;;;;;;;;;;;;;;;;;;;
;;;;;;;;;;;;;;;;;;;;;
;;;;;;;;;;;;;;;;;;;;;
;;;;;;;;;;;;;;;;;;;;;
;;;;;;;;;;;;;;;;;;;;;
;;;;;;;;;;;;;;;;;;;;;
;;;;;;;;;;;;;;;;;;;;;
;;;;;;;;;;;;;;;;;;;;;
;;;;;;;;;;;;;;;;;;;;;
;;;;;;;;;;;;;;;;;;;;;
;;;;;;;;;;;;;;;;;;;;;
;;;;;;;;;;;;;;;;;;;;;
;;;;;;;;;;;;;;;;;;;;;
;;;;;;;;;;;;;;;;;;;;;
;;;;;;;;;;;;;;;;;;;;;
;;;;;;;;;;;;;;;;;;;;;
;;;;;;;;;;;;;;;;;;;;;
;;;;;;;;;;;;;;;;;;;;;
;;;;;;;;;;;;;;;;;;;;;
;;;;;;;;;;;;;;;;;;;;;
;;;;;;;;;;;;;;;;;;;;;
;;;;;;;;;;;;;;;;;;;;;
;;;;;;;;;;;;;;;;;;;;;
;;;;;;;;;;;;;;;;;;;;;
;;;;;;;;;;;;;;;;;;;;;
;;;;;;;;;;;;;;;;;;;;;
;;;;;;;;;;;;;;;;;;;;;
;;;;;;;;;;;;;;;;;;;;;
;;;;;;;;;;;;;;;;;;;;;
;;;;;;;;;;;;;;;;;;;;;
;;;;;;;;;;;;;;;;;;;;;
;;;;;;;;;;;;;;;;;;;;;
;;;;;;;;;;;;;;;;;;;;;
;;;;;;;;;;;;;;;;;;;;;
;;;;;;;;;;;;;;;;;;;;;
;;;;;;;;;;;;;;;;;;;;;
;;;;;;;;;;;;;;;;;;;;;
;;;;;;;;;;;;;;;;;;;;;
;;;;;;;;;;;;;;;;;;;;;
;;;;;;;;;;;;;;;;;;;;;
;;;;;;;;;;;;;;;;;;;;;
;;;;;;;;;;;;;;;;;;;;;
;;;;;;;;;;;;;;;;;;;;;
;;;;;;;;;;;;;;;;;;;;;
;;;;;;;;;;;;;;;;;;;;;
;;;;;;;;;;;;;;;;;;;;;
;;;;;;;;;;;;;;;;;;;;;
;;;;;;;;;;;;;;;;;;;;;
;;;;;;;;;;;;;;;;;;;;;
;;;;;;;;;;;;;;;;;;;;;
;;;;;;;;;;;;;;;;;;;;;
;;;;;;;;;;;;;;;;;;;;;
;;;;;;;;;;;;;;;;;;;;;
;;;;;;;;;;;;;;;;;;;;;
;;;;;;;;;;;;;;;;;;;;;
;;;;;;;;;;;;;;;;;;;;;
;;;;;;;;;;;;;;;;;;;;;
;;;;;;;;;;;;;;;;;;;;;
;;;;;;;;;;;;;;;;;;;;;
;;;;;;;;;;;;;;;;;;;;;
;;;;;;;;;;;;;;;;;;;;;
;;;;;;;;;;;;;;;;;;;;;
;;;;;;;;;;;;;;;;;;;;;
;;;;;;;;;;;;;;;;;;;;;
;;;;;;;;;;;;;;;;;;;;;
;;;;;;;;;;;;;;;;;;;;;
;;;;;;;;;;;;;;;;;;;;;
;;;;;;;;;;;;;;;;;;;;;
;;;;;;;;;;;;;;;;;;;;;
;;;;;;;;;;;;;;;;;;;;;
;;;;;;;;;;;;;;;;;;;;;
;;;;;;;;;;;;;;;;;;;;;
;;;;;;;;;;;;;;;;;;;;;
;;;;;;;;;;;;;;;;;;;;;
;;;;;;;;;;;;;;;;;;;;;
;;;;;;;;;;;;;;;;;;;;;
;;;;;;;;;;;;;;;;;;;;;
;;;;;;;;;;;;;;;;;;;;;
;;;;;;;;;;;;;;;;;;;;;
;;;;;;;;;;;;;;;;;;;;;
;;;;;;;;;;;;;;;;;;;;;
;;;;;;;;;;;;;;;;;;;;;
;;;;;;;;;;;;;;;;;;;;;
;;;;;;;;;;;;;;;;;;;;;
;;;;;;;;;;;;;;;;;;;;;
;;;;;;;;;;;;;;;;;;;;;
;;;;;;;;;;;;;;;;;;;;;
;;;;;;;;;;;;;;;;;;;;;
;;;;;;;;;;;;;;;;;;;;;
;;;;;;;;;;;;;;;;;;;;;
;;;;;;;;;;;;;;;;;;;;;
;;;;;;;;;;;;;;;;;;;;;
;;;;;;;;;;;;;;;;;;;;;
;;;;;;;;;;;;;;;;;;;;;
;;;;;;;;;;;;;;;;;;;;;
;;;;;;;;;;;;;;;;;;;;;
;;;;;;;;;;;;;;;;;;;;;
;;;;;;;;;;;;;;;;;;;;;
;;;;;;;;;;;;;;;;;;;;;
;;;;;;;;;;;;;;;;;;;;;
;;;;;;;;;;;;;;;;;;;;;
;;;;;;;;;;;;;;;;;;;;;
;;;;;;;;;;;;;;;;;;;;;
;;;;;;;;;;;;;;;;;;;;;
;;;;;;;;;;;;;;;;;;;;;
;;;;;;;;;;;;;;;;;;;;;
;;;;;;;;;;;;;;;;;;;;;
;;;;;;;;;;;;;;;;;;;;;
;;;;;;;;;;;;;;;;;;;;;
;;;;;;;;;;;;;;;;;;;;;
;;;;;;;;;;;;;;;;;;;;;
;;;;;;;;;;;;;;;;;;;;;
;;;;;;;;;;;;;;;;;;;;;
;;;;;;;;;;;;;;;;;;;;;
;;;;;;;;;;;;;;;;;;;;;
;;;;;;;;;;;;;;;;;;;;;
;;;;;;;;;;;;;;;;;;;;;
;;;;;;;;;;;;;;;;;;;;;
;;;;;;;;;;;;;;;;;;;;;
;;;;;;;;;;;;;;;;;;;;;
;;;;;;;;;;;;;;;;;;;;;
;;;;;;;;;;;;;;;;;;;;;
;;;;;;;;;;;;;;;;;;;;;
;;;;;;;;;;;;;;;;;;;;;
;;;;;;;;;;;;;;;;;;;;;
;;;;;;;;;;;;;;;;;;;;;
;;;;;;;;;;;;;;;;;;;;;
;;;;;;;;;;;;;;;;;;;;;
;;;;;;;;;;;;;;;;;;;;;
;;;;;;;;;;;;;;;;;;;;;
;;;;;;;;;;;;;;;;;;;;;
;;;;;;;;;;;;;;;;;;;;;
;;;;;;;;;;;;;;;;;;;;;
;;;;;;;;;;;;;;;;;;;;;
;;;;;;;;;;;;;;;;;;;;;
;;;;;;;;;;;;;;;;;;;;;
;;;;;;;;;;;;;;;;;;;;;
;;;;;;;;;;;;;;;;;;;;;
;;;;;;;;;;;;;;;;;;;;;
;;;;;;;;;;;;;;;;;;;;;
;;;;;;;;;;;;;;;;;;;;;
;;;;;;;;;;;;;;;;;;;;;
;;;;;;;;;;;;;;;;;;;;;
;;;;;;;;;;;;;;;;;;;;;
;;;;;;;;;;;;;;;;;;;;;
;;;;;;;;;;;;;;;;;;;;;
;;;;;;;;;;;;;;;;;;;;;
;;;;;;;;;;;;;;;;;;;;;
;;;;;;;;;;;;;;;;;;;;;
;;;;;;;;;;;;;;;;;;;;;
;;;;;;;;;;;;;;;;;;;;;
;;;;;;;;;;;;;;;;;;;;;
;;;;;;;;;;;;;;;;;;;;;
;;;;;;;;;;;;;;;;;;;;;
;;;;;;;;;;;;;;;;;;;;;
;;;;;;;;;;;;;;;;;;;;;
;;;;;;;;;;;;;;;;;;;;;
;;;;;;;;;;;;;;;;;;;;;
;;;;;;;;;;;;;;;;;;;;;
;;;;;;;;;;;;;;;;;;;;;
;;;;;;;;;;;;;;;;;;;;;
;;;;;;;;;;;;;;;;;;;;;
;;;;;;;;;;;;;;;;;;;;;
;;;;;;;;;;;;;;;;;;;;;
;;;;;;;;;;;;;;;;;;;;;
;;;;;;;;;;;;;;;;;;;;;
;;;;;;;;;;;;;;;;;;;;;
;;;;;;;;;;;;;;;;;;;;;
